,categories,title,company_names,percentages,funding_amounts,target_amounts,n_supporters,likes,descriptions,durations,days_left
1216,뷰티,[코코포이즌샴푸] 천연 코코넛이 가득 담긴 샴푸로 두피를 가볍게!,아로하코스메틱,134%,"673,000원","500,000원",23,20,"놀라운 두피 변화의 시작! 압도적인 핵심 성분의 함유량!
천연 코코넛이 735,000ppm 함유 된 코코포이즌 샴푸로 두피 건강을 지키세요.",2021.04.19-2021.05.14,None
1217,뷰티, <한 통 9750원> 미친 가성비 바디크림이 전신 '미백 기능성'까지!,직선,2477%,"12,386,300원","500,000원",388,293,"한 통에 9750원, 일주일이면 체감할 수 있는 하얗고 밝은 피부 변화! 전신 피부까지 하얗게 관리하고 싶은 당신을 위해 준비한 미백&주름 개선 이중 기능성 바디크림과 바디 워시.",2020.02.19-2020.03.08,None
1218,뷰티,피부가 약한 남성을 위한 피부진정 화장품,와이엠앤씨 주식회사,246%,"1,230,000원","500,000원",61,26,"피부가 약한 남성과 1020남성을 위한 피부진정 화장품.
진정한내피부",2019.07.15-2019.08.11,None
1219,뷰티,"나의 유전자가 필요로 하는 비타민, 왓비타 이네이트",왓비타,2053%,"20,534,000원","1,000,000원",190,175,"이제 근거 없는 비타민 선택은 그만! 국내 최고 유전체 분석 기술로 14가지 항목의 내 유전자를 분석한 후 내게 필요한 비타민을 확인하고 비타민 제품 세트까지 챙겨가세요! 
    뷰티/헬스 기획전 파트너와 함께합니다.",2018.07.16-2018.08.17,None
1220,뷰티,말랑쫀쫀 신개념 퍼프형 클렌저! 세안-각질 두마리 토끼잡는 [필필스크럽],고은재,251%,"1,257,500원","500,000원",48,53,'스크럽 = 알갱이'라는 편견을 버려라! 부드러운 퍼프 소재와 풍부한 거품으로 자극 無 ⭐각질/피지/화이트&블랙헤드까지 케어하는 스크럽 잇템을 소개합니다⭐,2019.08.12-2019.08.25,None
1221,뷰티,"Dr.휴나셀 쿨토너미스트, 저자극, 휴나셀",(주)휴나코스메틱,128%,"643,900원","500,000원",16,12,"올 여름 지친 피부에 #수분충전 과 #피부온도 를 #낮추자! 
#쿨링 토너 미스트는 피부 온도 감소 효과 
#달아오른 피부케어에 도움
#쿨링감 및 수분감이 지속",2019.07.30-2019.08.20,None
1222,뷰티,기초는 이거 하나면 충분! 뷰앤럽 페이스 앤 바디 미스트,뷰앤럽 (beau&lov),5%,"271,000원","5,000,000원",12,14,"좋은 성분은 얼굴에만? 아닙니다! 
이젠 내 몸도 관리해주세요. 수분, 진정, 미백, 주름개선, 아로마테라피
한번의 터치로 360도 회전하는 연속 안개분사 올인원 미스트입니다.",2020.08.10-2020.09.14,펀딩성공
1223,뷰티,서포터와 함께 만들어 갑니다 '두피만 생각한 두피클렌져',NATURE SCALP CLEANSER,1145%,"11,450,900원","1,000,000원",259,188,‘시작은 두피로부터’ 라는 말을 많이 들어 보셨을 것입니다. 건강한 두피가 되려면 청결함을 유지하고 두피 pH를 약산성 (pH4.5 ~ 5.5)으로 유지시켜주는 것이 중요합니다.,2019.11.29-2019.12.22,None
1224,뷰티,[ 1년기획 ] 바쁘다 바빠! 바쁜 현대인을 위한 스킵케어가 나타났다!,(주)쏘루트,303%,"1,515,300원","500,000원",38,44,"1분 1초가 아까운 바쁜 현대인들, 소홀해지기 쉬운 스킨케어를 빠르고 확실하게!
채우고 채워넣은 보습성분으로 단 하나의 제대로 된 스킵케어 시작해 보세요 :)",2021.02.22-2021.03.08,None
1225,뷰티,"[4.9점,탈모완화기능성] 윤기있는 모발, 깨끗한 두피. 이젠 정착하세요",주식회사 탑코스메틱,4796%,"23,981,000원","500,000원",505,263,"오늘 하루는 어떠셨나요? 당신의 상처받은 마음과 머리를 상쾌하게 풀어드릴게요. 와사비 성분이 두피와 모발 보호는 물론, 탈모완화까지! 자연에서 찾은 당신을 위한 와사비 샴푸입니다.",2021.04.21-2021.05.10,None
1226,뷰티,어? 비누가 아니네! 자연 그대로의 산야초 12종을 발효시킨 발효클렌저,오보코리아,821%,"4,105,200원","500,000원",103,99,"건조한 날씨에 자꾸 손이가는 피부! 누가 신경써주죠? 20년 심마니의 등장! 약초단은 피부에 좋은 산야초 12종을 선별, 비법이 담긴 원료 추출법과 배합율로 발효시켜 만들었습니다.",2021.01.04-2021.02.05,None
1227,뷰티,"물방울 초음파? 하루 15분, 이제 집에서 편하게 시작하세요!",박대수(메디랩),32%,"3,264,000원","10,000,000원",8,33,"먼지와 하루종일 끼는 마스크까지. 오늘도 고생한 당신의 피부, 괜찮으세요?
이제 하루 15분 투자하세요. 값비싼 물방울 초음파를 아주 손쉽게 집에서 할 수 있답니다.",2021.04.15-2021.05.10,None
1228,뷰티,피부고민? 먹는거임? 쓸수록 좋아지는 건강한 성분의 퓨어위시 천연비누,주식회사 퓨어플랜,430%,"2,152,000원","500,000원",62,43,"'난 성분따위 생각하지 않아!' 내 피부에 직접 닿는건데, 당신의 피부는 소중한데, 좋은 성분의 화장품 써야하지 않겠어요? 순한 천연비누와 '건강하게 씻기'부터 시작해보세요!",2019.05.30-2019.06.23,None
1229,뷰티,개발비용 200억 | 40년만에 탄생한 진짜 EGF 주름개선 기능성 세럼,(주)이지에프올로지,13001%,"130,010,000원","1,000,000원","1,477",1357,기능성 화장품 고를 땐? #효능성분 부터 따져봐야죠! <식약처 개별고시> <임상 완료> NEW 효능성분 등장! 더 효과적인 주름 개선을 선물할 진짜 EGF 기능성 세럼을 만나보세요,2021.03.12-2021.03.29,None
1230,뷰티,"[4.9앵콜 녹차 토너+예민 피부 솔루션] 피부, 4주면 달라져요.",이터널뷰티/라빠레뜨뷰티,1344%,"6,720,300원","500,000원",174,135,"4.9점이 들려주는 변화, 직접 경험하세요. 
리얼 녹차잎을 담은 저자극 토너와 민감 피부에 콕 찍어주는 카밍 그린 솔루션까지 빈틈없이 피부를 생각합니다.",2020.04.07-2020.04.21,None
1231,뷰티,"카페에서 본 향수 같은 핸드워시, 대용량으로 집에서 써봐요. | 블랑쉐",주식회사 한미인터내셔널,743%,"7,436,800원","1,000,000원",135,150,"예쁘면 비싸거나, 저렴하면 예쁘지 않았던 핸드워시는 더이상 NO! 
만 원대에 만나볼 수 있는 고급 핸드워시-
언제 어디서든 당신의 갬성을 자극하는 블랑쉐 핸드워시와 함께 하세요.",2020.08.21-2020.09.07,None
1232,뷰티,<화장품 다 버리세요> 각질 정리+기초+모공 관리를 앰플 하나로 끝낸다?,라운드얼스,1198%,"5,994,900원","500,000원",156,160,"도드라진 모공, 한여름에도 당기는 속건조와 지저분한 각질. 한 병의 앰플로 해결할 수 있다면? 기초 케어와 각질 정리, 모공 관리까지 하나로 합친 화장품 혁명 <3초 깐달걀앰플>",2020.07.20-2020.08.10,None
1233,뷰티,"[운동&여행 필수품] 이것 하나면 OK, 천연 오일을 넣은 휴대용 워시",복스하우스,270%,"1,354,500원","500,000원",37,42,"운동, 물놀이, 여행까지 - 씻을 일이 많은 당신을 위해 준비했습니다. 
가방은 가볍게, 활동은 자유롭게, 샤워는 간편하게!
아꾸아 올인원 워시와 언제 어디서나 함께하세요.",2020.10.19-2020.11.02,None
1234,뷰티,앰플을 듬뿍 발라도 이 가격에 가능? 모르면 가질 수 없는 '진짜 수분',떼뜨,2229%,"11,147,980원","500,000원",173,132,"성분과 효과는 너무도 좋지만 비싸고 사용하기 불편한 앰플을 보다 '쉽게, 자주, 많이' 사용하실 수 있도록 넉넉한 용량에 좋은 성분들을 꾹꾹 눌러담은 물방울 앰플을 소개합니다.",2019.11.14-2019.12.08,None
1235,뷰티,[밴쯔 잇포유] 다이어트와 피부관리를 동시에!,밴쯔 잇포유,824%,"8,244,000원","1,000,000원",102,68,"밴쯔가 만든 수채지가는 [피부보습에 도움을줄수있음,과체중인 성인의 체지방 감소에 도움을 줄 수 있음] 이 두가지 기능성을 가진 건강기능식품입니다.",2019.07.10-2019.07.28,None
1236,뷰티,"청담동 맞춤형 피부관리, 집에서 쉽고 편하게",(주)스킨메시지 / (주)비즈인원,145%,"2,907,400원","2,000,000원",78,49,"사람마다 다른 피부타입, 언제나 변하는 피부 컨디션에 맞추어 섞어쓰는 고성분 앰플. 5천원짜리 로션을 5만원짜리로 만드는 마법. 맞춤형 앰플, 앰플로지.",2018.03.02-2018.04.01,None
1237,뷰티,"두피, 머릿결, 스타일링까지 올킬3종 꿀조합! 천하무적 실크 머릿결 탄생",다주자월드 ,599%,"5,996,100원","1,000,000원",115,118,집에서 끝내는 3 STEP 헤어 풀코스! 아낌없이 맥주효모 듬뿍듬뿍! 쉽고 간편하게 전문가의 손길을 느껴보세요. [다주자 독일 맥주 효모 샴푸+트리트먼트+브러쉬] 꿀조합!,2020.08.06-2020.08.31,None
1238,뷰티,⭐특허⭐매일 13원에 두피클리닉 하세요 가성비 혁신템 <닥터시드 부스터>,닥터시드,11081%,"55,409,800원","500,000원","1,985",744,샴푸 사지마세요! 쓰던 샴푸에 닥터시드 부스터 한방울 더하면 특허받은 성분으로 두피케어 샴푸 완성!,2019.07.30-2019.08.18,None
1239,뷰티,EGF의조상?FGF섬유아세포?원료 도달의 문제 - EGF/FGF면 가능,이선희,135%,"4,074,000원","3,000,000원",68,49,"EGF의 조상 FGF-좋은피부? 원료가 피부에 어떻게 도달하는지의 문제 
EGF/FGF화장품으로 관리",2019.03.01-2019.03.20,None
1240,뷰티,[민감피부안녕]패드한장이 피부를 결정한다! 각질제로 피부진정 원스텝패드,(주)피비코스메틱,413%,"2,068,100원","500,000원",78,72,좋은 피부의 비결은 각질제거 &클렌징 후 결국 보습진정!! 이제 클렌징과 각질제거에 보습과 진정까지 한번에 해결해주는 [비건톨로지 센텔라 시카케어 원스텝 패드] 를 사용하세요.,2020.08.07-2020.08.18,None
1241,뷰티,선크림 아직도 순한 것만? 공기처럼 가볍고 편한 망각/안녕 선크림  ,(주)에스비코스메틱스,1053%,"10,536,800원","1,000,000원",183,160,"선크림, 더이상 순하기만 한 선크림의 불편함을 참지도, 들뜨지도 마세요. 바른지 ""망각""하고 피부는 ""안녕""한 데일리 선케어의 시작! 에어래스팅 선크림 2종을 소개합니다!",2020.04.14-2020.05.03,None
1242,뷰티,[매습하] 찐 Ewg All Green 100%,주식회사 와이엠지엘비(YM GLB),266%,"1,333,500원","500,000원",65,65,"“어느게 진실?” 둘 다 진실이라면 믿어지십니까? 인공향료 0% 전성분 100% 올그린등급 !
피부와 두피의 휴식시간. 블룸리씨가 드리는 달콤한 휴식을 누리세요.",2020.04.03-2020.04.20,None
1243,뷰티,더 빨리 침투해 더 오래 머물라! 피부탱탱 TT크림,한스텍주식회사,101%,"1,018,000원","1,000,000원",32,39,뉴노멀 뷰티 프로젝트,2021.01.20-2021.02.24,None
1244,뷰티,칙- 뿌리고 쓱- 빗으면 끝! 머릿발 살리는 비밀병기 울버린 스타일러,(주)엠제이뷰티인터네셔널,564%,"2,824,000원","500,000원",113,95,"남자의 비밀병기 울버린 스타일러와 스파이왁스! 헤어스타일이 어려운 분, 옆머리 떠서 고민인 분, 포마드/애즈펌 스타일을 빠르게 완성하고 싶은 분들께 선물같은 제품을 소개합니다.",2020.04.10-2020.05.04,None
1245,뷰티,"심신 안정이 필요한 당신을 위한 향기테라피, [요가테라피 미스트] ",아로마데이,1125%,"11,250,500원","1,000,000원",163,98,[알콜제로 & 유기농로즈워터 & 퓨어에센셜오일 ] 상쾌하고 조용한 향의 바디미스트를 소개합니다. 몸과 공간 어디에든 뿌려주세요. 생기 넘치는 향이 우리의 일상을 바꿔줄 거예요.,2019.08.28-2019.09.17,None
1246,뷰티,이가격에 나올 향수가 아닌데,LOUIS1987,1603%,"16,037,600원","1,000,000원",259,163,"향수는 하나의 예술작품이며, 그것을 창조하는 조향사는 예술가, 아티스트입니다.",2019.02.27-2019.03.17,None
1247,뷰티,남자의 자존심~~밝고 건강한 사타구니 만들기 프로젝트 시크릿맨즈 청결제!,에폴리시스템,570%,"2,853,000원","500,000원",123,80,[남성청결제]남자의 자존심~~ 밝고 건강한 사타구니 만들기 프로젝트. 시크릿맨즈로 언제 어디서나~칙칙!! 건강한 나의 소중한 부위를 지켜주세요. 내면이 아름다운남자 바로 당신입니다,2020.07.21-2020.08.13,None
1248,뷰티,"[앵콜/만족도4.9] 후기로 검증된""아픈만큼 예뻐져."" 대용량 스피큘크림",에폴리시스템,5368%,"26,840,000원","500,000원",563,561,"[5758%앵콜/만족도4.9]수많은 후기로 검증된""아픈만큼 예뻐진다."" 센텔라 640.000ppm 대용량 #스피큘크림  보습부터 기미.탄력,주름까지 단하나면 충분합니다.",2020.03.17-2020.04.12,None
1249,뷰티,"[심플리오] 막강한 차단력, 매끈한 발림성, 순한 성분의 완벽 선크림",심플리오,942%,"4,711,000원","500,000원",136,128,"강한 자외선 차단력을 갖췄으면서도 피부에는 순한 선크림이 있을까요? 게다가 마치 안바른듯 가볍고 매끈한 사용감까지? 심플리오가 만들었습니다. 완벽에 가까운, 더블블로킹 선크림.",2020.04.01-2020.04.16,None
1250,뷰티,미국 킥스타터 1위! 피부 코어탄력을 살리는 흑미발효 항산화앰플,쿼럼바이오헬스케어 주식회사,3379%,"16,899,100원","500,000원",229,168,국내산 진도흑미 X 업그레이드된 발효기술의 콜라보! 항산화 가득 리얼 안티에이징 발효 테크닉의 정수를 단 한 병에 만나보세요.,2020.02.25-2020.03.15,None
1251,뷰티,96% 진짜 유기농! 사랑하는 사람과 가장 친밀한 그 순간을 함께하세요!,그러니,5283%,"26,419,700원","500,000원",651,496,"96% 진짜 유기농! 사랑하는 사람과 가장 친밀한 그 순간,  솜사탕 같은 부드러움을 드립니다!",2020.07.07-2020.07.29,None
1252,뷰티,"눈으로만 보던 부산이 담긴 화장품, 부산언니 인마이백",부산언니,150%,"3,010,400원","2,000,000원",76,21,"해운대, 광안리, 태종대..눈으로만 보던 부산을 코스메틱에 담았습니다.
여행을 사랑하고 또 부산을 사랑한다면  부산이 담긴 인마이백 시리즈를 만나보세요!",2017.11.23-2017.12.10,None
1253,뷰티,"[수분량 63.6% 증가] 마스크 속 열나는 피부, 세럼으로 수분 진정!",주식회사 코스모젠,107%,"536,100원","500,000원",11,26,"임상으로 증명된 8주만에 밝아진 피부톤, 피부 수분량 63.6% 증가! 마스크 속 지친 내 피부를 구원해줄 겉촉속촉 속건조 종결세럼",2021.04.22-2021.05.05,None
1254,뷰티,"양말?발팩? 발냄새, 가려움, 갈라짐엔 ""쪽""하세요",킨디고(KINDIGO),551%,"2,756,000원","500,000원",62,68,"반영구적으로 사용 가능한 신개념 천연 풋케어 ""더쪽 토삭스"". 번거로운 과정 없이, 양말처럼 신어 주세요! 우리의 피부와 환경까지 지켜줍니다.",2018.10.05-2018.10.31,None
1255,뷰티,추억을 담은 향수 ,센트그라피,3%,"30,000원","1,000,000원",25,12,"나를 기억하는 향기. 추억을 기억하는 향기.
향수에 소중한 추억을 담아드려요.",2020.02.11-2020.02.25,펀딩성공
1256,뷰티,올해 마지막 리얼시카솔루션!,(주)뷰티클로,262%,"2,620,500원","1,000,000원",41,24,"당신을 위한 마지막 리얼시카크림!
시카크림+스팟패치+시카마스크 솔루션",2018.12.04-2018.12.19,None
1257,뷰티,"상위1% 피부과학 X 22년 명품화장품 전문가, 피부를 다루다 I 다룸",(주)리딩프로스,6349%,"31,749,200원","500,000원",256,202,"다룸은 22년 이상 화장품 비즈니스를 통해 만난 다양한 피부 문제에 대한 깊은 이해와 공감으로부터 출발했습니다. 
섬세한 피부를 다루다 I '다룸'을 소개합니다.",2019.04.29-2019.05.24,None
1258,뷰티,"[천연캡슐샴푸] 안전한 성분의 사용, 이제 가라앉은 캡슐로 확인하세요!",주식회사 리연바이오케미칼,768%,"7,685,800원","1,000,000원",175,100,"천연샴푸 너무 많은데 믿고 쓸 만한 제품 어디 없나요? 

여기있습니다! 스탠다즈의 워터캡슐샴푸는 화학물질은 배제하고 천연성분을 사용해 캡슐이 가라앉아 있습니다.",2018.04.06-2018.04.25,None
1259,뷰티,"수분과 영양 공급, 브라이트닝까지 마스크팩 하나에 다 담았습니다.",탐나코스메틱,222%,"1,114,860원","500,000원",52,30,"수분과 영양 공급, 브라이트닝까지 마스크팩 하나에 다 담았습니다. 열정적인 삶을 사는 당신을 위한 마스크팩 <탐나 슈퍼 퓨어씰 3 Step 마스크팩>을 와디즈에서 최초로 소개합니다",2020.02.25-2020.03.16,None
1260,뷰티,[2억 2천 신화] 다신 없을 모공아웃 #카모패드 + 모공방어 #선크림 ,키노닉스,6493%,"129,866,000원","2,000,000원","3,076",1130,"발림성, 밀착력, 톤업, 마무리감, 성분은 물론 패키징까지 예쁜 선크림. 
매일 아침, 로지선밀크 하나면 충분합니다. 카모패드로 모공정리까지 한번에 하고, 셀카필터 피부연출하세요",2019.10.05-2019.10.21,None
1261,뷰티,[앵콜]사타구니 냄새&곰팡이세균 99%파괴! 자신있는 남자를 위한 누비누,(주)엘엔티테크,1209%,"6,048,100원","500,000원",211,94,"찝찝한 Y존, 남성청결제 누비누로 관리해보세요. 멘톨 성분으로 시원함을 더하고 자연유래성분으로 안심하고 쓰실 수 있습니다. 소중한 남성의 중심을 책임지겠습니다.",2019.10.01-2019.10.10,None
1262,뷰티,"화장은, 지우는 것이 중요하죠, 그래서 필요해요, PILYO!",모아나,285%,"1,428,500원","500,000원",41,58,"화장은, 하는 것보다 지우는 것이 중요하죠, 그래서 필요해요. 착한 클랜징 PILYO!",2019.11.26-2019.12.16,None
1263,뷰티,화장품 피부 끝까지 흡수시키기 대작전! 베니블리 갈바닉 LED 마사지기 ,나모메드,231%,"4,639,000원","2,000,000원",30,24,이제 시간과 비용에 맞춰진 피부샵을 가지않고 집에서 간편하게 케어 받으세요. 하루 13분 사용으로 맑고 깨끗한 피부를 경험해 보세요.,2020.06.05-2020.06.22,None
1264,뷰티,스트레스 해소에 도움이 되는 아로마 허브롤,주라이프 네츄럴코스메틱 주앤솝,113%,"569,500원","500,000원",21,12,집중력이 좋아지고 스트레스 해소에 도움을 주는 아로마 허브롤은 화학성분 없이 식물성 성분으로만 제조되어 올 여름을 시원하게 해 드릴겁니다.,2019.07.18-2019.07.25,None
1265,뷰티,"[생각 프로젝트 NO.1] 배꼽 전용 클렌저, '배꼽생각'",내머릿속엔 온통,75%,"759,800원","1,000,000원",44,32,"배꼽을 청결하고 안전하게!
내 머릿속에 온통 배꼽생각, 배꼽클렌저",2019.03.15-2019.04.07,펀딩성공
1266,뷰티,당신만의 위트 있는 향을 완성시켜줄 fradorant,<fradorant>,193%,"3,879,300원","2,000,000원",96,93,당신이 떠나고 난 그 자리에 남은건 fradorant의 진한 향기뿐일거에요:),2018.06.08-2018.07.07,None
1267,뷰티,[4365% 3차앵콜] 강력한 블랙헤드를 자극없이 흡착하는 모공올인원,순시키 코스메틱,1355%,"6,777,200원","500,000원",269,126,"모공 깊숙히 박힌 강력한 블랙헤드, 피지를 자극없이 흡착하는
★순시키 모공올인원★으로 집에서 쉽고 확실하게 블랙헤드 kill out!",2019.11.22-2019.12.02,None
1268,뷰티,[라피스 줄리] 향을 품은 보습종결 필수템 #데일리 오드 뚜왈렛,SI.BIO(에스아이바이오),519%,"2,595,860원","500,000원",80,42,"플로럴 라이프, 지속력높은 아름다운 향과 피부 보습에 좋은 귀한 원료를 함께 담은 데일리 오드 뚜왈렛 [라피스줄리] 그 첫번째 이야기.",2019.08.08-2019.08.26,None
1269,뷰티,2차 세안을 왜해요? #더세럼클렌저는 수분빼고 다 지우는데!,퍼스트무버스,1676%,"8,381,900원","500,000원",176,135,"여름에도 건조한 당신에게, 오일처럼 강력하고 세럼이라 촉촉한 슬로소피 더 세럼 클렌저를 소개합니다.

이젠 세럼으로 모공 속 피지와 워터프루프 메이크업까지 한 번에 씻어내세요!",2020.07.15-2020.08.03,None
1270,뷰티,[1억 앵콜] 사랑하는 이와 함께하는 시간 I 유기농96% 멀티 오일,뉴웨이브,4967%,"24,839,480원","500,000원",437,316,"실물이 더 놀라운 레전드 템, 어디에 놓아도 놀라운 마사지오일! 친밀한 그 순간에 늘 함께 해보세요! 후기가 증명하는 레전드 템, 후기 확인은 필수인건 너무나 잘 아시죠?",2021.04.09-2021.04.26,None
1271,뷰티,"수분촉촉 + 신선하고 효율적인 혁명템, 리아진 리다이얼 선 커버 에센스",(주)리아진코스메틱,14%,"438,000원","3,000,000원",52,35,"[ 간편한 휴대성 + 끈적임 Zero! + 번들거림 No! + 수분에센스 같은 촉촉함 ]

언제 어디서나 간편하게, 리아진 리다이얼 선 커버 에센스 자외선 철벽 방어 프로젝트!",2020.01.03-2020.01.12,펀딩성공
1272,뷰티,[수분량 200%UP] 3중 히알루론산으로 모공X만성개기름 완벽관리,다올 Daore,1778%,"8,894,700원","500,000원",257,270,[수분량 200% UP] 모공슈퍼타이트크림으로 모공X만성개기름 완벽관리,2020.03.10-2020.04.02,None
1273,뷰티,건조하고 민감한 아이 피부를 촉촉하게! 우리아이 꿀피부 프로젝트,네츄레메디,253%,"2,538,300원","1,000,000원",78,35,"이젠 더이상 건조해서 긁지 않아요!
민감한 아이피부를 강력하게 진정시켜주고 촉촉한 꿀피부로 만들어주는 네츄레메디 수딩 스틱밤",2018.02.27-2018.03.25,None
1274,뷰티,"16가지 피부 타입별 맞춤형 화장품, 16DROPS",(주)엠플러스코스메틱스,202%,"4,044,800원","2,000,000원",144,44,아무리 비싸도 내 피부에 맞는 화장품이 아니라면 좋은 제품이라고 할 수 없습니다. 16DROPS에서  정확한 피부 타입을 체크하고 나에게 딱 맞는 화장품을 찾아보세요.,2016.10.13-2016.11.13,None
1275,뷰티,[드롭더밤]  각질제거+항산화+피부보호+간편클렌징+휴대용,(주)드롭더밤,1217%,"6,087,700원","500,000원",85,54,"본품 + 휴대용케이스  기본구성!!
마스크 착용으로 거칠어진 피부!
항산화 성분이 들어간 각질제거 패드로 피부를 깨끗하게 :)",2020.07.09-2020.07.27,None
1276,뷰티,[데일리템] 귀엽고 예쁜데 똑똑하기까지! DOCO 4in1 멀티 스킨케어,주식회사 위즈굿,927%,"9,277,100원","1,000,000원",286,367,"귀엽고 예쁜데 똑똑하기 까지! DOCO 4in1 멀티 스킨케어로 음파 클렌징, 노폐물 제거, 영양 흡수, 피부 상태 체크까지 하나로!",2020.12.11-2021.02.01,None
1277,뷰티,[극강수분] 30대 피부고민에 답하다 - 영앤리치 콜라겐 마스크팩,라이프원오원,683%,"3,415,000원","500,000원",57,77,"[30대 피부고민에 답하다] 주름개선, 보습, 미백, 진정, 피부생기 30대 피부 복합솔루션 - 자는 동안 극강수분!",2020.11.11-2020.11.30,None
1278,뷰티,패드 한장으로 수분+영양+각질+진정을 한방에?? 5초 퍼펙트 스킨 케어!,퓨어멜로우,1097%,"5,485,200원","500,000원",140,108,"패드 한장으로 수분+영양+각질+진정을 한방에?? 5초 퍼펙트 스킨 케어!
아보카도를 넣어 만든 저자극 토너 패드!",2020.03.05-2020.03.16,None
1279,뷰티,[3억 앵콜] 6가지 영양성분이 들어간 착색괴물 틴트 1+1,더 블레스문,4411%,"22,059,800원","500,000원",449,375,하루에도 수만 번 쉴 틈 없이 움직이는 내 입술을 위해 좋은 것만 담았습니다. 입술 건강과 메이크업 고민을 동시에 해결해줄 블레스문 플러피 립 틴트 5종을 소개합니다.,2021.02.08-2021.03.11,None
1280,뷰티,[늦잠크림#2] 원래 하얀 피부인 척! 1분이면 환하고 촉촉한 수분톤업,(주)하이디어랩,3135%,"15,676,500원","500,000원",588,373,"수분크림 따로, 톤업크림 따로 시간 낭비 말고 한 번에 끝내요.
1분이면 원래부터 하얀 피부처럼 뽀얗게,촉촉하게! 미백 기능성 화장품이라 바를수록 진짜로 밝아지는 <늦잠톤업크림>",2019.12.23-2020.01.05,None
1281,뷰티,피부 나이가 리턴한다. 각질+진정+보습+탄력 한방에 3종세트,리셀미,1045%,"5,228,000원","500,000원",63,54,"예민한 피부도 걱정마!
피부진정,각질제거 티트리, 식물추출물, Dermatic AC3 성분 함유 
피부탄력, 주름개선, 미백 기능성  
펩타이드 추가 A-FREE 3종 솔류션!",2019.04.26-2019.05.14,None
1282,뷰티,우리 몸에서 세균에 가장 오염되기 쉬운 곳은?!,유리스킨,269%,"1,346,700원","500,000원",124,35,[핸드크림] 쌀쌀 해지는 날씨에 손은 까지고 건조해진 손건강 케어하는 방법은? 유리스킨! 록차일드!!,2018.11.01-2018.11.15,None
1283,뷰티,피부진정+보습 특허성분과 피부저자극 임상시험 완료된 포맨 올인원 에센스,크라니셀,7%,"76,500원","1,000,000원",8,10,"피부진정+보습에 특화된 2가지의 특허성분 함유와, 피부저자극 임상실험을 완료한 제품으로, 끈적이지 않고, 간편하게 언제 어디서나 사용할수 있는 남성용 올인원 제품입니다.",2020.12.24-2021.01.29,펀딩성공
