,categories,title,company_names,percentages,funding_amounts,target_amounts,n_supporters,likes,descriptions,durations,days_left
1831,뷰티,★5월 추천선물★ 냄새없이 어디서나! 바르고 떼는 매니큐어 <어도러블>,Pluchke (플루케),1102%,"5,511,000원","500,000원",145,82,"카페에서 차 마시며 바르는 매니큐어. 진짜냐고요? 안전한 성분으로 냄새없고 색깔도 너무 예쁜데, 지우기까지 쉬운 매니큐어. 이름마저 사랑스러운 어도러블을 소개합니다! :)",2019.03.22-2019.04.07,None
1832,뷰티,립스틱 10개를 한 번에 받는다면 얼마나 좋을까요 <립플레저 컬러스위치>,메이크힐,942%,"9,423,000원","1,000,000원",213,121,"남들은 다 '인생 립스틱'이 있는데 나만 없어서 속상했다면 <립플레저 컬러스위치> 업어 가세요. 한 번에 10가지 립 컬러를 받아보는데, 인생 립 컬러 하나쯤은 꼭 있지 않겠어요?",2019.05.22-2019.05.30,None
1833,뷰티,"내 피부, 정말 안녕하시카? 속까지 케어해야 진짜 시카, [미백&진정]",디자인(주),513%,"5,138,950원","1,000,000원",139,155,"'난 민감성이라 미백화장품은 못써...' '더 진정이 잘 되는 앰플은 없을까?' 
'시중 시카앰플보다 더! 좋은걸 원해' 
☞지금 바로 닥터벨라 시카앰플 2종과 만나보세요 !",2021.01.21-2021.02.15,None
1834,뷰티,"내생애 첫 수분재테크, [피부통장수분적금]",아루즈,518%,"2,594,900원","500,000원",116,53,"내생애 첫 수분재테크, 찰떡시트로 시작하다! 붙이는 만큼 촉촉하다! 얇은 시트의 한계를 뛰어넘은 5중레이어시트로, 좋은 성분 하나도 빠짐없이 피부에 전달하세요.",2018.12.19-2018.12.31,None
1835,뷰티,거울만 바꿨을 뿐인데 요즘 예뻐졌단 말 들어요ㅣ디오두 조명 거울,디오두,513%,"5,130,500원","1,000,000원",84,85,"하.늘.아.래 같은 색조는 없다. 조명 아래 같은 색조도 없다?!
 조명빨만 잘 받아도 화장이 달라집니다. 지금은 신상 색조가 아니라 거울부터 들여야 할 때 <디오두 조명거울>",2019.08.13-2019.08.25,None
1836,뷰티,[실크코쿤샴푸] 지구환경과 사람을 지키는 식물성분의 화장품,그린핸즈,1%,"68,000원","5,000,000원",5,12,석유계 화학 성분으로 망가진 환경과 화장품을 식물성분과 생분해 성분으로 만들어 사람과 지구 환경을 회복시키고자 15년간 연구 개발해온 화장품,2017.10.25-2017.12.10,펀딩성공
1837,뷰티,Ostay air Dock for Dyson airwrap,SE DESIGN(에스이디자인),29685%,"296,857,571원","1,000,000원","4,022",1900,"Ostay air Dock
다이슨 에어랩의 사용자와 공간을 위해 다이슨의 디자인을 완성하다!
고유의 아이덴티티는 부각시키고 에어랩의 거치와 8개의 스타일링툴을 수납할 수 있습니다.",2021.02.03-2021.03.15,None
1838,뷰티,[똥망진창피부] 잘만든 토너 하나로 끝장 해결! ,넘버즈인,591%,"2,959,700원","500,000원",63,47,"넘버즈인은 전직원이 100% 만족하지 않는 제품은 출시하지 않습니다. 일명 ‘품평지옥’이라는 블라인드 테스트를 거쳐 탄생한, 피부고민따라 골라쓰는 3가지 숫자토너를 소개합니다.",2019.08.14-2019.08.25,None
1839,뷰티,마진을 포기한 서포터님들을 위한 EGF/FGF화장품 체험판 7차,이선희,232%,"1,163,100원","500,000원",48,26,EGF/FGF Cosmetic,2020.09.22-2020.09.29,None
1840,뷰티,"4.8점 앵콜 | 인생 향수를 물었는데, 스카이보틀 바디로션이라고 말했다",(주)하늘을담다,3193%,"15,966,940원","500,000원",373,278,퍼퓸계의 미슐랭 가이드가 있다면 단연코 3-STAR! 죽기 전에 발라봐야 할 퍼퓸 바디로션이 앵콜로 돌아왔습니다.,2020.06.29-2020.07.20,None
1841,뷰티,마스크/습기에 무너지는 화장 짜증나죠? 메이크업 고정과 미스트를 한번에!,주식회사 에스비코스메틱스,2099%,"20,995,900원","1,000,000원",623,309,"마스크 벗을 때마다 수정 화장, 지겹지도 않나요? 지금 쓰는 화장품 그대로 메이크업하시고, 마스크 쓰기 전에 뿌려만 주세요. 아침 화장 저녁까지, 수분감은 촉촉하게 <쉴드 픽서>",2020.08.23-2020.09.07,None
1842,뷰티,[커뮤니티 체험리뷰 필히 확인]안 입은 것보다 더 편한 리버스 팬티,엠엠컴퍼니,1116%,"5,581,700원","500,000원",102,87,텐셀™ 라이오셀 섬유가 95% 함유된 원단에 획기적인 패턴과 재봉 방식을 더해 고정관념을 뒤집어 버린 <리버스> 팬티를 소개합니다.,2021.02.10-2021.02.24,None
1843,뷰티,4730%앵콜ㅣ쿠션에 특허가 몇개야? 91%수분에센스기능성 [순간쿠션],(주)샤르드,11344%,"56,724,800원","500,000원","1,060",705,"늦잠자도 #순간쿠션만 있으면 OK! 더이상 손쓰지마세요.앰플,에센스,선크림,파운데이션이 쿠션 하나로! 특허받은 성분들로 물광 올킬할수 있습니다!",2020.05.28-2020.06.15,None
1844,뷰티,방황은 이제 그만! 당신의 마음 속 '첫번째 샴푸'가 되겠습니다.,프레시그런트 코리아,23%,"119,900원","500,000원",37,35,"특허성분+다시마+창포+파파인+착한 성분이 함유된 피부에 순한 약산성 샴푸, 프레시그런트 첫번째 샴푸! 샴푸 유목민은 이제 그만! 당신의 마음 속 첫번째 샴푸가 되겠습니다.",2021.02.01-2021.02.15,펀딩성공
1845,뷰티,[청정모공] 더 이상의 자극적 관리는 NO! 에센스 하나로 매끈한 모공,내추럴더마 프로젝트,1239%,"12,392,100원","1,000,000원",268,240,"'Let your skin breathe'  자극으로 예민해진 피부각질,블랙헤드를 포함한 모든 피부 고민 모두 잘못된 모공 관리에서 시작되었습니다. 당신의 피부를 숨 쉬게 하세요!",2020.02.27-2020.03.22,None
1846,뷰티,선스틱에 색깔이 있어? 서퍼들의 선스틱 &SHAKA,그레이웨일,425%,"4,253,000원","1,000,000원",158,71,어떻게 서핑같은 여름 스포츠를 즐기고도 멀쩡한 피부로 일상에 복귀할 수 있을까요? 선케어 전문 브랜드 &SHAKA가 가장 쿨한 자외선 케어법을 소개합니다.,2018.06.12-2018.07.01,None
1847,뷰티,"[누적7천신화]후기로 검증된 신개념 ""여성청결제"" 이너샤인. 냄새안녕!!",에폴리시스템,3347%,"16,736,000원","500,000원",377,335,"[누적13443%앵콜/만족도4.9]수많은 후기로 검증된 ""여성청결제"" #착한성분 #냄새 #분비물에 효과적인 이너 여성청결제를 위생과 편리성에 집중된 신개념 용기로 1알에 행복!!!",2020.05.19-2020.06.14,None
1848,뷰티,"섞어 쓰는 콜라겐 화장품, 보신 적 있으세요? [100% 콜라겐 파우더]",주식회사 파켓,1031%,"10,319,800원","1,000,000원",241,213,100% 하이드롤라이즈드 콜라겐으로 피부 겉부터 속까지 촉촉하게 채워 주세요.,2020.11.27-2020.12.21,None
1849,뷰티,착하고 순한성분의 무실리콘 헤어케어,바이니즈,125%,"627,200원","500,000원",45,21,"손상모 일수록 착하고 순한 성분이필요하다!
무실리콘, 무설페이트, 무파라벤은 기본!
샴푸 EWG그린등급99% 트리트먼트EWG 그린등급95% 사용!
향까지 잡은 손상모케어 프로젝트!",2019.02.28-2019.04.02,None
1850,뷰티,"[리얼 찐 탄산온천 세안] 탄산온천의 6배! 클렌징의 완성, 케어의 시작",로도아이,771%,"3,855,000원","500,000원",91,86,"탄산 온천 기준치의 무려 6배! 
고농도 리얼 탄산수로 모공 속 노폐물까지 딥-퓨어 클렌징!
외부 환경으로부터 피부를 지켜내는 히어로 클렌저 : AND pH 밸런싱 스파 클렌저",2020.11.23-2020.12.04,None
1851,뷰티,"미스터리한 해삼으로 28일간 벌어질 놀라온 피부 변화, 해삼노니앰플",페이스엔,539%,"5,390,000원","1,000,000원",60,43,"미스테리한 해삼을 듬뿍 담아 고영양은 물론, 정제수 대신 넣은 노니추출물로 깊은 곳부터 차오르는 고영양 앰플, 시큐컴버미스테리 블루세럼 앰플!",2020.11.30-2020.12.15,None
1852,뷰티,피부에 잘 어울리는 30%함량ㅣ비타민C를 듬뿍 넣었다! 비타민앰플,포비즈,922%,"4,613,800원","500,000원",68,62,"10%? 부족해 20%? 부족해! 얼굴에 흡수되는 비타민 C를 몽땅 넣었다! 벨레펠레 비타민 C 앰플, 개봉 시 산화까지 생각 한 비타민 C 앰플은 우리밖에 없을걸? 비타민C앰플!",2021.04.12-2021.05.03,None
1853,뷰티,[1551% 앵콜] 죄송합니다. 이 비누 향수는 탈출구가 없습니다.,LIVELIVE(THE PARFUM),3370%,"16,852,000원","500,000원",406,326,"오늘부터 더 좋은 비누 향수 찾지 마세요. THE PARFUM 퍼퓸 디렉터의 ""솝 컬렉션""이면 충분하니까요.",2020.10.19-2020.11.02,None
1854,뷰티,[5점앵콜] 468개 LED로 빈틈없이 완벽한 피부ㅣ솔링디 LED 마스크,웨이투비,1871%,"9,358,000원","500,000원",72,135,"매일 똑같은 스킨케어, 이제 빛-케어하세요. 6가지 파장과 468개 LED로 빈틈없이 꽉 채운 동급최강 가성비, 가심비 <솔링디 LED 마스크>",2020.03.06-2020.03.16,None
1855,뷰티,[깃털패드]30초 만에 모공청소와 각질갈이까지 싹쓰리하는 클렌징패드 ,라운드얼스,312%,"1,563,300원","500,000원",62,71,"클렌징하는 거 세상에서 제일 귀찮잖아요. 깃털패드로 30초 세안하면 이중 세안 없이도 미세먼지, 각질, 모공 청소까지 끝! 간편한 파우치 형태로 외부에서도 손쉽게 피부관리 하세요.",2020.10.08-2020.10.26,None
1856,뷰티,[ 바른자세 Easy Learning ] 당신의 중심을 지켜라! 코어랩,앱타이론바이오,372%,"3,725,750원","1,000,000원",115,129,간단하고 간편한 자세보정기를 만들려 노력했습니다. 다리와 골반과의 인체공학적 원리를 통해 허리에 무리 가지않고 편하게 바른자세를 유지할 수 있도록  만들어 줍니다.,2019.03.27-2019.05.01,None
1857,뷰티,뭐지? 이 좋은 향기는. 여자를 뒤돌아보게 할 남자 향기의 모든 것,Olfactive Library,940%,"9,400,000원","1,000,000원",198,176,"이성의 감미로운 향기는 없던 호감도 불러일으킬 수 있죠.                 포근하고 달콤한 살냄새를 향으로 담아냈습니다.  
자, 이제 썸을 럽으로 만들어 볼까요?",2019.03.23-2019.04.28,None
1858,뷰티,[헤어사이클 프로젝트] 망가진 모발사이클을 위한 바다속 재생에너지 소환 ,주식회사 루토닉스,2426%,"12,132,000원","500,000원",258,242,"지구 생명의 근원, 무한한 자원이 존재하고있는 바다에 감명을 받아
해양 추출물을 이용하여 망가진 헤어사이클의 케어를 도와 탈모증상완화에도 도움을 주는 샴푸와 트리트먼트 제품입니다",2020.10.12-2020.11.06,None
1859,뷰티,봄에게 보내는 향기 (다용도 향기 스프레이),OH HE SHE,350%,"1,750,137원","500,000원",121,95,"어린 시절을 떠올리는 봄의 향기. 설레고 따뜻한 봄의 향기를 ""햇빛의 유년기""에 빗대었습니다. 오히쉬와 새로운 시작의 향기를 함께 하세요.",2019.01.25-2019.03.11,None
1860,뷰티,당신의 겨울을 감싸줄 향수,주식회사 클라우드에잇,1144%,"11,444,000원","1,000,000원",80,133,"그라스 최상의 향료, 일류 조향사의 섬세한 손길로 완성된 여섯 가지 향수로
당신의 일상에 작은 변화를 만들어보세요",2020.11.16-2020.12.02,None
1861,뷰티,♥앵콜♥ 기초만 순한성분 쓰지말고 메이크업도 비건하자 #심쿵스틱하이라이터,메리몽드,319%,"1,596,400원","500,000원",34,31,여성들은 매일 메이크업을 합니다. 기초케어는 순한 성분의 화장품을 꼼꼼히 고르지만 색조화장품 성분은 확인해보셨어요? 비건 브랜드 색조를 사용하여 메이크업으로 마음껏 아름다워지세요!,2019.06.28-2019.07.11,None
1862,뷰티,"피부 속부터 탄탄하게, 3세대 탄력케어 ""아쿠아 리페어링 크림""",마이디플러스,405%,"4,053,000원","1,000,000원",78,70,"값비싼 탄력케어 화장품, 대부분 효과 없다는 사실 아시나요? 피부 깊숙이 3GFs (EGF/FGF-1/IGF-1)를 전달하는 국내 최초의 3세대 탄력케어, 도헤:20입니다.",2020.02.21-2020.03.15,None
1863,뷰티,치아미백 더이상 사지마! 블링키트 한번으로 OK,디모데,1935%,"9,676,300원","500,000원",291,207,"블링키트 한번으로 계속 하얀치아 유지할수 있습니다.
더이상 치아미백 사지마세요",2019.10.29-2019.11.17,None
1864,뷰티,비타민C 6천배 항산화 제왕 아스타잔틴과 미스트의 만남! 꿀 피부 만들기,(주)지디이,108%,"540,500원","500,000원",32,33,"비타민C의 6,000배! 아스타잔틴 희석액과 올인원 에센스 미스트로 나만의 화장품 만들기. ""아스떼 DIY 솔루션 세트""",2020.10.23-2020.11.02,None
1865,뷰티,세계가 주목하는 진짜! 뷰티 디바이스,주식회사미듬,1100%,"11,000,000원","1,000,000원",35,62,"세계가 먼저 알아본 뷰티 디바이스! 디자인이면 디자인! 기능이면 기능! 뭐 하나 빠지는 것 없는 스마트 뷰티 디바이스. 
이제 그 놀라운 경험을 함께 하실 수 있습니다.",2020.01.07-2020.01.13,None
1866,뷰티,"[앵콜&신규/만족도5.0]향덕이 인정하는 그 향수-풀, 바다,첫사랑,위로",황수진,361%,"5,421,000원","1,500,000원",77,90,"마지막 앵콜 + 바다 바람, 물내음, 잔디밭 그리고 사랑의 기억속 순간을 담은 4종의 신규 향수가 준비되어 있습니다.",2020.07.30-2020.08.11,None
1867,뷰티,[평점 5점만점 앵콜]수분+탄력 한 번에 끝내는 겉탱속촉 입소문크림!,(주)투에이블,477%,"2,387,700원","500,000원",42,53,"[평점5.0앵콜]겨울철 피부의 핵심은 속보습! 지리산 산청에서 속건성을 위한 겉.탱.속.촉크림이 찾아왔어요! 매일 아침 메이크업 시간을 즐겁게 해줄, 배지힐스 기초케어를 만나보세요",2021.02.22-2021.03.08,None
1868,뷰티,"[앵콜] 샴푸 5병=1샴푸바! 무더위를 날릴 에어컨 샴푸 ""화해 샴푸바""",아렌시아,3128%,"15,644,500원","500,000원",325,345,"더욱 쿨~하게 돌아온 에어컨 샴푸,  ""화해 샴푸바""로 여름 무더위에 뜨겁게 달궈진 두피와 화해하세요. 이번엔 두가지 맛으로 돌아온 화해 샴푸바 취향따라 골라서 사용해보세요!",2020.07.17-2020.08.03,None
1869,뷰티,"[앵콜]후기가 증명하는 예민하고 뿔난피부 진정, EWG등급 화장품",트루하트,368%,"1,844,440원","500,000원",47,35,"[앵콜]붉고 성난피부 진정 성분을 담은 트루하트 센텔라 시카 크림과 함께 돌아온 후기가 증명하는 예민하고 뿔난피부를 위한 트루하트 센텔라 시카 스팟 에센스!
    패션잡화 기획전 파트너와 함께합니다.",2018.11.02-2018.11.11,None
1870,뷰티,"코를 쓱-, 모공을 쓱-, 모공관리의 즐거움 코쓱모쓱 !",유닛브랜드,196%,"1,963,300원","1,000,000원",19,24,"내 피부를 위한 피부관리의 기본 해결책 = '각질&모공관리' !
""내 피부도?"" 하며 혹해버린 화장품 돈낭비 ! 넘쳐나는 화장품들 !
코쓱모쓱으로 합리적인 화장품루트를 경험해보세요",2019.11.08-2019.11.29,None
1871,뷰티,스킨+에센스+로션+영양크림=올인원 영양크림 동동구리무로 더 이뻐지세요,주라이프네츄럴코스메틱 주앤솝,119%,"599,100원","500,000원",7,4,유해성분0% 안심성분으로 만든 올인원 크림[스킨+에센스+로션+영양크림=동동구리무]로 화장품 다이어트하여 피부미인 되세요! 유수분 밸런스를 맞추어 생기있는 피부로 만들어드립니다,2019.03.28-2019.04.03,None
1872,뷰티,마스크 팩의 기준! EWG그린 등급의 20가지 성분이면 충분합니다.,앤아이씨 랩,570%,"2,852,100원","500,000원",88,73,"EWG 그린등급의 20가지 성분으로만 만들어진 화장품 .
호박 추출물이 10,000 ppm 함유되어 있는 리얼 마이 페이스 핏!",2020.02.12-2020.02.26,None
1873,뷰티,5.0 앵콜ㅣ볼리프팅이 되는 앰플? 잔주름 개선과 시카 72%로 진정까지,디자인주식회사,340%,"1,700,450원","500,000원",40,49,"만족도 높은 앰플, 써본사람만이 느낄 수 있는 만족감, 스킨벨 시카앰플 2종이 다시 돌아왔습니다! 
볼리프팅 쫘-악 한번 땡겨봐. 잔주름 타파 앰플",2021.04.23-2021.05.17,None
1874,뷰티,"숙면이 필요한 사람에게! 잠,한방울!",이포이스퀘어(주),308%,"1,544,300원","500,000원",45,68,"숙면이 필요한 당신! 오늘의 숙면은 내일을 결정합니다.
여기 특허 담은 '잠, 한방울' 오일이 와디즈에 여러분을 만나러 왔습니다.",2019.11.28-2019.12.26,None
1875,뷰티,<연예인들의 헤어스프레이>쓰면 쓸수록 모발이 좋아지는 헤어스프레이?,청담남자,1325%,"6,626,500원","500,000원",145,74,"청담동 15년이상 경력의 헤어전문가들의 경험과 노하우를 담아
완성된 프리미엄 헤어스프레이!
모발 단백질 성분인 폴리펩타이드와 천연사탕수수원액을 주원료로 만든 차원이 다른 제품!",2021.04.28-2021.05.19,None
1876,뷰티,이 세상 단 하나의 프리미엄 보이차 에센스 [타임리스 브라운 에센스],주식회사유얼레디노우,2863%,"14,316,000원","500,000원",197,115,"[피부의 시간을 되돌리다] 트렌드를 따르지 않습니다. 최상의 원료만을 고집합니다. 좋은 화장품의 기준, 당신은 이미 알고 있습니다. 유얼레디노우의 첫 번째 프리미엄 에센스.",2020.01.10-2020.01.31,None
1877,뷰티,"다가올 봄의 향연, 오리엔탈 레드 티(tea) 향기로 만끽하세요",차애수,174%,"1,398,300원","800,000원",39,57,"[차애수]우디, 패출리, 베티버 오일과 장미를 블렌딩한 '오리엔탈 무드 레드 티(tea) 우디향수'로 편안하고 부드러운 겨울 속 봄을 맞이할 순간.",2020.01.28-2020.02.11,None
1878,뷰티,두피에 슥- 바르고 잠들면 끝! 초간단 탈모홈케어 [솔랩 두피 앰플팩],솔랩(Solep),4556%,"22,782,600원","500,000원",512,425,"바르고 잠들면 두피 깊숙이 비타민이 충전된다? ‘솔랩 두피 수면 앰플팩’으로 자는 동안, 초간단 탈모홈케어를 경험해보세요. 이제부터 두피에 ""1일 1앰플 팩""해보세요.",2020.02.28-2020.03.23,None
1879,뷰티,평점4.9! 아타라가 작정하고 만든 헤어에센스 끝판왕!,아타라코리아,107%,"5,399,600원","5,000,000원",137,88,아타라 헤어 에센스 오일은 안 좋은 성분 10가지를 빼고 헤어케어에 도움이 되는 오일 10가지를 넣어 아낌없는 최고의 헤어케어 제품을 만들고자 하였습니다.,2019.11.06-2019.11.17,None
1880,뷰티,"기미,잡티에원인 멜라닌색소를 안전하게 분해하는 유기농천연앰플 <멜라센스>",에폴리시스템,815%,"4,075,600원","500,000원",89,102,"기미,잡티의 원인 멜라닌색소를 안전하게 분해하는 유기농천연앰플 <멜라센스>
USAD 유기농센텔라(병풀추출물) 고함량 100.000ppm 으로 피부케어",2019.12.10-2019.12.29,None
1881,뷰티,"방금 채취한 신선한 다시마, 먹지 말고 피부에 붙이세요! [다시마하라]",HARAPACK,269%,"2,692,500원","1,000,000원",82,70,신선함을 그대로 담아내기 위해 펀딩과 함께 다시마 채취가 시작됩니다. 청정해역의 진짜 다시마로 만든 시트와 마스크시트가 만들어 낸 남다른 촉촉함! 자고 일어나면 깜짝 놀랄 거예요.,2019.08.27-2019.09.17,None
1882,뷰티,진정한 피부미인을 위한 이너뷰티,내몸에 사과해 뷰티콜라겐,104%,"522,500원","500,000원",14,10,"아직도 바르기만 하시나요? 피부속부터 채워야 진정한 피부미인!!
 1일 1포로 챙기는 피부건강의 시작. 피부미인이 되고 싶은신분 주목~~~~",2018.11.26-2018.12.16,None
1883,뷰티,"[4.9 앵콜!] 이 앰플이 뭐길래? 보습,피부결,미백, 주름까지 개선",주식회사 에스앤비산업,385%,"3,852,000원","1,000,000원",71,73,"“에스클래스파워앰플”은 보습,탄력,피부결,피부톤, 미백,주름 까지 개선에 도움을 주는 앰플입니다. 명품피부를 이 작은 한 병에 담았습니다. 놀라운 경험을 시작하세요",2020.10.06-2020.10.19,None
1884,뷰티,"""어머 이게 진짜 섬유향수 향이에요?"" 백화점 여직원도 깜짝 놀란 패브랩",트루프루,279%,"2,796,000원","1,000,000원",33,45,"니치퍼퓸 제조사에서 직접 만들었습니다!
니치퍼퓸 원액을 100% 듬뿍듬뿍! 
시트러스향 전문 니치퍼퓸 브랜드인 트루프루의 시원상큼달콤한 향의 세계로 드루와~보세요~ ^ㅅ^",2019.07.04-2019.07.24,None
1885,뷰티,"피부 진정을 위한, 예로부터 전해온 최적의 블렌딩을 가득 넣은 영양 토너",코르반,30%,"153,100원","500,000원",16,6,"피부를 가장 편안하게 해주는 궁극의 블렌딩을 찾아 
피부 진정과 보습을 책임져 주는 스킨토너",2019.10.23-2019.11.01,펀딩성공
1886,뷰티,"1만원대로 일상에 은은한 행운을 가져오는 마법의 향기, 샐리의 향수",프레시그런트 코리아,1054%,"5,274,600원","500,000원",186,140,"바쁜 일상과 복잡한 인간관계 속에 지친 당신!
이제 샐리의 향수의 은은하고 상큼한 향기로 
샐리의 법칙을 발동시켜 당신에겐 좋은 일만 생길 거예요!",2020.07.06-2020.07.27,None
1887,뷰티,2주일만 발라도 얼굴이 달라지는 미백앰플 + 마데카진정앰플!,(주)에이르랩,57%,"2,893,200원","5,000,000원",76,62,"피부미백, 마데카소사이드 피부 진정, 색소침착 개선까지!",2020.11.09-2020.11.25,펀딩성공
1888,뷰티,"[이향기뭐야?]매일 듣는 질문.향기로 기억되세요, 플로리스트 디퓨져4종",세이플레르,517%,"2,586,000원","500,000원",60,53,"[향기에 반하다] 더멀리, 더 오래, 더 향긋하게. 현직 플로리스트가 전하는 은은하고 오래가는 자연의 향기 
내가 있는 공간이 꽃집으로 변하다.",2021.04.08-2021.04.26,None
1889,뷰티,[네츄럴실키샴푸]  EWG 1등급 성분 99%의 착한샴푸,호바눔(HOBANUM),163%,"1,638,590원","1,000,000원",63,29,"가렵고 예민한 두피가 고민이라면, 안전등급 1등급 99%의 착한샴푸로
건강한 두피를 되찾아보세요 !",2018.10.03-2018.10.23,None
1890,뷰티,"모공까지 예쁘게 싹- 꿀피부 표현, 프로폴리스 듬뿍 | 리셋쿠션",자민경(주),910%,"4,551,000원","500,000원",104,84,"바를 수록 좋아지는 피부컨디션을 꿈꿀 수 있는 앰플쿠션! 임상만 17가지, 자민경의 홈쇼핑 완판템 90울트라 프로폴리스 앰플 34% 함유한 리셋쿠션으로 스킨케어와 메이크업을 한번에",2021.04.16-2021.05.03,None
1891,뷰티,[세라마이드 0.5 이펙터] 수딩젤을 영양에센스로 변신시키는 고농축 앰플,주식회사 위메이크코스메틱스,310%,"1,550,600원","500,000원",51,44,"아침저녁으로 달라지는 피부 컨디션을 위해 탄생한 고농축 앰플. '세라마이드' '레시틴' '6가지 히알루론산'을 함유한 COSLOW 앰플이 보습,영양에 대한 맞춤형 솔루션을 드려요.",2020.05.01-2020.05.25,None
1892,뷰티,"""탈모증상완화앰플쏙쏙""손으로 흡수시켰나요? 볼륨부스터로 두피속깊은곳까지!",루토닉스 볼륨부스터,1545%,"15,454,000원","1,000,000원",198,213,"여러분, 두피 안까지 제대로 흡수시켜본 적 있으세요? 시중에 나와있는 수많은 두피 앰플, 이제는 확실히 흡수시켜야 합니다. 볼륨부스터로 앰플의 주요성분을 두피 깊숙이 흡수시키세요!",2019.08.01-2019.08.25,None
1893,뷰티,7일간의 놀라운 변화! 곰보앰플로 해결하는 원스텝 진정 솔루션!,메이드미,236%,"1,184,400원","500,000원",62,50,"3600시간의 정성으로 직접 재배하고 추출한 곰보배추 가득! 
못난 피부를 깨끗하고 매끈하게 가꿔주는 피부 진정 솔루션,
눈에 보이는 7일간의 변화를 경험해보세요.",2019.08.12-2019.08.26,None
1894,뷰티,좋은 향수를 잘 만들고 싶었습니다.,LE MONDE BLANC,812%,"4,064,500원","500,000원",64,66,“하얀 세상”을 우리 브랜드의 색으로 아름답게 하나씩 채워 나가고자 합니다.,2019.06.13-2019.06.30,None
1895,뷰티,"지긋지긋한 발 각질! 근본부터 바꿔버리자!  100% 비건, 비건 풋크림",제이커네릭(Jakeneric),669%,"3,349,700원","500,000원",107,67,"겨울도 아닌데 발뒤꿈치에 하얗게 각질이 쌓여 있나요? 맨발일 때, 스타킹 신을 때, 양말 벗을 때 신경 쓰이나요? 각질 문제를 근본부터 바꿔줄 100% 비건 솔루션 <비건 풋크림>",2019.09.23-2019.10.13,None
1896,뷰티,[화장품원료회사] 독일산 구아이아줄렌 프리미엄 앰플,(주)코윈바이오,274%,"8,241,560원","3,000,000원",239,283,화장품 원료회사 6년의 경험을 담은 구아이아줄렌 파란병 앰플. 뿌리깊은 건조함을 피부 속부터 채워 맑고 건강한 피부로 가꾸어 드립니다.,2019.03.21-2019.04.04,None
1897,뷰티,"[4차앵콜] 묵은 피지, 블랙헤드도 한번에 씻는 클렌저 <세수한번>",심플리웍스,8304%,"41,522,400원","500,000원",924,471,"“당신의 세수는 얼마짜리인가요?” 
피부 · 시간 · 지갑을 위한 세수혁신 프로젝트! 
세 / 수 / 한 / 번",2019.03.14-2019.03.24,None
