,categories,title,company_names,percentages,funding_amounts,target_amounts,n_supporters,likes,descriptions,durations,days_left
612,뷰티,"[집콕러들 주목]  달콤한 목욕, 본베인과 함께하세요",본베인,553%,"2,765,000원","500,000원",22,31,"먹지 마세요, 바디케어에 양보하세요! 
다양하게 사용 가능한 상큼한 폼폼젤리와    달콤하고 풍성한 거품의 버블카라멜로 행복한 목욕이 더 행복해질 수 있게!",2021.04.06-2021.04.26,None
613,뷰티,한 장으로 피지&각질 부셔버리네요 [호박 필패드],주식회사 어셈블뷰티,230%,"1,152,900원","500,000원",53,70,한 장으로 피지&각질 부셔버리네요 [호박 필패드],2020.02.21-2020.03.01,None
614,뷰티,[앵콜]민트덕후를 위한 민트향수&민트초코향수 ,(주)워나스,1188%,"5,944,400원","500,000원",131,157,"[앵콜]리얼한 민트와 민트초코를 향기로 만들었습니다. 자칭, 타칭, 자타공인 ‘민트덕후’라면 이제 민트 향수까지 소장해야 할 시간!",2020.03.30-2020.04.12,None
615,뷰티,척박한 두피를 위한 우아한 단비. 장미밭에 풍덩빠진 #로즈샴푸,리베스크,613%,"3,068,400원","500,000원",76,62,"정제수 대신 49.57% 장미꽃추출물을 진하게 담은 우아한 샴푸메이트. 가렵고 열받은 두피, 건조하고 척박한 두피, 땀과 피지로 고군분투하는 두피를 말끔하게 정돈해줍니다.",2020.10.26-2020.11.09,None
616,뷰티,"[쉐이빙스틱] 참 피곤한 세상, 매일 아침 '털털'한 남자들의 정착템",더 쉐이브,306%,"3,067,000원","1,000,000원",179,85,"[안티스트레스 쉐이빙스틱]
오늘 아침, 면도 어떻게 하셨나요?
물을 묻혀, 면도부위에 발라주면 면도준비 끝.
크리미한 윤활력으로 부드럽게 바르는 스틱형 면도보조제품!!",2019.05.31-2019.06.16,None
617,뷰티,"온국민 항문조이기 케겔,하체단련 운동기구 엔조이",에프디아이,36%,"1,100,800원","3,000,000원",18,58,"케겔운동 및 하체단련 운동기구로 
남녀노소 누구나 쉽게 운동할 수 있는 운동기구 입니다.",2019.10.25-2019.11.25,펀딩성공
618,뷰티,세정이 필요없는 파우치속 청결제 ,헥사 바이오(주),12%,"1,201,500원","10,000,000원",14,14,좋은 화장품은 누구나 마음 놓고 사용 할 수 있고 상쾌하게 해줍니다.헥사 바이오(주)에서는 사용 후 세정이 필요없는 파우치속에 넣고 다닐수있는 여성용 청결제를 만들었습니다.,2019.07.12-2019.08.12,펀딩성공
619,뷰티,실효능을 위해 제형부터 싹 다 바꾼 트리트먼트형 탈모샴푸 #코스맥스최초,(주)알에이치앤비브랜즈,456%,"2,283,750원","500,000원",30,30,"다 똑같기만 했던 탈모샴푸, 이젠 바꾸세요! 제형이 바뀌어야 성분의 양이 달라집니다. 탈모를 위한 두피개선부터 손상모 케어까지  리얼그로 트리트먼트 샴푸로 한번에 관리해 보세요",2020.05.29-2020.06.15,None
620,뷰티,[임상완료] -2도 떨어지는 쿨링! 자연의 힘으로 안전한 순초 퀵 수딩젤,(주)유한건강생활,1046%,"8,372,400원","800,000원",165,91,"합성 성분으로 인한 인공적인 쿨링 효과는 더 이상 그만! 알레르기 물질, 발암물질, 내분비계 교란물질로부터 안전한 0세부터 쓸 수 있는 진정&쿨링 순초 퀵 수딩 젤",2021.04.15-2021.04.26,None
621,뷰티,쫀쫀 거품으로 물의 온도를 유지해주는 자연주의 버블 입욕제,나띵프로젝트(하프아티스트),846%,"8,468,700원","1,000,000원",219,128,"뜨끈한 목욕이 필요한 날, 사해소금과 먹을 수 있는 원료를 넣은 자연주의 버블 입욕제로 20분의 힐링을 즐기세요. 쫀쫀거품으로 온도 유지, 바디워시 없이도 피부가 촉촉 매끈해져요!",2018.10.15-2018.11.04,None
622,뷰티,[LED 마스크를 위하여] 전용 마스크팩으로 좋은 성분을 피부 끝까지,(주)일론,940%,"9,401,000원","1,000,000원",108,45,[LED-O 엘이디오] LED 마스크 디바이스를 더욱 효과적으로 사용할 수 있도록 제작한 전용 마스크팩 엘이디오 하이드로겔 마스크로 환절기 피부를 관리해보세요!,2019.10.08-2019.10.20,None
623,뷰티,이제부터 당신은 발효 미인,아름다움을 연구하는 기업 (주)에스디코스메틱,13%,"662,000원","5,000,000원",6,4,끓는다(FERVERE)~~~발효여과물 발효 명품화장품3종,2018.12.18-2019.01.01,펀딩성공
624,뷰티,"한국인의 두피,모발 특성을 고려한 한국 정통 포마드 ",주식회사 리찰스,1686%,"8,432,500원","500,000원",196,80,"‘남자의 자신감’을 완성시키는 포마드,
남자머리 54년 경험과 노하우로 만들어진 한국남자를 위한 정통 포마드를 소개합니다.",2019.05.31-2019.06.16,None
625,뷰티,신개념 각질제거법 | 칙 뿌리고 가볍게 밀면 끝나는 손쉬운 때밀기,(주)라이프사이언스코스메틱,783%,"3,917,000원","500,000원",163,114,"때밀기, 번거롭고 아파서 미뤄왔다면 “코스마인 이지클린 바디스프레이”를 만나세요.
뜨거운 물에 불리지 않아도, 힘주어 박박 밀지 않아도 되는 초간편 각질관리법입니다.",2020.01.16-2020.02.02,None
626,뷰티,당신만을 위한 프리미엄 니치향수 I 알고리즘으로 맞춤향기를 찾아드릴게요,스윗솔루션,2098%,"10,491,000원","500,000원",82,98,"어딜가도 비슷하고 남들 다 쓰는 향수가 질린다면, 당신을 오롯이 담아낸 당신만의 향기를 찾아줄 퀀텀센트의 나만을 위한 향기 'SCENT FINDER'(센트 파인더)를 만나보세요!
    부산경제진흥원 파트너와 함께합니다.",2020.12.21-2021.01.11,None
627,뷰티,"나노 금(Gold), 침투력에 집중하여 만들어 이슈!",새솔(SEASOL),195%,"976,800원","500,000원",9,22,"특별한공법으로 나노 금(Gold)을 천연화장품에 녹여내다.
흡수보다 침투력이 우선이라는 철학으로 10여년간 연구 끝에 개발한  리수연 인텐시브 시리즈를
와디즈에서 먼저 만나보세요.",2020.12.30-2021.01.18,None
628,뷰티,화장을 해도 피곤해보인다는 소리를 듣는다면? [퍼팩트크림],(주)오린,182%,"913,720원","500,000원",15,39,프리미엄 에센스를 담은 볼리에르 퍼팩트 크림으로 화장이 잘 받는 피부로 변화시켜보세요!,2020.02.10-2020.03.02,None
629,뷰티,머리 감는 시간이 즐거워지는  <이미지메이킹 샴푸바>,aromaverse (아로마벌스),177%,"889,500원","500,000원",36,33,"머리를 감으면서 나의 이미지를 만들수 있어요!
당신이 원하는 나의 모습은 어떤건가요?
열정적인? 솔직함? 매력적인? 용기있는?
<이미지메이킹 샴푸바>로 마법 같은 날을 만나보아요.",2020.12.16-2021.01.08,None
630,뷰티,깨끗한 두피와 건강한 모발을 위한 솔루션 토닉,(주)에코바이오의학연구소,16%,"168,000원","1,000,000원",12,12,건강한 두피 > 덩달아 건강해지는 모발 > 다시 젊은 시절 그 때로..,2019.04.11-2019.04.24,펀딩성공
631,뷰티,[앵콜] 땀으로 인한 고민 없는 올 여름 나기! 간편한 데오드란트 패드,셀리젠28,334%,"1,670,400원","500,000원",35,34,땀으로 인한 고민 없는 올 여름 나기! 간편하게 쓱쓱 겨땀 패드! #악취 제거 #톤업#미백 #쿨링 #간편한 사용 #뽀송함,2019.07.18-2019.07.28,None
632,뷰티,"그린토마토, 모공수렴으로 특허받아 화제!",(주)성분에디터,52668%,"263,341,600원","500,000원","6,061",3077,"특허받은 그린토마토가 모공을 쫀쫀하게 조여줍니다!
모공 사이즈, 면적, 볼륨까지  그린토마토 모공앰플 한병이면 OK!
나이들수록 넓어지는 모공, 지금부터 관리하세요",2020.11.16-2020.12.21,None
633,뷰티,[ 손톱 호강/5천원 ] 큐티클 순삭은 기본이죠! 유향미르 네일 에센스,우리민트 컴퍼니,3118%,"15,591,700원","500,000원",900,580,"메마른 겨울철, 고통 받는 손톱과 큐티클을 위하여 [ 바르면 됩니다 ] 바른 원료, 바른 제조! 오가닉 네일펜의 선두, 아르간 오일펜 [ 3세대 전면 개선판 ] 입니다",2020.12.23-2021.01.18,None
634,뷰티,[MOISWISH] LED마스크와 빛에 반응하는 화장품 세트,닥터아이앤비(주),1499%,"14,996,000원","1,000,000원",54,55,"""2주간 사용했는데 나보다 주변사람들이 먼저 알아챌 정도로 피부가 많이 좋아졌어요!"" 
LED 빛에 반응하는 화장품, 궁금하지 않나요?",2019.12.12-2019.12.17,None
635,뷰티,건조한 계절에도 수분 꽉! 잡아줄 수분크림의 정석,주식회사 미스터리보틀인터내셔널,1318%,"6,590,300원","500,000원",119,52,"계절 바뀌면 수분크림도 바꿔야 할까요? 피부가 수분을 머금는 기본 원리에 따라 만드니까, 계절 바뀌어도 바꿀 필요 없어요. 올 겨울 부터는 비레머디스 수분크림으로 정착해 보세요!",2020.11.23-2020.11.30,None
636,뷰티,"단 15일, 내 피부가 변하는 시간  '미백+고보습+진정' 최적의 레시피",더마네이처코스메틱(주),5849%,"29,247,000원","500,000원",575,512,"멜라닌색소 억제,완화에 도움을 줄 수 있는 5가지 멜라케어 성분이 피부를 환하게 밝히고! 피부 속까지 수분을 꽉 잡아주는 초저분자 히알루론산이 하루종일 촉촉하게 빛나는 피부를 완성",2020.03.05-2020.03.24,None
637,뷰티,당신의 눈가에서 세월의 흔적이 지워지길 바랍니다. 다이아프리티 아이크림,다이아프리티,35%,"358,400원","1,000,000원",24,18,"흐르는 시간을 멈출 순 없지만, 당신의 눈가에 흘러간 세월에 조금이나마 도움이 되었으면 좋겠습니다.",2019.08.30-2019.10.07,펀딩성공
638,뷰티,"[필독] 섹시한 그 남자의 선택, 피부 타입별 #올인원 #맨헤즈 ",(주)맨헤즈,1122%,"5,611,000원","500,000원",148,82,"남성의 다양한 피부에 꼭 맞는 Skin Care Solution
예민하고 솔직한 피부에 해답을! 
저자극 고기능[피부미백+주름개선] 2중 기능성 남성화장품!",2019.06.14-2019.07.01,None
639,뷰티,"미니멀루틴 스킨케어, 광.톤.결 3단케어 #깨죽크림",버진팜스,1017%,"5,089,150원","500,000원",145,120,"상위 1% 성분 제조가 선사하는 [광.톤.결 3단케어]/이데베논,비타민C유도체 함유된 [미니멀루틴 스킨케어]/이 한가지의 제품으로 당신의 광.톤.결에 대한 피부문제를 해결해드립니다",2019.11.18-2019.12.16,None
640,뷰티,"불가리아산 100% 식물성 원료, 내 몸이 원하는 힐링 바디오일",(주)이네스글로벌,422%,"4,228,000원","1,000,000원",120,75,샤워 후 바디오일을 바르는 것은 피부보습을 위한 필수 과정입니다. 미네랄 오일을 한 방울도 넣지 않은 불가리아에서 직수입한 100% 식물성 원료로 만든 바디오일을 소개합니다.,2019.03.18-2019.04.10,None
641,뷰티,더 이상 시간 들여 바르지 마세요. 바쁜 당신을 위한 #크림인스킨,잇츠스킨,366%,"1,833,700원","500,000원",85,32,"어느 세월에 3스킨, 7스킨? 이제 최소한의 필수 스텝으로 꼭 필요한 수분을 채워주며 간단하게 케어해 보세요. 
젠더리스 시즌리스 크림인스킨이 바쁜 하루를 도와드릴게요.",2019.06.10-2019.06.30,None
642,뷰티,"[4.3앵콜] 환경과 피부를 생각하는 올인원 진정케어, '베비농크림'",포레세,121%,"607,700원","500,000원",63,44,"민감성 피부를 위해 환경과 피부를 생각하는 올인원 진정케어 '베비농크림'이
앵콜펀딩으로 더 강력하게 돌아왔습니다!",2021.04.24-2021.05.07,None
643,뷰티,"[올인원 블랙헤드 케어] 쓱쓱~ 문질러 녹이고, 싹싹~ 문질러 지워요!",그래서그린 주식회사,8035%,"40,176,600원","500,000원","1,091",706,무독성 실리콘 브러쉬가 내장된 블랙헤드 클렌징 스틱이에요. 블랙헤드 제거에 좋다는 건 ‘다 해봐도 소용없더라!' 는 분도 이건 정말 다를걸요? :),2020.07.28-2020.08.18,None
644,뷰티,"톤팡질팡 하지 말고, 에뛰드 퍼스널 컬러 팔레트 프로!",(주)에뛰드,264%,"10,582,700원","4,000,000원",552,143,"내 안에 숨겨진 모습을 찾아주는 퍼스널 컬러!
웜톤/쿨톤에 봄,여름,가을,겨울 4계절까지 반영한 인생 팔레트!
더욱 정교해진 퍼스널컬러 팔레트 프로를 만나보세요~",2017.04.19-2017.05.07,None
645,뷰티,의사가 직접 연구 개발한 근거있는 #다이어트&쾌변,닥터에비던스,414%,"2,070,270원","500,000원",46,43,"잘못된 정보의 상업적 이용을 막고, 이를 바로 잡고자 의사로서 모든 것을 내려두고, 약 1년간 연구에 몰두하였습니다. 진실된 근거에 기반한 브랜드를 만들어 가겠습니다.",2019.04.07-2019.04.14,None
646,뷰티,[앵콜] 인기니치향26종에 레이어링팁까지?! 5만원대에 모두 가져가세요,노멀리스트,2037%,"10,185,000원","500,000원",176,225,장바구니에 20만원 짜리 향수를 넣어놓고 몇 개월째 망설이고 있나요? 이제는 향수 선택에 실패 없어요. 그리고 향에 대한 안목이 더 넓어질 거예요!,2021.04.05-2021.04.26,None
647,뷰티,세안 후 첫단계! <주름+수분+진정>을 한번에. 퍼스트 안티링클 에센스 ,에스네이처,966%,"9,668,500원","1,000,000원",133,90,"'주름개선 기능성 화장품'에 방황하는 유목민들 모두 모여라!
순하면서도 안티링클케어는 똑똑하게!
#12년기술력_에스네이처 안티링클 에센스",2019.11.29-2019.12.22,None
648,뷰티,"<비타민B,C 앰플> 너무 많은 비타민 앰플? 이번엔 다를겁니다!!",주식회사 뷰티넷코리아,29%,"147,000원","500,000원",26,27,"너무나도 많은 비타민 앰플! 이제는 제대로 사용할 때 됐습니다. 
비타민B, C 원하는 타입으로 골라 쓰자!",2021.02.03-2021.02.15,펀딩성공
649,뷰티,<샴푸만 바꾼다고 될까?>두피케어계의 신세계!  SUPP 런칭!,(주)신세계인터내셔날,146%,"1,460,000원","1,000,000원",22,40,"""샴푸만으로 탈모가 진짜 완화될까요?""
진짜 탈모케어는 머리카락이 살기 좋은 환경을 만들어주는 거예요.
비타민+영양제+쿨링+딥클린까지!  SUPP으로 진짜 헤어케어를 시작 하세요!",2020.08.05-2020.08.19,None
650,뷰티,"30초 안에 살리는 남자의 T존, 다비드필러!",프롬블랙,108%,"2,164,000원","2,000,000원",132,86,"30초 안에 살리는 남자의 T존, 코가 다했다! 프롬블랙 다비드필러",2019.03.21-2019.04.21,None
651,뷰티,"100방울의 마법, 커스텀 향수 DIY 키트",루이스네프,45%,"228,000원","500,000원",6,21,"총 100방울의 향료를 선택하세요, 세상에 단 하나뿐인 나만의 향기를 만들어드립니다. 그 향기로 직접 향수를 만들어보는 재미를 느껴 보세요.",2018.07.16-2018.07.30,펀딩성공
652,뷰티,손바닥 만큼 작은 비데가 있다면 믿으시겠어요?,바이오앤네이쳐,56%,"280,900원","500,000원",12,10,손바닥 만큼 작은 비데로 언제 어디서나 깨끗한 나를 만드세요,2019.07.24-2019.07.31,펀딩성공
653,뷰티,"주얼리 이침,  너는 더 건강하게 아름다울 수 있어",ZENCY EARCOCO[SEIGA],336%,"10,098,000원","3,000,000원",83,227,"#ZENCY is a jewelry brand of #SEIGA Inc.
젠시의 첫 제품 이어코코(EAR COCO)
언제 어디서나 아름다운 이침효과

2019.01.18",2019.01.18-2019.02.25,None
654,뷰티,[앵콜7차] 안전등급 착한원료 닥터프랜즈 2IN1 남성용 스킨로션,닥터프랜즈,140%,"2,810,300원","2,000,000원",104,47,"매 펀딩마다 새로운 기록!  남자의 투인원 스킨+로션
남/여 100명의 블라인드 테스트를 거쳐 가장 높은 점수를 받은 조합으로 태어난 남성용 투인원 닥터프랜즈 스킨+로션입니다.",2018.08.11-2018.09.10,None
655,뷰티,올인원클렌징솝바 I 블랙헤드&피지 녹이는 촉촉세안! 비누만 30년<효창>,효창,2309%,"11,547,000원","500,000원",343,258,"우리가 알던 폼클렌징은 잊어라!
비누만 30년,  '효창'이 만든 촉촉한 올인원 클렌징솝바!
쟁여두고 오래오래 나만 알고 싶은 비누, 효.창.비.누.",2021.03.18-2021.04.05,None
656,뷰티,"말이 돼? 기미,잡티 2주만에 개선! 임상으로 입증한 미백 항산화크림",주식회사 스킨이데아,6619%,"132,395,005원","2,000,000원","2,379",1812,"피부과학연구소에서 임상시험 진행한 찐! 화이트닝 항산화크림 #아스타잔틴! 인체적용시험 결과 2주만에  변화하는 피부 멜라닌 확인! 
 '솔라잔틴'이 앵콜펀딩으로 돌아왔습니다",2021.01.11-2021.02.15,None
657,뷰티,급이 다른 향. 세계 탑클래스 퍼퓨머의 프리미엄 핸드크림과 핸드워시,1FLR - 원플러,1874%,"9,373,500원","500,000원",347,175,"월드클래스 제조사에서 백화점 브랜드급 화장품을 거품을 빼고 만들어, 더 많은 사람들이 프리미엄 화장품을 일상으로 누렸으면 좋겠습니다. 
    외면의 아름다움 뷰티아웃사이드 파트너와 함께합니다.",2019.02.21-2019.03.04,None
658,뷰티,[진짜가 나타났다] 똥손도 금손으로 만들어주는 플라 이지랩 봉 고데기,주식회사 이니셜,556%,"5,567,100원","1,000,000원",102,154,"00야 너 머리 어디서했어?
누구나 쉽게 똥손도 금손으로 만들어주는 플라 이지랩 봉고데기!
머리길이에 맞게 봉 굵기교체가능,스타일리쉬하게 일상을 바꿔보세요.",2020.08.31-2020.09.14,None
659,뷰티,예술과 마스크팩의 콜라보! 미술 작품처럼 아름다운 피부결을 위한 마스크팩,(주)제이나인코스메틱,237%,"1,189,000원","500,000원",52,22,"마스크팩 한 장도 품격있게!
와디즈에서 처음 선보이는 서정아트센터 x 포라뽀 콜라보 마스크팩",2019.05.14-2019.05.30,None
660,뷰티,튜브형으로 간편하게 언제 어디서든 사용하는 립밤! I 퍼스트 립밤 포터블,세컨디자인,206%,"1,031,788원","500,000원",34,20,"퍼스트 립밤 리스토어 앤 수딩 포터블
튜브 타입 립밤, 언제 어디서든 간편하게!",2021.02.02-2021.02.10,None
661,뷰티,"두피 각질에게 굿바이 키스를 날리세요, 쪽~ I 호호히 두피바",모노무브,6002%,"30,014,100원","500,000원",948,518,"간지럽고 건조한 두피, 흩날리는 각질까지. 두피 고민 확실히 날려드리겠습니다! 나주 쪽 추출물 20,000ppm 담은 호호히 샴푸바로 튼튼한 두피, 찰랑이는 머릿결을 경험해보세요!",2021.01.16-2021.01.25,None
662,뷰티,"[다운펌, 매직펌 집에서하자!] 생활의 달인이 만든 혁신적인 남자헤어기기",(주) 레이센,2365%,"23,655,200원","1,000,000원",607,397,[ 헤어기기의 혁신 ] 생활의 달인이 직접 개발한 남자 전용 헤어기기.   이제 집에서 편하게 스타일링 하세요.,2019.03.11-2019.04.05,None
663,뷰티,"손바닥에 흡수되는 게 더 많은 앰플, 바르지말고 뿌리세요 [앰플 미스트]",디오사코스메틱,296%,"2,961,000원","1,000,000원",22,45,"아직도 수분 뺏어가는 미스트 뿌려?
난 초미세분사 앰플미스트로 관리해!
언제 어디서나 휴대가능한 뷰티 디바이스, 마이크로미니와
모든 타입을 지켜줄 365 유에너지 앰플을 만나보세요",2020.04.27-2020.05.18,None
664,뷰티,"8,280시간을 담은 93.7% 순수발효액. 나노 콜라겐 앰플 #코스플랜",코스플랜,671%,"6,716,800원","1,000,000원",121,117,"8,280시간... 코스플랜 앰플이 완성되기까지 걸린 시간입니다.
코스플랜만의 저분자 기술력으로 탄생한 
고도로 정제된 나노 콜라겐 앰플이
24시간 피부 깊숙히 콜라겐을 전달합니다",2019.06.04-2019.06.30,None
665,뷰티,[546% 앵콜] 제주도 녹나무 숲의 향을 빌린 향수 ,(주)다이브인그룹,834%,"4,173,000원","500,000원",71,97,몸과 마음에 안전하게 스며드는 제주도 녹나무 숲의 향을 빌려드립니다.,2021.01.15-2021.02.08,None
666,뷰티,"[착한동생] Y존, 아무거나 사용할순 없잖아? 약산성 아로마 여성청결제",착한동생,49%,"246,000원","500,000원",32,19,"민감한 나의 Y존, 아무거나 사용할순 없잖아?
자연유래성분과 은은한 아로마향이 가득한 [착한동생] Y존 5.5 약산성 아로마 여성청결제",2019.12.18-2020.01.02,펀딩성공
667,뷰티,고가의 기능성 앰플 마지막 한방울까지 낭비없이 에어셀로 바르자!,디오사코스메틱,279%,"5,593,000원","2,000,000원",64,45,"뷰티 디바이스의 혁신 ! 에스테틱에서 받는 관리를 집에서?
고가의 기능성 앰플을 한방울도 남김 없이 사용할 수 있는 에어셀
사용하시던 앰플, 아로마, 스킨, 토너, 모두 사용가능",2019.12.11-2019.12.22,None
668,뷰티,[씨드톡스] 피부나이를 생각한 놀라운 한방울/동백오일의 상식을 바꾸다!,버진팜스,1017%,"5,089,000원","500,000원",91,64,"지치고 푸석한 피부에 '세럼같은 오일'의 특별한 한방울! 지금까지 발라온 오일은 잊으세요! 피부 뿌리부터 탄탄한 생명력을 선사합니다!
    2019년 설날 선물 파트너와 함께합니다.",2018.12.13-2019.01.14,None
669,뷰티,[인체제대혈유래줄기세포배양액] 트리플배양액으로 확인하는 28일의 피부변화,주식회사 와이엔,2116%,"21,167,500원","1,000,000원",200,184,눈 딱 감고 넣었습니다. 인체제대혈유래줄기세포배양액에 2가지 배양액까지 더 담은 앰플! 트리플배양액으로 만든 피부장벽 철벽보호 앰플로 건강한 피부를 놓치지마세요!,2020.09.30-2020.10.19,None
670,뷰티,'매일 너를 그림자처럼 따라다닐거야!' 그림자 향수 리운스 RIUNS,wanasinc,267%,"1,339,950원","500,000원",28,31,"그림자처럼 하루종일 따라다니는 향기, 한번만 뿌려도 오래 지속되는 기분 좋은 ‘리운스’의 신상 향기를 와디즈에서 가장 먼저 만나보세요.",2020.06.11-2020.06.18,None
671,뷰티,"깨끗한 피부를 위한 자연의 기초화장품, 모두를 위한 클린뷰티",슈바넨가르텐,177%,"885,000원","500,000원",17,33,"피부는 타고 났다고? 천연 식물의 자생 한계점에서 찾은 강인한 생명력을 담은 항산화 스킨케어를 만나보세요.
오로지 자연스럽고 건강한 피부만을 생각하고 만들었습니다.",2020.02.20-2020.03.01,None
672,뷰티,[MINYA] 카밀리아 오일 사용으로 촉촉한 매트 립틴트,MINYA,113%,"566,500원","500,000원",37,65,"터치는 가볍게, 발색은 선명하게, 컬러는 오래가는 All Day Wear Lip Coat입니다!
카밀리아 오일과 올리브 오일이 함유되어 촉촉하지만 매트한 립틴트 제품",2020.02.24-2020.03.23,None
673,뷰티,[닥터스웰스] 특허성분 함유로 붓기완화 스킨케어 #안부끼크림,(주)클리엘코,150%,"751,900원","500,000원",43,55,"단순히 붓기를 관리하는 것이 아닙니다. 나 자신에 대한 생각을 전환하고 당신의 자신감 있는 모습이, 당신의 하루를 활기차게 바꿔주는 삶의'터닝포인트'를 경험합니다.",2020.01.10-2020.02.23,None
674,뷰티,"[시카 4,835ppm] #모공#예민걱정 No! 깨끗안심 클렌저",(주)엑스와이씨비,315%,"3,154,800원","1,000,000원",30,26,"모공과에 싸움에 지친 500만 클렌저 유목민 주목! 시카 4,853ppm이 함유된 안티포어 딥클렌저로 5단계 모공케어 메커니즘을 한통에 느껴보세요 :)",2020.05.20-2020.05.27,None
675,뷰티,[1300개 한정] 당신의 피부를 도화지처럼 [미백+수분+피부활력 앰플],스킨앤스랩,287%,"1,436,520원","500,000원",66,75,"★당신의 피부를 깨끗한 도화지처럼★
3가지 성분의 피부 미백 솔루션! 프리미엄 4가지 피부 활력성분을 그대로 담아낸 로얄 블루 빛 [도화지 앰플]",2020.12.02-2020.12.24,None
676,뷰티,[유리즌 찰떡화장패드] 절대 밀림없는 메이크업!  화장빨 올려주는 아이템,투래빗코스메틱,326%,"1,632,600원","500,000원",42,24,"화장빨 확 살려주면서 시간도 절약하고 방법도 쉽고 좋은 성분만 들어있는 제품, 누가 안 만들어주나? 전직 화장품 제조사 R&D 총괄 출신이 자기가 쓰려고 직접 개발한 찰떡화장패드!",2021.04.26-2021.05.20,None
677,뷰티,지금까지의 향수는 잊으세요. 당신의 마음을 사로잡을 쉬폰향수.,맨즈메이크미 주식회사,264%,"1,324,200원","500,000원",57,44,"향기로 기억을 물들이다, 셀러버의 6번째 프로젝트!
빅데이터를 기반으로 제작한 오로라, 아만다, 라일리를 가장 먼저 만나보세요.",2020.12.14-2020.12.21,None
678,뷰티,향기는 마음을 위해 사용되어야 한다. 마인드프레쉬너너,마인드프레쉬너(더수민),236%,"1,182,500원","500,000원",23,22,"나,너 &우리의 마음을 위해서 향기를 사용하는 아로마라이프를 시작해보세요.",2019.09.02-2019.09.24,None
679,뷰티,물(水)차오름 크림 / 물폭탄 크림 / 펌프 크림 / 폭포수 크림,(주)에스디코스메틱,5%,"298,300원","5,000,000원",17,12,물(水)차오름 수분 크림 / 메가톤급 용량 / 폭포수크림 / 펌프 크림 / 대용량 수분크림 / 남녀노소 사용 / 바디 로션으로도 사용 / 헤어팩으로도 사용하는 만능 크림,2018.08.16-2018.09.30,펀딩성공
