,categories,title,company_names,percentages,funding_amounts,target_amounts,n_supporters,likes,descriptions,durations,days_left
383,공연·컬쳐,"바리톤 허종훈 ""사명"" 라이브 레코딩&콘서트",위클래식 / weclassic,102%,"1,530,000원","1,500,000원",11,13,"내 눈앞에 공연이 라이브로 믹싱되어 헤드폰으로 전달되는 새로운 레코딩&콘서트!! 국내 최고 ""톤 스튜디오"" 에서 바리톤 허종훈의 ""사명"" 라이브 레코딩과 공연을 동시에 경험하다.",2019.01.31-2019.03.03,None
384,공연·컬쳐,함께 보는 지구시민뮤지컬,풀울림,114%,"3,440,000원","3,000,000원",22,19,"한국에 살고 있지만 다른 문화적 배경을 가지고 있는 이주민, 탈북자, 외국인 노동자와 유학생 등을 지구시민뮤지컬 공연에 초대하기 위해 모금을 합니다. 
    당신을 위한 특별한 하루 파트너와 함께합니다.",2018.12.13-2019.01.06,None
385,공연·컬쳐,"[크래프터/만족도5.0] 조금 더 완벽하게, 마호가니를 올솔리드로 만나요",크래프터 코리아,1508%,"150,890,000원","10,000,000원",212,163,"평점 5점 만점의 신화, 많은 분들께 감동을 선사한 크래프터가 감사한 마음으로 진행하는 1.5차 펀딩, '조금 더 완벽하게: 올솔리드 마호가니'로 만나보세요.",2020.08.30-2020.09.07,None
386,공연·컬쳐,"남성 아카펠라 그룹 Last Call의 새로운 도전, 라이브 인 서울!",박주환,669%,"6,697,000원","1,000,000원",121,52,노래를 향한 열정 하나로 뭉친 각양각색 15인조 남성 아카펠라 그룹 Last Call의 첫번째 아시아 투어. 그 첫번째 목적지인 서울에서의 콘서트로 여러분을 초대합니다!,2018.03.14-2018.03.25,None
387,공연·컬쳐,나도 이제 컬렉터! 세상에 단 하나뿐인 이지훈 작가의 도시 작품 소장하기,주식회사 퍼블릭갤러리 ,443%,"2,215,000원","500,000원",10,16,나도 이제 컬렉터! 소장한 순간부터 가치는 더욱 올라가는 작가의 세상에 단 하나 뿐인 작품을 만나보세요! 감정이 느껴지는 도시를 그리는 이지훈 작가,2020.11.09-2020.11.25,None
388,공연·컬쳐,tvN 더블캐스팅 공식굿즈 펀딩 프로젝트,CJ ENM,226%,"9,960,000원","4,400,000원",289,133,"앙상블이여, 주인공이 되어라! 단 한 명에게만 허락된 뮤지컬 주연 자리를 놓고 치열하게 경쟁하는 앙상블들의 이야기를 담은 <tvN 더블캐스팅> 그 감동을 한정 굿즈로 만나 보세요.",2020.03.12-2020.03.23,None
389,공연·컬쳐,"MBC 음악감독팀과의 음반 제작, Made in ME 시즌3",Made in ME(비밀의 정원),1780%,"17,809,600원","1,000,000원",33,72,"메이드인미는 누구나 나만의 음악을 만들 수 있게 도와드리는 서비스입니다. 성원에 감사드리며, 시즌3로 인사드립니다!",2019.07.23-2019.08.07,None
390,공연·컬쳐,[여행]: 잠깐 쉬었다가세요,VMS(Vital Music Studio),22%,"112,500원","500,000원",20,8,"잠시만이라도 각박한 현실 속에서 도망쳐 음악과 여행, 그리고 힐링이 있는 시간을 가져보세요.스트레스를 받아가며 많은 것을 포기하고 살아가는 사람들을 콘서트 '여행' 에 초대합니다.",2019.09.06-2019.09.23,펀딩성공
391,공연·컬쳐,잊지 말아야 할 소녀의 이야기 [뮤지컬 컴포트 우먼] 뉴욕 상영 프로젝트,주식회사 아이에이랩,81%,"2,439,500원","3,000,000원",80,30,"여기 결코 잊어서는 안될 우리 어머니와 할머니의 이야기가 있습니다. 
아직 해결되지 않은 위안부 이야기를 전 세계 무대에 알리는 이번 펀딩에 여러분의 도움이 필요합니다.",2018.07.11-2018.07.31,펀딩성공
392,공연·컬쳐,흑백맛집⭐사랑하는 사람과 함께 낭만적인 사진 찍으러 가자,프랑스적인 삶,515%,"5,157,000원","1,000,000원",103,87,"""프랑스적인 삶""은 낭만적인 흑백사진을 촬영하는 스튜디오입니다. 펀딩으로 모인 소중한 모금액은 ""프랑스적인 삶""이 더 좋은 공간으로 확장 할 수 있는 밑거름으로 사용할 예정입니다.",2019.07.09-2019.07.31,None
393,공연·컬쳐,매달 나의 성장기록이 담겨지는 촬영 구독서비스ㅣ월간기억 ,어바웃퍼펙트써클,936%,"4,684,500원","500,000원",48,59,"일기처럼 매달 나의 모습과 가족의 모습을 함께 남길 수 있는 
구독경제 기반 사진 서비스 ‘월간기억”입니다.

“지금이 당신의 제일 젊고 아름다운 순간입니다.",2020.11.13-2020.11.23,None
394,공연·컬쳐,<터닝메카드W: 블랙미러의 부활> 극장판 개봉 스페셜 펀딩,(주)제이앤씨미디어그룹,9%,"946,000원","10,000,000원",30,8,"대한민국 No.1  순수 국산 애니메이션 터닝메카드의 첫 극장판이 크라우드 펀딩을 진행합니다. 
아동 애니메이션 완구, 뮤지컬, 이제는 극장까지 그 놀라운 신드롬을 이어간다!",2016.12.30-2017.01.10,펀딩성공
395,공연·컬쳐,"[셀프사진관 팩시밀리] 다가오는 크리스마스, 제주에서 인생샷을!",팩시밀리,45%,"225,000원","500,000원",25,9,"팩시밀리와 함께 연말연초를 특별하게 기록해보세요!
#제주x팩시밀리 #셀프사진관 #크리스마스 #컨셉사진",2019.11.27-2019.12.09,펀딩성공
396,공연·컬쳐,"드림트리 재능나눔 선생님들의 꿈, 1st CCM앨범 발매 ",주식회사 드림트리빌리지,16%,"810,000원","5,000,000원",106,6,"음악이란 아름다운 예술적 재능으로 도움이 필요한 청소년들을 돕고 아이들의 꿈을 응원하는 재능나눔 선생님들이 이번엔 자신들의 꿈을 향해 도전합니다. CCM아티스트 데뷔를 위한 첫 걸음, ""꿈을 나누는 음악, 드림트리"" 재능나눔 강사들의 꿈을 향한 창작 앨범 제작 도전기!",2016.02.29-2016.04.30,펀딩성공
397,공연·컬쳐,[충남] 볼거리 즐길거리가 가득한 [제2회 제석골 서각예술제],(주)서각사랑 정지완,199%,"3,986,000원","2,000,000원",73,19,"문화예술을 매개로 마을공동체 가치를 발견하여 마을의 정체성을 살리고 지속 가능한 공동체로 가꾸고자 오는 9월 제석골 서각예술제가 열립니다! 
    지역사랑크라우드펀딩대회 파트너와 함께합니다.",2016.06.01-2016.06.30,None
398,공연·컬쳐,"동네 이름 이야기, 그림으로 재탄생하다",공공소통연구소,10%,"150,000원","1,500,000원",26,0,"공공소통연구소와 반크, 정진호 작가가 함께하는 '2호선 역사이야기'는 동네이름에 얽힌 이야기를 지하철 2호선을 따라 동화와 엽서로 제작하여 동네이름이 가진 가치를 지켜가고자합니다.",2014.08.22-2014.09.30,펀딩성공
399,공연·컬쳐,★874% 달성★ 문서 작성과 교정교열 비법 한방에 쏙쏙!,한국어문교열연구원,704%,"7,040,000원","1,000,000원",42,46,"학생, 연구원, 직장인뿐만 아니라 온 국민의 숙제인 한글맞춤법부터 비문 교정 비법까지 재밌고 쉽게 알려주는 교육서비스입니다.",2019.08.05-2019.08.25,None
400,공연·컬쳐,"마다가스카르, 10년의 거리 展 _바오밥나무 너머 진짜 이야기 ",강재현 ,115%,"6,679,200원","5,800,000원",132,0,"아름다운 바오밥나무 그리고 그 나무를 베어 넘길 수 밖에 없는 마다가스카르 사람들의 현실. 그 간극, 아득한 거리감을 담아낸 10년간의 이야기에 당신을 초대합니다.",2015.04.02-2015.05.27,None
401,공연·컬쳐,[특별공연] 서울오케스트라 X 강샤인 송년음악회 <아름다운 그대에게>,서울오케스트라,0%,0원,"1,000,000원",0,32,"코로나로 지친 시민들을 위한 12월4일 서울오케스트라와 이강윤, 권화평, 강동훈의 합동 송년음악회! 연말을 빛낼 공연을 코로나 극복 특별혜택으로 와디즈에서 지금 바로 함께 하세요!",2020.11.17-2020.11.24,펀딩성공
402,공연·컬쳐,12년간 마다가스카르에서 취재해 온 조금 다른 바오밥나무 사진전,강재현 ,125%,"5,003,000원","4,000,000원",67,26,"신석기 시대부터 존재했다고 전해지는 세상에서 가장 오래된 나무.
숲의 어머니라고 불리는 바오밥나무, 그 원산지에서의 기록.
12년간 마다가스카르를 취재한 포토그래퍼가 선보입니다.",2017.09.25-2017.10.18,None
403,공연·컬쳐,"서양화가 김지명의 8피스 회화의 마법, 소장자가 완성하는 나만의 작품!",어반아트,103%,"2,330,000원","2,260,000원",2,13,"8피스 마름모의 무한 변주가 만들어내는 회화의 마법! 
와디즈에서 최초 공개하는 김지명 작가의 한정 작품. 
내가 완성한 미술작품을 지금 만나보세요.",2020.08.21-2020.09.07,None
404,공연·컬쳐,뉴욕에만??서울에도!! 대한민국 최초 푸드트럭 페스티벌! ,이강용,5%,"298,800원","5,000,000원",23,0,"뉴욕에만 있다?? 서울에도 있다!!
대한민국 최초 '푸드트럭 페스티벌'을, 드디어 서울에서 개최합니다. 최고 '맛차'도 뽑아보고, 청년 창업희망자들에겐 푸드트럭도 제공합니다. 우리 같이 재미지게 만들어봐요~!",2015.07.30-2015.08.30,펀딩성공
405,공연·컬쳐,"해외입양 친구들의 특별한 여행, 다큐<Flight Buddies>제작지원",다큐멘터리 Flight Buddies,0%,"170,000원","30,000,000원",4,4,"1963년 미국행 비행기에 올랐던 한국인입양아들 중 Kelly, Midori, Laurie가 54년의 세월이 지나 다시 한국땅을 밟으며 가족,정체성의 의미를 찾는 휴먼 다큐입니다.",2017.08.14-2017.09.13,펀딩성공
406,공연·컬쳐,함께 만들어 가는 신진작가 후원전시 [기다리는 공간],얼킨 ul:kin,0%,0원,"2,000,000원",9,0,임대 전 빈 공간을 신진작가의 전시공간으로 활용하여 열린 공간으로 만들어 가는 프로젝트 입니다. 신진작가를 후원하고 상권도 살리는 얼킨의 프로젝트에 함께해 주세요!,2015.07.01-2015.08.16,펀딩성공
407,공연·컬쳐,"손 끝에서 종이로 꽃을 피우다! <페이퍼플라워 클래스, 전시>",프롬일랑,1436%,"21,542,000원","1,500,000원",249,198,"페이퍼플라워 손 끝에서 피워내는 열정, 금손되기 프로젝트, 이제는 집에서 편하게 취미생활해봐요, 전시회는 덤!",2019.02.05-2019.03.17,None
408,공연·컬쳐,소프라노 홍혜란의 한정판 LP [희망가] | 기부가 더해진 희망 프로젝트,스톰프뮤직,172%,"1,720,500원","1,000,000원",37,13,"[대한민국의 희망을 위하여 소프라노 홍혜란이 준비한 특별한 선물] 한국 대표 가곡 12곡이  수록된 그녀의 첫 앨범 
""희망가""의 한정판 LP를 통해 기부도 할 수 있는 프로젝트!",2020.06.02-2020.07.03,None
409,공연·컬쳐,겨울밤을 녹이는 목소리 에스텔의 명덕네거리 MV제작 프로젝트,사우스타운프로덕션,103%,"2,075,000원","2,000,000원",37,13,겨울을 녹이는 달콤한 R&B 리듬의 에스텔 '명덕네거리' 뮤직비디오 프로젝트!,2019.01.03-2019.01.31,None
410,공연·컬쳐,"영롱함 그 자체, 해금연구소 무궁의 2021 한정판 에디션 <펄 해금>", 무궁,10%,"3,870,000원","38,700,000원",8,33,"세상에 하나뿐인 해금으로 나만의 취미, 나만의 악기를 만들어 보는 건 어떨까요?
진주를 머금어 모습마저 너무 아름다운 해금! 와디즈 에서만 만날 수 있는 한정판 에디션 <펄 해금>",2021.04.15-2021.05.13,None
411,공연·컬쳐,"경주를 지키는 30km, Short Movie 프로젝트!",사단법인 녹색연합,104%,"3,143,456원","3,000,000원",61,0,"짧은 영상 하나가 경주를 지킬 수 있다면. 우리가 사랑하는 역사와 문화의 도시 경주가 영상 하나로 지켜질 수 있다면! 소중한 추억의 도시 경주를 지키고 싶은 당신, 30km 프로젝트 함께 해요!",2015.07.24-2015.09.04,None
412,공연·컬쳐,"아프리카 댄서들의 꿈을 그린 영화, [Black Dance]",이보영,75%,"3,020,000원","4,000,000원",49,10,"케냐 슬럼가 소년 소녀의 꿈,  댄스 필름으로 올 여름 아름답게 피어납니다.",2016.05.31-2016.07.03,펀딩성공
413,공연·컬쳐,디템포 치킨값 마련 프로젝트,남석종,127%,"2,553,000원","2,000,000원",76,34,"스트리밍 한번에 1원 남짓, 한달 음원수익으로
치킨 한마리를 먹을 수 있으면 성공이라며 웃는 현실 속에서
인디 아티스트들의 자립 가능성을 묻는다.

디템포 치킨값 마련 프로젝트.",2017.07.28-2017.08.28,None
414,공연·컬쳐,"목소리가 마치, 인간 공기청정기? [2019 안지연 콘서트]",안지연,825%,"8,251,000원","1,000,000원",116,51,"혼코노 2대스타 등극, 드라마 ost 등을 통해서 검증된 신인가수 
안지연의 '너에게 쓰는, 두번째 편지’ 콘서트를 서포팅 해주세요!! 
아름다운 라이브 공연이 제작 됩니다.",2019.04.25-2019.05.12,None
415,공연·컬쳐,"제주 별빛공장의 첫번째 꿈, Impossible Dream!",The PARAN 더 파란,254%,"2,542,000원","1,000,000원",36,13,"왜 꿈꿔야 하는가! 
살아있다는 것을 증명하기 위해서!
열정 가득한 돈키호테가 세상에 제안하는 별빛공장의 첫번째 꿈, Impossible Dream! 그 꿈을 향해서 맨땅에 헤딩!
    Jeju with Wadiz 파트너와 함께합니다.",2018.04.30-2018.05.13,None
416,공연·컬쳐,[가족영상] 방송국 공채 출신 PD가 당신의 가족을 담아드립니다!,콘텐츠민주주의,178%,"890,000원","500,000원",10,20,"방송국 공채 출신 PD들이 찍어주는 영상! 우리 가족, 부모님의 아름다운 순간을 영상으로 기록해보세요!",2020.01.28-2020.02.23,None
417,공연·컬쳐,8월 제주 이색 영화제 ‘아무캠: 아일랜드 무비 캠프 페스타’,아무캠2018 운영사무국,106%,"4,248,000원","4,000,000원",62,25,"영화, 아무렇게나 좀 보자! 색다른 영화 체험을 기다려 왔다면, 주목! 한여름 제주의 특별한 무비 페스티벌 <아무캠2018>로 초대합니다. 첫 회라 더 아무렇습니다 ;)
    Jeju with Wadiz 파트너와 함께합니다.",2018.08.01-2018.08.13,None
418,공연·컬쳐,"계속 듣고싶고, 보고싶은 음악. 뮤지션 '다능(DANUNG)'",다능 (DANUNG),24%,"545,000원","2,220,000원",8,7,"작사 작곡은 물론 전체적인 앨범 프로듀싱, 디자인, 그리고 제작까지 모든것을 직접 하는 다재다능한 아티스트 '다능 (DANUNG)' 의 두번째 앨범 발매 프로젝트",2018.01.26-2018.02.22,펀딩성공
419,공연·컬쳐,맛있는 그림이 있는 봄사무소에 놀러오세요,봄사무소,7%,"50,000원","700,000원",10,0,"안녕하세요? 맛있는 그림을 그리고 싶은 봄입니다. 제가 좋아하는 따뜻하고 맛있는 이야기, 그림을 함께 나눌 분들을 만나고 싶습니다. 봄사무소에 놀러오세요!",2014.09.26-2014.10.31,펀딩성공
420,공연·컬쳐,[1568%앵콜] <웨딩영상> 영화인이 당신의 진짜 감정을 담아드립니다,김윤기,2239%,"22,390,000원","1,000,000원",45,104,하나부터 열까지 신랑 신부의 사소한 감정까지 놓치지 않고 기록해드려요. 평생 잊지 못할 순간을 특별히 간직할 수 있는 영상을 만들어 드립니다.,2019.11.13-2019.12.03,None
421,공연·컬쳐,"#복순도가 슈퍼콜라보프로젝트, 완연한봄X북촌한옥에서X막걸리빚기X풍류",복순도가,416%,"11,669,800원","2,800,000원",115,72,"프리미엄 전통주 브랜드 복순도가福順都家와 함께 따뜻한 봄날, 멋진 한옥 락고재에서 막걸리를 빚고 마실 수 있는 시간!",2020.04.24-2020.05.03,None
422,공연·컬쳐,'우릴 좋아하게 되고 말거야' 헤일 앨범/쇼케이스 & 담이 웹드라마 제작,왓츠더웨더,120%,"2,407,722원","2,000,000원",86,46,‘왓츠더웨더’는 여러분에게 아티스트의 작품을 다양한 콘텐츠로  선물하는 아티스트 레이블입니다.  '우릴 좋아하게 되고 말거야' 제작에 여러분들도 함께해 주세요!!,2017.02.06-2017.02.28,None
423,공연·컬쳐, 탈북민과 함께하는 바자회에 초대합니다! 바자회 속 공연개최를 위한 펀딩,나훈주(창조예술인협동조합 대표),4%,"95,000원","2,000,000원",8,0,"탈북민과 함께하는 사당역 바자회에 초대합니다! 바자회 속 멋진 공연을 열 수 있도록 참여해주세요!

탈북민들과 함께하는 바자회에서 공연을 하고자 합니다. '공연무대설치', '공연음향', '소정의 출연료' 가 잘 준비되어 성공적인 공연과 바자회가 되어 우리의 이웃인 탈북민 돕기 바자회가 성공적이고도 지속적으로 치뤄졌으면 합니다.",2015.06.08-2015.06.28,펀딩성공
424,공연·컬쳐,"[30점한정] 달을 그대로 닮은, 함윤정 도예가의 <내곁의 달항아리> ",곰아저씨,162%,"1,620,000원","1,000,000원",6,11,"""올 한해, 원하던 바를 모두 이루셨나요?"" 소원을 빌던 달을 우리집으로. 당신 곁에 간절함을 가득 담아, 한타래씩 쌓아올린 2020 함윤정 작가의 달항아리 에디션을 소개합니다.",2020.11.25-2020.12.14,None
425,공연·컬쳐,1000명의 얼굴과 꿈을 그린 아트북 만들기,안기은(키리나하우스),103%,"10,370,000원","10,000,000원",125,0,당신의 외면뿐만이 아니라 내면의 이야기까지 담은 초상화! 그 초상화들을 모아 천명의 위인전을 만들고자 합니다.,2014.10.15-2015.04.30,None
426,공연·컬쳐,2014년 첫번째 크라우드펀딩 스쿨을 함께 만들어 주세요!,크라우드산업연구소,19%,"49,500원","250,000원",13,0,크라우드펀딩스쿨은 펀딩 성공전략을 배우는 최고의 시간입니다. 1월 펀딩스쿨을 함께 만들어주세요.,2014.01.06-2014.01.22,펀딩성공
427,공연·컬쳐,찬송가와 블랙가스펠의 조화 The Gospel 4: The Hymns,헤리티지 미니스트리,272%,"8,165,000원","3,000,000원",172,95,수백년간 변하지 않고 내려온 신앙의 유산(Heritage)인 찬송가와 블랙가스펠의 만남에 초대합니다.,2019.10.16-2019.11.17,None
428,공연·컬쳐,영화 [에스프레소 더블샷]. 바쁘고 지친 대한민국 20대를 위해,이종현,112%,"1,120,000원","1,000,000원",72,2,"“세상 살아가는 사람들의 흔하지만 특별한 이야기"" 
평범한 우리들의 이야기지만, 평범하지 않은 우리들의 이야기입니다. 저희의 첫번째 영화 <에스프레소 더블샷>, 그리고 앞으로의 영화에 '제작진'이 되어주세요. 기다리고 있습니다.

    서울국제초단편영화제 파트너와 함께합니다.",2014.08.20-2014.09.23,None
429,공연·컬쳐,치유 야행 옥상 콘서트,루트머지 주식회사,102%,"5,100,000원","5,000,000원",19,10,"멈춰버린 평범한 일상을 찾아가 가슴 뛰는 위로를 선사하고자 합니다.

루트머지 치유야행 옥상콘서트로 여러분들 한명 한명에게 
선물 같은 힐링 공연을 전해드릴게요.",2020.11.11-2020.12.04,None
430,공연·컬쳐,"<살롱 드 께쎄> 전시, 공연  ""비로소, 서쪽으로""",살롱 드 께쎄,117%,"9,422,486원","8,000,000원",85,26,SALON DE CASSÉ 가 만들어낸 다양한 상상속 세계들을 한 눈에 볼 수 있는 기회!!,2020.08.03-2020.08.25,None
431,공연·컬쳐,나의 일상이 드라마로 만들어진다면?,바닐라씨 주식회사,100%,"1,004,180원","1,000,000원",31,15,"소소한 이야기와 웹드라마는 너무나 닮아있어요.
그래서 독립서적 5권을 웹드라마로 만들었습니다.
어떻게 만들었을까요?",2020.10.20-2020.11.06,None
432,공연·컬쳐,<웨딩영상> 영화인이 당신의 진짜 감정을 담아드립니다,윤기필름,3469%,"34,690,000원","1,000,000원",55,154,하나부터 열까지 신랑 신부의 사소한 감정까지 놓치지 않고 기록해드려요. 평생 잊지 못할 순간을 특별히 간직할 수 있는 영상을 만들어 드립니다!,2020.11.26-2020.12.14,None
433,공연·컬쳐,"이 세상에서 단 하나뿐인 당신만의 노래, 토브로 고백하세요!",토브사운드,134%,"673,000원","500,000원",10,23,"당신의 마음 속 이야기를 꺼내어 노래로 만들어보세요. 이 세상에서 단 하나뿐인 당신만의 노래, 토브사운드가 함께합니다.",2019.12.27-2020.01.13,None
434,공연·컬쳐,"영화 [좋아해,너를] 렌티큘러 블루레이 & DVD 런칭 기념 펀딩",(주)알스컴퍼니,218%,"10,946,400원","5,000,000원",261,73,"뉴이스트 멤버 전원 출연 영화 좋아해,너를 렌티큘러 케이스 블루레이 및 DVD 출시를 기념하여 펀딩 오픈!
정식 출시 전 와디즈에서 다양한 리워드혜택과 함께 최초로 선보입니다.",2018.03.15-2018.04.08,None
435,공연·컬쳐,하성운/아스트로/CIX/모모랜드/ 놓칠 수 없는 <청년의날 페스티벌>,제3회 대한민국 청년의 날(사단법인 청년과미래),2711%,"27,111,000원","1,000,000원",300,69,"올해 청년의 날에는 취업진로존, 체험존, 뷰티존 뿐만 아니라 토크콘서트, 청년정책경진대회을 준비 중입니다. 하성운, 아스트로, CIX 등 최고의 라인업이 준비되어 있습니다.",2019.09.05-2019.09.15,None
436,공연·컬쳐,사람의 여러 감정들을 아름답게 노래하는 밴드 푼타유니온의 1st ep앨범,푼타유니온,165%,"2,487,500원","1,500,000원",33,15,"사람이 살아가면서 느끼는 여러 감정들에 대해 노래하는 밴드 푼타유니온 입니다. 올해 새로이 합류한 보컬과 함께 발매하는 ep 앨범 ""Three Years ago"" 기대해주세요.",2017.10.24-2017.11.16,None
437,공연·컬쳐, 영화 <로스트 인 파리> 로맨틱 어드벤처 패키지,그린나래미디어,52%,"526,000원","1,000,000원",25,4,"세상 가장 사랑스러운 도시, 파리를 여행하는 가장 로맨틱한 방법!?

영화 <로스트 인 파리> 리미티드 패키지와 함께하는 83분의 파리 여행!",2017.05.08-2017.05.16,펀딩성공
438,공연·컬쳐,"나의 가족, 반려동물을 캔버스에 그리고 전시합니다 <댕냥이새김>아트전시회",테트라스튜디오,103%,"2,068,000원","2,000,000원",80,64,"여러분의 반려동물이 캔버스 위 그림의 주인공이 됩니다. 집사에게도, 댕냥이들에게도 특별한 경험이 될 테트라잉크의 댕냥이 그리기 프로젝트, 그리고 발렌타인데이 전시파티에 초대합니다.
    당신을 위한 특별한 하루 파트너와 함께합니다.",2019.01.18-2019.02.06,None
439,공연·컬쳐,당신이 몰랐던 서울을 보여줄게요! 우리동네스토어 서울편 vol.1,비디오트럭,142%,"2,130,000원","1,500,000원",67,28,"공간을 만드는 건 '사람'입니다. 
공간을 운영하고 계신 가게 사장님들의 이야기를 영상으로 담는 프로젝트, '우리동네 스토어'.
당신을 스토리가 있는 로컬 여행으로 초대합니다!",2019.03.26-2019.04.21,None
440,공연·컬쳐,"MBC 음악감독팀과의 음반 제작,  Made in ME 시즌2 ",Made in Me(주식회사 디오리진그룹),346%,"10,380,000원","3,000,000원",34,51,"Made in Me는 누구나 자신만의 음악을 만들 수 있게 도와드리는 서비스입니다. 성원에 감사드리며, 시즌2로 인사드립니다!",2018.12.12-2018.12.25,None
441,공연·컬쳐,"방구석에서 무대까지 '컴펙트 스테이지 기타', 2021년식 올 뉴 마이노",크래프터 코리아,668%,"66,885,000원","10,000,000원",180,323,"컴팩트 바디에 50년 장인정신과 기술력을 꾹 눌러 담았습니다. 더욱 풍성한 사운드와 범용성을 들려주는 미니기타, '2021 올 뉴 마이노' 와디즈를 통해 최초 공개합니다.",2021.01.30-2021.03.02,None
442,공연·컬쳐,웹드라마 [지구에서의 특별한 기록],대고MEDIA,0%,0원,"1,000,000원",11,8,"로맨틱 코미디_오피스몰_캠퍼스몰_
연영과 여신 '첫사랑의 아이콘'  과거와 다른 삶을 살아가는 성장 로맨스",2020.11.08-2020.11.23,펀딩성공
443,공연·컬쳐,본격 관객참여 카톡연극 #나만빼고 새로운 재미를 보장 합니다.,극단 화담,129%,"1,290,000원","1,000,000원",38,23,"극단화담의 첫번째 프로젝트 연극   #나만빼고

일상의 소소함을 연극으로 만나, 큰 웃음과 감동이 찾아 옵니다.",2019.02.14-2019.02.24,None
444,공연·컬쳐,"서부경남 유일의 독립영화축제, 제 8회 진주같은영화제로 오세요!",진주시민미디어센터,108%,"1,630,000원","1,500,000원",78,0,"진주같은영화제는 9월 15일~19일 동안 열리는 서부경남 유일의 독립영화축제입니다. 영화상영, 감독과의 대화, 야외공연, 심야상영, 폐막파티에 누구나 와서 즐겨봐요!",2015.07.24-2015.08.31,None
445,공연·컬쳐,119구조대의 이야기를 연극으로!  골든타임,이종대,0%,0원,"2,000,000원",0,2,"119 구조대의 이야기를 소재로 
현 소방관들의 인간적인 모습을 중점으로 다가간 작품입니다.
이 프로젝트를 통해서 많은 분들이  알게되시면 좋겠습니다",2015.12.23-2016.01.09,펀딩성공
446,공연·컬쳐,누적 조회수 1천만! 디즈니 목소리 유튜버 <별은> 데뷔를 함께 해주세요,인터파크 엔터테인먼트,585%,"11,831,000원","2,020,921원",237,106,"누적 조회 수 1천만, 디즈니 목소리 유튜버 <별은>입니다:) 간절히 바라왔던 저만의 첫 곡이 생겼어요! 가수 <별은>이 될 수 있게 저의 첫 데뷔를 함께 해주세요♥",2020.09.08-2020.09.21,None
