,categories,title,company_names,percentages,funding_amounts,target_amounts,n_supporters,likes,descriptions,durations,days_left
255,공연·컬쳐,"마커스 11주년, 당신과 함께 만드는 B.W.C!",마커스 미니스트리,78%,"8,625,000원","11,000,000원",301,21,"마커스 B.W.C (브리핑,워십,콘서트)는
국내의 가슴 아픈 상황들을 감안하여, 다음을 기약하며 
이번 프로젝트를 개최하지 않기로 결정했음을 알려드립니다",2014.03.27-2014.04.20,펀딩성공
256,공연·컬쳐,"[벤티볼리오]매니아들이 바라던 하이엔드 옵션, 보급형 어쿠스틱에 담다",벤티볼리오,3498%,"104,940,000원","3,000,000원",353,279,"고가의 하이엔드 기타에서만 만나오던 옵션, 보급형 어쿠스틱 기타에 적용할 수는 없을까? 국내 1위 통기타 커뮤니티에서 출발한 '신흥 강자' 벤티볼리오는 답합니다. 할 수 있다고.",2020.08.16-2020.08.31,None
257,공연·컬쳐,직장인 페스티벌 with 조조에코,김경래,111%,"2,235,000원","2,000,000원",134,5,"직장인 여러분! 함께 축제를 열지 않으시겠어요?
일과 음악 둘 다 놓치고 싶지 않은 직장인 밴드 조조에코가 여러분과 함께 페스티발을 만들고 싶습니다. 신나는 공연과 자유로운 네트워킹!
여러분의 참여가 즐거움을 결정합니다.",2013.07.05-2013.07.31,None
258,공연·컬쳐,[2차앵콜] 나만의 커버영상 만들기 어렵지 않게 만나보세요!,마제스티 스튜디오 (MaJesty Studio),132%,"1,320,000원","1,000,000원",15,32,"전문적인 녹음실 에서 직접 녹음하고 촬영하고 
더이상 어렵지 않게 나만의 커버영상 만들기에 도전해보세요^^ 
당신의 꿈과 열정을 응원합니다.!",2020.05.15-2020.05.25,None
259,공연·컬쳐,전공자가 더 좋아하는 밴드! JAZZ POP 최강듀오 <와인루프>,와인루프,341%,"3,417,000원","1,000,000원",79,32,"전공자가 더 좋아하는 아티스트 ""와인루프""! 재즈팝 (JAZZ POP) 기반 뮤직으로 7년간 실력을 다져온 혼성그룹 와인루프의 첫 전국 투어 공연에 함께해주세요!",2019.05.28-2019.06.16,None
260,공연·컬쳐,"[아콘] 여행기부터 음식, 영화까지 즐기는 아프리카 콘서트",일그램아프리카,100%,"2,005,000원","2,000,000원",49,0,멀게만 느껴지는 미지의 아프리카. 나도 모르게 가난과 내전이라는 색안경을 두껍게 끼고 바라보고 있지 않은가요? 아프리카 콘서트를 통해 진짜 아프리카를 만나보세요!,2015.03.17-2015.05.06,None
261,공연·컬쳐,<판도라> 2016 재난 블록버스터의 대미를 장식할 영화 ,판도라 백경숙PD,53%,"16,032,100원","30,000,000원",672,124,"영화 판도라는 지진으로 인한 재난 속에서 사투를 벌이는 평범한 사람들의 이야기입니다.  대한민국이 봐야할 영화 판도라, 국내 최초로 투자 리워드  크라우드펀딩이 동시 진행됩니다",2016.11.03-2016.11.21,펀딩성공
262,공연·컬쳐,[5분완펀! 어워드 선정!] 앵콜로 돌아온 일반인 앨범자켓 촬영 프로젝트,드림온스튜디오,1576%,"78,800,000원","5,000,000원",179,238,"[5분완펀! 별점 5점! ] 앵콜로 돌아온 일반인 앨범자켓 촬영 프로젝트! 연예인 화보, 나는 왜 못 찍어? 여러분도 동화 속 주인공이 되어 보세요!",2021.04.02-2021.04.09,None
263,공연·컬쳐,[상상지] 여기서 놀자~ 그라제! : 청소년들을 위한 공연,그라지오소,9%,"102,000원","1,100,000원",50,1,"무엇이든 할 수 있는 '나' 이다. 
무엇이든 할 수 있는 '나이' 다. 

    성남시청소년재단 파트너와 함께합니다.",2016.08.12-2016.09.10,펀딩성공
264,공연·컬쳐,"엄마, 그리고 사랑하는 사람과 함께 가는 대학로, 연극 [마당씨의 식탁]",(주)문화공작소 상상마루,235%,"2,352,500원","1,000,000원",33,16,"만화로 많은 사람들의 심금을 울린 '마당씨의 식탁'이 여러분과 함께, 최초로 연극으로 만들어집니다.",2018.02.28-2018.03.06,None
265,공연·컬쳐,★청정보컬★ 윤예은의 <여름소풍> 콘서트에 초대합니다!,뮤지션 윤예은,270%,"1,352,000원","500,000원",60,27,"더운 여름, 시냇물같이 맑고 탄산수처럼 청량한 목소리로 기분전환 어때요?
맑고 깨끗한 청정보이스 싱어송라이터 윤예은의 단독공연, <여름소풍> 에서 만나요 :)",2019.06.27-2019.07.21,None
266,공연·컬쳐,먼데이키즈 이진성 콘서트ㅣ가장 감미로운 2월의 콘서트 <템포 인 발라드>,경기문화예술진흥원,0%,0원,"1,000,000원",0,19,"남자라면 한번쯤은 노래방에서 불러본 남자 가수, 먼데이키즈 이진성이 와디즈에 옵니다. 
가슴 먹먹한 그의 보컬을 VVIP 좌석에서 직접 들을 수 있는 기회를 절대 놓치지 마세요!",2020.01.17-2020.01.30,펀딩성공
267,공연·컬쳐,"늦기 전에, 원전 중지!",최명섭,15%,"150,000원","1,000,000원",12,0,"죽음의 핵 방사능으로부터 우리는 당장 탈출해야 합니다. 이 문제를 영화로 다루어 보고자 합니다. 동참해 주세요.
    서울국제초단편영화제 파트너와 함께합니다.",2014.08.22-2014.09.23,펀딩성공
268,공연·컬쳐,대한민국 도시를 알려라! 글로벌 웹예능 <트립플> 제작 프로젝트! ,LETstudio,101%,"4,045,555원","4,000,000원",71,62,"대한민국 도시 알리기, 글로벌 프로젝트!
<여행더하기 : 트립플>
여러분이 직접 우리나라 도시를 세상에 알리세요
MC Q, EVA, Krissy가 여러분과 함께 합니다 
    한국전파진흥협회 파트너와 함께합니다.",2017.07.04-2017.08.14,None
269,공연·컬쳐,교회 청년과 청년사역자를 위한 다큐 제작 프로젝트,김여명,55%,"2,785,000원","5,000,000원",52,2,청년신앙운동을 살펴보고 대안을 모색하는 다큐멘터리를 제작합니다,2015.10.21-2015.11.30,펀딩성공
270,공연·컬쳐,"[VIP스탠딩 입장권] 다듀X자이언티X이영지와 함께, 평화 힙합콘서트",(주)경기문화예술진흥원,8%,"600,000원","7,000,000원",29,17,"1919년 3월1일 삼일절, 1919년 4월 11일 대한민국 임시정부수립 
100년전 뜻 깊었던 역사적인 날을 기념하기 위한 전에  없던 평화콘서트가 펼쳐집니다.",2019.10.07-2019.10.14,펀딩성공
271,공연·컬쳐,"여름의 끝자락, 훈자 파티",(주)어스맨,149%,"1,940,000원","1,300,000원",51,0,"어스맨과 함께하는 <여름의 끝자락, 훈자 파티>는 파키스탄 훈자 지역에서 생산되는 공정무역 제품과 공정무역에 대한 이야기를 사람들과 함께 공유하기 위해 만든 자리입니다.",2015.08.25-2015.09.05,None
272,공연·컬쳐,누구나 예술을 누리는 대한민국을 향해 달려라! #<무빙갤러리>,무빙갤러리,305%,"4,589,000원","1,500,000원",22,23,화이트큐브가 아닌 도로위에서 작가와 관객이 만나는 대안예술공간 <무빙갤러리>입니다.,2019.10.28-2019.11.28,None
273,공연·컬쳐,"[힙합해커톤] 랩퍼들의 교류와 화합의 장,  SHOW&PROVE 시즌2",무브더크라우드,225%,"6,772,000원","3,000,000원",156,15,"48시간만에 만드는 나만의 힙합곡! 국내 유일의 아마추어 랩퍼들을 위한 교류와 화합의 장, 힙합해커톤 'SHOW & PROVE'. 시즌1 성공에 힘입어 두번째 시즌이 돌아왔습니다!",2016.12.01-2016.12.28,None
274,공연·컬쳐,"대한민국 인재와 청춘들의 소통의 장, 인재플랫폼",실패를 즐기는 사람들,13%,"134,000원","1,000,000원",18,1,무의미한 스펙쌓기에 찌든 청춘들에게 자신의 꿈을 좇을 수 있는 이유를 드리고자  [실사]에서 강연회 <인재플랫폼>을 주최합니다. 2015. 1. 25(토)에 진행되는 <인재플랫폼> 많은 참여와 응원 부탁드립니다.,2014.12.26-2015.01.25,펀딩성공
275,공연·컬쳐,성공과 치유의 힘을 동시에. 아트페어 대상 작가의 작품을 원본으로 갖다.,gallery DOO,755%,"22,650,000원","3,000,000원",36,53,"성공과 재물, 치유와 에너지를 모두 가진 '물고기'. 나무의 생명력을 그대로 이어받아 작품으로 탄생했습니다. 아트페어 대상 '이정인 작가'의 작품을 원본으로 걸어 보세요.",2020.02.20-2020.03.16,None
276,공연·컬쳐,심장병 어린이 후원 프로젝트! 사랑새 나눔 콘서트,사랑새 프로젝트,124%,"744,000원","600,000원",42,10,"‘사랑새 나눔 콘서트’는 한 명의 심장병 어린이의 수술비 후원을 위한 기부 목적의 프로젝트입니다. 음악을 통해 새 생명, 새 영혼을 살리는 일에 동참해주세요!
    소셜임팩트 챌린지 파트너와 함께합니다.",2018.10.02-2018.10.15,None
277,공연·컬쳐,여러분의 덕력을 펼쳐보아요!,임지영,324%,"1,620,000원","500,000원",88,6,덕후가 아니라고 생각하는 당신을 위한 축제!,2015.10.13-2015.10.30,None
278,공연·컬쳐,이토록 아름다운 한옥에서 열리는 여름날 콘서트 <메이드 오브 트리 #1>,옐로밤,356%,"3,564,000원","1,000,000원",47,29,"누구든 쉬어갈 수 있고 무엇이든 상상할 수 있는 공간이 있습니다.
다락에 누워 그저 달을 바라보기만 해도 좋은 곳, 
은평한옥마을 ㅡ 일루와유 달보루에서 음악과 공간을 즐겨보세요!",2019.06.24-2019.07.14,None
279,공연·컬쳐,"[꿈틀이]가 만드는 전시,강연,파티가 어우러진 국내최초 꿈전시회!!",꿈틀이,115%,"2,885,000원","2,500,000원",233,0,"제 1회 꿈틀이展은 평범한 청춘들의 꿈을 관객들과 공유하고 소통하고 즐길 수 있는 장입니다.
전시, 파티, 강연 이 3가지 컨텐츠가 결합된 전시회는 아주 색다른 재미와 영감을 줄 것입니다.
열정적인 사람들이 한데 모여 그 에너지를 주고받는 모습, 상상만해도 즐겁지 않나요?
꿈꾸는 대한민국 사회를 만들기 위한 그 작은 첫 발걸음.
함께해주세요.",2014.11.07-2014.12.22,None
280,공연·컬쳐,가야금과 해금을 집콕 취미로?! 악기까지 빌려주는 국악 온라인 클래스,문카데미 주식회사,1049%,"10,491,700원","1,000,000원",99,109,"커피 1잔 가격으로 즐기는 가야금/해금 온라인 클래스! 
나만의 특별하고 고상한 반려악기를 집에서 편하게 배워보세요:)",2020.12.15-2020.12.28,None
281,공연·컬쳐,내가 가고싶은 복합문화공간 '플레이스사이',플레이스사이,100%,"2,010,000원","2,000,000원",34,4,"뻔한 공연장, 클럽, 미술관에 지쳤다면! 가고싶은 복합문화공간을 직접 만들어봅시다. '뮤직 + 아트'가 공존하는 플레이스사이는, 미디어아트, 설치미술, 다양한 공연으로 매주 여러분을 찾아갑니다.",2016.03.18-2016.04.08,None
282,공연·컬쳐,함께 읽고 나누는 대화식 전도훈련 [오이코스 관계전도 세미나],오이코스,4%,"243,000원","6,000,000원",7,0,전도는 방법 이전에 삶입니다. 1월 22일 서울을 시작으로 전국 5개 도시에서 열리는 오이코스  관계전도 세미나에서 일상 속 관계 전도법에 대한 답을 찾을 수 있습니다.,2015.01.08-2015.02.10,펀딩성공
283,공연·컬쳐,"그림이 움직여요! 내 방에 들어온 행복한 겨울, 정승원 작가 디지털에디션",위시트윈,773%,"7,730,000원","1,000,000원",13,38,"행복의 순간들을 모아모아 하나의 살아있는 일러스트로! 추운 겨울, 따뜻함을 나누는 사람들을 재미있게 그려낸 [ 정승원 작가 ]의 작품 2종을 디지털 액자로 만나보세요!",2021.01.04-2021.01.18,None
284,공연·컬쳐,[마지막 앵콜] 무선 사일런트 기타ㅣ어디에 있든 그곳이 무대가 됩니다,주식회사 세션맨,3090%,"30,908,000원","1,000,000원",85,165,"음악을 사랑하고, 기타를 좋아하는 분, 그리고 기타를 연주하고 싶은 분이 보다 쉽게 기타와 함께 동행할 수 있도록 이 리워드를 준비했습니다. 어디서나 자유롭게 연주하세요.",2021.02.24-2021.03.22,None
285,공연·컬쳐,"책이 말을 걸어올 때, 멘토박스",위리더컴퍼니,373%,"1,867,500원","500,000원",23,54,"인생의 고민, 물어볼 데가 없다?!
책이 말을 걸어올 때, [멘토박스]를 통해 나의 문제와 마주하고, 나의 질문, 생각, 표현을 담아내는 [커스텀 노트]와 함께 나를 들여다 봅니다",2019.12.18-2020.01.07,None
286,공연·컬쳐,감성이별 웹 드라마 ‘에필로그 다이어리 : 할부이별’ 제작 펀딩,똥꼬발랄 스튜디오,100%,"5,000,000원","5,000,000원",13,19,<에필로그 다이어리 : 할부이별>은 ‘사랑과 싸움의 시간’들이 쌓여 마음이 지쳐버린 두 남녀의 '이별 과정'을 그린 ‘감성이별웹드라마’입니다,2018.05.03-2018.06.25,None
287,공연·컬쳐,이젠 프사 말고 프로필영상ㅣ뮤비감독의 고퀄영상을 5만원대에 [인생영상],인생영상,1865%,"9,327,000원","500,000원",112,127,MV/광고영상 감독 & 제일기획 출신이 찍어주는 [인생영상] ㅡ 감각적인 프로필 영상으로 카톡 프로필과 SNS에서 나를 표현하세요! 이제는 프로필 영상의 시대,2019.12.31-2020.01.19,None
288,공연·컬쳐,정채연 주연 웹드라마 <아이엠> 후반작업 및 상영회를 위한 펀딩,브릿지ENT,58%,"2,929,000원","5,000,000원",26,15,"다이아 정채연 주연의 웹드라마 <아이엠>
드라마 후반작업 및 상영회를 위한 여러분들의 후원을 기다립니다^^",2017.06.30-2017.07.10,펀딩성공
289,공연·컬쳐,"38만 대학생의 가을운동회, 대학세력전! ",대정대학교,51%,"1,550,000원","3,000,000원",142,0,"대학간 서열 매기기, 취업난, 스펙 쌓기 대전쟁 등...
본래의 대학 모습은 온데간데 없는 요즘의 상아탑들...
꿈 가득한 대학생이 주인공인 드라마는 더이상 찾아볼 수 없고, 현실에 찌들어 취업과 스펙에 목매고 있는 이 시대의 대학생들에게 ""신""나는 선물을 하고 싶다!
꼭 신나게 해주고 싶다! 꼭 다같이 신났으면 좋겠다!",2013.10.31-2013.11.09,펀딩성공
290,공연·컬쳐,"반려동물의 마음을 담은 싱글앨범, '침묵하는 너에게'",Official Redam,39%,"796,000원","2,000,000원",36,16,"이번 프로젝트는 반려동물의 마음을 음악으로 담아 제작된  인디뮤지션 신다희의 싱글 '침묵하는 너에게' 발매 기념
견주와 강아지가 함께하는 '반려견 음감회'를 개최하고자 합니다",2020.06.02-2020.07.10,펀딩성공
291,공연·컬쳐,"장애 예술가들의 콜라보 프로젝트, 봄 울림 Art & Talk 콘서트",코리아 아트빌리티 체임버,145%,"2,905,000원","2,000,000원",257,0,"다름을 예술로 승화시키는 사람들, 장애 예술가들의 그림과 음악을 만나보고, 동시에 우리 모두의 이야기를 나눌 수 있는 진정한 소통의 자리. 5월 29일 <봄, 울림> 콘서트의 또다른 주인공이 되어주세요!",2015.04.27-2015.05.28,None
292,공연·컬쳐,"[소리를 그립니다] 전 백두산 드러머, 최소리가 소리로 만드는 그림",에코캐피탈,173%,"2,600,000원","1,500,000원",3,13,"[소리의 경계를 허물다] 한국 록밴드의 전설, ""백두산""의 드러머에서 작가가 된 최소리 
어느날 소리가 사라지니, 소리가 보이기 시작했다",2020.11.12-2020.11.30,None
293,공연·컬쳐,장애를 이겨낸 10명의 작가가 참여한 아시아 호텔아트페어 서울2014  ,아시아 호텔아트페어 서울 2014,100%,"4,000,000원","4,000,000원",49,5,"2014년 8월 22일~24일까지 소공동 롯데호텔에서 진행되는 아시아 호텔아트페어 서울 2014. 에이블아트 소속 10명의 작가들이 이 행사에 참여합니다. ""예술에서 장애는 장애가 아니다"" 프리다칼로의 말처럼 이 젊은 작가들의 용기와 도전을 응원해 주시고, 호텔 속 전시회라는 이색 체험도 함께 경험해보세요!",2014.07.25-2014.08.31,None
294,공연·컬쳐,"현대 미술계 거장, 86세 아트 파워 로즈 와일리 대표작< 헐러걸> 한정",주식회사 유엔씨갤러리,817%,"81,700,000원","10,000,000원",53,43,"영국을 너머 전세계를 사로잡은 로즈 와일리의 대표작,  판화 리미티드 에디션 100점을 와디즈 단독으로 판매합니다. 핸드메이드 프린트 기법과 콜라주디테일이 더해진 스페셜에디션",2021.04.12-2021.04.26,None
295,공연·컬쳐,"[3255%앵콜]뻔한 웨딩 촬영은 가라 ""땡큐웨딩""의 매력만점 컨셉 촬영",땡큐웨딩,1057%,"10,570,000원","1,000,000원",18,93,"펀딩률 3,255% 달성! 많은 서포터님의 앵콜 요청으로 다시 돌아왔습니다. 준비부터 마무리까지 ‘땡큐’의 연속! 
안 찍으면 손해인 개꿀 웨딩 촬영 프로젝트",2020.09.09-2020.09.28,None
296,공연·컬쳐,"한국을 대표하는 아카펠라그룹 메이트리의 한정판 LP 앨범 ""그대내게다시""",아트펌컴퍼니,778%,"7,784,000원","1,000,000원",171,74,"한국 최고의, 아시아 최정상의 아카펠라그룹 메이트리의 생애 첫 LP!! 김형석 작곡가의 주옥같은 명곡들이 메이트리만의 고급진 감성으로 되살아나는 소장가치 100%의 한정판 프로젝트",2020.03.17-2020.04.06,None
297,공연·컬쳐,[앵콜]빛을 받으면 참 아름다운 소반. 라미나 뉴트로 소반 진줏빛 에디션,(주) 아트앤팩토리,431%,"4,318,000원","1,000,000원",47,73,"실용적이며 현대적인 소반을 소개합니다.
현대 기술을 기반으로 전통공예품 살리기 프로젝트,
업그레이드된 뉴트로 진줏빛 소반 <라미나 소반 진줏빛 에디션 2.0>",2021.02.16-2021.03.08,None
298,공연·컬쳐,창작 뮤지컬 <러브 트릴로지:청춘> 대학로 입성기,심찬양,135%,"2,030,000원","1,500,000원",101,3,"시골 청년들이 만든 청춘 사랑 노래,  대학생 순수창작뮤지컬 <러브 트릴로지:청춘> 이 시즌4를 거쳐 드디어 서울에서 공연됩니다. 극본, 음악 좀 쩌는 창작뮤지컬 <러브 트릴로지: 청춘>, 놓치지 마세요!",2016.02.23-2016.03.06,None
299,공연·컬쳐,어디서든 연주하세요ㅣ나만을 위한 작은 기타 Klang ver.N,조동진 기타제작소,6287%,"125,751,000원","2,000,000원",575,702,"언제 어디서나 쉽게 휴대가능한 "" 나만을 위한 기타 klang """,2020.09.30-2020.10.19,None
300,공연·컬쳐,사랑스러운 곰돌이 우쿨렐레와 함께하는 나만의 힐링타임 [베어렐레],베어렐레,1745%,"17,451,000원","1,000,000원",219,194,"버킷리스트 중 하나인 '악기 배우기'
어렵지 않은 우쿨렐레로 시작해보세요.
수준높은 사운드와 퀄리티는 기본, 사랑스러운 디자인까지! [베어렐레]가 여러분의 꿈과 함께 하겠습니다.",2020.06.02-2020.06.28,None
301,공연·컬쳐,"[감성스냅사진] 나도 몰랐던 반려동물의 시선, 찰나의 순간을 담아드려요.",이태윤,418%,"4,180,000원","1,000,000원",31,36,"나의 작은 친구 반려동물의 제일 자연스럽고 기억에 오래 남을, 먼 훗날 웃으며 볼 수 있는 추억 사진을 담아드립니다. 찰나의 순간을요 !",2021.04.13-2021.05.03,None
302,공연·컬쳐,부산감천문화마을을 배경으로 지역관광활성 웹툰1탄(감천) 제작 프로젝트  ,김영길,0%,"30,000원","7,000,000원",3,4,"부산 감천문화마을을 배경으로 하는 실종 살인 미스테리 웹툰(감천)
지역의 명소를 배경으로 지역 관광 활성화 함께하고자 제작하는 웹툰 1탄 입니다.",2017.06.14-2017.07.26,5일 남음
303,공연·컬쳐,엄선된 D.VIP 1 & 2기 블록체인 프로젝트를 한번에 만나는 컨퍼런스,디스트리트,177%,"1,770,000원","1,000,000원",128,64,매일경제와 함께하는 블록체인 사교모임/네트워킹 D.VIP 시즌1기 프로젝트들의 진행 성과와 D.VIP 시즌2기 참여 프로젝트들을 한번에 만나보실 수 있는 D.VIP 컨퍼런스입니다.,2019.03.27-2019.04.14,None
304,공연·컬쳐,당신만을 위한 음악을 작곡해 드립니다. 나의 분위기를 담은 앰비언트 뮤직,Warm Around,4%,"295,000원","6,500,000원",5,19,공간마다 특유의 분위기와 감성이 있는 것처럼 우리도 우리만의 분위기가 있습니다. 당신의 분위기를 담아 세상에 단 한 곡뿐인 노래를 작곡해 드립니다. 듣는 것만으로 힘이 될 거예요.,2020.05.07-2020.06.01,펀딩성공
305,공연·컬쳐,[전시] 아티스트 200명의 개인전을 관람할 수 있는 기회!,BINCAN,0%,0원,"3,000,000원",0,8,"아티스트 200명에게 개인전의 기회를, 관객 200,000명에게 다양한 전시 관람의 기회를 주는 프로젝트입니다",2018.01.05-2018.02.28,펀딩성공
306,공연·컬쳐,"사진 원정대 HIM, 당신이 가고 싶은 그 장소에서 추억을 담아옵니다",사진원정대 H.I.M,0%,0원,"250,000원",5,0,"오랫동안 만나지 못한 친구.. 어렸을 적 살던 동네.. 가족,연인,친구들과의 추억이 깃든 곳. 꼭 가보고 싶지만 바쁜 일상생활에 치여 가보지 못한 여러분을 위해, 저희가 대신 그 곳에 가서 추억을 담아오겠습니다. 사진 원정대, HIM 입니다.",2014.06.05-2014.07.06,펀딩성공
307,공연·컬쳐,"보컬리스트 ""니니(Ni Ni)""의 새로운 앨범을 만들어 주세요",라인엠컴퍼니,104%,"5,221,000원","5,000,000원",33,21,보컬리스트 니니(NiNi)와 음원 유통사 라인엠컴퍼니의 앨범 만들기 프로젝트!,2017.09.29-2017.11.03,None
308,공연·컬쳐,"인싸취미템 1위ㅣ더욱 풍부한 음색으로 돌아온 힐링악기, 네코즈 칼림바",주식회사 위키위키,2328%,"116,402,000원","5,000,000원","1,712",879,좋은 소리를 만들기 위해 집착에 가까운 노력을 기울였습니다. 11년간 악기만 만들어온 제작자의 노하우를 마침내 여러분 손에 전해드립니다.,2020.07.25-2020.08.17,None
309,공연·컬쳐,"숨은 보석, '아티스트' 세상 밖으로 나오다",어나브린 스튜디오,102%,"3,086,701원","3,000,000원",86,17,"아직 알려지지 않은 숨은 보석, 언더그라운드에만 있기는 아까운 ""아티스트 발굴 프로젝트""!
그들의 다채로운 모습들을 담은 영상을 즐기시고, 아티스트 굿즈를 만나봐요!",2020.05.29-2020.06.16,None
310,공연·컬쳐,국민이 직접 만드는 100년 전 그날의 함성! ,고정균 _ (사)한국전통문화예술원 이사장,0%,"217,500원","30,000,000원",17,7,"일본은 감추고 우리는 찾으려는 역사!
역사적 사실을 잊지않기 위해, 진정한 독립을 위해,  
우리 국민이 힘을 모으고 화합하기 위해, 
정부 지원 없이 국민이 직접 만드는 공연.",2019.09.04-2019.09.21,펀딩성공
311,공연·컬쳐,"[앵콜] 아이들이 직접 만들어가는 미술 전시회, 에이드런과 함께해주세요.",김지민,154%,"2,313,100원","1,500,000원",183,25,천사원아이들과 전문작가들이 함께 미술 수업을 하며 만든 콜라보 전시 <兒티스트 전>. 이 전시회의 후원은 아이들에게 미술시간과 행복한 추억을 선물해주는 특별한 기부가 될 것입니다.,2016.06.27-2016.07.11,None
312,공연·컬쳐,피규어 좋아하세요? 세상의 모든 피규어 덕후를 위한 놀이터 <더쿠스카페>,더쿠스 (THE QOOS) ,57%,"574,000원","1,000,000원",17,25,덕후들의 공간이 만들어 집니다.희소성과 가치를 지닌 다양한 피규어와 콜렉터를 카페 [더쿠스]에서 만나실 수 있습니다.더쿠스오픈을 위해 힘을 모아주세요!!,2019.04.04-2019.04.28,펀딩성공
313,공연·컬쳐,현대도예가 김쥬쥬의 아트굿즈 <풍만한 조각상 오일램프>,김쥬쥬스튜디오,151%,"1,516,000원","1,000,000원",16,28,"정형화 되지 않은, 다양한 아름다움에 대해 고민해야 할때
'풍만한 조각상 오일램프 시리즈'는 나만의 공간에 위안을 줄 수 있는 오브제가 될 것 입니다.",2020.01.02-2020.01.19,None
314,공연·컬쳐,바이닐(LP)정기 구독 서비스 <월간 바이닐>  프로모션 펀딩,(주)아트버스터,420%,"12,620,000원","3,000,000원",211,63,"바이닐(LP) 정기 구독 서비스, <월간 바이닐> 은 매월 구독 회원분들에게 바이닐(LP)을 제공하는 서비스입니다. 본 서비스 론칭을 위한 프로모션에 많은 참여 부탁드립니다.",2021.04.14-2021.04.30,None
315,공연·컬쳐,[첫번재 소통] 마음으로 읽는 3D캘리그라피,36.5Creator,19%,"195,000원","1,000,000원",34,1,"[소통 프로젝트 전시]
-3D프린터로 탄생한 4mm 3D캘리그라피-
시각장애인들도 함께 즐길 수 있는 캘리그라피 재능기부를 통해 시각장애인과 공감하고 함께 같은 작품을 즐기며 또 공감합니다.

SNS지지만으로도 큰 힘이 됩니다. 저희 전시회 이야기 많이많이 퍼뜨려주세요 ~^^",2015.07.26-2015.09.10,2일 남음
316,공연·컬쳐,"퀸 트리뷰트밴드 ""영부인밴드"" 2019 첫 콘서트",위클래식 / weclassic,185%,"5,550,000원","3,000,000원",131,34,"영부인밴드 - 국내 유일의 22년차 퀸 트리뷰트 밴드의 2019년 첫 콘서트를 개최합니다. 퀸을 사랑하는 모든 사람들과 함께 즐기고 싶습니다.
    당신을 위한 특별한 하루 파트너와 함께합니다.",2018.12.11-2019.01.06,None
