,categories,title,company_names,percentages,funding_amounts,target_amounts,n_supporters,likes,descriptions,durations,days_left
0,공연·컬쳐,[미친 존재감] 아침부터 밤까지 변화하는 그림이 있다? 게다가 조명까지!,(주)아니,2542%,"50,850,500원","2,000,000원",195,377,"[상상도못한 정체] 낮부터 밤까지 변화하는 ANI 캔버스 
밤이 되면 은은하게 빛나는┗ (･o･ ) ┓ 조명 기능까지?!?!",2020.10.18-2020.11.09,None
1,공연·컬쳐,"아이돌, 또는 대형 기획사 가수만 음반 내는 시대는 끝났다.",나도가수다,20%,"2,060,000원","10,000,000원",11,24,"현재 최고의 뮤직 프로듀서진들과 대한민국 최고의 시설을 자랑하는 스튜디오에서 개인만의 스토리가 담긴 음원 제작 및 모든 음원사이트에 발매 되는 #나도가수다, 프로젝트 입니다.",2018.10.19-2018.11.11,펀딩성공
2,공연·컬쳐,플레이리스트 신작 웹드라마 [한입만] 시즌1을 응원해주세요 !,플레이리스트 ,49%,"12,330,000원","25,000,000원",33,16,플레이리스트 웹드라마 [한입만] 시즌1을 응원해주세요 !,2018.06.19-2018.07.08,펀딩성공
3,공연·컬쳐,지판에 내 이름을 새긴 세상에 오직 하나밖에 없는 나의 커스텀 기타,인포유 ,128%,"2,560,000원","2,000,000원",9,28,"지판에 내 이름을 새긴 
세상에 하나밖에 없는 나의 커스텀 기타",2020.12.24-2021.01.26,None
4,공연·컬쳐,[영화 김군] 5·18을 기억하는 당신과 청소년을 위한 1+1 나눔캠페인,영화 김군,104%,"520,000원","500,000원",33,13,"5·18을 기억하는 당신을 '김군'이  만나러 갑니다.
우리 함께, 이 시대 대한민국 십대들에게 역사의 진실을 전했으면 합니다.",2019.05.27-2019.06.16,None
5,공연·컬쳐,"[의류 광고]사진, 영상, 모델 섭외를 한번에! 스토어 매출 상승 지름길",콩가루필름,0%,0원,"1,000,000원",2,5,"신생 패션 브랜드 및 소상공인, 중소기업을 위한 경쟁력 업그레이드 서비스. 움직이는 착장 영상 및 브랜드 패션 필름을 저렴하게 제공해 드립니다.",2021.04.26-2021.05.24,None
6,공연·컬쳐,"셀럽이 사랑한 바로 그 전시, 이번엔 당신이 주.인.공 입니다.",본다빈치(주) ,130%,"1,300,000원","1,000,000원",61,42,"'Bon Lounge'란 본다빈치(주)가 주관하는 전시, 이벤트, 프로모션, 관련제품에 대하여 VIP 서비스 및 혜택을 누릴 수 있는 특별 기획 프로젝트를 의미합니다.",2018.07.05-2018.07.29,None
7,공연·컬쳐,칠석데이 음반 제작 프로젝트,(주)마인드디자인,101%,"10,172,500원","10,000,000원",222,1,"칠석데이 컴필레이션 '사랑가' 프로젝트,  '사랑가'의 새로운 변신에 여러분들도 함께해 주세요!",2015.06.04-2015.08.03,None
8,공연·컬쳐,"레전드급 뮤지션들의 선택ㅣ자연스러운 울림과 풍부한 사운드, 스윙 어쿠스틱",(주)스윙악기,2482%,"24,820,000원","1,000,000원",117,156,"엄선된 스푸루스탑과 마호가니, 로즈우드 측후판의 조화로 완성 된 따뜻하면서도 맑고 밝은 사운드를 느껴보세요.",2020.07.31-2020.08.24,None
9,공연·컬쳐,"브라운팟, 삶을 노래하다 [토크콘서트, 여러분의 이야기를 들려주세요]",Hyojun Shin,100%,"2,207,000원","2,200,000원",133,1,"하고 싶은 것과 해야 하는 것들에 대한 고민, 삶에 대한 고민,
여러분과 저희들의 모든 고민을 노래하는 
브라운팟 토크콘서트, 5월 2일 홍대 벨로주에서 만나요!",2015.03.24-2015.04.17,None
10,공연·컬쳐,"슈퍼감성보컬 ""슈어"" 키우기, 정규2집 [Kee] 발매 프로젝트",슈어 sure kim,275%,"2,066,833원","750,000원",56,14,"윤식당이 픽한 슈퍼감성보컬, ""슈어""를 키워주세요! 
진한 감성을 꾹꾹 눌러담은 슈어의 2집 앨범이 발매됩니다.
    당신을 위한 특별한 하루 파트너와 함께합니다.",2018.12.12-2018.12.30,None
11,공연·컬쳐,1일 1악기 시대! 나를 위한 소소한 힐링 칼림바 [ KALIMBA ] ,나반 NAVAN,545%,"10,917,000원","2,000,000원",209,267,"국내에서 핸드메이드로 제작되는 칼림바!
누구나 어디서나 두손에 가볍게 들고 연주가능한 나의 첫 악기! 같이 시작해봐요^^",2020.06.04-2020.06.30,None
12,공연·컬쳐,커피랑도서관 '품격'구독 서비스,커피랑도서관 주식회사,20%,"1,007,500원","5,000,000원",33,13,프리미엄 도서관 큐레이팅 팀이 선사하는 당신만을 위한 도서 구독 서비스 런칭!,2020.10.22-2020.11.16,펀딩성공
13,공연·컬쳐,"본격 레게 방송 ""한밤의 레게 연예"" by 스컬&하하, 엠타이슨",스크립토나이츠(주),122%,"4,890,000원","4,000,000원",45,30,"대한민국 레게뮤지션들이 총출동!  레게를 노래하고 대한민국 길거리 곳곳에 숨어있는 레게 문화들을 생방송으로 직접 보여주고 느끼고 체험해보는 시간 국내 최초! - 레게 전문 방송 -
    한국전파진흥협회 파트너와 함께합니다.",2017.07.03-2017.08.14,None
14,공연·컬쳐,"청소년 연극팀 청연, 경쟁사회 속 청소년들의 공포를 담다 연극 [괴담]",청연,1%,"15,000원","1,500,000원",2,0,"청연은 문화놀이터 액션가면에 속한 청소년 연극팀입니다. 연극을 통해 청연이 꿈꾸는 것은 바로!
첫째, 청소년들이 예술활동을 통해 자신의 재능을 마음것 펼칠 수 있는 장을 마련하는 것
둘째, 공연을 함으로써 자신의 콤플렉스를 극복하고 자신감을 향상시키는 것
셋째, 공연의 수익금으로 더 많은 청소년들이 자신의 꿈에 한 걸음 더 다가갈 수 있도록 하는 것 입니다.",2015.01.07-2015.01.24,펀딩성공
15,공연·컬쳐,앰프 없이 기타 한 대로 나만의 무대를 완성하세요! 내장 이펙터 기타,필립컴퍼니,1097%,"10,978,000원","1,000,000원",30,76,"오버톤 기타는 통기타 내부에 장착된 Sonic Generator를 통하여 별도의 외부장치 없이
자연스러운 이펙트 사운드를 구현해줍니다.
빌트인 이펙트 기타 'Overtone'",2020.11.09-2020.11.30,None
16,공연·컬쳐,"온라인 포토마켓, 예술과 소유의 경계를 허물다",363studiogalleria,36%,"1,338,000원","3,630,000원",32,8,"아쉽게 목표액은 성공하지못했지만,여러분들의 관심에 감사드리며,
참여해주신 금액은 결제가 일어나지 않고 예약건이 취소될 것입니다.",2016.11.11-2016.12.18,펀딩성공
17,공연·컬쳐,미디어 파사드 기법을 통해 청춘의 이야기를 보여드립니다.,Spring Time,0%,"13,000원","2,000,000원",15,0,"""청춘""을 이야기 하기 위해 전공도, 사는 곳도 전혀 다른 청춘 8인방이 모였습니다. 다양한 청춘의 이야기와 예술적인 감각이 만나 화려한 영상으로 태어나고있습니다. 이 소중한 영상을 대형 건물에 맵핑하여 많은 이들과 함께 나누고 싶습니다!  여러분의 작은 손길이 함께할 때, Spring Time의 청춘 동영상이 서울 한복판 대형 건물에 맵핑될 수 있습니다:D",2014.01.29-2014.02.20,펀딩성공
18,공연·컬쳐,"★미친라인업★사이먼도미닉, 그레이까지! 서핑&뮤직 미드나잇피크닉페스티벌",(주)위고온,349%,"3,496,000원","1,000,000원",18,32,"이국적인 서핑&뮤직 페스티벌! 낮에는 서핑! 밤에는 뮤직! 미드나잇피크닉페스티벌 2019! 미드나잇피크닉페스티벌을
서포터분들께 누구보다 더 똑똑하게 즐기는 방법을 소개해 드립니다",2019.06.13-2019.07.01,None
19,공연·컬쳐,부모님의 가장 젊은 오늘을 의미있게 기록하는법! [리마인드웨딩/가족사진],펜타그라피 스튜디오,335%,"8,390,000원","2,500,000원",16,46,부모님을 위한 특별한 효도선물을 찾고 계신가요? 사랑하는 부모님의 가장 젊은 오늘의 모습을 사진으로 남겨보세요! 진짜 몸만오면 되는 초간편 [ 토탈 리마인드 + 가족사진 촬영권 ],2020.04.10-2020.04.27,None
20,공연·컬쳐,남양주 스몰웨딩 만족도 1위!  와디즈 단독 이벤트 진행 ,남양주 라뷰 ,0%,0원,"3,000,000원",10,25,남양주 스몰웨딩 만족도 1위 ! 분위기 넘사벽 ! 와디즈 서포터님들을 위한 특별이벤트,2019.06.28-2019.08.30,펀딩성공
21,공연·컬쳐,BJ의 이야기로 웹 드라마 만들기! 웹 드라마 <케첩걸> 입니다,강지태,0%,0원,"3,000,000원",1,11,"메이저 BJ가 되기 위한 하꼬 BJ 케첩걸의 성장 드라마!

게임 BJ들과 그들의 매니저, 편집자들의 뒷 이야기를 같이 만나보세요!",2021.04.19-2021.05.07,None
22,공연·컬쳐,[한 달 동안 길-게 즐기는 꽃다발] 트랜스포머 꽃꽂이 온라인 클래스,설해냄,566%,"2,833,500원","500,000원",63,40,"일상에 지친 사람들!
한 개의 꽃다발을 한 달 동안 세가지 스타일로 만들어보는 트랜스포머 온라인 꽃 수업으로 힐링하세요. 
""생화+꽃꽂이 재료+강의""를 당신의 집으로 보내드려요.",2021.03.10-2021.03.29,None
23,공연·컬쳐,'빛나는 별은  당신에게 '  청년들이 기획하는 뮤지컬 '한 울',허재범,5%,"552,500원","10,000,000원",53,18,"청년들과 청소년들이 만들어내는, 단군왕검을 소재로 한 뮤지컬. 여러분들의 도움이 필요합니다!",2017.05.26-2017.06.30,펀딩성공
24,공연·컬쳐,[나는 기획자다] 코엑스가 기획 커뮤니티 멤버를 찾습니다!,코엑스,283%,"13,600,000원","4,800,000원",39,36,"코엑스의 축제형 컨퍼런스인 <360 서울, 2020>은 어떻게 만들어 질까요? ‘기획 커뮤니티’에 참여하여 그 특별한 과정에 동행하세요!",2019.12.26-2020.01.12,None
25,공연·컬쳐,'승마' 또다른 '취미'가 되다.,말산업협동조합,1%,"90,000원","5,000,000원",2,1,"승마가 대중화되고 있다는 사실. 여러분 알고 계셨나요?
승마를 엘리트 스포츠라고 생각하신다면 이제그만!
지금부터 여러분들을 위해 전문적으로 승마를 배워볼 수 있는프로그램을 소개합니다.",2014.07.24-2014.08.31,펀딩성공
26,공연·컬쳐,[토닥토닥 연말콘서트] 한 해동안 수고한 당신을 위한 따뜻한 노래,토브사운드,104%,"1,040,000원","1,000,000원",32,19,한 해 동안 수고했던 마음들에게 따뜻한 위로가 되는 콘서트를 만들어 가고 싶습니다.,2018.11.13-2018.11.28,None
27,공연·컬쳐,<휴게소> 인간의 사악함이 사탄을 깨우다,(주)스타이엔엠,1%,"50,000원","5,000,000원",1,4,"늦은 시간 휴게소를 가지마라! 당신이 타겟이 될 지도 모른다!
휴게소에서 벌어지는 인간의 사악하고 이기적인 본능이 만든
충격적인 반전과 공포가 시작된다!",2017.08.29-2017.10.09,펀딩성공
28,공연·컬쳐,새로운 도전들로 가득한 복합 예술 공연 Via,김상준,20%,"100,000원","500,000원",6,0,"힙합, R&B, Live session, 영상, 설치 미술에 도전하는 IVC Records의 새로운 한걸음이 4월 25일 서강대 아루페관 KINOBEANS에서 열립니다. 복합예술공연 Via로 초대합니다.",2016.04.08-2016.04.18,펀딩성공
29,공연·컬쳐,"[동명이인 프로젝트-시나리오북] 다시, 두 사람의 이야기가 펼쳐집니다.",올드웨일,4%,"91,000원","2,000,000원",3,3,"동명이인 프로젝트 Scenario Book에 후원해주시면, 옴니버스 장편영화 <동명이인 프로젝트, 시즌3>이 제작됩니다.",2019.01.31-2019.03.03,펀딩성공
30,공연·컬쳐,특별한 날을 위한 아주 특별한 노래,YourMusic,0%,0원,"5,000,000원",2,10,"당신의 인생은 특별합니다. 그래서 특별한 노래가 필요합니다.
    충남창조경제혁신센터 파트너와 함께합니다.",2017.08.30-2017.09.30,펀딩성공
31,공연·컬쳐,한국 최초 여성영화의 장! SIWFF 20주년 여성감독 DVD 콜렉션 ,서울국제여성영화제,385%,"3,850,000원","1,000,000원",105,30,"'여성의 눈으로 세계를 보자'라는 주제 아래, 역량있는 여성영화인들을 발굴&지원해 온 서울국제여성영화제가 올해 20주년을 맞아 이를 기념하는 단편 DVD 콜렉션을 선보입니다!",2018.05.10-2018.05.23,None
32,공연·컬쳐,밀라노 아트페어를 찾아가는 경쾌한 불교 미술,배종훈,17%,"886,000원","5,000,000원",15,0,불교와 명상 이야기를 현대적이고 경쾌하게 표현하는 미술 작업을 하고 있는 작가입니다.우리 불교의 가치는 이미 높습니다.  그것을 세계에 알리고 싶습니다. 그 첫 시작으로 이탈리아 밀라노에서 열리는 국제아트페어에 제 작품을 직접 들고 나가려 합니다.,2015.02.03-2015.03.15,펀딩성공
33,공연·컬쳐,"누적 6억 | 2가지 스트링을 하나로, 작고 가벼운 기타 Klang S",조동진 기타제작소,12016%,"120,162,000원","1,000,000원",490,894,모든 시리즈의 장점을 모았습니다. 손가락이 아파서 연습을 포기했던 기억이 있나요? Klang S는 손가락과 손목의 부담을 줄여서 연습하기 쉽도록 디자인 되었습니다.,2021.03.30-2021.04.26,None
34,공연·컬쳐,복민이와 TED 2014 컨퍼런스 참석 함께하기,어복민,135%,"690,000원","510,000원",31,1,"안녕하세요? 저는 TEDxKT 오거나이저 어복민입니다.
이번에 캐나다에서 열리는 TED Active에 참여하기 위해 큰 용기를 내었습니다.
좋은 경험을 하고 돌아와 여러분과 더 많이 나누겠습니다. 
응원해주세요!",2014.02.22-2014.03.24,None
35,공연·컬쳐,"내가 뽑는 버스킹 스타 ""2019 대한민국 버스킹콘테스트"" 결선 후원",버스킹TV,167%,"838,000원","500,000원",75,23,"국내 문화산업 발전을 위해 YTN과 버스킹플레이가 함께하는 '2019 대한민국 버스킹콘테스트'
청중 평가단의 사전&현장 투표권!",2019.11.15-2019.11.28,None
36,공연·컬쳐,인도여행 중에 만난 훈남과 일주일. 웹드라마 <인도행티켓>,(주)콘플로우 컴퍼니,584%,"58,458,000원","10,000,000원","1,533",1184,인도여행 중에 만난 훈남과 일주일. 웹드라마 <인도행티켓>,2020.02.08-2020.02.21,None
37,공연·컬쳐,"[프라이빗도슨트] 피카소가 사랑한 화가, 툴루즈 로트렉 국내 최초 단독전",메이드인뷰,469%,"4,692,000원","1,000,000원",96,61,"19세기 후반, 낭만이 넘치던 파리가 사랑한 '작은 거인', 툴루즈 로트렉 작품이 국내 최초 단독전으로 소개됩니다. 누구보다 빠르게 예술의 전당에서 프라이빗 도슨트로 만나세요.",2019.12.05-2019.12.29,None
38,공연·컬쳐,"나만의 색깔 찾기, The COLORED",THE COLORED,106%,"530,000원","500,000원",37,16,"취업, 승진, 결혼..
세상은 우리에게 모두 같은 모습의 삶을 살아가기를 요구합니다.
여기, 자신만의 색깔로 살아가는 사람들이 있습니다.
당신의 색깔은 무엇인가요?",2019.08.08-2019.08.24,None
39,공연·컬쳐,이별을 통해 사랑을 배운 Kevin Kang의 첫작품,강원상(Kevin Kang),103%,"2,061,000원","2,000,000원",108,1,"<30대 직장인도 꿈이 있습니다>

<이제 그 꿈에 한발 다가가려 합니다>",2015.09.01-2015.10.31,None
40,공연·컬쳐,국!내!유!일! 코미디 체험극 당신이 주인공의 중국 진출 프로젝트,당신이주인공,0%,"35,000원","5,000,000원",5,1,"50만명이 함께한 국내 최초 코미디 체험극 '당신이 주인공!'
이제는 중국 진출을 위해 더 많은 당신들과 함께하려고 합니다!
여러분의 참여가 곧 '당신이 주인공'이 세계 무대로 향하는 밑거름이 됩니다. 
함께 하실래요?",2014.08.13-2014.10.30,펀딩성공
41,공연·컬쳐,[와디즈 한정] 크로스오버 그룹 <안단테> 첫 번째 단독 콘서트,(주)위클래식,1189%,"12,490,000원","1,050,000원",89,62,"와디즈 ONLY !  
크로스오버 그룹 <안단테> 첫 번째 단독 콘서트. 
다양한 색깔로 가슴을 물들일 크로스오버의 진수를 만나다!",2021.04.15-2021.05.03,None
42,공연·컬쳐,"카페처럼 쉽게 찾고, 커피처럼 친숙한 현대무용ㅣUniverse in Me",문화오름,105%,"3,175,000원","3,000,000원",18,14,"현대무용이 만들어지는 과정을 A부터 Z까지 알 수 있는 기회!
아티스트와 작품에 관해 이야기 나눠 볼 수 있는 시간!",2019.08.12-2019.08.19,None
43,공연·컬쳐,"인생사진? 이젠 쉬워요~ 억지웃음, 어색함 걱정 끝! [컨페티 사진관]",최수진,3242%,"16,211,000원","500,000원",127,95,인생사진? 이젠 쉬워요~억지로 웃지 않아도 인생사진을 건지는 '컨페티사진관'! 던지기만 하면 웃음이 나오는 '마법의 가루'와 함께신나게 던지고 놀면서 인생사진 남기세요!,2020.07.31-2020.08.17,None
44,공연·컬쳐,누구나 무료로 배울 수 있는 통기타 강좌 제작,유인석,51%,"1,530,000원","3,000,000원",64,9,유튜브에 무료 기타 강좌와 연주 영상을 업로드 하고 있는 카페인기타입니다. 여러분의 후원을 필요로 합니다. 2016년에도 카페인기타가 계속 활동할 수 있도록 도와주세요!,2015.12.07-2015.12.25,펀딩성공
45,공연·컬쳐,"세상 어디에도 없는 음악, 뮤지컬 <광염 소나타>",코어씨드㈜,682%,"6,820,000원","1,000,000원",82,17,동명의 고전소설을 모티브로 한 탄탄한 구성! 클래식 선율이 더해진 새로운 스타일의 스릴러 뮤지컬! 아름다운 클래식 선율 뒤에 숨겨진 파멸... 예술의 진정한 가치는 무엇인가?,2017.04.07-2017.04.16,None
46,공연·컬쳐,"청춘인디콘썰트, 끝나지 않을 우리들의 이야기",다락방 기획,10%,"52,500원","500,000원",3,0,"각기 다른 매력으로 청춘을 노래하는 인디뮤지션들과
한때 청춘이었던 또는 지금 청춘인 사람들과 만나
서로 공감하고 소통하는 토크 콘서트입니다..",2018.02.21-2018.03.04,펀딩성공
47,공연·컬쳐,'고요한가을' 첫 EP앨범 제작 프로젝트,팝인코리아,109%,"3,277,000원","3,000,000원",59,26,'고요한 가을'  EP앨범 제작 프로젝트와 함께 해주세요.,2017.04.12-2017.05.07,None
48,공연·컬쳐,한여름 밤의 꿀같은 추억 서울국제청소년 영화제,서울국제청소년영화제,14%,"436,000원","3,000,000원",38,0,"한여름 밤의 꿈, 아니 꿀같은 추억을 원하신다면, 득템의 기회는 지금입니다! 특별한 도심 속 페스티벌, 17회 서울국제청소년영화제로 
연인, 가족, 친구와 함께 무더운 여름의 더위를 날려 보내세요! #개막작은 #마녀배달부키키",2015.07.14-2015.08.04,펀딩성공
49,공연·컬쳐,[서울 패션 페스티벌 2017] 블라인드 티켓 단독 오픈,브이유 엔터테인먼트,141%,"8,505,000원","6,000,000원",128,34,"뮤직 페스티벌, 패션을 끌어안다! 
서울 패션 페스티벌 2017에 음악과 패션을 사랑하는 당신을 초대합니다.
탑 디자이너 브랜드 패션쇼와 국내 최정상 아티스트들의 퍼포먼스까지!",2017.06.21-2017.07.02,None
50,공연·컬쳐,세계 기업가정신을 찾아떠나는 우리의 도전을 응원해주세요!,Dream Seed,5%,"50,000원","1,000,000원",15,1,"드림씨드, Dream Seed
드림씨드는 일반 대학생들로 구성되있는 커뮤니케이터 팀입니다.
저희는 WET를 통해 세계 청년기업가들을 만나고 그들과 소통하여
더 넓은 시야를 가지고 사회에 나가고 싶습니다.
그러나 일반 대학생들의 용돈과 아르바이트 비용으로는 턱없이 
부족한 비용때문에 여러분의 도움을 받고자 합니다.",2014.01.28-2014.02.28,펀딩성공
51,공연·컬쳐,힙합 좋아하세요? 힙합을 만드는 사람들과 래퍼 파탈의 <랩 전시회>,파탈돕차일드 (FATAL DOPECHILD),118%,"2,955,900원","2,500,000원",30,12,"하나의 힙합 앨범이 완성되기까지. 
메세지와 경험, 모든 예술적인 접근을 담아냈습니다. 
래퍼 '파탈'의 <랩 전시회>",2019.07.23-2019.08.11,None
52,공연·컬쳐,구글/국립현대미술관이 선택한 세계적아티스트 권기수작가 <동구리 렌티큘러>,갤러리나우,1703%,"34,073,000원","2,000,000원",42,75,구글과 세계적미술관들이 선택한 자랑스러운 한국 작가 권기수의 '동구리'가 특별한 렌티큘러 에디션으로 찾아왔습니다. 동구리의 매력이 한껏 발산되는 렌티큘러 단독 한정판을 꼭잡으세요!,2020.03.30-2020.04.13,None
53,공연·컬쳐,"부산을 위해 대학생이 만든 AIESEC 프로젝트의 마지막 퍼즐은, 당신!",아이섹 코리아,3%,"15,000원","500,000원",12,0,"AIESEC 부산대학교에서  부산 내의 '환경, 문화와 인권'문제를 고등학생들에게 전하고자 행사 '환경 축전'과 '휴먼라이브러리'를 준비하고 있습니다. 함께 그 축제를 만들며 환경과 인권에 대한 인식을 가지게 되길 기대합니다.",2014.12.19-2015.01.16,펀딩성공
54,공연·컬쳐,청년배우들을 위한 실무교육 세미나,Jackbro,0%,0원,"1,500,000원",6,0,"<청년배우들을 위한 실무교육 프로젝트>
아무런 실무 인프라가 없는 3년 미만의 청년배우들에게 필요한 캐스팅, 계약서 등에 대한 교육 세미나를 여는 프로젝트입니다. 


    경기콘텐츠코리아랩 파트너와 함께합니다.",2015.10.15-2015.11.20,펀딩성공
55,공연·컬쳐,"[뉴트로 필름사진관] 광고 포토그래퍼가 촬영하는 인생사진, 픽커서울",픽커서울(PICKER SEOUL),358%,"3,585,000원","1,000,000원",31,65,"전문 광고 포토그래퍼가 촬영하는 뉴트로 필름사진관. 필름으로 담는 특별한 36컷과 인테리어 소품, 일회용 필름카메라까지 고퀄리티 구성을 간직해보세요.",2020.10.04-2020.10.25,None
56,공연·컬쳐,철학과 학생이 만드는 [철학과 다큐멘터리],류재영,140%,"841,289원","600,000원",51,0,"철학과에서는 뭘 할까, 철학과 학생들은 어떤 사람들일까? 경희대학교 철학과에 다니는 학생들이 중심이 되어 '철학과', 그리고 '철학'에 대한 다큐멘터리를 만듭니다.",2015.06.11-2015.07.15,None
57,공연·컬쳐,[서울] 문화가 세상을 바꾼다 [소극장 젊은예술가들의장터],예장프로덕션,112%,"5,622,000원","5,000,000원",83,16,"마시고 노는 연신내에서 문화 한잔 하시겠습니까?
연신내에 소극장을 만들어 문화를 우리 집앞까지 배달해드립니다.
    지역사랑크라우드펀딩대회 파트너와 함께합니다.",2016.06.01-2016.06.30,None
58,공연·컬쳐,사진의 기준을 바꾸는 '포쉬스튜디오'의 뷰티 & 플라워 화보 컨셉 촬영,포쉬스튜디오,938%,"4,690,000원","500,000원",24,36,29년의 노하우로 빚어내는 라인의 아름다움 뷰티화보와 어디서도 만나본적 없는 플라워 아트 콜라보레이션 화보 지금 포쉬스튜디오에서 만나보세요,2020.06.22-2020.06.29,None
59,공연·컬쳐,우리가 좋아하는 영화 속 장면에 기록되기 <#01.나홀로 크리스마스>,어거스트썸띵,583%,"5,834,000원","1,000,000원",83,99,"좋아하는 영화, 혹은 책의 한 장면에 내가 들어갈 수 있다면?
특별한 장면 속에서 혼자, 혹은 소중한 사람들과 함께 사진을 남겨보세요.
분명 환상적인 한 장면이 만들어질 거예요.",2020.11.23-2020.12.14,None
60,공연·컬쳐,Latin Jazz Band 'Triomenon' 첫 번째 앨범,트리오메논,114%,"3,430,000원","3,000,000원",66,26,"세상을 변화시키는 최소 단위 3과, 그들이 만드는 현상을 의미하는 Triomenon은 음악을 통해 사람들에게 좋은 영향력이 흘러가길, 조금 더 좋은 세상이 되길 바라는 밴드입니다.",2017.10.23-2017.11.17,None
61,공연·컬쳐,테이프로 인물화를 만들어내는 아티스트 조윤진 원화 소장 프로젝트,gallery DOO,202%,"2,020,000원","1,000,000원",2,15,당신이 애정하는 인물을 테이프로 그리다. 한국을 대표하는 테이프 아티스트 조윤진 작가의 생동감 넘치는 단 하나뿐인 원화 작품을 소장하세요!,2020.04.07-2020.04.20,None
62,공연·컬쳐,2019 뮤니브 콘서트,대학생 문화기획단체 뮤니브,106%,"3,200,000원","3,000,000원",78,23,"일상을 탈피해 열정 속으로, 20대가 만드는 무대

: 2019 뮤니브 콘서트 “불난 집에 부채질”",2019.03.27-2019.04.21,None
63,공연·컬쳐,퀴어영화  〈 뷰티풀 〉,99film,6%,"300,000원","5,000,000원",7,10,〈퀴어영화 뷰티풀〉 후반제작 펀딩 프로젝트에 여러분의 목소리를 함께해주세요,2017.02.01-2017.03.31,펀딩성공
64,공연·컬쳐,"2,500명이 거쳐간 스냅 장인 <지니스타일>의 프로필 최초 단독런칭",지니스타일,674%,"6,743,000원","1,000,000원",73,71,"지니 스타일이 추구하는 사진은 지속성입니다.
수명이 긴 사진을 추구합니다. 언젠가 다시 꺼내서 바라볼 때
당신이 남겨놓은 시간의 틈새로 다시 돌아갈 수 있게끔.",2020.06.25-2020.07.06,None
65,공연·컬쳐,[5점만점 앵콜] 수중으로 떠나는 여름휴가!! 버킷리스트 완성하세요,아쿠아루체,2960%,"29,600,000원","1,000,000원",52,58,"남들과 똑같은 사진은 필요없다!!
나만의 독특한 [수중촬영]에 도전하세요
몽환적이고 아름다운 사진을 선물 합니다.",2021.04.25-2021.05.13,None
