,categories,title,company_names,percentages,funding_amounts,target_amounts,n_supporters,likes,descriptions,durations,days_left
469,여행·레저,◈ 당신이 기다리던 바로 그 '러기지' <소울 스마트 하이브리드 러기지>,SOWLE (소울),2656%,"13,284,500원","500,000원",103,180,프론트 포켓 / 무게 측정 핸들 / 100% 독일 바이엘 PC / 공간 확장  / 2중 안전 지퍼 / 듀얼 TSA Lock / 탈착식 더블 휠 [소울 스마트 하이브리드 러기지],2019.05.29-2019.06.16,None
470,여행·레저,[감성충만]미니멀 캠핑을 위한 월넛 롤테이블과 버너테이블.,컬,3782%,"37,821,000원","1,000,000원",129,548,"이제는 미니멀 캠핑 시대!! 이것저것 싸들고 다니는 캠핑은 이제그만. 
최소한의 부피로 즐기기 위한 롤테이블과 버너테이블로
미니멀하게 그리고 감성 돋게 캠핑을 즐기세요.",2020.04.29-2020.05.17,None
471,여행·레저,아늑(ANUK) | 우리 모두를 위한 아늑한 면텐트가 왔어요.,주식회사 얀,15736%,"472,108,000원","3,000,000원",448,650,"자연 속 텐트에서 나 혼자 누리는 아늑함,
캠핑장에서 사랑하는 사람들과 머무는 아늑함,
어디서나 느끼는 텐트 속 아늑함.",2020.11.27-2020.12.14,None
472,여행·레저,"여행과 일상의 경계를 허무는 가방, 딜럽 유닛백",(주)업드림코리아,2355%,"47,111,000원","2,000,000원",480,215,"2년간의 개발기간, 13번의 샘플링, 80장의 페이퍼 패턴, 158번의 수작업. 여행과 일상, 두 마리 토끼를 잡기위해 노력해온 결과물인 딜럽 유닛백 지금 공개합니다.",2018.01.16-2018.02.04,None
473,여행·레저,[지금이니까 만날수 있는 가격] 추석에 괌으로 떠나자! 항공권 펀딩,(주)인터파크,112%,"55,142,000원","48,860,000원",51,95,"""100명만 모이면 뜬다"" 포스트 코로나 시대를 여행하는 새로운 여행법-내가 직접 유치하는 항공기 펀딩, 얼리버드&추석 황금연휴 출발",2021.03.24-2021.04.05,None
474,여행·레저,[드디어 앵콜] SNS를 달군 화제의 바로 그 텐트! 루트베이스,헬버,6048%,"120,960,000원","2,000,000원",118,254,For Great Expeditions! 16ft의 앵콜 텐트 프로젝트 '루트베이스' 잊혀졌던 당신의 탐험 본능을 깨워 보세요.,2021.04.12-2021.04.19,None
475,여행·레저,"혼자사세요? 캠핑이나 여행가세요? 당신을 안전하게 만듭니다 ""캠지"" ",CAM.G ,466%,"4,669,500원","1,000,000원",99,119,"더욱 강해져서 돌아왔습니다! 세계최초의 휴대용 안전 도우미 캠지가 2세대 휴대용 안전 도우미 ""캠지 플러스""로 집과 캠핑, 여행을 보다 안전하게 만들어 드립니다.",2019.11.21-2019.12.18,None
476,여행·레저,여행 레저의 필수템 [지문인식 자물쇠] ,주식회사 포클레어,846%,"8,466,000원","1,000,000원",157,242,Your Finger Is The Key :  키나 암호가 필요없는 지문인식 자물쇠,2019.10.15-2019.11.10,None
477,여행·레저,가장 한국적인 것이 가장 세계적이다! 대한민국 美를 담아 떠나자~!!,아티모 ARTIMO,83%,"12,473,000원","15,000,000원",57,30,"가장 한국적인 것이 가장 세계적이다! 대한민국 美를 담은 캐리어로 톡톡튀는 여행을 떠나자~!!
    신용보증기금 파트너와 함께합니다.",2018.06.05-2018.07.04,펀딩성공
478,여행·레저,"[4.6점 앵콜] 지갑1켠에 7가지 기능을 담다, 7 in 1 오거나이져",롱테일컴퍼니,1501%,"15,018,620원","1,000,000원",393,352,"다양한 메모리 카드를 쉽고 안전하게 보관하며, 여행 및 일상에 유용한 기능을 제공하는 신용카드  크기의 오거나이저 MICRO TRAVELER KIT",2020.09.02-2020.09.16,None
479,여행·레저,[캠핑용품] 아름다운 밤을 위한 스테인리스 캠핑 스토브 ,무브디자인,44%,"668,000원","1,500,000원",4,34,"10년이상은 써야한다. 2mm stainless 스토브. 아름다운 캠핑의 밤을 선물합니다. 불멍 , 요리는 물론 보관과 사용이 세상 쉬운 울프 캠핑 스토브입니다.",2021.02.22-2021.03.08,펀딩성공
480,여행·레저,구명조끼는 선택이 아닌 필수! 휴대가 편한 포터블 공기 주입식 구명조끼,DATAFLY COMMERCE Inc.,3293%,"32,935,000원","1,000,000원",394,382,"휴대하기 어렵고 보관이 불편해 늘 렌트하게 되는 구명조끼, 뛰어난 디자인에 휴대와 관리가 쉽고 KC 인증까지 받아 안전성을 검증받은 와일드혼 제티(JETTY)",2019.06.05-2019.06.25,None
481,여행·레저,"[랜턴스피커] 따스한 불빛과 잔잔한 음악, 아웃도어 필수템.",유진정밀주식회사,1766%,"17,662,300원","1,000,000원",226,322,"Light up, Connect
빛과 소리를 함께 담은 모리모리 LED 랜턴 스피커
테라스에서의 저녁 식사, 홈파티, 침실, 야외 캠핑장 등 다양한 곳에서 함께하세요!",2020.01.31-2020.02.23,None
482,여행·레저,코펜하겐 한 달 살기 - 북유럽 행복 라이프스타일 커뮤니티,NAKED DENMARK,48%,"10,900,000원","22,500,000원",19,54,"북유럽, 꿈꾸지 말고 직접 살아보세요. 워라밸 천국으로 꼽히는 행복 선진국 덴마크 코펜하겐에서 한 달 간 로컬처럼 살며 인생을 재설계하는 라이프스타일 커뮤니티. 코펜하겐 한달살기",2019.06.26-2019.07.21,펀딩성공
483,여행·레저,물없이 닦을 수 있다고? 간편한 워터리스 아웃도어 세정제! #슈가워시,디테일가이,523%,"5,232,500원","1,000,000원",74,52,"이제 설거지 하러 먼길 떠나지 마세요! 앉은 자리에서 슈가워시 거품으로 먼저 닦고, 물로 가볍게 헹궈주면 설거지 끝!",2021.04.16-2021.05.03,None
484,여행·레저,역대급 가성비의 인생 첫 화목 난로! 마이스토브!,우드앤번,10929%,"327,888,000원","3,000,000원",602,714,"감성과 기술의 하모니.
2차 연소의 강력한 화력과 컴팩트한 사이즈와 수납!
캠린이도 손쉽게 사용하며 4계절 모두 함께 할 수 있는 올라운더 화목난로.
우드앤번 마이스토브",2021.01.29-2021.02.15,None
485,여행·레저,"화로 유목민들 주목! 캠핑의 고민을 해결할 마지막 화로, 캠프에디션!",버닝클럽,750%,"7,508,000원","1,000,000원",43,137,"화로라면 고기는 물론, 무드있는 꼬치구이에 냄비정도까지는 무리없이 올릴 수 있어야 하지 않을까요? 디자인과 실용성을 한번에 잡은 다재다능한 화로, 캠프에디션을 만나보세요.",2020.11.27-2020.12.14,None
486,여행·레저,"[등산 필수템] 하나, 둘, 3초만에 펴지고, 백팩에 들어가는 등산스틱",위즈,102%,"10,261,600원","10,000,000원",119,123,"작고, 강하고, 편한 삼박자의 등산스틱은 왜 만들 수 없을까?
휘츠가 생각했습니다. 그래서 만들었습니다.",2020.06.26-2020.07.18,None
487,여행·레저,"캠퍼를 위한 우드 소품, 원목 모기향 거치대. 자연의 감성을 피우세요.",김혜인,267%,"1,336,200원","500,000원",71,40,"한적한 자연을 찾게 되는 오늘. 모기향 거치대부터 트레이까지! 캠퍼를 위한 다양한 용도의 실용성있는 우드 소품, 원목 모기향 거치대.",2020.07.11-2020.07.31,None
488,여행·레저,이름을 새겨 세상에 단 하나뿐인 여권케이스와 네임텍 세트,스마일,22%,"112,000원","500,000원",4,8,"여권케이스는 많이 있어요. 그렇지만 나만의 여권케이스는 없지요.
나만의 오로지 나만을 위한 여권케이스를 소개합니다.",2019.01.31-2019.02.24,펀딩성공
489,여행·레저,"도심속 아웃도어, 가벼운 여행을 위한 City Traveler Set",ZATO,184%,"5,526,000원","3,000,000원",108,93,"도심속의 아웃도어 ""City Travler"" 들을 위한 가장 편안한 여행복장
Wear for good life ! , zato",2019.03.21-2019.04.07,None
490,여행·레저,"[전국,서울,제주] 박물관, 미술관이 있는 문화여행지도",트라이앵글,179%,"1,794,800원","1,000,000원",182,82,"가볼만한 박물관, 미술관, 과학관 중심으로 만든 여행지도 / 특수섬유타이벡으로 제작되어 친환경적이고 영구적인 지도입니다",2019.06.14-2019.07.01,None
491,여행·레저,8만원으로 캠핑장 호텔을 2박 체험,주식회사 캠킵,93%,"7,460,000원","8,000,000원",123,305,"2박 8만원으로 320만원대 반고카팔루아 면AIR텐트와 소품일체 렌탈(철수비포함).
캠핑장 현장 무인렌탈 IOT보관함에서 렌탈제품 수령.",2020.07.01-2020.07.31,펀딩성공
492,여행·레저,"[앵콜] 여행필수품 ""트래블백 버디"" 간편, 안전, 안심 신박템!",Wimi Corp,528%,"2,644,030원","500,000원",56,83,"여권,비행기표 등등 양 손에 꼭 쥐고 면세쇼핑하랴 화장실 다녀오랴 분주하면서도 불안했던 기억 있으시죠? 양 손의 자유를 허하며 캐리어와 보스턴백등을 체결하고 다양한 수납공간 활용!",2020.01.07-2020.01.20,None
493,여행·레저,"[이런혜택은없다] 믿고 펀딩하는 에이든여행지도, 6개 해외도시 런칭",주식회사 타블라라사,743%,"7,436,800원","1,000,000원",217,97,"에이든 여행지도 오사카, 홍콩, 괌/사이판, 다낭, 파리, 런던 6개 도시. 한꺼번에 미리 혜택을 받으세요. 펀딩 후 어느 채널에서도 할인 불가 합니다.",2019.03.08-2019.04.01,None
494,여행·레저,"어린왕자의 고향, 마다가스카르 바오밥나무 여행",강재현,260%,"22,750,000원","8,750,000원",13,44,"아프리카의 소행성, 마다가스카르 바오밥나무 여행",2019.12.31-2020.01.07,None
495,여행·레저,[추석여행] 괌 3박4일 #알차게_미리_준비하기,주식회사오세아니아투어스,6%,"2,780,000원","40,000,000원",14,31,"이번 추석, 가족여행의 성지 괌에서 오래 기다려 왔던 여행을 해보세요! 편안한 호텔과 정글탐험, BBQ체험, 스타게이징 까지 잊을 수 없는 추억을 만들어 드리겠습니다.",2021.03.24-2021.04.26,펀딩성공
496,여행·레저,이것이 찐! 우드감성 캠핑테이블 - 재미와 감동을 당겨주는 폴테이블,이자인우드,427%,"4,274,000원","1,000,000원",19,87,"우드 테이블로 캠핑에 클래식한 감성을 더해주며,  더욱 작은 수납 사이즈와 설치할때 놀라운 재미까지 있는 실용적인 캠핑테이블 입니다.",2021.04.01-2021.04.26,None
497,여행·레저,"세계 최초의 공유여행, 당신이 그 주인공입니다",테마여행신문,0%,"11,000원","3,000,000원",8,2,"오늘 만난 친구와 동네여행하는 ‘공유여행’의 시대!  대한민국 최초로 ‘공모전 여행’, ‘캠퍼스 전국일주’를 기획한 삐급여행 조명화 여행작가(現 테마여행신문 편집장)가 여러분과 함께 공유여행 가이드북을 만드는 세계최초의 '공유여행' 프로젝트에 초대합니다!",2014.06.19-2014.09.27,펀딩성공
498,여행·레저,'김포공항 홈투홈 왕복서비스' 사전예약 얼리버드 리워드 프로젝트,스타디움공항파킹셔틀,30%,"300,000원","1,000,000원",6,12,"5월 연휴, 여름휴가 시즌 여행계획 있으시죠?
'김포공항 홈투홈 왕복서비스' 사전예약 얼리버드 프로젝트의 특별한 혜택 받으세요. 김포공항에 가고 오는 길이 편안하고 빨라져요.",2018.02.26-2018.03.09,펀딩성공
499,여행·레저,세계정복은 우리나라부터 시작된다. 포도와 함께 국내여행 기록하기,김민구,18%,"1,096,000원","6,000,000원",51,38,"우리나라는 얼마나 아름다운지 알고 계시나요? 일상으로 무뎌져 아름다움을 잊은건 아닌지요? 우리나라 방방곡곡을 여행하며, 포도와 함께 발자취를 남겨보세요~",2017.12.07-2018.01.29,펀딩성공
500,여행·레저,"[11/12월] 훌쩍 떠나는 마추픽추, 우유니 여행 5~7일",비욘드코리아,64%,"3,245,000원","4,995,000원",8,52,"여러분이 꿈꾸던 바로 그 곳! 
최소한의 시간과 금액 투자로 남미여행의 꽃, 마추픽추 그리고 우유니를 여행해 보세요!",2019.08.30-2019.09.08,펀딩성공
501,여행·레저,"2019년 여름을 강타할 스노클링 마스크 끝판왕, SEAVIEW SV2",Datafly Commerce Inc,2893%,"28,933,000원","1,000,000원",395,364,"세계 최대 쇼핑몰 아마존에서 인정받은 와일드혼의 기술력으로 탄생한 ""차세대"" 스노클링 마스크 SEAVIEW SV2와 함께 생생하고 실감나는 수중 생태계를 경험해보세요",2018.12.04-2018.12.25,None
502,여행·레저,"[7박10일] 시간이 멈춘 나라, 쿠바&칸쿤 여행",유캔고,10%,"1,000,000원","10,000,000원",11,34,"빠르게 흐르는 시간, 매일 반복되는 일상에 지쳐있지 않으세요? 가슴 속 일탈이 꿈틀거릴때, 나를 위한 의미있는 여행, 시간이 멈춘 나라 쿠바로 떠나는 7박 10일",2020.01.20-2020.01.27,펀딩성공
503,여행·레저,"[4161%앵콜] 안장통을 날려버리는 상쾌한 라이딩, HUAN PPS안장",(주)휴안,2909%,"29,090,400원","1,000,000원",250,266,라이더라면 한번쯤 경험해본 안장통! HUAN PPS안장이 해결해드립니다! 한층 [업그레이드]되어 돌아온 [PPS안장]으로 라이딩을 즐기세요!!,2020.09.16-2020.10.05,None
504,여행·레저,"별자리와 함께 떠나는 여행, 여행 4종 별자리 에디션",엔엠텍코리아(주),128%,"1,282,500원","1,000,000원",52,43,"항상 설레임을 안고 떠나는 여행, 그 여행에 특별함을 더해드리고자 고민하였습니다. 누구나 사용하는 액세서리가 아닌, 나만의 별자리와 함께하는 여행. 준비되셨나요?",2018.07.20-2018.08.19,None
505,여행·레저,[감성 캠핑] 5분만에 완성하는 우리만의 차박 텐트 ,주식회사 인디카튜닝,5964%,"59,644,800원","1,000,000원",407,560,"감성 차박 캠핑, 비싸지 않아요. 어렵지 않아요. 5분만에 완성하는 우리만의 차박 여행",2020.07.06-2020.07.15,None
506,여행·레저,'안전하고' '편리한' 여행을 위한 단 하나의 가방 ,백네스트,118%,"2,363,000원","2,000,000원",90,56,"안전하고 편리한 여행을 위해 필요한 단 하나의 가방!
    여행/레져 기획전 파트너와 함께합니다.",2018.06.18-2018.07.01,None
507,여행·레저,버클 하나로 내 몸에 착! 감겨버리는 감성x실용 캠핑담요,지엠엠케이(GMMK),79%,"796,000원","1,000,000원",33,32,"캐나다에서부터 출발한 캠핑 픽업크루 아이템.
착용감, 활동성, 보온성 까지!
감성 캠핑 stewincämp™ Loki 캠핑담요.",2021.03.16-2021.03.29,펀딩성공
508,여행·레저,한 소년의 세상을 바꾸는 이야기 [호주 4000km 대륙횡단],유은미,18%,"564,000원","3,000,000원",73,11,"제가 다른 누군가 삶의 이야기를 통해 희망을 얻은 것 처럼 저의 삶의 이야기로 사람들에게 희망과 꿈을 줄 수 있다면 우리나라는, 아니 이 세상은 어떻게 바뀔까요?",2016.06.28-2016.09.09,펀딩성공
509,여행·레저,로맨틱한 나이트피크닉 투어,주식회사 글로벌투어서비스,56%,"564,000원","1,000,000원",28,4,비대면으로 안전하게 피크닉 즐기기,2020.11.30-2020.12.06,펀딩성공
510,여행·레저,이제 벌레걱정 끝! 벌레쫓는 #특수원단 아미앙스 안티 버그가드,다민사,304%,"3,040,800원","1,000,000원",91,98,"즐거운 야외활동을 위한 필수템! 가볍게 덮어주는것만으로 모기,진드기 등 각종 해충으로 부터 걱정 끝! 아동용섬유제품 13종 검사완료를 통해 더욱더 안전한 담요!",2019.10.08-2019.10.27,None
511,여행·레저,"우드삼각랜턴걸이 (캠핑장의 꽃, 실내인테리어의 정점)",(주)제이앤에이치에이전시,5%,"2,244,000원","40,000,000원",46,70,"캠핑장에서는 화려한 랜턴걸이 실내에서는 인테리어 소품으로 쉽게 조립,설치가 가능하고 보관 이동이 편리한 국만 삼각랜턴걸이",2021.01.27-2021.03.26,펀딩성공
512,여행·레저,"착한_호텔 숙박권, 코트야드 메리어트 서울 남대문 클럽라운지 패키지",(주)감동여행디자인,1320%,"13,206,000원","1,000,000원",120,132,"#착한_호텔_스테이의 첫번째  Project  ""코트야드 메리어트 서울 남대문""으로 초대합니다.  당신의 완벽한 하루에 펀딩하고 활기찬 신년 계획과 착한 기부도 실천하세요",2021.02.16-2021.02.25,None
513,여행·레저,[앵콜 피크닉파트너스]우리가 원하던 바로 그 텐트! 힌트오리진 어넥스,피크닉파트너스,2659%,"106,391,000원","4,000,000원",108,532,"봄 여름 가을 겨울 형태를 바꿔가며 1년 내내 새로운 모습과 쓸모로 변신하는
우리가 원하는 바로 그 텐트! 힌트 오리진 어넥스입니다.",2019.10.10-2019.11.03,None
514,여행·레저,BISON GEARS 키리다쉬 포켓 나이프,"BISON GEARS, San Francisco, CA",351%,"6,677,000원","1,900,000원",239,146,이국적 감성과 수려한 외모에 핸디한 '바이슨 기어스 키리다쉬 포켓나이프!' 드디어 한국 상륙!! 컴팩트한 크기의 포켓 나이프! 키체인에 달고 다니세요.,2019.10.21-2019.11.08,None
515,여행·레저,더플백 끝판왕 백네스트 롤링더플백,bagnest,15%,"1,074,000원","7,000,000원",7,37,이 프로젝트의 시작은 가방을 여러개 들고 다니는걸 귀찮아 하면서 시작됐습니다,2019.02.01-2019.02.17,펀딩성공
516,여행·레저,"세계여행 ""준비 끝"" 올인원 여행용 멀티어댑터 '크리스탈클라우드 '",크리스탈클라우드,2049%,"20,498,000원","1,000,000원",525,544,"안녕하세요 크리스탈클라우드 브랜드 소유권사 (주)한국입니다.
양산제품으로 2019년 기준 5만대 이상 판매를 한 제품을 공급사와 기술공동개발을 통해 신제품 소개하고자 합니다.",2019.12.30-2020.01.26,None
517,여행·레저,"All-In-One 캠핑장비, 저스트고 퍼니처+트랜스포머 키친박스I 캠플",캠플(Cample),177%,"3,559,000원","2,000,000원",40,126,"2분이면 나만의 캠핑카를 만들 수 있다.
합리적 가격의 아이템 하나로, 캠핑카와 캠핑용품 준비 끝!",2020.07.10-2020.08.16,None
518,여행·레저,"[유유자적] 차량용 텐트, 이제는 합리적인 가격으로!!",주식회사 유유자적,39%,"1,995,000원","5,000,000원",27,103,"좋은 건 너무 비싸고, 싼건 너무 안좋고...
합리적인 캠핑용품, 앞으로 유유자적이 만들겠습니다.
그 첫번째, 올블랙 차량용 텐트를 소개합니다!",2020.06.18-2020.07.09,펀딩성공
519,여행·레저,침수 분실 걱정 끝! 소지품을 들고 물놀이 한다? 완벽방수 아쿠아백!,ZATO,522%,"5,228,500원","1,000,000원",198,211,"물놀이, 아웃도어, 여행, 레져 등 상황과 장소에 상관없이 이 가방하나로 끝 ! 내 소지품을 완벽하게 지켜주는 방수기능을 담은 아쿠아백",2019.06.04-2019.06.23,None
520,여행·레저,"임도의 아름다움, 자전거와 만났다!",ISAR,103%,"10,330,000원","10,000,000원",119,94,"자전거와 임도를 이어주는 앱으로 전국 5,100여 임도 정보를 제공하고 있어요. 여러분 가까운 곳에 숨겨진 여행지, 아름다운 임도를 찾아보세요.",2018.02.06-2018.03.08,None
521,여행·레저,[캠핑용품]미니마 윈드스크린 바람막이,무브디자인,49%,"496,000원","1,000,000원",9,17,"캠핑의 계절 봄이 오고 있습니다~~!
봄철 바람을 막아줄 윈드스크린 하나 챙겨서 캠핑을 가는건 어떠세요?
솔로캠핑 혹은 지인과의 캠핑에서 유용하게 쓰이는 바람막이를 소개합니다.",2021.04.05-2021.04.15,펀딩성공
522,여행·레저,[야경실화?]프리미엄 헬스장이 6개월 15만원?,3Bfitness,15%,"159,000원","1,000,000원",21,18,[야경실화?]한강뷰의 프리미엄 헬스장이 6개월 15만원대?,2019.07.12-2019.07.21,펀딩성공
523,여행·레저,백팩이 에어매트가 된다고!? 이제 자충매트 따로 들고 다닐필요 없어요.,블랙브라이어,86%,"8,661,000원","10,000,000원",109,100,"이동할땐 백팩으로, 필요할땐 에어매트로, 보관할땐 작게 말아서.
가벼움과 기능성을 모두 잡은 [에어매트백팩]
익스트림 브랜드 블랙브라이어의 세계최초 에어매트 백팩",2020.04.28-2020.05.18,펀딩성공
524,여행·레저,다기능 캠핑그릴 앤쿡,비엠베(BMBe),56%,"566,000원","1,000,000원",6,47,야외에서 간편 깔끔하게 사용할 수 있는 다용도 캠핑스텐그릴 입니다.,2020.12.29-2021.01.20,펀딩성공
525,여행·레저,[피싱라이트]밤낚시에 도움을 주는 기존엔 없던 필수 아이템,디자인카페,35%,"179,500원","500,000원",11,16,"밤낚시의 필수품 랜턴. 그러나 낚시준비, 미끼, 낚시바늘 교환 등 여러 작업을 하면서 대부분의 낚시꾼들이 사용하는 헤드렌턴을, 켜고 끄고 번거롭고 불편하셨다면 피싱라이트!!",2020.03.19-2020.04.10,펀딩성공
526,여행·레저,"[앵콜] 금속공예가가 만든 럭셔리 캠핑 화로대 ""AGUNG""",스틸박스,202%,"8,085,000원","4,000,000원",31,128,"금속공예가가 불과 금속을 연구하고, 환상적인 2차연소 불꽃까지 디자인 _ 작가가 직접 손으로 설계, 제작하여 탄생시킨 럭셔리 캠핑 화로대 "" AGUNG """,2020.01.30-2020.02.17,None
527,여행·레저,당신에게 보내는 손글씨: 일상 속 작은 새로움이 될 여행 엽서,이혜진,51%,"205,000원","400,000원",39,1,"나만 즐기기엔 아까운 여행의 향기, 당신에게도 한 장 보내드릴게요!",2015.03.24-2015.05.17,펀딩성공
528,여행·레저,[캠핑가방 끝판왕] 다~들어갑니다! 캠핑 장비 빠뜨리지 말고 다니세요! ,bluey,1124%,"5,620,000원","500,000원",57,102,캠핑 갈때마다 빠뜨리는 용품들! 이제 블루이 폴딩백으로 간편하게 해결하세요!,2020.09.30-2020.10.19,None
529,여행·레저,여행중 늘어난 짐 당황하지 마세요. 잘 만든 폴딩백 라이트포켓이면 OK ,스트랩스(수퍼컨셉),383%,"3,837,200원","1,000,000원",113,158,"가방때문에 쇼핑을 포기하지 마세요.
잘 만든 폴딩백. 라이트포켓이면 다 담을수 있어요",2019.09.19-2019.10.17,None
530,여행·레저,"[2차펀딩]더운 여름 시원한 샤워를 책임질, 쿨파스 샤워바",코르반_쿨파스샤워바,285%,"1,427,700원","500,000원",60,34,"더운 여름 시원한 샤워를 책임질, 쿨파스 샤워바",2019.06.20-2019.06.26,None
531,여행·레저,[우중캠핑] 비 소식의 캠핑 가는걸 고민하는 당신에게 꼭 필요한 아이템 ,SUREENOUGH,88%,"8,829,600원","10,000,000원",68,170,"캠핑, 백팩킹 일상에서도 꼭 필요한 Anorak Pancho Raincoat",2021.03.29-2021.04.19,펀딩성공
532,여행·레저,"2천명이 예약한 40L 배낭이 온다, 엠비치오넴",엠비치오넴,1318%,"65,921,001원","5,000,000원",262,178,"여행을 기록하는 새로운 방법, '엠비치오넴''",2017.12.21-2018.01.10,None
533,여행·레저,"[로이훈] 첫 번째 여행 프로젝트, 일상 여행자를 위한 트래블러 모자",로이훈 LOiHOON,158%,"1,587,900원","1,000,000원",51,47,"여행에서의 영감을 유니크한 디자인으로 패치위에 자수놓은 트래블러 모자의 첫 번째 시리즈, 이집트편",2020.06.29-2020.07.13,None
534,여행·레저,[슬램덩크 포에버] 일본 같이 갈 '사람을 찾습니다',컨셉흥신소 ,100%,"10,065,000원","10,000,000원",120,23,"#SLAMDUNK_FOREVER, 완간20주년 특별프로젝트

일본 같이 갈 ‘사람을 찾습니다’",2016.10.12-2016.10.31,None
535,여행·레저,"나만 보는 쌍안경, 단망경은 그만! 이제 가족과 친구와 나눠보자. ",세기P&C(주),933%,"9,333,000원","1,000,000원",38,99,"친구, 가족, 지인들과 함께 나눠 볼 수 있는 쌍안경과 핸드폰과 연결하여 사진 촬영이 가능한 단망경을 소개합니다. 
PENTAX VD 4 X 20 WP / VM 6 X 21 WP",2021.04.12-2021.05.10,None
536,여행·레저,(앵콜) [킬리X여행에미치다] 청춘들을 위한 리얼 여행배낭 제작 프로젝트,킬리아웃피터스,10234%,"511,715,159원","5,000,000원","3,093",770,"배낭여행을 꿈꾸시나요?

누구나 쉽고 편한 배낭여행을 즐길 수 있도록,  
'킬리'와 '여행에미치다' 만나 함께 특별한 배낭을 만들었습니다.",2017.01.19-2017.02.17,None
537,여행·레저,｜국내최초｜여행용 '스마트' 세면도구｜ 맞춤형 세면 키트 심플트레블러,코글로브,2085%,"20,858,000원","1,000,000원",567,406,"가정에서 사용하는 대용량 세면용품 필요한만큼만 담아 경제적이고 끈과 버클기능으로 편리성은 최대화, 항공기내반입이 가능한 만능 세면도구가 당신의 무거운 짐을 덜어드리겠습니다.
    여행/레져 기획전 파트너와 함께합니다.",2018.05.02-2018.06.10,None
538,여행·레저,"앵콜 수학여행, 다시 떠나는 경주! ",(주) 하나레저서비스,0%,0원,"12,000,000원",4,4,[응답하라 7080] 앵콜 수학여행 경주편,2021.04.22-2021.04.30,None
539,여행·레저,"[최초공개] 낚시인들을 위해 탄생한, 원터치 낚시텐트!",(주)에이칸에스티,17%,"858,000원","5,000,000원",10,34,당신이 평생 고장없이 사용하게될 원터치 낚시텐트. 텐트의 혁명! 40년 텐트장인이 제대로 만든 낚시텐트를 와디즈를 위한 프로젝트에서 최초로 만나보세요.,2020.02.06-2020.03.16,2일 남음
