,categories,title,company_names,percentages,funding_amounts,target_amounts,n_supporters,likes,descriptions,durations,days_left
0,여행·레저,[업그레이드 앵콜] 봉화로 신형 받침대 출시 기념 앵콜 펀딩!,(주) 동원하이텍,22%,"661,500원","3,000,000원",11,42,"서포터 여러분의 성원에 힘입어 앵콜펀딩!
기존 받침대에서 발전하여 다리가 생겨났답니다.
더욱더 안정된 봉화로와 함께 올겨울 동계 캠핑을 즐겨보세요~",2021.01.18-2021.01.25,펀딩성공
1,여행·레저,심플러 - 천연성분 치약이 코팅된 일회용 칫솔,에스씨유(SCU),206%,"4,137,700원","2,000,000원",94,53,"이를 닦을 때 꼭 치약을 짜야만 할까요? 이 귀찮음을 누가 대신 해줄 수는 없을까요? 그래서 여기 여러분을 위해 칫솔모에 치약이 미리 발라진 일회용칫솔 심플러를 가져왔습니다.
    한국과학창의재단 파트너와 함께합니다.",2017.11.01-2017.11.20,None
2,여행·레저,"품질만큼 놀라운 가격! 신소재 PET로 만든 스마트 캐리어, ZERO",ZERO LUGGAGE (7G),417%,"41,705,600원","10,000,000원",458,623,"더 튼튼하고 안전한 신소재 PETG, 스마트 충전, 더블지퍼, 매립형 TSA락, TPE 더블 휠, 여행필수템이 담긴 GIFT SET 까지! 여행에 집중한 사려깊은 캐리어! ZERO",2018.10.05-2018.10.29,None
3,여행·레저,우리 아이 좌석을 퍼스트클래스로 만들어주는 [젯키즈 베드박스],박세훈(바구스 글로벌),708%,"21,241,800원","3,000,000원",111,74,파일럿 출신의 아빠가 만든 젯키즈 베드박스는 소중한 우리아이의 항공기 좌석을 일등석으로 만들어 주는 노르웨이에서 온 아이용 캐리어겸 베드박스 입니다,2017.06.22-2017.07.12,None
4,여행·레저,스크래치? 파티션? 캐리어 쓰다 불편했던 거 말만 해 [피크 캐리어],(주)공정뮤토,7134%,"71,343,000원","1,000,000원",626,835,"캐리어가 있는데 커버는 왜 또 씌우지? 
지퍼 또 열어야 하네.
누가 캐리어에 파티션 좀 넣어줘요.


캐리어 쓰다 겪어봤을 바로 그 불편함, 뮤토 피크 캐리어가 해결해 드립니다!",2019.05.09-2019.05.30,None
5,여행·레저,"수면의 혁명, 블랙커(BLACKER)",페르소나(persona),369%,"1,846,000원","500,000원",37,66,"가장 진화한 목쿠션, 단단한 고정력으로 수면의 자유를 주다.
    1인창조기업 파트너와 함께합니다.",2018.10.17-2018.11.18,None
6,여행·레저,★앵콜★ 스마트폰보다 가볍고 손바닥보다 작은 폴딩백팩 [4몬스터] ,4몬스터,1739%,"8,699,500원","500,000원",182,125,"24리터의 넉넉한 수납 공간, 손바닥 크기의 파우치에 쏙 들어가는 휴대성까지! 가성비 좋은 초경량 폴딩백팩 [포몬스터]",2019.07.31-2019.08.11,None
7,여행·레저,<세이브그린감성매트> 수분은 튕겨내고 감성은 채워줘요,CCLAN (끌랑),223%,"2,235,500원","1,000,000원",85,85,"BYE-플라스틱! 건강한 피크닉을 위해 만들었습니다. 펀딩 금액은 환경캠페인 뮤직페스티벌 ""그린플러그드2019서울"" 후원금으로 사용됩니다.",2019.04.22-2019.05.12,None
8,여행·레저,손선풍기에도 레벨이 있습니다. 프리미엄 핸디쿨러 JALOUX,(주)매경,7%,"889,000원","11,300,000원",34,31,"휴대용 네모 선풍기 네모네. 대한민국 1% 선택!!! 프리미엄 핸디쿨러 ""JALOUX"". JALOUX을 선택한 당신은 프리미엄. 이제 당신은 시샘 받을 수 있습니다.",2018.10.25-2018.12.14,펀딩성공
9,여행·레저,돌봄프로젝트 1탄 - 가벼운 화로대로 가볍게 떠나는 캠핑! 돌봄캠핑불멍,돌봄,102%,"2,448,501원","2,400,000원",95,80,돌봄프로젝트 1탄 - 전국민 불멍프로젝트! 가성비 끝판왕 캠핑불멍! 간단한 조립 형태로 보관과 사용성이 매우좋은 불멍입니다.,2021.04.07-2021.05.07,None
10,여행·레저,[푸디온] 랜선 낮술 여행 - 홍천 수제막걸리를 찾아 떠나는 힐링여행,푸디온투어,147%,"1,471,000원","1,000,000원",33,24,강원도 홍천 전통주 양조장의 100% 수제 막걸리를 다 함께 낮술로 시음해보는 온라인 랜선 여행입니다. 전통 프리미엄 수제 막걸리를 맛보고 싶으시다면? 푸디온으로 오세요-♡,2020.10.01-2020.10.13,None
11,여행·레저,[오후의 팜맥] 자연 속에서 직접 수제맥주 만들기&나만의 네이처 컬러링,스토리쿡,112%,"560,000원","500,000원",39,16,"바쁜 도시 속 지루한 일상을 벗어나는 방법! 자연속으로의 여행에 초대합니다.
오롯이 나만을 위한 시간을 선물해드려요.",2020.05.25-2020.06.12,None
12,여행·레저,알뜰여행! 할인족을 위한 대한민국 관광지 플랫폼 VIT,브레오코리아,41%,"2,078,500원","5,000,000원",36,1,"알뜰여행을 위한 대한민국 관광지 플랫폼 VIT (Very Important Tourist) 펀딩이 종료되었습니다. 보상품 시계는 사전에 모두 발송해 드렸으며, VIT 모바일쿠폰은 10/1 발송하였습니다. 앞으로 대한민국 관광지 플랫폼 VIT(www.vitkorea.net)에 대한 지속적인 관심과 애정 부탁드립니다. 감사합니다.",2015.09.01-2015.09.30,펀딩성공
13,여행·레저,[1억앵콜] 6만원대 갓성비 캠핑랜턴! 탱크처럼 강력한 랜턴이 돌아왔어요,(주)오이알,5280%,"52,808,300원","1,000,000원",742,416,"캠핑장의 메인 랜턴으로 안성 맞춤인 프로메테우스2가 돌아왔습니다.
강력한 몸집 + 강력한 밝기 + 강력한 지속력으로 우리들 캠핑의 밤을 밝게 비춰보세요!",2021.03.16-2021.04.05,None
14,여행·레저,"[퍼펙트가드] 가벼운 편안함, 도난방지의 새로운 시작 MERGER BAG",컨스파라,6115%,"61,157,000원","1,000,000원",898,727,"새로운 디자인 새로운 원단 새로운 잠금장치, 이젠 일상에서 사용하고 여행 갈 때 챙겨가자!",2019.08.28-2019.09.29,None
15,여행·레저,이번 휴가도 줄서서 씻게요? 야외샤워/설거지/세척엔 휴대용 샤워기ㅣ헬리오,(주)엠케이아웃도어,6056%,"60,569,000원","1,000,000원",609,816,바닷가에서도 캠핑 할 때도 집에서처럼 샤워하고 설거지하고 손 닦을 순 없을까? 미국 캠핑 브랜드 '니모'는 샤워기를 들고 다닐 때 아웃도어 활동이 얼마나 편해지는지 증명해 줍니다!,2020.05.24-2020.06.15,None
16,여행·레저,"[트래비랑 여행가자!] 1회차, 부산 박살내기!!",트래비(TraB),26%,"130,000원","500,000원",23,15,"안녕하세요! 여러분의 여행 동반자, 트래비(TraB)입니다.
코로나19 사태 이후 조금 더 즐겁고 보람찬 여행 하셨으면 해서 이번 프로젝트를 준비했습니다!
1탄! 부산 박살내기!",2020.07.06-2020.08.10,펀딩성공
17,여행·레저,"<글로벌15억펀딩> 옷장을 통째로 삼킨 괴물캐리어, 짐싸기는 이제 5초컷",주식회사 지스트,921%,"9,213,000원","1,000,000원",54,170,<글로벌 15억펀딩> 짐싸기 5초컷 가능! 옷장을 통째로 삼킨 괴물 캐리어가 한국에 상륙했습니다. 이제 짐은 싸는게 아니라 통째로 한방에 옮겨버리는겁니다.,2021.03.01-2021.03.15,None
18,여행·레저,여성을 위한 여행의 소울메이트 ~ ARTG,아트패드,189%,"1,895,500원","1,000,000원",31,34,"ARTG 네오프렌 엠보 숄더백으로 엣지 있는 패션을 완성하세요! 
가벼운 네오프렌 소재에 6중 나염 코팅과 고급스러운 엠보를 입혀 핸드메이드로 완성한 디자인 숄더백입니다.
    여행/레져 기획전 파트너와 함께합니다.",2018.05.28-2018.06.24,None
19,여행·레저,"여행을 기록하는 도트맵, 줄라이닷츠 한국지도",줄라이웍스,3948%,"78,978,801원","2,000,000원","3,989",579,"여행을 언제나 추억하고 꿈꿀 수 있는 하나의 도구, 줄라이닷츠.                
수많은 여행지에서의 추억, 새로운 여행을 기다리는 마음을 소중하게 담아보세요.
    추석 특별 기획전 파트너와 함께합니다.",2017.10.02-2017.10.16,None
20,여행·레저,[3.1절 기념/ 3+1이벤트/ 마지막 앵콜] 독도 알리는 여행자 신분증,골든피스원™,686%,"3,430,000원","500,000원",95,85,"[3.1절 기념/ 3+1이벤트/ 유심어댑터 선물] 독도 알리는 여행자 신분증, '한반도 여권케이스' 마지막 앵콜",2019.02.27-2019.03.13,None
21,여행·레저,"여행을 더 안전하게, 전자소매치기 방지 여행가방 '윈디코너'",윈디코너,1130%,"11,302,000원","1,000,000원",206,127,"안심할 수 있을 때, 
여행은 더 즐거워집니다.",2017.08.25-2017.09.15,None
22,여행·레저,[치얼업메이커]여행필수품!!! BOOKKI 올인원 트래블 키트 :),크레더블(Credible),39%,"399,200원","1,000,000원",22,26,여행의 즐거움을 더해 줄 BOOKKI 올인원 7-스텝 트래블 키트,2019.04.17-2019.05.06,펀딩성공
23,여행·레저,겨울철 필수 아이템! 겨울에는 눈을!  눈을 만드는 사람들  88스노우,투와이,20%,"490,000원","2,450,000원",7,24,"겨울철 필수 아이템. 인공눈 제설기.
겨울에는 눈을!  여름에는 워터스플래시!
눈을 만드는 사람들 88스노우.
88스노우만 있으면 누구나 인공눈을 만들수 있습니다.",2021.04.02-2021.04.26,펀딩성공
24,여행·레저,즐거운 추억을 위하여 - 안전한 여행가방 윈디코너,윈디코너,4704%,"47,042,500원","1,000,000원",660,406,"안심할 수 있을 때, 
여행은 더 즐거워 집니다.",2017.12.05-2018.01.09,None
25,여행·레저,"[국내 제작] 사용해보면 알아요, 베게를 열면 담요가??",DKAL Global,246%,"1,232,400원","500,000원",30,27,"국내 제작 
간편한 휴대성과 다양한 실용성으로 사용가능한
2 IN 1 배게 담요",2020.10.16-2020.11.02,None
26,여행·레저,프리미엄 스마트캐리어 지니,(주)엘엔씨인터내셔널,43%,"4,347,000원","10,000,000원",36,92,"""18년 경력의 캐리어 전문가가 만든다""
캐리어사용 불편한점 없으셨나요? 프로답게 해결했습니다.
다갖춘캐리어 [프리미엄 스마트 캐리어 지니]",2020.01.03-2020.02.16,펀딩성공
27,여행·레저,캠핑도 이젠 세련되게! 블랙 감성을 입은 [내셔널지오그래픽] 텐트,(주)더네이쳐홀딩스,3371%,"101,156,400원","3,000,000원",312,545,"유니크한 텐트의 등장! 
공간 활용도가 좋은 유럽 스타일의 자립식 터널형 텐트부터 눈비에 강한 입체형 티피 텐트까지 지금 바로 만나보세요!",2020.02.17-2020.03.02,None
28,여행·레저,2세대 바그람 팩: 오피스/짐(GYM)/여행 백팩 [업그레이드 에디션],ESHENA (애쉬나),613%,"30,694,000원","5,000,000원",179,254,"2016년 국내외 2억원, 1500명의 후원을 받고 지금의 애쉬나를 있게해준 바그람 팩이 업그레이드 되어 2세대 바그람 팩으로 다시 돌아왔습니다.",2019.11.28-2020.01.12,None
29,여행·레저,[감성캠핑200%업그레이드자신감]에스티피크니커 썸머 시트커버,에스티피크니커,460%,"2,303,300원","500,000원",48,33,"여름캠핑감성 업그레이드! 바다, 산, 수영장, 호텔, 집 어디서나 쓰임새가 다양한 빅타올 시트커버!! 호환이 용이한 썸머시트커버면 감성200% UP! 누구나 감성캠퍼가 될수있어요",2021.04.06-2021.04.26,None
30,여행·레저,"여행길 깨끗한 물 ""웰스프링 텀블러""가 동행 합니다.",(주)필로스,144%,"2,898,500원","2,000,000원",43,66,멤브레인펜이 보틀과 만나 일체형 텀블러로 돌아 왔습니다.여름철 여행길 물갈이 해방 프로젝트!웰스프링 텀블러!,2018.07.10-2018.07.24,None
31,여행·레저,팔찌로 변신하는 캐리어 네임텍! 디자인 캐리어 네임텍+예쁜 가죽팔찌,블랑쉐나인,26%,"133,600원","500,000원",23,16,"특별한 여행을 바라는 당신에게 특별한 여행 아이템을 추천합니다
팔찌로도 또는 감성 캐리어 네임택으로도 변신 가능한 감성 캐리어 네임텍",2019.08.13-2019.08.21,펀딩성공
32,여행·레저,바로쿡2020년 베스트 메이커 선정 앵콜! 기념 불없이 조리하는 바로쿡!,주식회사 사람,1665%,"49,972,000원","3,000,000원",647,476,바로쿡 의 진수를 보여드립니다. 전세계 24개국에 수출하는 우리제품 바로쿡 와디즈와 함께 합니다.,2021.02.17-2021.03.08,None
33,여행·레저,[베트남/2월출발] 봉사전문가 박현서BJ와 함께하는 다낭&호이안 볼룬투어,Concept Tour(컨셉투어) by Modetour,50%,"4,288,000원","8,576,000원",9,10,"기존 패키지 여행의 틀을 깨는, 새로운 여행의 패러다임. 여행에 개성을 입힌, Concept Tour.",2019.01.15-2019.01.20,펀딩성공
34,여행·레저,"[4차 펀딩] 여행갈때 입는 옷, 고고팬츠 & 고고티셔츠",롯지,2630%,"131,505,000원","5,000,000원",944,387,"여행갈때 여러분은 어떤 바지를 입으세요? 배낭여행, 휴양지, 캠핑.. 어디서든 '고고팬츠'
    여행/레져 기획전 파트너와 함께합니다.",2018.06.12-2018.06.26,None
35,여행·레저,"운동, 여행, 일상에 편리함과 시원함을 더해줄 반바지 l 액티비티 팬츠",CONDEA,2427%,"12,139,600원","500,000원",241,250,"운동바지, 캐주얼바지, 속옷의 기능을 모두 갖춘 액티비티 팬츠를 3만원대에 만나보세요!",2020.07.16-2020.07.27,None
36,여행·레저,[앵콜]서포터들의 의견이 반영된 개선형 Parking Cooler,칼라풀스트림,52%,"525,000원","1,000,000원",9,15,한여름 태양빛에 달궈진 뜨거운 차량에 시원한 그늘막(Parking Cooler)을 설치하시면 좀더 쾌적한 Driving을 하실수 있습니다.,2019.07.15-2019.07.28,펀딩성공
37,여행·레저,[가성비 혁신] 스마트폰보다 가벼운 폴딩백팩이 3만원대?,4monster,1830%,"18,304,000원","1,000,000원",361,228,"24리터의 넉넉한 수납 공간, 손바닥 크기의 파우치에 쏙 들어가는 휴대성까지!
가성비 좋은 초경량 폴딩백팩 [포몬스터]",2019.06.18-2019.07.07,None
38,여행·레저,캠핑 별거 아니네?! 이제 쉽게 감성 캠핑 해봐요. | 그라비티 캠프,debroke,9475%,"94,752,000원","1,000,000원",438,903,"2020년 그라비티 캠프 신상 라인 출시!
이번에는 그라비티 캠프만의 감성을 담아 캠핑 의자와 테이블, 타프를 준비했습니다.
모던한 디자인과 세련된 색상으로 ‘감성 캠핑’ 적합",2020.04.18-2020.05.18,None
39,여행·레저,여행과 모험을 꿈꾸는 당신을 위한 특별한 컨텐츠 세계지도,AWESOMEMAPS,502%,"5,021,600원","1,000,000원",112,102,"당신이 꿈꾸는 모든 모험이 담겨 있는 세계지도
You are Awesome! We are AwesomeMaps!",2019.04.10-2019.04.28,None
40,여행·레저,"[앵콜/후기확인필수]캠핑테이블의 혁명! 루핀으로 캠핑준비, 1분이면 OK",주식회사  웰큐,2082%,"20,828,000원","1,000,000원",114,169,"큰맘 먹고 떠난 캠핑인데 세팅하다가 하루가 가진 않나요?
당신이 쉼에 집중할 수 있도록 가스버너와 테이블, 바비큐그릴을 하나에 담았습니다
신개념 #원모션캠핑테이블#루핀",2020.10.30-2020.11.09,None
41,여행·레저,[지금이니까 만날수 있는 가격] 추석에 푸꾸옥으로 떠나자! 항공권 펀딩,(주)인터파크,14%,"5,586,000원","39,900,000원",16,25,"""100명만 모이면 뜬다"" 포스트 코로나 시대를 여행하는 새로운 여행법-내가 직접 유치하는 항공기 펀딩, 얼리버드&추석 황금연휴 출발",2021.03.24-2021.04.05,펀딩성공
42,여행·레저,가족과 함께하는 즐거운 낚시여행 만들기 - 반디불이,트레스테크(주),265%,"13,285,000원","5,000,000원",130,64,"이젠 낚시도  ""IoT 시대"" ... 전자케미,어신기를 하나로 

    서울산업진흥원 파트너와 함께합니다.",2017.08.17-2017.09.18,None
43,여행·레저,분실방지 스마트 패션 악세사리 - 루퍼 태슬(Looper Tassel),IDIO Creative Works,403%,"12,099,000원","3,000,000원",275,137,"루퍼는 당신의 소중한 시간과 물건을 지킬 수 있도록 도와주는 스마트 패션 악세서리입니다. 스마트폰과 연동되며 이탈리아산 최고급 가죽, 쥬얼리 세공, 핸드메이드를 통해 제작 됩니다.",2016.11.22-2017.01.08,None
44,여행·레저,미니멀한 캠핑을 위한 컴팩트라이트 체어&테이블,진스포츠,228%,"6,855,000원","3,000,000원",59,94,캠핑족을 위한 미니멀 아이템! 컴팩트 경량 체어와 테이블로 캠핑의 즐거움을 더욱 느껴보세요!,2020.09.23-2020.10.05,None
45,여행·레저,여행기억상자: 보르네오 반딧불 에디션,권윤정,7%,"221,000원","3,000,000원",15,4,"여행에 카메라만 챙기시나요? 여행을 기억하고 감상을 기록할 수 있는, 노트와 펜, 엽서, 배기지 스티커가 담긴 '여행기억상자'를 만나보세요. 보르네오 섬 산림보호를 위한 베이비나무심기에도 동참하는 착한 프로젝트.",2016.01.25-2016.02.26,펀딩성공
46,여행·레저,[추석여행]    필리핀 보홀직항_힐링여행_떠나보세요  ,주식회사 넘버원투어,199%,"1,998,000원","1,000,000원",12,25,"필리핀의 숨겨진 지상낙원,   자연 그대로의 섬 보홀로의  여행 어떠신가요?   많이 기다려온 여행인 만큼 잘 준비해서 떠나봐요!",2021.03.24-2021.04.26,None
47,여행·레저,카니멀라이프.우드 테이블 : 내 차 안에서 즐기는 우리만의 홈카페,토요요(TOYOYO),778%,"7,785,500원","1,000,000원",153,294,"아슬아슬 흘러내릴까, 어디에 둬야 할지 갈 곳 잃은 손이 불편했던 적 있나요? 새로운 솔루션으로 공간의 편리함과 홈 카페 감성을 담은 카니멀라이프 우드 테이블을 경험해 보세요",2020.10.07-2020.11.03,None
48,여행·레저,"충전하는 셀카봉, 한국신제품 하이브리드 충전셀카봉 브라보!",(주)커뮤니케이션 소리,178%,"5,369,500원","3,000,000원",127,47,"신개념 충전셀카봉 브라보!! 
입고 및 배송준비 완료.
2월부터 www.bravo1.co.kr에서 만나보실 수 있습니다.",2017.12.28-2018.01.28,None
49,여행·레저,[분실 걱정 끝]스마트 분실방지 여권 케이스로 즐거운 여행 되세요~,헤이통주식회사,434%,"4,348,200원","1,000,000원",53,77,"멋진 여행을 위한 출발~ 도난 이나 분실 걱정 해보시지는 않으셨나요? 
이제 걱정 하지 마세요, 분실 방지 스마트 여권 케이스와 네임텍이 지켜 드릴게요

    서울산업진흥원 파트너와 함께합니다.",2018.09.18-2018.10.22,None
50,여행·레저,"[평점5.0 앵콜] 5분만에 설치하는 차박텐트, 캠핑 이렇게 쉽다구요?",(주)컨머스,22653%,"226,535,000원","1,000,000원","1,179",1429,"감성차박캠핑, 어렵지 않아요, 5분만에 완성하는 우리만의 차박여행",2021.02.24-2021.03.22,None
51,여행·레저,[최초 항공권펀딩] 베트남 달랏 항공권+호텔3박이 40만원대?!,(주)트래블비드,4540%,"43,590,000원","960,000원",57,133,"왜 항상 전세기 좌석은 임박해서 특가로 팔아야 하나?
임박특가 부럽지 않은 진짜 특가로 ""인생샷 여행지"" 베트남 달랏 대한항공 전세기 [얼리버드 프로젝트]를 진행합니다",2019.05.22-2019.05.29,None
52,여행·레저,[슬로라잎 프로젝트] 당신을 위한 숲속 슬로스테이 @제주,더슬로우 프로젝트 그룹,187%,"2,180,000원","1,160,000원",23,46,"제주 송당마을에서의 숲속 슬로라잎 프로젝트. 온전한 쉼이 필요한 당신을 위해 마련한 2박 3일 슬로스테이(slow-stay) 프로그램입니다. 나를 위한 특별한 슬로라이프한 시간.
    Jeju with Wadiz 파트너와 함께합니다.",2019.08.14-2019.08.28,None
53,여행·레저,키덜트/캐릭터 상품 직수입 해외교육 [키덜트산업 창업 멘토링],하이큐빅,64%,"3,200,000원","5,000,000원",2,10,"각광받는 [키덜트, 캐릭터상품] 시장, 직수입 기술과 아이템이 만나 최고의 창업을 하다. [키덜트, 캐릭터상품 창업 멘토링]",2017.08.31-2017.10.10,펀딩성공
54,여행·레저,비즈니스 여행을 가는 당신을 위한 정장가방,투팩(TWOPACK),1336%,"6,682,000원","500,000원",119,159,소중한 옷은 구김없이 담아야 합니다. 여행 그리고 비즈니스의 품격을 높여주는 정장가방,2019.12.13-2019.12.29,None
55,여행·레저,자동차 빈 공간을 슬기롭게 활용하게 해 줄 뒷좌석 정리함,토이조이,1242%,"12,422,000원","1,000,000원",186,123,"집, 회사 다음으로 많은 시간을 보내는 자동차
항상 빈 공간으로 남아 있는 자동차 뒷좌석
자동차의 빈 공간을 활용해 짐을 수납할 수 있도록 한 뒷좌석 정리함을 소개합니다",2020.10.26-2020.11.16,None
56,여행·레저,[이런지도는없다] 여행콘텐츠 전문 팀이 만든 세계여행지도,(주)타블라라사,1631%,"16,317,300원","1,000,000원",552,359,"'여행'이라는 주제로 만들어진 국내유일의 세계여행지도. 190여개 국가의 역사 수록, 유럽/동남아/일본 확대지도, 왜곡을 최소화한 다이맥션맵 그리고 예쁜 포스터 지도 제공합니다.",2018.12.12-2019.01.16,None
57,여행·레저,[앵콜] 정수기 텀블러! 여행 갈 때도 정수기 갖고가세요!,PHILOS,151%,"757,000원","500,000원",35,40,"여름 휴가 시즌, 안전한 물로 여행길 동반자가 되겠습니다.",2019.07.03-2019.07.15,None
58,여행·레저,[전용차량+자유여행] 당신이 꿈꿔온 스페인 안달루시아,(주)하나투어리스트,822%,"8,140,000원","990,000원",11,80,전용차량으로 편리하게! 인솔자 동행으로 안전하게! 자유시간은 충분하게! 스페인의 핵심 : 마드리드+안달루시아+바르셀로나를 알차고 편하게 여행할 수 있도록 구성했습니다.,2019.09.15-2019.09.22,None
59,여행·레저,세상에 없던 트랜스포머 스토브! 티루드 랜드마크!,우드앤번,1305%,"65,252,800원","5,000,000원",265,246,"세계최초! 가변형 사이즈의 우드가스 스토브!
인원에 따라, 상황에 따라, 필요한 화력에 따라
자유로운 조합시스템으로 마음대로 구성하고 아름다운 2차연소 불꽃을 즐기세요!",2019.09.20-2019.09.29,None
60,여행·레저,처음엔 돈주고 왜 지도를 펀딩해야해? 생각했어요-블랙 에이든전국지도 출시,(주)타블라라사,885%,"8,859,195원","1,000,000원",459,327,모던 인테리어에 어울리는 '모노톤(블랙/그레이) 에이든 전국여행지도' 출시.  역사예능 방송에 소개되었던 한국관광공사 선정 관광벤처기업이 만드는 지도,2021.01.14-2021.02.15,None
61,여행·레저,뉴홀더 -경차부터~SUV까지 탈부착이 되는 차량용 타프,윤빛산업,11%,"350,000원","3,000,000원",5,41,"경차부터 ~ SUV차량까지 사용간편하게 탈부착이 가능한 
뉴 홀더
가족,연인,친구들과 차량캠핑을 떠날수 있는 필수 아이템",2019.05.31-2019.06.30,펀딩성공
62,여행·레저,[3782%앵콜]감성충만 미니멀 캠핑을 위한 월넛 롤테이블과 버너테이블.,컬(curl),1601%,"16,012,250원","1,000,000원",57,161,"이제는 미니멀 캠핑 시대! 이것저것 싸들고 다니는 캠핑은 이제 그만!
최소한의 부피를 위한 롤테이블과 버너테이블로 미니멀 하게, 그리고 감성 돋게 캠핑을 즐기세요.",2020.10.18-2020.10.26,None
63,여행·레저,국내최초 차량배터리 방전예방 수명연장을 위한 배터리커버 비가드백 출시 ,제품명 비가드백   회사명 마루백 ,4%,"90,000원","2,000,000원",7,15,저희업체는 차량용 배터리 보냉 보온커버 국내최초 실용신안을 받아 전년도 1톤차량을 시작으로 2018년 3월 국내 전승용차 를 출시 하였습니다 방전예방 수명연장 특징입니다,2018.06.12-2018.07.15,펀딩성공
64,여행·레저,네모난 캠핑상판은 이제 그만! 컵홀더 원형상판으로 캠핑을 디자인하다.,(주)공간백터,2%,"62,600원","3,000,000원",52,28,"짐정리와 감성있는 테이블 상판이 한번에!!
편하면서 디자인적인 요소를 한번에 충족하는 밀크박스 폴딩테이블 상판으로
미니멀하게 캠핑과 피크닉을 다녀오세요!",2021.03.20-2021.03.26,펀딩성공
65,여행·레저,나인트리 프리미어 호텔 서울 판교 [6월 12일 신개념 개관 펀딩],파르나스호텔 주식회사,640%,"64,028,000원","9,990,000원",425,196,"신생 호텔 그랜드 오픈에 맞춘 신개념 크라우드 펀딩,
나인트리 프리미어 호텔 서울 판교에서 추억과 나눔을 함께하는 가치,
와디즈 서포터분들만을 위한 특별한 객실 펀딩",2021.04.15-2021.04.30,None
66,여행·레저,"손쉬운 조립, 견고한 다리, 나사못을 전혀 사용하지 않은 조립식 테이블",스페이스백터,22%,"330,000원","1,500,000원",13,29,"감성뿜뿜!! 이쁘고 견고한 나만의 테이블과 여행을 떠나요~
누구나 가지고 있고 쉽게 고장나는  롤테이블은 이제 그만!!
조립과정에서 나사못을 전혀 사용하지 않아 오래쓰고 튼튼합니다",2021.04.14-2021.04.28,None
