,categories,title,company_names,percentages,funding_amounts,target_amounts,n_supporters,likes,descriptions,durations,days_left
269,여행·레저,[5억펀딩] 이게 도난방지 가방이다! 퍼펙트 가드 블랙원 에디션,컨스파라,8763%,"87,633,000원","1,000,000원","1,337",1553,"이제 여행의 필수품이 된 퍼펙트 가드 블랙원 에디션입니다.
서포터분들의 안전하고 즐거운 여행을 책임지겠습니다.",2020.01.26-2020.03.01,None
270,여행·레저,"지구를 위한 캠페인, 티크보틀 ",티 크리에이티브 Tea Creative ,64%,"449,000원","700,000원",38,32,"보틀 사용으로 일회용품, 플라스틱 사용 줄이기에 참여해주세요!",2018.05.15-2018.06.06,펀딩성공
271,여행·레저,"[특별구성]국내여행지도 3종세트, 가이드북을 담은 에이든 여행지도",타블라라사,2315%,"23,151,400원","1,000,000원","1,016",461,"주말마다 어디 가야 할지 고민되시죠? 미리 다 가보고 조사해서 지도 위에 가득 올려두었어요. 그랬더니 지도 한 장에 가이드북 100페이지 분량이 되더라고요.
    여행/레져 기획전 파트너와 함께합니다.",2018.06.28-2018.07.30,None
272,여행·레저,[앵콜 피크닉파트너스] 해먹이 있는 면텐트 힌트 오리진 아시메트리,피크닉파트너스,1115%,"33,450,000원","3,000,000원",147,170,"[해먹이 있는 5-6인용 면텐트] 내하중 120kg 견고함, 비대칭 설계로 실현된 공간감, 초발수 면소재와 특수 심실링 기술의 탁월함, 캠핑의 완성: 힌트 오리진 아시메트리",2019.06.26-2019.07.21,None
273,여행·레저,[여행자의 배낭 킬리] 보헤미안 Forest,킬리아웃피터스,2375%,"118,782,000원","5,000,000원",663,480,"아름다운 자연 환경을 지키기위해 노력하고 있습니다.
킬리에서 최고의 혜택으로 준비한 특별한 프로젝트를 소개합니다.",2019.05.30-2019.06.20,None
274,여행·레저,"<글로벌15억펀딩> 옷장을 통째로 삼킨 괴물캐리어, 짐싸기는 이제 5초컷",주식회사 지스트,2417%,"24,174,000원","1,000,000원",148,317,<🎊글로벌 15펀딩> 짐싸기 5초컷 가능! 옷장을 통째로 삼킨 괴물 캐리어가 한국에 상륙했습니다. 이제 짐은 싸는게 아니라 통째로 한방에 옮겨버리는겁니다. (300대 한정이예요),2020.08.09-2020.08.31,None
275,여행·레저,"적당한 크기의 완벽한 수납, 내외부 방수 스포츠 트래블백 Quiver",(주)한스브릿지,25%,"3,257,500원","13,000,000원",57,104,"스타일리쉬하고 세련된 다기능성 스포티한 힙색 가방 Quiver, 가벼움과 내구성은 기본! 부족했던 공간을 확장해 신발, 세면 용품, 텀블러 등 필수품들을 보관할 수 있습니다.",2019.07.29-2019.08.26,펀딩성공
276,여행·레저,나만의 여행용 다이어리 #TIME #TRAVEL #DIARY ,스윗아이디어스,96%,"965,823원","1,000,000원",55,71,집앞을 나서도 마음이 흔들리면 여행이다. 여행을 떠날 때 함께 하는 다이어리,2019.02.01-2019.02.24,펀딩성공
277,여행·레저,"[3차 펀딩] 여행갈 때 입는 옷, 몬순자켓 & 고고팬츠 2세대",롯지 (김주원),2558%,"127,936,000원","5,000,000원",917,403,"여행갈때 여러분은 어떤 옷을 입으세요? 배낭여행, 휴양지, 캠핑.. 어디서든 몬순자켓 & 고고팬츠",2018.02.28-2018.03.14,None
278,여행·레저,올여름엔 ‘노브라 티셔츠’로 몸도 가방도 가볍게 떠나세요.,프리플,1053%,"10,533,000원","1,000,000원",214,256,"올여름 인생 여행을 계획하셨나요? 몸도 가방도 가볍게 떠나세요. 브래지어 3장만 빼도 가방이 가벼워집니다. ‘노브라 티셔츠’ 3장과 청바지만으로도 감각있는 여행지 패션이 완성됩니다
    여행/레져 기획전 파트너와 함께합니다.",2018.06.26-2018.07.13,None
279,여행·레저,완벽한 여행을 꿈꾸시나요? 완벽한 스마트 캐리어와 함께 하세요 ,FESSONIA & TMTR,932%,"46,623,000원","5,000,000원",472,462,"스마트한 캐리어의 탄생!
베터리의 충전이 자유로운 Smart Charge Module과 
충격흡수 Shock Absorber Module 탑재로 처음 세상에 탄생 하려 합니다.
    여행/레져 기획전 파트너와 함께합니다.",2018.04.09-2018.05.13,None
280,여행·레저,"[캠핑 이제 대여다] 캠린이를 위한 여름휴가솔루션, 포항가서 캠프닉하자!",영일상점,216%,"1,080,000원","500,000원",19,15,[코로나 걱정 없는 여름휴가 계획하기] 캠핑용품 사도 1년에 한 번 캠핑 갈까 말까.. 합리적인 가격에 대여로 즐길 수 있다면?  포항 바다에서 즐기는 캠핑+피크닉 감성 캠프닉!,2021.03.24-2021.03.31,None
281,여행·레저,캐리어를 품은 보스턴백,Grafito,153%,"3,066,000원","2,000,000원",35,49,"자동차를 이용하는 여행이나 출장시 가볍게 지닐만한 가방을 고민했습니다. 기내반입이 가능하며, 튼튼하게 제작되어 10년은 끄떡없을 가방을 소개합니다.",2019.01.04-2019.01.14,None
282,여행·레저,"부모님,어린이가 좋아하는 선물 그 유명한 에이든 전국여행지도 MINT",주식회사 타블라라사,348%,"3,487,700원","1,000,000원",249,138,"기존 에이든 전국여행지도에서 '상세한 설명을 빼고 폰트를 키운' 민트버전, 어버이날 부모님과 어린이날 아이들에게 선물 해보세요! 만족도 99%를 보장합니다.!!",2020.04.23-2020.05.04,None
283,여행·레저,2만원으로 물티슈를 멋스럽게 변신시키자 ! 물티슈파우치의 등장!! ,스페이스길 SPACEGIIL,1141%,"5,709,000원","500,000원",180,53,"물티슈를 멋스럽게 변신시키자! 물티슈파우치의 등장!!
시작은 이러했다, 캠핑을 다녀와서 사진을 정리하다보니 형형색색의 저건 뭐지?. . .쓸 때는 편했는데 사진 다 망쳐놓는 물티슈",2021.03.16-2021.03.22,None
284,여행·레저,[휴가철 필수템] 숙박업소의 찝찝한 베개는 이제 그만! 여행용 베개시트,휴고링,153%,"1,534,500원","1,000,000원",65,57,"우리가 깨끗하다고 믿고있던 호텔,모텔,기타 숙박업소의 베개.
하지만 실상은 그렇지 않다고 합니다.
그렇다면 계속 수건을 깔고 자야하는걸까요?
그럴 필요 없이 챙기세요! 잘때, 한장",2020.07.01-2020.07.08,None
285,여행·레저,"캠핑용품이 아닌 원목가구 ★ 분해 조립식 ""감성 캠핑퍼니쳐""",비갠후 우드워크,29%,"299,000원","1,000,000원",21,68,분해 조립식으로 부피 부담이 적은 원목가구 같은 캠핑퍼니쳐.,2019.04.30-2019.05.15,펀딩성공
286,여행·레저,"전 세계 독도 알리러 떠나자, '한반도 여권케이스'",골든피스원™,784%,"7,841,000원","1,000,000원",213,211,"<평창에서 평화까지> ‘독도’ 전 세계에 알리러 Go~~ 평화시대 ‘유라시아’를 달려 서울에서 평양, 파리까지 Go~Go!!
    여행/레져 기획전 파트너와 함께합니다.",2018.05.17-2018.06.25,None
287,여행·레저,오싹한 사건의 공간에서 직접 경험하는 기묘한 이야기 <서울기담>,(주)헤리티지프로젝트,452%,"2,260,000원","500,000원",62,47,"서울의 오싹한 진짜 이야기와 도시괴담이 숨어있는 장소를 찾아가 스토리텔러와 함께 이야기를 발굴하고 미션을 수행하는 현장 기담체험으로, 처음 소개되는 한국형 고스트투어입니다!",2019.08.30-2019.09.15,None
288,여행·레저,"[앵콜] 전 세계 독도 알리러 떠나자, '한반도 여권케이스'",골든피스원™,411%,"4,117,100원","1,000,000원",115,88,"우리나라 해외 여행객 수 3000만명 시대, 여행시 우리 모두는 국가대표입니다. 여권케이스에 담긴 한반도기를 보여주면서 현지인들에게 '독도'를 설명해 볼까요!!
    추석 기획전 파트너와 함께합니다.",2018.08.13-2018.09.03,None
289,여행·레저,"[under const.] 구김 ZERO, 출장용 옷가방",under const.,90%,"2,704,000원","3,000,000원",39,64,"구김 ZERO! 옷은 이제 옷을 위한 가방에 담자!
필요에 따라 확장 가능한 여행용 옷가방 ""under const. 가먼트롤백""",2018.03.26-2018.04.27,펀딩성공
290,여행·레저,1초만에 불이? 간편하고 빠르게 붙는 1초점화캠핑통!!,한국세라프,594%,"2,972,600원","500,000원",146,107,"1초에 뜯어 1초에 점화하여 10분안에 드시고 
즐거운 캠핑을 할수 있는 1초점화캠핑통",2020.07.17-2020.07.27,None
291,여행·레저,"'우리나라 역사지도' 런칭, 역사를 잊은 민족에게 미래는 없다",주식회사 타블라라사,4093%,"40,931,750원","1,000,000원","1,235",437,91*61cm의 포스터 종이에 고조선 이후의 깨알같은 우리나라 역사이야기를 담고 있는 '우리나라 역사지도'를 런칭했습니다.  누구나 하나 쯤 갖고 싶은 마음이 들도록 만들었습니다.,2020.06.29-2020.07.22,None
292,여행·레저,"[최초 런칭] 캠핑의 꽃, 바비큐! 남들과 다르게! 더 빠르고 맛있게!",한쉐프 (Han Chef) ,64%,"642,000원","1,000,000원",18,39,"아직도 번거로운 화덕과 그릴, 숯불연기로 새까매진 바비큐를?
이제는 한국식품과학연구원에서 6개월마다 식품으로 검증한 대나무 숯불맛으로 잡내가 없고 빛깔도 좋은 바비큐를 즐겨보세요!",2019.08.23-2019.09.29,펀딩성공
293,여행·레저,디즈니가 선사하는 즐거움 이제 여행에서도 느껴보세요!ㅣ디즈니 캐리어,주식회사 휠팩,141%,"1,412,000원","1,000,000원",19,42,디즈니가 선사하는 즐거움을 이제 여행에서도 느껴보세요! 매력적인 비주얼과 풍성한 혜택을 담았습니다. 모든이에게 여행의 행복을 선사하는 기본기 탄탄한 디즈니 캐리어를 공개합니다.,2020.03.02-2020.03.22,None
294,여행·레저,무엇으로도 터치가능한 핸드폰 케이스,(주)에프티씨,19%,"588,000원","3,000,000원",17,29,장갑을 착용하고도 스마트폰을 사용할수있으면 얼마나 편할까요? 물속에서도 본인의 폰으로 사진을 찍어 인스타그램에 올린다면??? 이제 임팩트터치 케이스라면 그모든것이 가능합니다.,2018.08.17-2018.09.15,펀딩성공
295,여행·레저,우리땅독도를 품은 이태리가죽 해킹방지여권케이스와 머니클립,주식회사큐블코퍼레이션,82%,"821,000원","1,000,000원",15,15,"최고의 명품 이태리가죽으로 만들고 표지에 ""우리땅독도""를 담았습니다.아름다운 4개의 테마로 만나는 안티스키밍 여권케이스,머니클립! 소중한 나를 위한 와디즈에디션!  

    여행/레져 기획전 파트너와 함께합니다.",2018.05.24-2018.06.11,펀딩성공
296,여행·레저,[내셔널지오그래픽] 2021 더 오리지널 캐빈 하우스,(주)더네이쳐홀딩스,25166%,"755,005,750원","3,000,000원",647,862,텐트도 이젠 뉴트로 시대! 60-70년대 빈티지 스타일에 현대적 디자인을 더하여 새롭게 탄생한 '2021 더 오리지널 캐빈 하우스'를 지금 만나보세요!,2021.03.26-2021.04.26,None
297,여행·레저,[앵콜! 평점5] 내셔널지오그래픽 뉴트로 감성 장착한 텐트 캐빈하우스,(주)더네이쳐홀딩스,22402%,"672,060,500원","3,000,000원",735,1050,[평점5점/앵콜] 텐트도 이젠 뉴트로시대! 60-70년대 빈티지 스타일에 현대적 디자인을 더하여 새롭게 탄생한 '더 오리지널 캐빈하우스'를 지금 만나보세요!,2020.05.27-2020.06.15,None
298,여행·레저,"[라이더스백] 힙색, 자전거와 만나다!",라스트크래프트바겐,204%,"6,123,000원","3,000,000원",147,113,"자전거 라이딩 그리고 여행에 보다 집중할 수 있도록 고민하여 디자인하였습니다. 자전거와 함께 하는 일상과 여행에 편리함을 담은 가방 
라이더스 백 지금 확인하시죠!",2017.04.12-2017.05.13,None
299,여행·레저,대박!이런 여행 해봤니? 당일치기 수제 전통주 만들고&시골집밥 힐링 여행,푸디온투어,2374%,"11,872,200원","500,000원",91,107,집밥체험서비스 푸디온♥  강원도 홍천에서 전통주 만들기와 시골 밥상을 통해 새로운 경험을 선물해 드릴게요 ^^ 함께 가실래요?,2019.09.23-2019.10.06,None
300,여행·레저,"""독도야 간밤에 잘 잤느냐?"" <한반도 여권케이스> #로즈골드에디션",골든피스원®,952%,"4,764,000원","500,000원",135,313,"2018 평창 동계올림픽때 지워진 '독도'를 보고!! 전 세계에 '독도'를 알리고자 시작한, 독도 알리미 프로젝트 <한반도 여권케이스>가 로즈골드 에디션으로 다시 찾아왔습니다.",2020.03.31-2020.05.18,None
301,여행·레저,"[2차앵콜/아코디언 트래블 파우치] 여행 짐 정리, 2초 만 뚝딱 백팩용",베드메이트유,1416%,"14,165,800원","1,000,000원",400,376,[2차앵콜/아코디언 트래블 파우치] 시즌2 백팩용 추가! 신경 쓰이는 여행짐 정리? 이거 하나로 쉽고 빠르게 해결!,2020.06.09-2020.06.22,None
302,여행·레저,"따뜻해진 날씨, 여러분의 야외활동을 더 재미있게! [프릿원반]과 함께해요",FREEIT 프릿,410%,"2,051,000원","500,000원",86,50,"어디서든 신나게 즐길 수 있는 원반던지기! 
재미는 물론 스트레스해소와 운동효과까지!
남녀노소 모두가 함께 즐길 수 있는 취미활동!
친구 연인 가족과 함께 던져보세요!",2019.05.08-2019.06.02,None
303,여행·레저,[엠비치오넴] 단기 여행용 캐리어백팩 'Iter 이테르',엠비치오넴,1142%,"34,260,000원","3,000,000원",235,152,"캐리어의 수납공간과 백팩의 휴대성을 단번에, ""이테르 백팩""",2018.02.06-2018.02.19,None
304,여행·레저,[앵콜]평점 4.9 인생 첫 화목난로 마이스토브!,우드앤번,3422%,"102,663,000원","3,000,000원",207,218,[앵콜] 감성과 기술의 하모니. 2차 연소의 강력한 화력과 컴팩트한 사이즈와 수납! 캠린이도 손쉽게 사용하며 4계절 모두 함께 할 수 있는 올라운더 화목난로. 우드앤번 마이스토브!,2021.03.16-2021.03.23,None
305,여행·레저,[한정수량425개]레투 100% 알루미늄 캐리어 9만원대 가격 실화?!,레투코리아,2129%,"21,298,000원","1,000,000원",192,234,캐리어 맛집 레투에서! 100% 풀바디 알루미늄 캐리어를 줍줍하세요!,2020.08.14-2020.09.11,None
306,여행·레저,가볍기만 하다고? 디자인과 실용성을 모두 갖춘 포터블 백팩,어나더에이,182%,"1,826,100원","1,000,000원",46,81,"가볍기만한 경랑가방? 디자인과 실용성을 모두 갖췄다!

여행 시, 캠핑 시, 가벼운 아웃도어용으로는 물론 데일리로 

착용 가능한 포터블 팩백을 소개합니다!",2020.08.31-2020.09.23,None
307,여행·레저,"[대한항공직항] 판타지 세계로 풍덩, 환상의 뉴질랜드 7박9일",(주)하나투어,37%,"3,000,000원","8,000,000원",9,28,"<반지의 제왕>과 <호빗>의 무대 속에서 즐기는 압도적인 자연!
대한항공 직항으로 편하게, 영화테마로 흥미진진하게 즐기는
뉴질랜드 남섬북섬 7박 9일 여행, 지금 떠나요!",2019.10.22-2019.10.29,펀딩성공
308,여행·레저,"앵콜> 착한호텔 숙박권, 코트야드 메리어트 서울 남대문 클럽라운지 패키지",(주)감동여행디자인,2652%,"26,524,000원","1,000,000원",182,161,"#착한_호텔의 첫번째 프로젝트 ""코트야드 메리어트 서울 남대문""를 1차 앵콜을 준비했습니다. 당신의 완벽한 하루에 펀딩하고 재충전과 착한 기부를 실현하세요",2021.04.12-2021.04.19,None
309,여행·레저,"[6억 앵콜] 여행갈 때 입는 옷, 고고팬츠 2세대",롯지 (LODGE),1228%,"61,434,000원","5,000,000원",560,409,"여행자의 옷, 고고팬츠 2세대가 새로운 컬러로 돌아왔습니다!",2020.03.23-2020.04.06,None
310,여행·레저,[다울팩토리] 하늘담은 캠핑거울,주식회사 다울,15%,"159,400원","1,000,000원",22,22,국내 캠핑인구 600만이 넘는 시대. 아웃도어 생활중에도 예쁨은 포기하지 않도록 우드캠핑거울을 소개합니다. 360도 도는 스트랩이 포인트! 생활방수와 편안한 우드 디자인 거울,2019.09.16-2019.10.16,펀딩성공
311,여행·레저,1초점화 100분연소!! 특별한 캠핑을위한 아빠장작 락큰롱 퐈이야,버닝 코리아,276%,"2,766,700원","1,000,000원",88,69,"덥고 짜증나는 불 피우기 완벽 탈출!
1초만에 발화하고 100분동안 바비큐가 가능한 캠핑용 숯
락큰롱 퐈이야",2020.06.25-2020.07.09,None
312,여행·레저,"[앵콜] 여행필수품 ""트래블백 버디"" 간편, 안전, 안심 신박템!",Wimi Corporation,1266%,"6,330,600원","500,000원",146,180,"⭐️앵콜⭐️여행필수품 ""트래블백 버디"" 와디즈 단독 펀딩! 신속 간편 안전 안심. 아이디어 신박템!",2019.10.17-2019.11.18,None
313,여행·레저,일상을 위한 가방 AROUND:P 함푸백,Aboutblank,53%,"1,612,000원","3,000,000원",17,33,"일본산 쿠라시키 함푸 원단으로! 독일의 세라필 실로! 대한민국 40년 가방장인이 만든 튼튼하고 가벼운 방수 기능의  미니, 툴, 피크닉백 가족!
    여행/레져 기획전 파트너와 함께합니다.",2018.05.23-2018.06.15,펀딩성공
314,여행·레저,짐정리 끝판왕! 수납형 캐리어 Bag In Bag '행백',아름다운컴퍼니,1929%,"19,294,900원","1,000,000원",504,463,"여행지에서 나만의 수납장!

미리 정리해서 짐을 넣고, 펼치기만 하면 수납장처럼 사용할 수 있는 신개념 캐리어  Bag-In-Bag  【Hang Bag(행백)】",2019.07.17-2019.08.11,None
315,여행·레저,[스노쿨링 마스크]홀로그램 UV차단 유아&성인 물놀이 필수템 !! ,펠리즈몽,256%,"7,697,200원","3,000,000원",199,144,국내 유아 스노쿨링 중에 유일하게 UV 차단 기능의 홀로그램까지 입혀져 있는 제품으로서 밴딩 타입에서 간편한 버클 타입으로 변경 된 신제품을 출시 전에 펀딩하실 수 있습니다.,2020.07.06-2020.07.12,None
316,여행·레저,"[앵콜펀딩] 단 1초만에 구명튜브로 변신! 수상레저의 수호신, 에스튜브!",네프,1005%,"10,055,000원","1,000,000원",98,145,"구명조끼의 성능은 인정합니다. 단 부유성능만요. 평소에는 활동성을 저해하지 않는 스타일리시한 스포츠벨트, 위급 상황에는 1초 만에 구명튜브로 변신하는 수상레저의 수호신, 에스튜브!",2021.03.26-2021.04.26,None
317,여행·레저,이 제품 실화냐? 모기쫓는#특수원단  PK버그가드,프라이스코리아,1240%,"24,807,600원","2,000,000원",665,402,"언제 어디서나 가볍게 걸쳐주고 덮어주는것만으로  모기,진드기등 각종 해충 걱정 끝~~
무색, 무취로 누구나 사용가능한 탁월한제품입니다^^

    여행/레져 기획전 파트너와 함께합니다.",2018.04.20-2018.04.30,None
318,여행·레저,물이 있는 곳이라면 꼭 챙기세요. 단 1초만에 구명튜브로! 에스튜브,네프,899%,"8,993,000원","1,000,000원",60,113,"구명조끼의 성능은 인정합니다. 단, 부유 성능만요. 이제 에스튜브로 바꾸세요! 평소에는 멋진 스포츠 벨트, 위급상황 시 단 1초만에 구명튜브로 변신하는 수상레저의 수호신, 에스튜브",2020.11.20-2020.11.30,None
319,여행·레저,해충 없는 우리집 가드미 LED 랜턴,가드미,211%,"1,057,500원","500,000원",57,43,해충 없는 우리집 가드미 LED 랜턴,2018.11.21-2018.12.13,None
320,여행·레저,겨울이 따뜻해져요~!! 커플캔들만들기(와인증정)&나홀로여행객(캔들) 체험,콩줌(kongzum),0%,0원,"1,000,000원",2,6,"연인들의 데이트 공간으로 ~
나홀로 여행객에겐 편안한 쉼의 공간으로~ 
겨울을 따뜻하게 해줄 캔들체험과 지역와인상품 증정!!",2018.11.09-2018.12.02,펀딩성공
321,여행·레저,[5만원대] 쿨러백이 내장된 피크닉 가방 ,팬프 ,9%,"299,000원","3,000,000원",8,21,"나들이 갈때 이것저것 아이들 물건을 챙기다보면, 너무 많은 가방들이 필요하죠. 하나의 가방으로 간편하게 나들이를 제안합니다. 쿨러백이 들어있어 활용도가 높은 피크닉가방",2020.09.10-2020.10.05,펀딩성공
322,여행·레저,[DMZ마을로 떠나요]여행도 하고 영화도 만들고?! 일석이조!!,(주)마을영화100,250%,"2,500,000원","1,000,000원",9,10,"[금강산에서 24km]  우리가족 영화만들기 여행
    연구개발특구진흥재단 파트너와 함께합니다.",2021.04.22-2021.05.14,None
323,여행·레저,"여행캐리어 가방, 이젠 쉽고 편하게 다니세요! 2탄 ""캐리어메이트""",힐랩,5%,"177,500원","3,000,000원",11,12,"몸이 편해야 여행도 즐겁습니다. ""무거운짐"" 여행캐리어가방을 쉽고 편하게 다닐수 있는 여행가방 보조손잡이 ""캐리어메이트"" 입니다.",2019.05.13-2019.05.27,16일 남음
324,여행·레저,"""잘 자자!"" 수면 이야기, 싱잉볼과 함께하는 꿀잠 프로그램",낮잠 naZzzam,40%,"325,000원","800,000원",21,5,"""나는 잘 자고 있을까?"" ""왜 잠을 못 자는걸까?""
 나의 수면 건강을 체크해보고 건강한 수면 관리를 통해 원하는 목표를 얻을 수 있는 방법을 제안합니다.",2019.05.10-2019.05.27,16일 남음
325,여행·레저,"CS 웨어러블 하네스와 핸디포켓 ! 여행을 편리하게, 두 손을 자유롭게 ",캐링솔루션,509%,"5,097,500원","1,000,000원",93,73,CS 웨어러블 세트를 새로운 컨셉의 여행.레저 필수품으로 개발하게 되었고 국내 및 해외 시장 유통 전에  시장 테스트 목적으로 와디즈를 통해 소개하게 되었습니다.,2019.11.11-2019.11.24,None
326,여행·레저,"미래의 '나'이자, '부모님'을 위해 선물하는 치유여행, 슬로우리 군산 ",화접도,210%,"2,100,000원","1,000,000원",18,27,"지역재생 프로젝트 '슬로우리,군산'을 통해 시니어를 대상으로 한 치유여행을 선보입니다. 군산의 지역자원 중 '슬로라이프'를 발굴하여 연계하고, 여행자와 지역을 치유합니다.",2019.08.02-2019.08.22,None
327,여행·레저,"옷은 저희가 준비할게요, 여러분은 여행을 계획하세요[유틸리티셋업]",비아지아(viaggia),9%,"456,000원","5,000,000원",6,17,"여름휴가, 여행시 가볍게 입기좋은 다양한 기능의 유틸리티 셋업을 소개합니다.",2019.05.24-2019.06.16,펀딩성공
328,여행·레저,"황사,미세먼지 공포로부터 피부를 지켜주는 클린벤저스~!!!",조래호(나이언뷰티),122%,"3,660,500원","3,000,000원",50,37,"피부를 지치고 병들게 하는 황사, 미세먼지, 두꺼운 화장까지~손이 닿지 않는 모공 깊은 곳까지 청소해주는 세안 습관의 혁신을 나이온 뷰티가 이루고자 합니다.",2018.05.04-2018.05.23,None
329,여행·레저,"[캠핑혁명템] 한번 더 혁신! 의자 하나로 쓰레기통, 화장실까지 해결",setoworks,471%,"4,715,200원","1,000,000원",65,113,"접이식 의자의 개념을 바꿔놓은 파타토가 3세대로 돌아왔습니다. 가볍고, 튼튼하고, 실용적이며 어디에 두어도 어울리는 파타토 3세대. 몇 장 준비해 놓으시면 후회 없으실거예요.",2020.11.19-2020.12.14,None
330,여행·레저,"여행의 가장 설레는 순간을 담다, ""트레비썸 여권케이스""",Travisome,805%,"4,025,500원","500,000원",76,62,"누구나 다른 목적을 가지고 여행을 떠나지만, 여행은 누구에게나 행복을 가져다 줍니다. 추억과 기대, 즐거움을 담을 수 있는 여권케이스, Travisome 입니다.",2019.03.06-2019.03.20,None
331,여행·레저,"금속공예가가 만든 럭셔리 캠핑 화로대 "" AGUNG """,스틸박스,249%,"9,988,000원","4,000,000원",47,148,"금속공예가가 불과 금속을 연구하고, 환상적인 2차연소 불꽃까지 디자인 _ 
작가가 직접 손으로 설계, 제작하여 탄생시킨 럭셔리 캠핑 화로대 "" AGUNG """,2019.12.10-2019.12.18,None
332,여행·레저,"(등산,트레킹) 하나, 둘, 3초에 피고 접고, 백팩에 들어가는 등산스틱",위즈,2755%,"27,552,700원","1,000,000원",243,141,"작고, 강하고, 편한 삼박자의 등산스틱은 왜 만들 수 없을까?
휘츠가 생각했습니다. 그리고 만들었습니다.
서포터분들의 많은 성원에 감사드리며, 다시 시작합니다!",2020.12.07-2020.12.16,None
333,여행·레저,3분컷 설치! 간편한 ONE POLE MINI TARP로 아웃도어 완성!,피에이씨코리아,1649%,"8,246,000원","500,000원",85,164,"즐거운 아웃도어 활동! 텐트, 대형 타프 설치로 지치지 않으셨나요?
약 1kg의 경량성과 3분 내 설치가능한 간편함까지! 
ONE POLE MINI TARP가 국내 첫 상륙합니다.",2020.10.15-2020.11.09,None
334,여행·레저,[어디서든 OK]모래가 슉슉 빠지는 신비로운 캠핑 아웃도어 매트&백팩,(주)숀아이비엔엘,4284%,"21,421,800원","500,000원",306,451,"모래가 아래로 빠지는 신비로운 매트 입니다
나혼자,가족들과,연인과,친구들과 좀 더 나은 환경을 즐기기 위해서는 
지금, CGear를 할 때 입니다.",2020.08.03-2020.08.24,None
