,categories,title,company_names,percentages,funding_amounts,days_left,n_supporters,likes,descriptions,durations,target_amounts
294,출판,"당신의 마음을 전달하는 방법, [따뜻한 책] 출판 프로젝트",김수미,100%,"2,011,000원",펀딩성공,77,0,"곧 다가오는 봄의 계절 5월, 가족, 친구, 연인에게 숨겨 왔던 마음을 전할 수 있는 [따듯한 책]을  선물해보는 것 어떠세요?",2015.04.14-2015.05.22,"2,000,000원"
295,출판,"동네서점들과 함께 만드는 진심의 선물, 도트윈 북마크",도트윈 스튜디오,100%,"3,022,000원",펀딩성공,128,8,작은 동네서점들을 좋아하는 당신에게 동네서점들의 진심이 담긴 가장 감성적인 책갈피를 선물하세요. 본 프로젝트의 수익금을 통해 시각장애인분들의 다양한 삶을 담은 출판물이 제작됩니다.,2016.01.04-2016.02.02,"3,000,000원"
296,출판,<도서 출판 프로젝트>평범한 대학생들이 특별한 청소년들에게 전하는 이야기,송기환,100%,"1,000,200원",펀딩성공,115,5,"높은 교육열, 입시 스트레스, 부모님과의 갈등 등 누구보다 힘든 시기를 겪어야만 하는 청소년들. 그런 청소년들을 위해 평범한 대학생들이 보내는 응원을 엮은 도서 출판 프로젝트!",2016.02.16-2016.03.20,"1,000,000원"
297,출판,[국내최초]세계를 위한 최고의 기업 비콥소개서  한국어판 출간,MYSC (주)엠와이소셜컴퍼니,100%,"2,500,000원",펀딩성공,83,12,더 많은 국내 기업들이 글로벌 사회혁신 기업인 비콥이 될 수 있도록 「 유니레버는 왜 비콥(B corp)이 되려 할까?: 세계를 위한 최고의 기업으로」한국어판을 출간합니다!,2016.07.26-2016.09.04,"2,500,000원"
298,출판,"이야기에 색을 입히다, 조금 특별한 컬러링북 <감>",Tengs (임성균),100%,"3,003,000원",펀딩성공,116,22,"거울을 비추어 나를 바라보듯, 이야기를 통해 우리를 바라보다.",2016.12.07-2016.12.31,"3,000,000원"
299,출판,중학생 취향저격 영어단어책 뮤 (예비중1~예비고1),스터디스타 혜라샘,100%,"3,009,000원",펀딩성공,70,29,중학생의 마음을 헤아려 시작한 영어단어책 《뮤》,2018.11.17-2018.12.31,"3,000,000원"
300,출판,한국을 대표하는 서정시인 정지상 시선,출판사 희망공장  ,100%,"1,132,000원",펀딩성공,38,4,우리나라를 대표하는 시인 누구를 알고 계십니까?,2019.03.01-2019.03.20,"1,122,000원"
301,출판,플레이북 : 선생님과 학생들이 함께 만드는 플래너,이중용,99%,"2,693,000원",,66,10,"플래너에 학생들과 선생님의 아이디어가 하나 둘씩 더해져 ‘매일 가지고 노는 플래너, 플레이북'이 탄생했습니다. ‘하루를 응원해주는 당신의 페이스메이커’ 플레이북을 소개합니다!",2015.10.02-2015.10.31,"2,700,000원"
302,출판,중국 시장을 이해하는 가장 빠른 방법 - 미디어 마케팅 편 리포트,원아시아,93%,"1,875,000원",,26,11,중국시장을 누구보다 제대로 알고 있는 원아시아가 중국 유명 매체 출신 전문 기자 및 현지 CEO들과 중국 미디어 마케팅 시장에 대한 보고서 발간 크라우드펀딩을 진행합니다.,2017.09.11-2017.09.25,"2,000,000원"
303,출판,심리상담사가 알려주는 반려견과 행복하게 사는 법 (PDF전자책),박주연 (박주연),93%,"469,720원",,47,24,심리상담 & 명상가의 ‘교감’ 노하우를 담았습니다.,2020.10.04-2020.11.24,"500,000원"
304,출판,"[1,000만 성도의 꿈]나만의 평생 예배스토리를 만들다, 생활예배노트",생활예배노트,91%,"916,500원",,17,25,대한민국 1000만 성도가 꿈꾸던 예배전용 노트가 출시되었습니다.,2019.12.26-2020.01.31,"1,000,000원"
305,출판,온라인 멘토링으로 나만의 경험과 노하우를 수익화 하는법,빠마씨ㅣ하정민 (하정민),90%,"451,050원",,18,19,"1일 2회 식후 30분, 나만의 멘토링 커리큘럼으로 멘토와 소통하고 부수입을 얻어가세요 :)",2020.11.16-2020.11.30,"500,000원"
306,출판,"전문가가 알려주는 머신러닝, 딥러닝 Computer Vision 마스터",주식회사 크리애플,89%,"891,000원",,11,37,"인공지능이 대세라는 것은 말할 필요가 없습니다. 전문가가 알려주는 머신러닝, 딥러닝 Computer Vision 마스터에 프로젝트와 강의에서 선별한 유용한 컨텐츠를 모았습니다.",2020.09.28-2020.11.20,"1,000,000원"
307,출판,일상창업 - 예비창업자 및 3년 미만 창업자를 위한 안내서,한완희 (한완희),87%,"439,500원",,75,30,"일상창업 - 예비창업자, 3년 미만 창업자의 외로움과 창업의 어려움을 일상창업 에세이를 통해 위로받고 방법론도 자연스럽게 읽으며 창업의 길에서 성공하기를 바랍니다.",2020.10.03-2020.11.09,"500,000원"
308,출판,"언택트 시대, 쉽고 저렴하게 집에서 즐기는 [셀프 플라워 클래스]",마이루트,84%,"423,000원",,61,19,더이상 플라워 원데이 클래스에 갈 필요가 없어요.,2020.10.10-2020.10.30,"500,000원"
309,출판,"대학의 민낯을 알리는, 검열없는 언론 'N대알리'",대학언론협동조합,76%,"2,288,000원",,84,11,'N대알리'는 기존 학보와 달리 대학본부의 검열이 없는 자유독립언론입니다. 대학생의 알권리를 지키는 N대알리를 지켜주세요,2016.09.05-2016.10.06,"3,000,000원"
310,출판,"세 달의 기적, 습관은 눈덩이처럼",고객중심,76%,"768,600원",,45,46,사소한 습관의 차이가 삶의 차이를 만들어 냅니다.,2020.06.24-2020.07.24,"1,000,000원"
311,출판,평범한 내가 책으로 1억 번 비법,장동완 (장동완),72%,"364,500원",,46,46,나의 생각과 경험이,2020.12.07-2021.01.04,"500,000원"
312,출판,[소자본창업 강의] 8천원으로 정복하기!! 입문자전용 E-Book  ,캘튼,71%,"356,100원",,51,34,브랜드창업 및 1인 창업 전문 코치 캘튼 대표의 노하우를 남김없이 공개된 E-Book.,2020.03.27-2020.04.12,"500,000원"
313,출판,내 모습을 대변해 줘! 현대인을 위한 아트북 <울랄라 패밀리Vol.1>,(주)강경숙칠판 노트앤다그,71%,"1,071,000원",,42,17,소장욕구 불러일으키는 현대인들을 위한 아트북 <울랄라 패밀리 Vol.1> 내 모습을 대변해 줘!,2019.12.13-2020.01.05,"1,500,000원"
314,출판,"[냉정한 여행] 도서출판 프로젝트, 당신은 누구의 눈으로 세상을 봅니까?",방성식,70%,"2,826,000원",,179,1,냉정(冷靜) - 생각과 행동이 감정에 좌우되지 않고 침착함,2015.03.15-2015.04.24,"4,000,000원"
315,출판,너도 셀프 마케팅 할수 있어! <50페이지 브랜딩 마케팅 비법노트>,세라안녕,70%,"351,000원",,50,40,셀프마케팅을 준비 중이신가요? 대행업체 대신 직접 운영하고 싶으신가요?,2020.10.05-2020.11.09,"500,000원"
316,출판,"나만의 손글씨 굿즈 만들기, EASY 캘리그라피",남혜란 (남혜란),69%,"346,500원",,49,42,"캘리그라피가 하고 싶었던 여러분을 전자책 가이드로  캘리그라피를 쉽게 시작할 수있게 도와드릴게요. 어디서든 구할 수 있는 <붓펜>으로 간단하고 편하게, 지금 바로 시작해볼까요?",2020.09.25-2020.11.16,"500,000원"
317,출판,마음을 담은 문구를 매듭으로 전하세요. [감개매듭 기법 도안 - 기본편],배키맴,69%,"349,500원",,34,9,"본 책은 국화매듭(감개매듭)을 기본으로 세로와 가로, 상하좌우 부등호로 변형하는 과정을 익히는 기본편으로 우리의 매듭공예 매력에 빠져 즐거운 시간을 보내시기 바랍니다.",2020.12.12-2020.12.30,"500,000원"
318,출판,"세계 100대 명화 X 동주, 소월, 용운, 영랑의 글",(주)인디뮤즈,67%,"337,500원",,31,18,"고흐,모네,르누아르,드가의 그림과 동주,소월,용운,영랑의 글을 담은 아트북",2021.01.11-2021.02.10,"500,000원"
319,출판,2016 제3회 청소년독서토론대회,토론연구개발원,66%,"660,000원",,10,1,"토론대회에 예선 서류에서 떨어진 친구들,",2016.01.12-2016.02.12,"1,000,000원"
320,출판,"매일 아침 출근길, 영어원서 완독 프로젝트! 읽고 듣다.",킴예스,64%,"1,932,000원",,105,89,"아침 출근길, 직장인 영어공부의 새로운 패러다임, 영어원서 완독 프로젝트! 강의 오디오북(mp3)을 핸드폰에 저장, 언제 어디서나 편하게 듣고, 책으로 점검 학습하면 어느새 완독!",2020.02.24-2020.03.22,"3,000,000원"
321,출판,수능에 나올 지문만! 수능 영어 연계교재 The final 204제,패스파인더보습학원,64%,"640,000원",,17,28,수능 연계교재 중요지문 204제만 뽑아 상세히 분석하여 연계될 수 있는 가능성을 최대한 이 책에 담았습니다.,2020.11.03-2020.11.13,"1,000,000원"
322,출판,"공대생, 영포자들을 위한 기초영어기본서, 공대생 영어 ",임선라 (임선라),64%,"322,800원",,37,48,"a,an,the,전치사? 그런거 틀려도 되.",2020.11.27-2020.12.31,"500,000원"
323,출판,아이들을 위한 여행 동화 팝업북 - 수원편,정유미 (정유미),64%,"323,000원",,28,16,<내 뿔을 찾아줘!>는 코로나로 여행을 못가는 아이들을 위한 여행동화책입니다. 수원에 대한 볼거리를 팝업 연출을 통해 흥미롭고 재미있게 선물합니다.,2021.03.15-2021.03.31,"500,000원"
324,출판,상처란 치유되고 있다는 증거다,러브아더스(Loveothers),61%,"1,844,000원",,35,18,"트라우마로 인한 자퇴이후, 수년간 겪은 지옥에서 우연히 빛을 발견 지금은 사랑이 되었다.",2021.03.01-2021.03.31,"3,000,000원"
325,출판,퇴근 후 나만의 일을 시작하라 <사이드 허슬러>,심두보 (심두보),59%,"1,183,200원",,87,70,<사이드 허슬러>는 직장인 사이드 프로젝트를 돕기 위해 시장 조사와 인터뷰를 통해 탄생했습니다. 직장인 허슬러 8인의 '딥 인터뷰'도 담겨 있어요.,2020.04.10-2020.05.31,"2,000,000원"
326,출판,"[사쿤] 도깨비, 인간 세상에 발들이다.",(주)쿤스,58%,"1,740,000원",,66,14,"사쿤도깨비, 인간 세상에 발들이다.",2016.07.18-2016.08.15,"3,000,000원"
327,출판,"백소영의 <드라마속 윤(倫), 리(理)> 출판, 토크 콘서트 프로젝트",꿈꾸는터,58%,"879,000원",,42,26,"드라마에서 퍼 올린 ‘나, 너, 우리’를 위한 윤리.",2017.07.07-2017.07.24,"1,500,000원"
328,출판,"마음을 다스리는 동양철학의 힘, <주체적으로 산다>",책과이음,58%,"385,200원",,24,16,"우리는 지금 어떤 삶을 살고 있을까요? 무엇을 위해 살아가는 걸까요? 주체적 삶을 위한 철학, 명나라의 철학자 왕양명의 사상을 함께 읽는 책 <주체적으로 산다>를 펴냅니다.",2019.07.10-2019.08.21,"660,000원"
329,출판,꼼지맘의 시각장애아동을 위한 점자촉각그림책 만들기,꼼지맘 박귀선,53%,"1,607,000원",,75,0,그림책을 살 수 도 빌릴 수 도 있지만 볼 수 없는 친구들이 있습니다. 바로 시각장애인입니다.,2014.10.31-2014.12.23,"3,000,000원"
330,출판,일상에서 예술하실래요? 떠오를 잡지 [서툰],박소현,53%,"1,079,000원",,42,3,#Let Your Life be ART,2015.10.15-2015.11.21,"2,000,000원"
331,출판,[TOOLKIT] 마음과 행동을 기획하는 비즈니스 툴킷,흰빛출판사,52%,"261,500원",,16,10,나다운 일을 만드는 TOOLKIT! 창업과 협업을 위해 필요한 도구! 마음과 행동을 기획하는 비즈니스 툴킷으로 자신에게 적합한 비즈니스 모델을 만들어보세요!,2020.10.01-2020.11.11,"500,000원"
332,출판,보통 사람들의 진짜 커리어를 공유합니다.  Mebook,레이즈지엘에스,51%,"1,556,000원",,50,27,"세상에 길은 많다. 취업을 고민하고 있을 친구들을 위해 사회 선배들이 다양한 진로, 경험을 하나의 책으로 묶었습니다.",2017.04.12-2017.05.11,"3,000,000원"
333,출판,"세계 영화 장인 112명의 노트와 인터뷰, '필름크래프트'",커뮤니케이션북스출판사,50%,"2,205,000원",,19,22,"‘필름 크래프트’, 영화를 만든다는 것에 대하여",2018.10.15-2018.11.07,"4,400,000원"
334,출판, [당신은 관심없는 독거노인이야기] 출간,도서출판 큰글사랑,47%,"2,350,000원",,193,0,이 시대를 함께 살아가고 있는 독거노인들의 사연을 책으로 엮어 알리려고 합니다. 사람들의 관심이 그들의 희망으로 바뀔수 있게 도와주세요.,2015.07.30-2015.09.05,"5,000,000원"
335,출판,UFO: CIA 극비문서 최초 출간!,투나미스 출판사,47%,"1,415,000원",,47,12,"미중앙정보부 CIA가 밝힌 UFO 공식 연구 자료, 드디어 출간되다!",2016.07.07-2016.08.31,"3,000,000원"
336,출판,영어를 잘하고 싶은 당신과 함께 나누고 싶은 이야기,안효원 (안효원),47%,"237,500원",,10,27,"아무도 말해주지 않는 나만의 영어 이야기. 메이커의 실제 경험을 바탕으로 구성된 영역별 영어 공부 방법, 호주 워킹홀리데이, 미국 대학원, 해외 취업 이야기들.",2020.09.23-2020.10.30,"500,000원"
337,출판,"50페이지로 완성하는 최소한의 인생 재테크, 놀테크 ",리치우먼코리아,46%,"231,000원",,45,36,"귀찮고 어려워서 포기했던 가계부 쓰기+재테크, 단 50페이지의 [인생 재테크_놀테크]로 해결해 보세요.",2020.10.10-2020.10.26,"500,000원"
338,출판,"작은 책속에 담긴 넓은 부산이야기 : 다시, 부산",DasiBusan,43%,"1,290,000원",,67,10,"부산을 사랑합니다. 부산을 보여주기 위해, 부산에서 모여, 몇 달을 고민하여 만들었습니다.",2016.09.08-2016.10.04,"3,000,000원"
339,출판,연봉 1억 마케터의  이직&업무 ,크리스탈빈 (김정선),43%,"216,000원",,32,19,"14년차 마케터인 메이커가,",2020.09.27-2020.10.19,"500,000원"
340,출판,"[1,627km 국토대장정 스몰 에세이] 조금 긴 산책을 떠나보았습니다",박연준 (박연준),43%,"215,400원",,11,4,"인생에 한번이라도 국토대장정을 버킷리스트에 담아본 적이 있었다면, 그러나 이루지 못한 채로 흘러왔다면, 이번 펀딩을 놓치지 마시길 바랍니다.",2020.10.11-2020.11.13,"500,000원"
341,출판,성인들을 위한 <취미수학>,<취미수학> (노서영),42%,"427,456원",,48,33,안녕하세요? 취미수학입니다. <br>,2017.02.24-2017.03.26,"1,000,000원"
342,출판,[물을 거슬러 노를 저어라] 출판 기념 파티 ,브레인이노베이터,41%,"2,069,000원",,64,0,"퍼렐 윌리엄스, 슬라보예 지젝 등 각 분야의 창조가 59인의 영감을 모아 엮은 책 <물을 거슬러 노를 저어라> 입니다. 국내 다양한 분야의 전문가 10인과의 네트워킹 파티까지 즐겨보세요.",2015.04.16-2015.05.31,"5,000,000원"
343,출판,결혼은 하는 것보다 유지하는 것이 더 어렵다,서지완 (서지완),41%,"209,600원",,25,12,PDF 전자책 -,2020.10.09-2020.10.27,"500,000원"
344,출판,'신화적 명제'로 쓴 시와 미술평론 <예술의 명제>,채종욱,39%,"788,000원",,11,5,"'신화적 명제' 이후 모든 예술작품들은 한 줄의 명제로 기술된다. ""청춘은 샘이다"" ""변기는 변기다"" 등등.",2016.12.29-2017.02.20,"2,000,000원"
345,출판,컨설턴트도 합격생도 말해주지 않았던 자기소개서 작성 진짜 tip,조채영 (조채영),39%,"198,000원",,40,27,"짧고 간결하게! 핵심만 전달하는 자기소개서 tip 리스트. 실전에 바로 적용시킬 수 있도록 쉽게 설명했습니다. 자소서 쓰기, 막막하다면 이 책과 함께 시작해보세요.",2020.10.11-2020.11.06,"500,000원"
346,출판,스트레스가 풀리는 그림 명상 :  만다라 드로잉 워크북,채지수 (채지수),39%,"199,000원",,45,47,"명상은 하고 싶은데 어떻게 하는지 모르겠나요? 아니면 잡생각 때문에 명상을 하기 힘드신가요? 누구나 쉽게 따라할 수 있는 그림명상, '만다라 드로잉 명상'을 해보세요.",2020.09.23-2020.11.16,"500,000원"
347,출판,가방 디자이너가 알아야 할 기본 지식+기술 8가지 - 속성 입문 가이드,한시앤와이,38%,"582,800원",,44,30,"17년 차 현역 가방 디자이너가 정리한, 가방 디자인을 할 때 알고 있으면 실무에 빨리 적응할 수 있는 기본 지식들과 필요한 기술들을 모아 놓은 책!",2020.10.13-2020.11.24,"1,500,000원"
348,출판,"[180조 시장]중소기업을 위한 시장, 공공입찰(나라장터) 뽀개기",주식회사 연플,37%,"1,111,000원",,20,35,중소기업에도 언제든 기회가 있다. 180조 규모의 공공기관에 우리의 제품을 납품해보자! 나라장터에서 입찰하기,2020.12.08-2021.01.04,"3,000,000원"
349,출판,90세에 문인의 삶 찾아나선 할머니 <90세의 꿈>,아트와,36%,"1,275,000원",,22,18,88세까지 병원진료를 하셨던 김길태 할머니는 89세에 글쓰기를 시작하셨지요. 백화점 문화센터에 등록하고 매일 쓰고 고치고 옮겨적기를 반복하면서 한장씩 채워나간 할머니의 노트!,2018.04.10-2018.05.05,"3,500,000원"
350,출판,[ 영한 대역 에세이] 생각하는 번역가의 자유로운 사색 ,안지희 (안지희),35%,"175,500원",,27,14,영어 독해 리딩북,2020.11.16-2020.12.30,"500,000원"
351,출판,"젊은 시각으로 읽는 전통공예 사진에세이집 [손길, 손끝] 출판 프로젝트",PK,34%,"1,900,000원",,68,0,"잊혀져 가는, 사라져 가는 우리 전통문화. 이제는 더 많은 젊은이들과 함께 나누고 싶습니다. 대중적인 젊은 시각으로 다시 읽은 전통공예 사진 에세이집 [손길, 손끝] 출판에 힘을 모아주세요. 전국 서점에서 만날 수 있는 대중 서적으로 출판할 [손길,손끝]을 가장 먼저 만나보세요.",2014.10.16-2014.11.19,"5,500,000원"
352,출판,​[고생일지 출판 프로젝트] ​무식했기​​에 용감했던 청춘 여행기 ​,김한솔,34%,"512,000원",,59,14,불가능해 보였던 나의 꿈에 도전하기 위해 떠났던 여행.,2016.05.31-2016.07.18,"1,500,000원"
353,출판,★자존감플래너(+이벤트중)★ 나의 행복을 우선하는 100일,미니북키,34%,"1,191,500원",,63,44,"오늘 '해야만 하는 일'보다 '진정으로 나를 위해 하고 싶은 일'을 실천하며, 내가 바라는 나의 이상적인 모습을 매 순간 닮아가는 경험을 직접 체험해보세요.",2019.07.02-2019.08.18,"3,500,000원"
354,출판," [오디오북] 365일 하루 한편, 이윤지가 낭독하는 베드타임 스토리",커뮤니케이션북스(주),34%,"1,710,000원",,45,16,매일 잠자기 전 하루 한 편의 오디오북과 함께 온 가족이 이야기 나라로 여행을 떠나세요. 이윤지가 낭독하는 베드타임 스토리 오디오북 <베개 타고 떠나는 이야기 여행>,2021.03.26-2021.04.19,"5,000,000원"
355,출판,n개의 문장 : 소규모 교환 에세이집 프로젝트 [Theme : 여행],(주) 아이커머,34%,"344,000원",,16,19,n개의 문장은 공통의 관심사를 가진 사람들과 문장을 주고받는 소규모 교환 에세이집 프로젝트입니다.,2021.03.30-2021.04.16,"1,000,000원"
356,출판,고승님을 향한 나의 마음 여행기,양자출판사,34%,"170,000원",,18,8,[쓰담쓰담 마음여행] 마음이 힘들고 괴로울 때 마음여행을 함께 떠나요. 큰스님의 마음에서 저의 마음을 보면서 서포터님의 마음은 좋아지고 산사풍경은 서포터님의 마음을 따뜻하게 하지요,2021.03.30-2021.04.26,"500,000원"
357,출판,세상에서 가장 쉬운 철학책_플라톤,세상에서 가장 쉬운 철학책,33%,"251,000원",,11,12,철학책은 어렵다는 편견은 이제 그만!,2018.05.11-2018.07.09,"750,000원"
358,출판,[당을 끊는 레시피]를 선물하세요,최소영(솔트앤씨드),32%,"1,643,000원",,70,0,"올 여름, 건강도 챙기면서 가장 빠르게 다이어트에 성공할 수 있는 법! <당을 끊는 식사법>의 실천편, <당을 끊는 레시피>가 출간 전 여러분을 만나러 갑니다.",2015.04.30-2015.06.07,"5,000,000원"
359,출판,"나 자신을 발견해 나가는 여정이 담긴 작은 책, 그리고 퍼즐",보임과 숨김 제작소 (심성아),32%,"162,500원",,9,5,"생일날 아침 아버지가 쓰신 편지로부터 시작되는, 스스로를 발견해 나가는 시간을 담은 작은 그림책과 퍼즐 ""나를 찾아서""",2019.05.10-2019.06.09,"500,000원"
360,출판,"한 번 뿐인 인생, 나를 위한 선물. 나를 찾아 책 속으로 떠나는 여행.",이정숙 (이정숙),32%,"164,000원",,17,15,한 번 뿐인 나의 인생.,2020.12.18-2021.01.04,"500,000원"
361,출판,태국과 동남아의 신학생들에게 '현지어'로 된 전공서적을 제공합니다. ,송현우(그레이스노트),30%,"615,000원",,39,0,"[그레이스노트]태국과 동남아지역에는 아직 현지어로 된 성경맥잡기와 관련된 적절한 교재가 없습니다. 태국에 계신 신상태 선교사님이 만드신 교재를 편집, 번역하여 태국과 동남아의 학생들에게 배포할수 있게 됩니다.",2015.05.27-2015.06.27,"2,000,000원"
362,출판,상상이 현실로... 우리아이가 동화책속으로 들어왔다,상상사진카페,30%,"303,000원",,6,17,상상이 현실이 된다,2020.02.24-2020.03.31,"1,000,000원"
363,출판,꿈을 고민할 기회를 주세요. <MeBook_스페셜리스트> ,레이즈지엘에스,29%,"586,000원",,30,35,"조금은 특별한 직업을 가진, 스페셜리스트들의 경험을 담은 책 <MeBook_스페셜리스트>입니다. 이 책으로 아이들에게 진로를 고민할 기회를 주세요.",2017.06.26-2017.07.31,"2,000,000원"
364,출판,보다 나은 삶을 위한 목표관리 도구 - 석세스플래너 2018,(주)석세스위드,29%,"582,800원",,20,6,전문가들이 편리하게 사용하는 목표 관리 도구 - Success Planner,2017.11.30-2017.12.18,"2,000,000원"
365,출판,개발자에게 쉽게 배우자! 데이터 사이언스부터 머신러닝까지,주식회사 크리애플,29%,"299,400원",,19,27,"어딜 가나 데이터 사이언스 머신러닝 열풍! 파이썬 데이터시각화, 머신러닝, 텐서플로 3가지 동영상 강의를 E-BOOK으로 정리했습니다! 데이터 사이언스부터 머신러닝까지 쉽게 배우자",2020.09.28-2020.11.20,"1,000,000원"
366,출판,부산 서면을 날 것의 시선으로 보는 독립잡지 [날_서면 vol.2],날_서면 (한정우),28%,"775,200원",,50,30,부산 서면을 날 것의 시선으로 보는 독립잡지 [날_서면] 입니다.,2020.02.04-2020.03.16,"2,700,000원"
367,출판,수학과 코딩교육을 동시에 ! 메타코딩 수학,권영준 (권영준),28%,"280,000원",,13,14,수학 문장제를 컴퓨팅 사고법으로 해결하는 교과 융합형 코딩교육 워크북입니다.,2018.06.20-2018.08.05,"1,000,000원"
368,출판,[스몰 창업] 원 아이템으로 시작하는 패션 & 잡화 브랜드 창업 비밀노트,신혜수 (신혜수),28%,"144,000원",,14,21,[브랜드가 되는 당신의 취향 ] 한 가지 아이템으로 시작하는 패션 & 잡화 브랜드 창업 : 작은 시작으로 마켓에 포지셔닝하는 스몰 패션 브랜드의 창업 비밀 노트 !,2020.10.11-2020.11.20,"500,000원"
369,출판,"기적을기억하다, 소설<태안>과 캠페인에코백",주식회사 펀치라인엔터테인먼트,27%,"1,390,000원",,59,21,"2007년 12월 , 우리가 만든 기적을 기억하나요? 태안 사건 발생 10주년을 맞아 그 가슴 뜨거운 기적을 오래, 널리, 함께 기억할수있게 소설과 에코백, 텀블러를 만듭니다.",2017.09.20-2017.11.06,"5,000,000원"
370,출판,MD로 살고 있습니다 (예비 상품기획자 & 취준생 길라잡이),네츄럴라이프,27%,"136,080원",,20,11,요새 뜨는 상품은 누가 어떻게 만들까?,2020.10.20-2020.11.30,"500,000원"
371,출판,"저항의 아이콘, ""가이 포크스"" 원작소설",투나미스,25%,"253,000원",,20,17,"저항의 아이콘이자 실존 인물인 ""가이 포크스"" 원작 소설(1840) 최초로 옮깁니다.",2018.10.25-2018.12.02,"1,000,000원"
372,출판,"모르면 5,000만원 손해보는 '무료자원'",조영준 (조영준),24%,"120,000원",,10,13,여러분이 모르고 사용을 못했던 무료자원의 핵심만 모아서 문서로 전달해 드립니다.,2017.03.09-2017.04.10,"500,000원"
373,출판,30분만에 주식 초보 탈출하기,철학하는시인,24%,"324,000원",,14,31,주식 고수가 되는 것은 10년이 걸릴 수도 있지만,2020.05.14-2020.06.01,"1,300,000원"
374,출판,색과 도형으로 보는 너와 나의 심리이야기<오로라심리카드>,유동환 (유동환),24%,"368,000원",,13,22,오로라 심리카드는 9개의 색과 도형으로 구성된 나의 심리 상대방의 심리를 읽어 주는 심리카드 이며 라포형성의 매개체로 활용 됩니다.,2021.01.22-2021.02.26,"1,500,000원"
375,출판,인싸아싸 다 모여라! 인싸들의 마술책,박성욱(Kacio) (박성욱),23%,"476,400원",,30,19,새로운 끼를 발산하기 좋은 새해가 밝았습니다. 누구나 쉽게 할 수 있는 마법같은 카드 마술을 통한 인싸로 거듭나기!!,2019.02.21-2019.03.24,"2,000,000원"
376,출판,"본격 이슬람 문화여행, 낯설고 신비로운 이슬람, 그리고 두바이! ",(주)야나트립,23%,"238,300원",,30,23,본격 이슬람 & 중동 발굴 프로젝트!,2020.09.30-2020.11.11,"1,000,000원"
