,categories,title,company_names,percentages,funding_amounts,days_left,n_supporters,likes,descriptions,durations,target_amounts
222,출판,면접 STAR 카드,주식회사 학토재,127%,"1,914,000원",펀딩성공,78,49,<STAR기법을 기반으로 한 면접 질문과 답변 가이드> 커리어코칭 전문가의 노하우가 담긴 면접 STAR 카드로 면접의 자신감을 더하고 면접의 'STAR'가 되어보세요,2020.07.29-2020.08.31,"1,500,000원"
223,출판,취업 부스터로 취준생활 빠르게 탈출!!,주식회사 로드투커리어,127%,"636,130원",펀딩성공,78,35,취준기간과 비용을 단축시켜주는 취업 가이드북,2021.02.26-2021.03.22,"500,000원"
224,출판," 세상에서 가장 재미있는 성경책, 올마이티바이블 - 요한계시록편",올마이티바이블홀딩스,126%,"3,781,000원",펀딩성공,20,6,여러분의 성원과 후원에 힘입어 요한계시록 캠페인은 성공적으로 종료하였습니다. 감사합니다~,2015.09.16-2015.10.19,"3,000,000원"
225,출판,자녀교육을 위한 부모수업,(주)글로벌콘텐츠출판그룹,126%,"1,262,000원",펀딩성공,17,6,학벌 위주가 아닌 아이들 스스로 자신의 재능을 펼쳐갈 수 있도록 도와주는 자녀교육방법에 관한 책입니다.,2019.04.10-2019.05.06,"1,000,000원"
226,출판,"[프랜차이즈 음식점] 창업이 처음인 당신을 위해, 성공창업 지침서.",전성민 (전성민),126%,"634,500원",펀딩성공,31,22,"대한민국, 음식점 사장님들이 많이 한다는 <프랜차이즈 창업> 프랜차이즈 본사 출신이 예비창업자의 시선에서 창업에 필요한 솔루션을 알려드립니다.",2021.01.25-2021.02.15,"500,000원"
227,출판,개인투자자 수익대박을 위한 도서 출판-개수작,(주) 청개구리 인베스트먼트,124%,"31,191,000원",펀딩성공,280,7,"개인 투자자가 금융 시장에서 생존할 수 있도록, 주식, 재무설계 등 각 분야 최고의 전문가들이 모여 오롯이 ""개인투자자 수익 대박 작전""을 위한 책을 집필합니다. 이 책으로 금융 시장에서 개인 투자자가 승리할 수 있게 도와주세요!",2015.09.21-2015.11.22,"25,000,000원"
228,출판,"아빠를 위한 잡지, [볼드저널] 창간호 발행",주식회사 볼드피리어드,123%,"6,166,000원",펀딩성공,196,30,'Life Lessons for Modern Fathers',2016.04.18-2016.05.06,"5,000,000원"
229,출판,2017년  버크셔해서웨이 주주총회를 가다,미국주식에 미치다 (장우석),122%,"9,837,000원",펀딩성공,83,40,현존하는 투자의 대가인 워렌버핏의 지주회사 버크셔해서웨이 2017년 주주총회에 참석하고자 합니다. 워렌버핏의 투자철학과 주주총회의 생생한 현장이야기를 체험하고 공유하고자 합니다.,2017.03.17-2017.04.16,"8,000,000원"
230,출판,"[미술관은 못가도 명화는 보고 싶다] 갤러리북 시리즈 3, 클로드 모네",유화컴퍼니,122%,"61,147,650원",펀딩성공,"1,485",625,해외 미술관에서나 느낄 수 있던 모네 작품의 아름다움과 감동을 책에 재현하다.,2020.10.04-2020.11.13,"50,000,000원"
231,출판,"[앵콜] 1+1 기부프로젝트_쓰면서 선교하는 필사노트, ""말씀을 심다.",파머스 (FARMUS),122%,"1,832,500원",펀딩성공,47,44,"[ 1 + 1 ] _ 필사하며 말씀을 깊이 묵상하고, 선교지에 언어 교육과 복음 전파용으로 1권이 기부되는 ""함께 성장"" 프로젝트 ""말씀을 심다""",2021.01.26-2021.02.24,"1,500,000원"
232,출판,"[중국경제 왕홍으로 통通한다] 중국진출, 왕홍도전의 유일한 지침서",중국왕홍프로젝트 (임예성),122%,"1,227,500원",펀딩성공,45,24,"14억 중국의 유통경제를 움직이는 핵심키워드'왕홍' 관련 서적입니다. 중국시장에 진출을 원하는 기업들과, 중국의 크리에이터인 '왕홍'으로 활동을 원하는 청년들에게 필요한 책입니다",2019.07.06-2019.08.14,"1,000,000원"
233,출판,"[1+1기부 프로젝트] 쓰면서 선교하는 성경필사노트,  '말씀을 심다'.",파머스 (FARMUS),120%,"5,443,500원",펀딩성공,132,74,"[  1 + 1  ] _ 필사하며 말씀을 깊이 묵상하고, 선교지에 언어 교육과 복음 전파용으로 1권이 기부되는 ""함께 성장"" 프로젝트 ""말씀을 심다""",2020.11.24-2020.12.14,"4,500,000원"
234,출판,크리스마스 트리가 된 루돌프,여기저기출판사,120%,"1,201,500원",펀딩성공,28,30,따분한 크리스마스 트리는 이제 그만 !,2019.11.19-2019.12.01,"1,000,000원"
235,출판,"조금 특별한 동물도감, 멸종위기동물 아트북을 소개합니다.",성실화랑,119%,"5,965,000원",펀딩성공,425,87,"조금 특별한 동물도감, 멸종위기동물 아트북을 소개합니다.",2016.06.16-2016.07.31,"5,000,000원"
236,출판,생각 얽힌 '나' 포트폴리오 직접 만들기,김동은 (김동은),119%,"598,000원",펀딩성공,68,48,[생각 얽힌 '나'],2020.10.14-2020.11.09,"500,000원"
237,출판,"빈곤을 이해하는 첫걸음, Poverty Simulation 한국어판 제작",복지세상을 열어가는 시민모임,117%,"2,345,000원",펀딩성공,105,1,"Poverty Simulation Kit는 빈곤문제, 빈민에 대한 인식개선을 위해 미국의 Missouri Association for Community Action이 만든 가상빈곤체험 키트입니다.",2015.06.01-2015.06.30,"2,000,000원"
238,출판,[취업을 성공으로 이끄는 전략 도우미 ] 성공취업과 전략,이화영 (이화영),117%,"588,000원",펀딩성공,27,17,**성공적인 취업을위한 5단계 준비 전략  -   취업 준비생을 위한 단계적 전략 계획서  /  직업훈련기관을 위한 학생 취업 지도 교과서  / 취업 초보 강사를 위한 강의 지침서,2020.12.01-2020.12.15,"500,000원"
239,출판,(3차앵콜)하루 1시간. 쿠팡파트너스로 매일 치맥값정도는 벌기_부업 투잡,임민혁 (임민혁),116%,"583,000원",펀딩성공,39,39,"평범한 남자 임호입니다. 임호라는 닉네임으로 투잡강사를 하고 있으며,",2021.02.24-2021.03.10,"500,000원"
240,출판,합격포인트 콕콕 짚어주는 핵심꿀팁 실전서! 나도 찐 피부미용사,김현진 (김현진),115%,"575,000원",펀딩성공,35,24,"피부자격증 필요한데 대면 수업은 겁나고, 너튜브, 초록창 만날 쳐다봐도 모를 때, 합격포인트 콕콕 짚어드릴테니 지금! 당신에게 꼭! 필요한 피부미용사 자격증 실기! 함께 하실래요?",2020.11.16-2020.12.14,"500,000원"
241,출판,"누워서 읽는 법학 [민사법] 2판 제작, [형사법], [공법] 편 구매",로스타트,114%,"5,707,800원",펀딩성공,196,3,"<누워서 읽는 법학> 민사법 편이 2판으로 돌아왔습니다! 서점에 들어가기 전, 할인된 가격으로 예약할 수 있는 마지막 기회입니다.",2014.12.24-2015.01.19,"5,000,000원"
242,출판,"재기발랄 육군 장교 이야기, ROTC가이드북!",한동협,114%,"3,421,000원",펀딩성공,208,2,"군대 이야기 낯설죠? 하지만 여러분의 가족 또는 가까운 지인은 군 생활을 거쳐야만 하기 때문에 다른 세상 이야기만은 아닐 것 같습니다. 다행히 병사 생활에 관한 지침서는 시중에 많습니다. 다만, 육군 장교 생활에 관한 지침서는 거의 전무한데요. 저는 작년에 전역한 예비역 중위이고, 제가 겪은 장교 생활 중 미리 알았더라면 좋았을 법한 이야기들을 들려주고 싶어서 집필을 시작하게 되었습니다. 제 이야기 한번 들어보실래요?",2015.09.23-2015.11.30,"3,000,000원"
243,출판,해외취업은 어때? 실감나는 취업비법을 바로 알려줄게요!,미래유망기술연구원,113%,"1,134,000원",펀딩성공,64,40,"국내 취업만 생각하면 취업의 폭이 너무 좁죠. 지금 해외취업이 기회일 수 있어요. 해외취업, 어떻게 준비하면 좋을지, 해외생활의 꿀팁을 알려드립니다.",2021.02.17-2021.03.19,"1,000,000원"
244,출판,(4차앵콜)하루 1시간. 쿠팡파트너스로 매일 치맥값정도는 벌기_부업 투잡,임민혁 (임민혁),113%,"567,000원",펀딩성공,31,21,"평범한 남자 임호입니다. 임호라는 닉네임으로 투잡강사를 하고 있으며,",2021.04.13-2021.04.23,"500,000원"
245,출판,"스물다섯 청년의 황당한 유라시아 방랑기, 100일만에 10cm",서지산,112%,"3,361,500원",펀딩성공,125,24,"세상에서 가장 솔직한 여행기.  당신의 배꼽을 공격할 스물다섯 청년의 황당한 유라시아 방랑기, 100일 만에 10cm",2016.12.07-2017.01.15,"3,000,000원"
246,출판,세상에서 가장 재미있는 성경책 올마아티바이블 - 여호수아사사기,(주) 올마이티바이블홀딩스,112%,"3,385,000원",펀딩성공,25,6,전세계에서 꾸준히 사랑받는  기독교 교육 콘텐츠 <올마이티바이블 > 여호수아사사기의 재미있고 감동적 이야기 속으로 여러분을 초대합니다.,2017.10.23-2017.12.03,"3,000,000원"
247,출판,"당신의 '아름다움'을 향한 발걸음,5개월 간의 '세계 녹색기업 탐방여행'",Green Enterprise Travel (임관섭),111%,"1,673,000원",펀딩성공,43,28,사람들이 날씨 좋은 아름다운 날 행복한 얼굴로 그 순간을 즐기는 것이 너무 좋습니다. 우린 그 조건이 되는 아름다운 날을 평생 만들어주고 싶습니다.  그 길을 찾아 떠납니다.,2017.04.20-2017.05.21,"1,500,000원"
248,출판,수학문제 해설을 동영상으로!,정재호,111%,"1,117,000원",펀딩성공,32,9,믿음직한 수학선생님의 고퀄 동영상해설! 높은 가성비!! 게다가 실시간!!!,2017.12.07-2017.12.31,"1,000,000원"
249,출판,"창업을 원한다면, 팀 드레이퍼의《스타트업 히어로》를 만나보세요.",미래의창,111%,"559,200원",펀딩성공,29,21,“ 수많은 창업가들 중 극소수만이 스타트업계의 히어로로 부상한다.,2019.02.13-2019.03.20,"500,000원"
250,출판,"나도 이제 'BAR- 홈텐더' 집에서 만드는 홈테일, 칵테일",임민혁 (임민혁),111%,"556,000원",펀딩성공,12,18,안녕하세요. '칵테일을 사랑하는 남자' 임호입니다.,2020.10.04-2020.10.23,"500,000원"
251,출판,보기만 해도 1달만에 영어회화 가능한 비밀,한국항공훈련센터,111%,"2,232,900원",펀딩성공,160,111,"영어회화 노하우, 강의교안, 테스트교재, 채널에 공개된 유튜브 강의 30강 과 함께 30일만에 영어회화를  가능하게 해드립니다!!",2020.10.09-2020.11.06,"2,000,000원"
252,출판,손기정평전-오팔세대와 밀레니얼세대가 함께 하는 회환의 손기정 열전 마라톤,도서출판 귀거래사,111%,"4,686,000원",펀딩성공,88,10,≪손기정 평전≫ 은 '스포츠'와 '평화'를 위해 살아온 선생의 인생 궤적을 다루고 있습니다. 차갑게 얼어붙은 한일 관계를 풀어줄 하나의 유효하고 가슴 훈훈한 메시지를 줄 것입니다.,2020.04.22-2020.05.15,"4,219,500원"
253,출판,Take out My Sexy Book 두 번째 출간 프로젝트,Take out My Sexy Book,110%,"551,000원",펀딩성공,17,0,"꾸미거나 과장되지 않은, 진정한 '섹시함'에 대한 잡지, Take Out My Sexy Book 두 번째 출간프로젝트입니다.",2014.11.21-2014.12.06,"500,000원"
254,출판,차별화된 온라인 모임 만들기와 운영 노하우 꿀팁,허필선 (허필선),110%,"550,000원",펀딩성공,52,24,요즘 SNS를 보면 온라인 모임이 정말 많이 생기지 않았나요? 나도 한 번 해보고 싶지만 어디서부터 시작해야 할지 막막하지 않으신가요? 그 궁금증에 대한 답이 될 것입니다.,2020.10.13-2020.11.09,"500,000원"
255,출판,영포자를 위한 문법책이 찾아왔다! 삼등급부터 구등급까지 모여라!,장진우,109%,"6,009,100원",펀딩성공,301,7,"영포자를 위해 찾아왔다! 어렵기만 한 수능 영어! 감도 못 잡는 수능 영문법! 오직 ""삼등급부터 구등급까지 모여라""만이 해결할 수 있다.",2015.02.23-2015.04.09,"5,500,000원"
256,출판,<사라지는 것들을 잡다> 사진엽서집 출판 프로젝트,달무지개(김민지),109%,"1,642,000원",펀딩성공,85,0,"잠시 소홀했던 주변사람들에게 당신의 사랑과 응원을 전달해 줄, 직접 찍은 사진이 담긴 엽서집의 출판을 시작하려합니다. @mj_daliris",2015.05.08-2015.06.30,"1,500,000원"
257,출판,다가올 미래가치 [회복력] 도서 번역 프로젝트,미래가치리질리언스포럼,108%,"6,490,000원",펀딩성공,215,2,"우리는 경제성장을 위해 소중한 자유와 권리를 희생하면 가난과 굶주림에서 벗어난다고 믿었습니다. 하지만 우리에게는 빈부격차의 심화, 지역경제의 붕괴, 마을 공동체의 해체 등 너무나 큰 상처만 남았습니다. 이에 대한 자각과 대항으로 마을공동체, 대안경제 등 시민의 반격이 시작됐습니다. 대안적인 시도들을 통하여 회복력을 갖춘 삶의 터전을 만들자고 제안하는 「The Resilience Imperative」. 이제 곧 한국어로 번역되어 여러분을 찾아갑니다.",2015.01.28-2015.02.20,"6,000,000원"
258,출판,"[도화지] 강제징용 (강제노역,위안부 등) 책 발간 프로젝트",진민식(도화지),108%,"7,580,500원",펀딩성공,284,55,"한국 청년으로 일제시대를 지나온 분들의 생생한 이야기를 책으로 담아 현재의 대한민국 청년들에게 들려주고 싶은 이야기가 있습니다. 도화지 첫번째 프로젝트, 잊혀져선 안 될 이야기.",2016.03.04-2016.04.07,"7,000,000원"
259,출판,히데코의 사계절 술안주 X 은곡도마 ,맛있는 책방,108%,"10,801,000원",펀딩성공,118,286,맛있는 술과 안주 그리고 이를 아름답게 빛내줄 원목 플레이트!,2018.04.12-2018.05.07,"10,000,000원"
260,출판,후와유 마림바 리듬편,후와유 소셜 미디어 커머스,108%,"3,241,000원",펀딩성공,18,6,"""후와유 마림바"" 새롭게 돌아 왔습니다.신나는 교육을 지향하는  ""후와유 마림바 리듬편"" 을 통하여 자라나는 아이들의  꿈을 키워 주세요.",2019.08.26-2019.09.28,"3,000,000원"
261,출판,[Design Like You Give a Damn] 한국어판 출판,국제 전문인 도시 건축 봉사단,107%,"5,372,000원",펀딩성공,102,5,Architecture for Humanity가 전세계적으로 사회적 소외계층을 위한 건축 프로젝트들을 진행하며 얻은 경험과 결과물을 소개한 책 'Design Like You Give a Damn'의 한국어 번역본을 출판합니다.,2015.09.16-2015.11.11,"5,000,000원"
262,출판,"새해엔 나도 CEO '아빠, 나 창업할래' 출판 프로젝트",(주)리안메모아,107%,"5,380,000원",펀딩성공,66,8,“창업은 인생 공부”라고 가르치는 아버지와,2017.01.05-2017.01.31,"5,000,000원"
263,출판,SQL과 구글시트로 시작하는 데이터 분석,박범진 (박범진),107%,"537,600원",펀딩성공,40,15,데이터 분석에 가장 많이 쓰이고 기본적인 툴인 sql 과 구글시트를 이용하여 제공되는 데이터를 이용하여 실습하며 학습할 수 있게 구성하였습니다.,2020.10.12-2020.10.19,"500,000원"
264,출판,[취업] 평범한 스펙만으로 매력적인 자소서 작성하기 가이드북,오선호 (오선호),107%,"535,500원",펀딩성공,18,13,본 프로젝트는 취업준비를 하는 취준생을 위해 시작하였습니다. 취업의 첫 관문인 자소서 작성 가이드북이며 스펙이 부족하더라도 매력적인 자소서를 쓰는 법에 대한 노하우를 전달드립니다.,2020.10.19-2020.10.30,"500,000원"
265,출판,"세상에서 제일 재미있는 성경책, 올마이티바이블 창세기",(주) 올마이티바이블홀딩스,106%,"3,192,000원",펀딩성공,21,11,"세상에서 제일 재미있는 성경책, 올마이티바이블,  창세기가 나왔습니다. 이전 9권에 이어 마지막 10번째 책, 창세기는 여러분께 살아있는 성경말씀을 전해드립니다.",2018.06.25-2018.07.31,"3,000,000원"
266,출판,[재미와 로봇교육을 한번에] 움직이는 페이퍼토이 + 동화책,로보트리,106%,"1,060,000원",펀딩성공,65,41,"지루하고 어렵기만한 로봇/공학 교육은 이제 그만. 움직이는 페이퍼토이와 동화책 '타임메이커 시리즈'로 재미있고, 친환경적이고, 저렴하기까지 한 로봇교육.로보트리와 함께해요",2020.04.06-2020.04.30,"1,000,000원"
267,출판,일상 속 여행감성 TRAVEL COME TRUE! 컬러링북 마이컬러트립,(주)비유비유,106%,"1,069,200원",펀딩성공,42,46,세계도시 컬러링북 마이컬러트립.,2018.09.13-2018.10.14,"1,000,000원"
268,출판,베트남 & 인도네시아 주식투자 실전 가이드북,Hexagon,106%,"5,307,500원",펀딩성공,119,61,"이제, 우리가 검은머리 외국인투자자가 되어",2019.08.26-2019.09.29,"5,000,000원"
269,출판,"행복한 가사 분담을 위한, 가사분담 굿 가이드북",김수연 (김수연),106%,"1,492,500원",펀딩성공,47,20,"가사분담, 어떻게 하지? 가사분담 방법부터 가사분담 대화에 유용한 팁까지. 원활한 가사분담을 위한 가이드북, 가사분담 굿 가이드북을 만나보세요.",2020.09.28-2020.10.16,"1,400,000원"
270,출판,<천가시千家詩> 한 권으로 끝내는 중국 한시 ,달시루 출판사,105%,"1,892,600원",펀딩성공,52,27,"<천가시千家詩> 는 청대 초에 편찬된 5언 7언의 시가집. 시인 천 명? 시 천 수? 베일에 가려 있던 천가시, 한 권으로 끝내는 중국 한시! 천가시와 함께 옛날의 숲을 거닐다!",2019.01.28-2019.03.10,"1,800,000원"
271,출판,"청춘의 기록, 에세이모음집 [말하지 못한 건, 들어주지 않아서]",아로새김 (양현지),105%,"2,100,000원",펀딩성공,114,41,"말할 수 없었던 청춘들이 고민을 쓰고, 아로새김이 모아 함께 나누어 읽습니다. 전국 각지에서 모인 35명 청년들의 추억과 기록을 책으로 엮었습니다.",2019.01.31-2019.03.03,"2,000,000원"
272,출판,"초보아빠를 위한 출산선물, 아빠랑 함께하는 공동육아 365",임수연,105%,"5,292,500원",펀딩성공,90,85,아기가 태어난 날에 맞춰 한장씩 넘기세요. 매일 새로운 꿀팁정보로 함께 아이를 돌보시는데 유용하실 거예요 : ),2019.07.17-2019.08.11,"5,000,000원"
273,출판,"<여리고에서 배우는 재정관리, 샬롬재테크>  출판 프로젝트 ",여리고 아카데미 성경적 재정교육,104%,"3,138,000원",펀딩성공,40,6,"어렵고 딱딱했던 성경적 재정원리들을 여호수아 6장, 여리고전쟁과 결합하여 쉽게 이해하면서 재미와 감동은 물론 현실의 재테크에도 적용할 수 있는 도서제작 프로젝트",2016.11.21-2016.12.23,"3,000,000원"
274,출판,과학기술로 세상을 바꾸고 싶은 사람들 vol. 1,(주)마이소사이어티,104%,"626,000원",펀딩성공,37,12,"UN, 글로벌NGO, 기업에서 인류의 문제를 해결하고 있는",2016.05.03-2016.06.03,"600,000원"
275,출판,"함께 마음껏색칠, 신개념 컬러 놀이「틴코」",스마트한(주),104%,"2,096,900원",펀딩성공,32,26,"혼자 노는게 익숙한 우리 아이에게 '틴코 컬러 놀이'로 친구와 쉽게 친해지고, 재미있게 노는 방법을 알려주세요.",2017.12.07-2018.01.15,"2,000,000원"
276,출판,감각을 열어야 들리는 물고기 마지막 말 <해양동물 아트 북>,BLUE_temperature,104%,"521,400원",펀딩성공,38,35,뻔한 백과사전? 느낌 없이 나열된 해양동물 도감이 아닌,2020.01.22-2020.03.04,"500,000원"
277,출판,"혼자여도, 함께여도 좋은 감성충만 맥주&와인 페어링 박스",lazybunny,104%,"1,045,600원",펀딩성공,31,30,"술과 음식, 그리고 이야기가 필요한 시점마다 요긴하게 활용할 수 있는 '슬기로운 주류생활을 위한 페어링 박스'를 소개해드리겠습니다.",2018.08.27-2018.09.09,"1,000,000원"
278,출판,IDEO HCD Toolkit 한국어판 출판 ,MYSC (주)엠와이소셜컴퍼니,103%,"7,828,000원",펀딩성공,176,11,세계적인 디자인 그룹 IDEO가 내놓은 인간중심의 디자인 방법론 <HCD: Human Centered Design Toolkit>. 디자이너 뿐 아니라 모든 사람들이 내 주변의 문제를 인식하고 해결하는데 도움이 되는 방법론이 '한정' 한국어판으로 제작됩니다. 어렵게만 생각되는 사회혁신의 첫걸음을 HCDtoolkit으로 배워보세요!,2014.02.07-2014.03.31,"7,600,000원"
279,출판,함께 피워내는 봄꽃 같은 소설 &lt;얼음새꽃&gt;,정현석,103%,"4,133,000원",펀딩성공,108,1,"예술은 천천히, 그러나 쉽게 세상을 바꿀 수 있다고 믿습니다. 많은 이들이 지금 이 순간에도 주위의 시선 속에 꿈을 포기하고 있습니다. 저마다의 뜻에 공감하는 이들이 모이면 끝내 빛을 볼 수 있다는 희망이 될 수 있다는 것을 작가와 독자가 함께 만드는 소설 '얼음새꽃'을 통해 보여주고 싶습니다.",2014.11.06-2014.12.10,"4,000,000원"
280,출판,[한글이나르샤] 소리와 글자로 쉽게 익히는 우리아이 첫 한글책!,(주) 가온한국어,103%,"2,065,000원",펀딩성공,40,13,소리와 글자로 익히는 우리 아이 첫 한글책!,2016.09.27-2016.10.27,"2,000,000원"
281,출판,당신의 제품엔 브랜딩이 필요하다! 브랜딩 지침서 <브랜딩 고유감각>,테이콘커뮤니케이션즈,103%,"517,000원",펀딩성공,22,10,당신의 제품엔 브랜딩이 필요합니다.,2020.06.23-2020.06.29,"500,000원"
282,출판,"내 마음을 돌보는 심리도구, 열기카드",이소인문상담소,102%,"2,042,000원",펀딩성공,50,35,"대화를 열고 마음으로 만나는 소통의 도구, 이소 열기카드",2019.06.27-2019.08.04,"2,000,000원"
283,출판,면접으로 직행하는 자기소개서 작성법!,에이앤케이컴퍼니,102%,"514,000원",펀딩성공,14,17,지금도 취업으로 마음을 졸이며 준비하고 계실 취준생 여러분들께 자소서로 고민하는 시간을 조금이라도 덜어드리고자 하는 마음에서 시작하게된 자소서 작성가이드 프로젝트입니다.,2020.10.11-2020.10.26,"500,000원"
284,출판,최경일쌤의 컬러링북 시즌2,최경일쌤 (최경일),102%,"1,483,500원",펀딩성공,29,6,* 펀딩 후원금 사용 계획,2019.08.30-2019.09.22,"1,450,000원"
285,출판,국내 최초의 크라우드펀딩 서적 출판에 직접 참여하세요!,크라우드산업연구소,101%,"3,050,000원",펀딩성공,101,6,"크라우드펀딩...여기저기서 많이 들어 궁금한데, 마땅히 읽을만한 책이 없습니다.",2013.09.17-2013.12.31,"3,000,000원"
286,출판, <오늘이 내 인생의 봄날입니다>도서출간에 힘을 보태주세요,다산북스,101%,"1,017,400원",펀딩성공,43,13,당당하게 오늘의 인생을 찾는 할머니들의 외침!,2020.06.12-2020.06.30,"1,000,000원"
287,출판,2018년 한해를 되돌아 보는 2019년 한국보도사진전 달력,한국사진기자협회 & 뉴스포픽,101%,"1,014,000원",펀딩성공,8,5,바쁘게 지나온 올 한해의 발자취를 2019년 보도사진상 달력으로 만나보세요.,2018.11.28-2018.12.26,"1,000,000원"
288,출판,"30대 아티스트로 살아가기, Jack Kim's Story",맨션나인 주식회사,101%,"509,500원",펀딩성공,46,13,"이 책은 아티스트 Jack Kim으로 활발히 활동하고 있는 30대 비전공자 김성호작가의 창작의 모티브와 현실속에서 꿈을 꾸고, 이루기 위한 노력이 담긴 모습의 에세이북입니다.",2019.10.18-2019.12.01,"500,000원"
289,출판,엄마가 새겨주는 후천적 부자 DNA,조상경 (조상경),101%,"509,800원",펀딩성공,31,23,부자 엄마가 아니더라도 물려줄 수 있는 유산이자,2020.10.06-2020.11.11,"500,000원"
290,출판,"소규모 독립출판 프로젝트, 청춘백화",청춘백화,100%,"544,000원",펀딩성공,78,10,"청년들에게 출판이라는 경험이 단순히 자신의 이야기를 인쇄물로 만드는 작업이 아니라, 자신의 가치관이나, 생각, 경험, 그리고 꿈을 풀어낼 수 있는 일련의 예술적 과정이 될 수 있도록, 출판기획(Book Consulting), 디자인(Book Design), 편집의 과정을 함께 만들어가는 청년 독립출판 프로젝트입니다.",2014.01.29-2014.06.13,"540,000원"
291,출판,"길엔터테인먼트의 어른동화, 인형의 별을 함께 만들어주세요",길 엔터테인먼트,100%,"3,000,000원",펀딩성공,24,2,"5월 11일 일요일 오후 4시에 서울시청에서 초연하는 공연 '인형의 별'의 공연 제작 비용을 모금하고, 향후 상설공연 진행시 문화소외계층에 공연관람 및 찾아가는 문화활동을 할 수 있는 기반을 다지기 위해 이렇게 프로젝트를 시작하게 되었습니다! 이 뜻깊은 공연이 잘 만들어질 수 있도록 함께 참여해주세요!",2014.04.10-2014.04.30,"3,000,000원"
292,출판,"장애인 문학동아리의 창작동화 출판기, 어린이들에게 꿈을 선물합니다",(주)파스칼,100%,"1,504,000원",펀딩성공,47,1,장애인문학동아리 [구르는 달팽이]의 출판기! 함께하는 세상을 만들기 위한 이들의 꿈을 응원해주세요!,2014.12.24-2015.02.05,"1,500,000원"
293,출판,지역아동센터 아동들을 위한 놀이책 [V-코칭북],(주)HUVE,100%,"3,023,000원",펀딩성공,238,0,세상에서 사람들을 가장 많이 움직이게 하는 기업 HUVE!,2015.03.12-2015.04.08,"3,000,000원"
