,categories,title,company_names,percentages,funding_amounts,days_left,n_supporters,likes,descriptions,durations,target_amounts
994,테크·가전,"[앵콜] 세계최초헤더형 물청소기 ""스위틀"" : 먼지와 오염을 세척한다!!",SETOWORKS,1039%,"31,198,050원",펀딩성공,232,166,"<최종 앵콜> 반려 동물 키우세요? 자주 흘리세요? 카페트, 쇼파, 매트리스 오염은 어떻게 제거하세요? 가족과 반려동물을 위한 세계최초 헤드형 물청소기 스위틀로 간단하게 세척하세요",2018.09.22-2018.10.07,"3,000,000원"
995,테크·가전,휴맥스 와이파이 삼형제와 함께라면 인터넷 어디든 갈 수 있어요!,휴맥스 ,1037%,"10,371,000원",펀딩성공,80,157,이런 공유기 어떠세요? 툭! 탁! 톡! 이 세단계 하나면 휴맥스 와이파이 삼형제와 함께 여러분의 인터넷 생활이 더 자유로워질 거에요!,2018.10.30-2018.11.30,"1,000,000원"
996,테크·가전,넘치는 흥을 주체할 수 없을 때 ! 모토로라 파티스피커 소닉맥스810,주식회사 크레앙,1036%,"10,362,000원",펀딩성공,96,207,"소닉맥스 810은 모토로라의 강력한 베이스 사운드를 가진 무선 파티 스피커로 가장 중요한 소비자인 한국 소비자, 그 중 와디즈 서포터님들에게 가장 먼저 선보입니다.",2020.04.14-2020.05.03,"1,000,000원"
997,테크·가전,편하고 푹신한 방석에 온열기능을 더했다! [히츠폼즈 전자파없는 엉따방석],주식회사 현대홈쇼핑,1035%,"10,353,500원",펀딩성공,290,272,"추운겨울,차가운실내에서 몸의 온도를 유지하는것은 매우 중요한데요, 전자파없는 온열방석인데 편안하고 푹신하다면?",2020.10.25-2020.11.04,"1,000,000원"
998,테크·가전,[점프앤고]15초 만에 자동차 방전을 해결하는 방법,주식회사 에너캠프,1035%,"51,791,800원",펀딩성공,413,362,점프앤고 하나면 누구나 15초만에 자동차 방전은 해결할 수 있습니다.,2019.10.29-2019.11.24,"5,000,000원"
999,테크·가전,내가족을 위해 항상 청결하고 깨끗하게 사용할수있는 지라이더 미니선풍기,에스티에이엠 모바일 네트웍스,1033%,"20,673,000원",펀딩성공,884,210,더운 여름 쉽게 더러워지고 오염될수 있는 미니선풍기!  이젠 항상 깨끗하고 청결하게 사용할수 있는 '지라이더 팬'을 사용해보세요!!,2018.03.30-2018.04.10,"2,000,000원"
1000,테크·가전,"우리 가족의 건강을 해치는 유해물질! “센스""로 항상 확인하세요!",(주) 나란,1033%,"20,669,500원",펀딩성공,287,197,"초소형 스마트센서로 언제 어디서나 공기질을 모니터링 하세요! (휘발성유기화합물, 이산화탄소, 온습도, 소음, 조도 등)",2018.05.10-2018.06.29,"2,000,000원"
1001,테크·가전,"최상의 핏, 흔들림 없는 파워풀 사운드 완전무선 스포츠 이어폰 윙스",주식회사 릭,1033%,"51,659,500원",펀딩성공,707,409,움직임에 강하다! 무선이어폰 윙스,2018.07.24-2018.08.19,"5,000,000원"
1002,테크·가전,[브리츠X에디파이어] 게이밍에 극대화된 7.1채널 헤드셋 KG40,디앤비인터내셔널(주),1032%,"15,482,000원",펀딩성공,278,120,음향 전문 제조사 브리츠와 에디파이어가 만났습니다. 절정의 사운드 기술력 그대로 프로게이밍 헤드셋에 입혀 가상 7.1채널로 게임의 몰입감을 극대화 했습니다.,2018.10.24-2018.11.11,"1,500,000원"
1003,테크·가전,[앵콜] 애플 유저를 위한 MFi 인증 2in1 무선충전기 초이패드!,엔인원,1032%,"10,329,000원",펀딩성공,124,191,"[애플 디바이스 전용 2in1 무선충전기 초이패드] 애플 유저를 위한 MFi 인증, 무선충전 안정성을 위한 Qi인증, 한국을 포함한 글로벌 인증까지 취득한 가성비 끝판왕 무선충전기",2020.07.23-2020.08.17,"1,000,000원"
1004,테크·가전,"[앵콜펀딩] 흘러내리지마! 닌텐도 링핏 유저를 위한 필수품, 링핏 홀더!",제너럴마켓 주식회사,1032%,"5,162,000원",펀딩성공,211,138,"닌텐도 스위치 링핏 어드벤처를 제대로 즐기기 위한 필수 아이템, 링핏 홀더!",2021.03.30-2021.04.13,"500,000원"
1005,테크·가전,"[한정수량]유리창, 배란다 외창 청소 힘드시죠 이젠 간편히 클링봇으로",아이뮤즈,1029%,"30,899,000원",펀딩성공,205,440,"유리창 청소기 클링봇은 유리창 외창 청소의  어려운점을 효과적으로 청소할 수 있는 제품이고 그외에도 바닥, 타일, 큰거울 등 다목적으로 사용 가능합니.다",2019.09.06-2019.10.31,"3,000,000원"
1006,테크·가전,선없이 가볍게 붙이기만 하세요! 무선 충전 보조 배터리 [브릭파워],(주)파이스콘,1027%,"20,556,700원",펀딩성공,512,527,무선충전과 보조배터리가 하나로 합쳐진 브릭파워로 이제 복잡한 선과 무거운 무게로 부터 벗어나세요!,2019.07.19-2019.08.18,"2,000,000원"
1007,테크·가전,산업용 공기정화 기술을 일상 생활에! [로바 휴대용&차량용 공기청정기],(주)청우씨엔티,1023%,"10,238,000원",펀딩성공,110,153,공기청정기의 핵심은 '필터'입니다!,2020.02.26-2020.03.12,"1,000,000원"
1008,테크·가전,"마음까지 녹아버리는 닥터에어 미니안마의자 SET, 만날 준비 되셨나요?",닥터에어,1022%,"5,114,000원",펀딩성공,14,40,활기를 되찾게 도와주는 닥터에어 미니안마의자SET로 피곤한 몸을 마사지해주세요.,2019.06.03-2019.06.17,"500,000원"
1009,테크·가전,[아이패드를 맥북처럼] 초슬림 C타입 USB 6in1 허브 Colorii,주식회사 릭,1021%,"30,648,600원",펀딩성공,612,693,하나면 충분! 아이패드 프로를 맥북 처럼 활용하고자 하면 필요한 아이템이 너무 많았습니다. 6in1 C타입 USB 허브 코로리로 C타입 디바이스의 한계를 해소해 보시기 바랍니다.,2019.10.01-2019.10.31,"3,000,000원"
1010,테크·가전,타자기를 닮은 레트로 기계식 키보드 페나,엘레트론 코리아,1019%,"101,965,900원",펀딩성공,564,558,PENNA는 타자기를 닮은 레트로 무선 기계식 키보드를 개발하는 프로젝트입니다. PENNA와 함께라면 당신의 모바일기기가 빈티지 타자기가 됩니다.,2018.05.02-2018.05.27,"10,000,000원"
1011,테크·가전,폰케이스에 꽂는  일체형 블루투스 무선 이어폰 'NOW(나우)',NOW(아이티디자인),1018%,"10,188,800원",펀딩성공,170,212,무선 이어폰이 스마트폰에 꽂혔다. 외출할때 스마트폰 따로 무선 이어폰 따로 챙기셨나요? '휴대성 갑' 폰케이스 일체형 코드프리 블루투스 무선 이어폰 'NOW',2018.08.30-2018.09.30,"1,000,000원"
1012,테크·가전,"[150개 한정ㅣ앵콜 ] 견고하게, 가볍게, 넓게. 포터블 모니터 Z1",쿨디자인,1018%,"30,546,000원",펀딩성공,192,353,"디자인 브랜드 LEPOW의 포터블 모니터 ""Z1""의 앵콜 펀딩입니다.",2020.02.20-2020.03.01,"3,000,000원"
1013,테크·가전,[앵콜]음악을 즐기는 새로운 방법 : Cork Speaker,(주)이디연,1017%,"20,347,000원",펀딩성공,429,181,"나의 공병이 스피커가 되다. 사용하고 남은 공병들, 버리지 말고 Cork와 결합하여 음악을 즐겨보세요. 블루투스스피커의 고정관념을 깬 Cork를 소개합니다.",2017.09.12-2017.10.09,"2,000,000원"
1014,테크·가전,"깐깐하게 만든 고성능 로봇청소기: 앱으로 작동하고, 물걸레까지! ",UDISCOMPANY,1015%,"50,789,000원",펀딩성공,256,255,"스마트 로봇청소기.거품 없는 가격으로 '청소기의 본질'에 승부하겠습니다. 가격 거품은 '제로', 품질과 성능은 '제대로! 국내 로봇청소기 크레타!",2018.10.23-2018.11.18,"5,000,000원"
1015,테크·가전,1264% 앵콜! <인공지능 프리미엄 청소기> 눌러주고 잡아주면 청소 끝,주식회사 좋은생활청담,1014%,"30,442,000원",펀딩성공,66,111,이제 청소기도 말을 한다! 자동으로 먼지를 감지해서 강력하게 청소하고 청소기의 상태를 음성으로 알려주는 스마트시스템을 장착한 똑똑한 청소기로 편리함을 맘껏 누리세요!,2021.03.30-2021.04.12,"3,000,000원"
1016,테크·가전,[KBS 특집 앙코르] 공병을 활용한 Cork 스피커,이연택 (이연택),1012%,"20,244,700원",펀딩성공,462,106,"Cork 는 버려지는 병을 재사용하여 스피커의 음질을 향상시키고, 소리를 증폭시키는 블루투스 스피커 제품입니다.",2016.07.29-2016.08.26,"2,000,000원"
1017,테크·가전,"소중한 사람을 지켜주세요!  내 손안의 보디가드  “247CASE"" ",247INC.,1012%,"10,128,500원",펀딩성공,52,61,어서와~ 이런 아이폰 케이스는 처음이지?,2017.10.24-2017.11.10,"1,000,000원"
1018,테크·가전,[자세 관리 끝판왕] 스마트 방석 백키퍼와 함께하는 슬기로운 의자생활,주식회사 에이치씨랩,1012%,"10,125,000원",펀딩성공,73,111,스마트 방석 백키퍼와 앱으로 '자세 관리' 한 번에 끝내보세요! 백키퍼만이 알고 있는 내 자세의 모든 것.,2020.06.11-2020.07.06,"1,000,000원"
1019,테크·가전,올여름 미리 준비하는 작고 가벼운 2인치 미니선풍기,주식회사 트로닉,1009%,"5,047,200원",펀딩성공,242,137,"2인치 폴딩팬은 트로닉 자체 공장에서 설계, 제작을 모두 진행한 제품입니다. 특히 다른 미니 선풍기와 다르게 자력이 있어 어디든 원하는 곳에 붙여 사용가능한 제품입니다.",2019.05.16-2019.05.24,"500,000원"
1020,테크·가전,"[5천만원 앵콜펀딩] ""사운드 허브"" - 올인원앰프 & 하이파이 스피커",에이케이시스(주),1009%,"20,181,000원",펀딩성공,95,269,10가지 이상의 외부 연결 / 콤팩트한 사이즈 / 심플한 디자인에 뉴트로 감성 / 하이파이 시스템에 버금가는 올인원 앰프와 고음질 스피커의 조합을 지금 와디즈에서 만나보세요!,2020.12.16-2021.01.11,"2,000,000원"
1021,테크·가전,"[루블루 TV] 나에게 딱 맞는 스마트 TV, 비쌀 필요 있나요?",루블루 TV,1005%,"100,527,000원",펀딩성공,205,483,"요즘은 스마트 TV가 대세다? 스마트 TV 의 ""핵인싸"" 루블루TV를 소개해 드립니다.",2019.12.10-2019.12.22,"10,000,000원"
1022,테크·가전,[다이슨 필수템] 트리거 버튼 계속 누르지 말고 이제 한번만 누르세요!,Home Lab (신윤정),1004%,"5,022,700원",펀딩성공,369,106,다이슨 참 많이 사용 하시죠?  그런데 다이슨은 왜? 트리거를 계속 누르고 청소 해야 하나요? 이제  다이슨용 트리거 파워 버튼으로 한번만 눌러 주세요. 청소가 정말 편해집니다.,2018.12.13-2019.01.06,"500,000원"
1023,테크·가전,"갈고,다지고,삶고 올인원! 원더우먼 필수템 [베네프]",(주)제이월드텍,1003%,"10,034,500원",펀딩성공,58,102,"시간은 줄이고, 건강은 올리고~! 이제는 베네프로 편리하고 간편하게~!",2020.10.26-2020.11.09,"1,000,000원"
1024,테크·가전,모든 시간을 다 관리하다. 모든 타이머가 다 뭉쳤다. '위너카운터-X',이소탄,1003%,"5,015,300원",펀딩성공,256,275,우리가 알고 있던 모든 타이머가 뭉쳤다. 디데이기능까지 무장한 어벤져스급 타이머,2021.03.05-2021.04.23,"500,000원"
1025,테크·가전,삼겹살 1근을 10분만에 알아서 구워주는 [베스타노 IH 인덕션 오븐],(주) 성신이엔씨,1002%,"100,274,000원",펀딩성공,471,1085,"구이, 볶음 요리부터 국물 있는 요리까지 하나로 가능한 베스타노 인덕션 오븐입니다. 강력한 화력으로 삼겹살 1근을 10분만에 알아서 익혀주는 베스타노 인덕션 오븐을 만나보세요.",2020.12.21-2021.01.11,"10,000,000원"
1026,테크·가전,"[160대한정] 신나는 라이프스타일, 출퇴근 전기자전거 <미니벨로 F1>",(주)코엔지,987%,"29,637,000원",펀딩성공,82,225,"확실한 사후관리 서비스 코리아바이크, 와디즈를 통해 첫 제품 런칭!",2020.09.25-2020.10.05,"3,000,000원"
1027,테크·가전,"일잘러가 되기 위한 15분, 15초 워크워치 살리",엑스토(EXSTO),984%,"4,920,600원",펀딩성공,214,221,어디든 부착할 수 있으니까! 필요할 때 볼 수 있고! 덕분에 일잘러가 될 수 있고! 시간을 살리는 워크워치 살리!,2021.01.04-2021.01.15,"500,000원"
1028,테크·가전,"애플도 인정한 4만원 대 스마트 홈카메라 ""걱정되면 eufy 하세요""",(주)디스티팩토리,979%,"97,903,895원",펀딩성공,"1,591",1165,"태어날 아기와 산모, 초보아빠를 위한, 평생을 함께할 반려동물을 위한 스마트 홈카메라를 만나보세요! 2K 고화질과 모션트래킹, 실시간 음성대화, 지정 구역 설정과 자동 응답까지!",2020.10.19-2020.11.02,"10,000,000원"
1029,테크·가전,목표 달성을 위한 시간 측정부터 관리까지! 이제는 시작할 때,레밋,974%,"9,745,000원",펀딩성공,170,368,회전을 통해 '기록'하고 어플리케이션에서 '관리'하세요. 어느새 인가 목표가 이루어져 있을 겁니다!,2020.05.15-2020.07.01,"1,000,000원"
1030,테크·가전,"귀를 열고 음악을 듣는 골전도 블루투스 헤드폰 ""OYE"" ",LAB OF 404,973%,"48,681,000원",펀딩성공,906,347,프리미엄 음질과 최고의 품질로 손과 귀를 자유롭게.,2017.07.18-2017.08.17,"5,000,000원"
1031,테크·가전,음식의 적정온도를 알아서 맞춰주는 <BBZCOOK 스마트 보온 식기>,라이프어스,972%,"4,862,800원",펀딩성공,87,193,음식의 온도를 자동으로 맞춰주는 보온 기능으로 우리 아이에게 따뜻하고 건강한 한끼 식사를 제공해줍니다.,2020.12.29-2021.01.18,"500,000원"
1032,테크·가전,[청소기 끝판왕] 쓸고 닦고 스스로 세척까지! 하나로 다하는 무선 청소기,주식회사 디티엘코리아,970%,"97,002,000원",펀딩성공,447,1577,"생활먼지 부터 음료수 청소까지! 20만원대 무선청소기 WYPE. 스스로 세척하고 미세먼지 걱정없는 새로운 개념의 무선청소기, 거품없는 가격으로 와디즈에서 선보입니다!!",2021.01.29-2021.03.12,"10,000,000원"
1033,테크·가전,추억을 담는 7 in 1 촬영 디바이스 : 셀디,주식회사 마이포브,969%,"29,090,000원",펀딩성공,321,193,"우리 인생에서 우리는 배우이자 감독입니다. 전세계에서 가장 많이 사용되는 카메라 스마트폰으로 우리 일상을 촬영하는 감독이 되어보세요.  스마트폰, 셀디, Be a director!",2017.10.07-2017.10.29,"3,000,000원"
1034,테크·가전,[버그클린] ABS-1000A 모기 & 해충 퇴치기,(주)오르다,966%,"28,996,500원",펀딩성공,461,625,LED를 이용한 차세대 저소음 가정용/캠핑용 전격살충기 해충퇴치기 버그클린(BugClean)과 효과적으로 모기 및 해충 퇴치를 위한 솔루션 제공,2018.04.10-2018.05.10,"3,000,000원"
1035,테크·가전,내 자동차의 문콕으로 인한 상실감은 컨티아이의 디펜스가 지켜준다.,컨티아이,966%,"9,666,000원",펀딩성공,210,141,"[상상도 못할 간편함]특허받은 차량용 문콕 방지 용품 ""디펜스""로 여러분의 소중한 차량을 보호하세요.이제 내 차의 문콕 방지 ""디펜스""가 도와드리겠습니다.",2019.02.26-2019.03.31,"1,000,000원"
1036,테크·가전,지구최강 100W 정격! PD3.0+QC3.0 통합 올인원 고속충전기!,파워베슬(펀디안),959%,"28,793,500원",펀딩성공,496,324,노트북+맥북+스마트폰+아이폰+서피스+닌텐도스위치를 모두 지원하는 하나의 기기! PD3.0+QC3.0 최신 고속충전 표준 기술로 무장한 파워베슬! 일체형 스탠드 가로/세로 거치 지원,2018.07.31-2018.08.30,"3,000,000원"
1037,테크·가전,"[유미스] 건강한 먹거리의 시작,전자동 진공포장기",yumyth,956%,"28,692,800원",펀딩성공,354,274,"전자저울을 탑재하여 음식물을 소분하고,원터치 전자동 진공 포장하세요.식탁을 더 맛있고 신선하게, 유미스 전자동 진공포장기",2019.03.06-2019.03.27,"3,000,000원"
1038,테크·가전,집안의 모든 리모컨 이것 하나로 해결!! 휴대간편 사용간편 통합리모컨,(주)마이미디어,956%,"4,784,000원",펀딩성공,367,192,"모든 리모컨을 하나로 통합하여 핸드폰에서 사용할수 있는 초소형  리모컨을 소개합니다.  에어컨,TV, 유선방송,선풍기,청소기, 조명,오디오 등 국내 대부분의 리모컨을 지원합니다.",2020.07.06-2020.07.20,"500,000원"
1039,테크·가전,"숲에서 살 수 없다면, 집에 숲을 들이세요! <아쿠아팟플러스> ",홈톡스닷컴,951%,"9,518,000원",펀딩성공,91,171,"바람, 물, 초록빛 풀들과 작은 물고기까지.",2019.06.25-2019.07.21,"1,000,000원"
1040,테크·가전,360도 스마트 회전 셀카봉 삼각대,(주)디엠케이코리아,949%,"9,497,000원",펀딩성공,335,349,더 다양하고 생생한 각도로 찍자! 자동으로 360도 회전하는 셀카봉 출시!,2020.04.08-2020.05.01,"1,000,000원"
1041,테크·가전,[앵콜]서포터 요구를 앵콜로 응답! 맥북+닌텐도스위치+C타입모바일 컨버터,펀디안(주),947%,"28,420,000원",펀딩성공,406,512,"3명의 피드백, 3일간의 논의, 3주만의 신제품 개발! 의미있는 앵콜로 돌아왔습니다. C타입 도킹스테이션의 명가 벤션의 플래그십, C타입 기능 확장 필수품 ~ 올인원 컨버터",2020.05.29-2020.06.22,"3,000,000원"
1042,테크·가전,[1초컷 태블릿스탠드] 완성도 있게 업그레이드되어 돌아왔어요!,주식회사 엠피큐레이션,947%,"4,738,500원",펀딩성공,145,216,"[1초컷 폴드스탠드 시리즈] 스마트폰, 랩탑에 이어 이번엔 태블릿이다. 2만원대의 합리적인 가격으로 태블릿을 업그레이드 하세요.",2021.01.05-2021.01.25,"500,000원"
1043,테크·가전,[프로직딩마우스] 손목건강사수!만능 프리젠터 겸 펜그립마우스<트랙포인트>,트렌드기어,941%,"47,083,800원",펀딩성공,437,461,언제까지 보급형 버티컬마우스로 손목통증과 생산성을 기대하려 하는가! 초미니*펜그립 디자인*에어 마우스에 최신 스마트 프리젠터 기능까지 품은 마우스계의 아이폰!,2019.11.05-2019.11.24,"5,000,000원"
1044,테크·가전,[글로벌19억] 초광각 영화촬영이 가능한 SIRUI 24mm애너모픽 렌즈,대광엔터프라이즈,939%,"28,183,000원",펀딩성공,37,79,[글로벌펀딩 19억 달성] 광각으로 만나는 영화 같은 영상 SIRUI 24mm 애너모픽 렌즈!,2021.03.17-2021.04.07,"3,000,000원"
1045,테크·가전,노마드 아이폰12 맥세이프 가죽 케이스 [ 국내독점 ],(주)인포바이더,938%,"4,691,450원",펀딩성공,100,85,노마드(NOMAD) 프리미엄 가죽 맥세이프 케이스를 국내 최초로 만나보세요!,2021.03.12-2021.03.29,"500,000원"
1046,테크·가전,"스탠드 & 패드 변신이 가능한 듀얼모드, 언제나 고속 무선충전하세요.",빅쏘코리아,936%,"9,362,100원",펀딩성공,258,288,듀얼모드로 스탠드 또는 패드로 사용이 가능한 고속 무선충전기 입니다. 듀얼 코일로 대형 스마트폰 까지 가로 또는 세로 거치가 가능합니다. 서포터분들께 새롭게 공개합니다.,2020.08.04-2020.08.31,"1,000,000원"
1047,테크·가전,원터치로 UV샤워하자! 살균 모니터 받침대 nocnoc base S200,주식회사 모스터일렉,932%,"9,325,000원",펀딩성공,141,304,사용하는 모니터는 달라도  받침대는 무조건 [nocnoc base S200]. 원터치 UV살균을 지원하는 nocnoc의 기술로  당신의 책상 위 건강에 노크(KNOCK)하세요!,2020.12.18-2021.01.18,"1,000,000원"
1048,테크·가전,드라이버가 가질 수 있는 능력의 끝! -스피너 드라이브,폭스아이디어,932%,"9,321,200원",펀딩성공,123,269,"드라이버가 가질 수 있는 능력의 끝! 기본 + 정밀 + T-핸들, 이 모두를 대체할 단 하나의 공구 - 스피너 드라이브 (Spinner Drive)",2019.07.18-2019.09.01,"1,000,000원"
1049,테크·가전,충격과 보안에 특화된 외장하드는 에이데이터 러기드 뿐입니다.,에이데이타(ADATA),930%,"13,959,500원",펀딩성공,114,96,소중한 데이터를 안전하게 보관할 수 있는! ADATA 러기드 외장하드 HD330 신제품 출시!,2018.08.03-2018.08.26,"1,500,000원"
1050,테크·가전,[진공청소+ 물걸레 청소+핸디형까지?] All In One 바로바로청소기,에이티테크놀로지(주),927%,"13,918,500원",펀딩성공,84,259,"진공청소기와 물걸레 청소기, 핸디형 청소기를 하나에 담았습니다.",2020.01.31-2020.02.12,"1,500,000원"
1051,테크·가전,호흡으로 혁신을? 호흡 훈련 디바이스와 함께하는 바른 호흡 프로젝트!,주식회사 휴원트,927%,"9,271,000원",펀딩성공,241,300,"호흡이 중요하다는 사실 알고계시죠? 잠자는 시간도 부족한 현대인의 생활 속, 한 숨 돌릴 여유도 없다는 슬픈 현실! 브리드-온과 함께 게임을 통해 건강하고 바른호름을 시작하세요!",2020.10.21-2020.11.10,"1,000,000원"
1052,테크·가전,아로마테라피의 향을 기분따라 시간따라 바꾸는 미래형 디퓨저 <에이온리>,주식회사 에이온리,924%,"9,244,300원",펀딩성공,126,194,버튼을 누르는 순간 그곳이 숲으로 꽃밭으로 산으로 변화됩니다. 향기를 누리는데 필요했던 모든 불편함은 에이온리가 해결했습니다. 나만의 힐링장소를 만들어보세요,2020.05.26-2020.06.03,"1,000,000원"
1053,테크·가전,"직장인을 위한 데스크테리어 IT템, 퀵셀패드 엑셀/한글/포토샵",오네어(ONAIRE),922%,"9,228,500원",펀딩성공,396,457,#엑셀단축키 #직장인선물 #오피스템 #데스크테리어 #취업선물,2021.03.09-2021.03.31,"1,000,000원"
1054,테크·가전,[4.9점 앵콜] 무선충전+손목받침+장패드를 하나로! 책상 위 필수템!,(주)맥스컴코리아,918%,"9,188,900원",펀딩성공,223,266,"책상 위에 정말 필요한 기능들을 한번에 모았어요. 무선충전부터 거치대, 손목보호대까지 구성된 스위스 밀리터리 무선고속 충전 패드입니다. 업무력 상승은 덤!",2019.11.11-2019.11.25,"1,000,000원"
1055,테크·가전,"책 없이 시작하는 우리 아이 독서 습관, 책 읽어주는 TV <아이윙TV>",아이윙,911%,"18,238,000원",펀딩성공,77,46,"책 읽기 싫어하는 우리 아이, 유튜브를 보여주기에는 불안하다면? 유튜브보다 재미있으면서 감성을 풍부하게 만들어주는 동화가 카드 한 장에 쏙! <아이윙TV>",2019.04.12-2019.05.01,"2,000,000원"
1056,테크·가전,배터리 없는 신기한 무선 스위치와 디자인 멀티탭 [비스킷&버터],(주)커널로그,903%,"27,096,600원",펀딩성공,579,764,우리 집을 똑똑하게 해줄 비스킷과 버터를 소개합니다.,2019.04.23-2019.05.26,"3,000,000원"
1057,테크·가전,클래스가 남다른 더클래스 양가죽 핸들커버 (고급스러움과 정성을 가득담아),주식회사 차바치,903%,"9,037,800원",펀딩성공,247,221,"차바치가 직접 만든 인조가죽, 소가죽도 아닌 양가죽의 고퀄리티 핸들커버로 텐션이 좋은 부드러운 가죽으로 인체에 무해하며, 핸들 열전도율이 빠르며 그립감이 좋아 선물용으로도 굿!",2021.01.20-2021.02.19,"1,000,000원"
1058,테크·가전,반려동물 키우세요? 아이 키우세요? 스위틀 하나로 물 청소 고민 끝!,SWITLE,898%,"17,960,500원",펀딩성공,181,255,"매트리스, 카페트, 쇼파, 카 시트 등에 흘린 반려동물의 배설물, 음식물, 미세먼지, 얼룩 등 이젠 물로 깨끗하게 '세척'하세요!  스위틀이 더 멋지고 강력해져 돌아왔습니다.",2020.02.14-2020.03.09,"2,000,000원"
1059,테크·가전,내 차에 꼭 필요한 공기청정기+차량용 고속 충전기+케이블 올인원 키트!,(주)맥스컴 코리아,893%,"8,937,000원",펀딩성공,158,239,"쾌적한 드라이빙의 시작, 소중한 나에게 주는 신선한 공기, 독보적 듀얼 고속 충전 탑재 ! 청정한 공간 속에서 소중한 사람들과 즐겁고 건강한 무빙 라이프를 시작해보세요~!",2020.01.09-2020.01.28,"1,000,000원"
1060,테크·가전,[평점5점 만점! 앵콜!] 그립감! 구분감! 위생을 모두 갖춘 허니터치,주식회사 엘앤제이,892%,"4,464,400원",펀딩성공,243,135,'내' 손이 닿는 모든 물건에 사용이 가능한 위생패치 [허니터치] - 최고의 그립감과 구분감을 느껴보세요!,2020.05.25-2020.06.14,"500,000원"
1061,테크·가전,"LP 턴테이블과 블루투스 스피커를 품은 하이브리드 음향기기, DUO",(주)사운드솔루션,892%,"44,618,000원",펀딩성공,183,345,음악을 즐기는 가장 최신의 방법,2019.07.15-2019.08.04,"5,000,000원"
1062,테크·가전,번호판이 또렷하게! 번호판 집중촬영모드 블랙박스로 주차 뺑소니 걱정 끝!,(주)에이치아이디솔루션,892%,"44,605,000원",펀딩성공,206,309,"블랙캠의 CAT-X는 전,후방 모두 번호판 식별이 가능한 고화질로 10배나 많은 영상 파일을 저장 할수 있는 뛰어난 블랙박스 입니다.",2020.10.24-2020.11.16,"5,000,000원"
