,categories,title,company_names,percentages,funding_amounts,days_left,n_supporters,likes,descriptions,durations,target_amounts
1511,테크·가전,"쾌적한 실내환경, IoT 온습도계 터치등 미나엘E로 만들어보세요!",(주)엘센,278%,"5,567,000원",펀딩성공,122,42,IoT기술을 이용해 쾌적한 생활을 하고 싶으신가요?<br>,2017.01.12-2017.02.11,"2,000,000원"
1512,테크·가전,상상만 하던 가상현실 세상! [오리얼 글래스]로 리얼~ 하게 즐기자!,버넥트,276%,"2,764,700원",펀딩성공,78,18,"“심심한 오늘, 콘서트에 갈까? 우주 여행이나 해볼까?”",2016.02.29-2016.03.31,"1,000,000원"
1513,테크·가전,캠핑에서 개운한 숙면을? 시원함과 따듯함을 하나로! 4계절 캠핑매트 캠보,온수플러스,276%,"8,304,000원",펀딩성공,54,246,"캠핑에서 전자파 없다는 온수매트를 쓰고 싶으세요? 작게 접고, 배터리로 작동되는 휴대 온수매트가 있다면? 온도까지 스스로 맞춰주는 똑똑함 까지? 4계절 자동온도 조절 온수매트 캠보",2020.08.26-2020.09.14,"3,000,000원"
1514,테크·가전,언제 어디서나 디제잉을 즐기자! 올인원 DJ 장비 고디제이 플러스,(주)제이디사운드,275%,"27,546,000원",펀딩성공,73,77,뻔한 취미는 싫다. 언제 어디서나 즐기는 올인원 DJ 장비. GODJ PLUS.,2018.09.19-2018.09.30,"10,000,000원"
1515,테크·가전,목 베개야? 목 마사지기야? 둘 다! 온열까지 완벽한  <NP2 air>,(주)텐마인즈,275%,"8,258,000원",펀딩성공,57,71,"기다렸던 여행인데 벌써 지칠 순 없지! 여행 필수품 목베개에 온열, 마사지까지 된다면? 텐마인즈 브레오의 프리미엄 목베개 마사지기 NP2 air를 와디즈에서 처음 소개합니다.",2020.07.29-2020.08.10,"3,000,000원"
1516,테크·가전,[1000%달성앵콜] 지친 하루 당신을 위한 홈케어 필수템! 쑥패치 쑥뜸,(주)코리아씨티씨,274%,"1,373,700원",펀딩성공,30,92,"고급스러운 세라믹 본체, 3단계 온도 조절로 효과적인 쑥뜸뜸이! 2년 숙성된 인진쑥으로 만든 쑥패치! 15분 셀프케어! 지친 하루에 생기를 불어 넣으세요! 안정성 태스트 완료!",2020.09.22-2020.10.26,"500,000원"
1517,테크·가전,아이폰 유저들 주목!  스마트폰을 위한 휴대녹음기 iMemo,주식회사 티피오스,273%,"19,130,200원",펀딩성공,499,143,"언제, 어디서나 버튼 하나로 간편한 녹음! 스마트폰을 위한 녹음기 iMemo",2016.07.25-2016.09.15,"7,000,000원"
1518,테크·가전,"단, 하루 10분만에 피부관리 끝! [BlingBelle LED 마스크]",폭서코리아,273%,"2,736,000원",펀딩성공,65,44,"가격 부담 없는 BlingBelle LED 마스크 하나로 단, 하루 10분만 사용하여 당당한 자신의 모습을 만나보세요~!!!!",2019.03.27-2019.04.10,"1,000,000원"
1519,테크·가전,[진정한 미세먼지 측정기]미세:와치 아웃도어/ 미세먼지를 눈으로 보세요!,이노디지털 주식회사,271%,"1,358,000원",펀딩성공,19,55,지금 이 곳!!! 이 시간!!! 미세먼지와 공기질을 정확하게 파악하여 직관적으로 보여주는 미세:와치 아웃도어.,2020.12.24-2021.01.13,"500,000원"
1520,테크·가전,[모니보니프로] 올인원PC에 최신 9세대 데스크톱 CPU를 탑재!,위더스컴퓨터(주),270%,"13,505,000원",펀딩성공,21,88,"이제껏 만나보지 못한 고성능 올인원 PC,",2019.09.30-2019.10.13,"5,000,000원"
1521,테크·가전,누구나 원하는 로봇을 만들 수 있습니다. 마운지 로봇!,골드래빗(주),269%,"26,950,500원",펀딩성공,162,147,"이제 나만을 위한 로봇을 만들어 보세요! 신기하고, 기묘한 모듈 로봇!",2018.02.28-2018.04.13,"10,000,000원"
1522,테크·가전,능동형 솔라셀 아로마 디퓨저 ,자연에너지연구소 주식회사 ,269%,"2,692,000원",펀딩성공,79,64,햇살만 있으면 Power On.,2019.10.01-2019.10.30,"1,000,000원"
1523,테크·가전,클러치OK! 모든 노트북을 담을 수 있는 5만원대 소가죽케이스 [로터프],(주) 인포바이더,268%,"2,682,000원",펀딩성공,56,109,퀄리티 검증 완료! 제대로 만든 하이퀄리티 로터프 가죽 노트북 파우치로 서류케이스부터 클러치백까지 다양하게 활용해보세요,2020.06.10-2020.06.29,"1,000,000원"
1524,테크·가전,[바른자세] 당신의 코어 근육과 허리 건강을 지켜주는 코어랩,앱타이론바이오,268%,"1,340,300원",펀딩성공,51,89,"바른자세, 코어랩으로 코어근육과 허리건강을 챙기세요.",2020.09.22-2020.10.08,"500,000원"
1525,테크·가전,"침입탐지/ 도난방지도 해주는 동그란 ""티머니 GPS 위치추적기"" ",(주)디엔엑스,266%,"8,002,500원",펀딩성공,123,142,"독자적으로 GPS 위치를 전송하고, 티머니로 언제든 결제가 가능하며, 위급시 본능적 동작으로 사이렌 긴급호출을 합니다. 물건과 창문에 올려두면 신속하게 침입탐지를 알려줍니다.",2017.12.22-2018.01.22,"3,000,000원"
1526,테크·가전,한번쓰면 정착하게 되는 태블릿케이스 정착템,디크래프트,266%,"1,332,750원",펀딩성공,32,71,태블릿케이스를 찾아 돌아다니지 마세요!  서포터의 유목생활을 청산하게 도와 줄 태블릿케이스 정착템을 소개합니다.,2019.11.18-2019.12.02,"500,000원"
1527,테크·가전,[일석이조] 고급스러운 디자인 + 향기 + 특별한 기능까지 더하다,주식회사 위즈라이프,265%,"1,326,000원",펀딩성공,23,35,"단순히 고급스럽고 견고한 방향제처럼 보이시나요? 방향제 기능에 특별한 기능을 더한 방향제, 와디즈를 통해 처음으로 여러분께 공개합니다.",2020.09.22-2020.10.07,"500,000원"
1528,테크·가전,롱쉽 360도 VR 보안 카메라,캐링솔루션,264%,"26,464,000원",펀딩성공,309,230,"사각지대는 없다! 내 공간을 스마트하고 안전하게 관리해 주는 히어로,",2019.05.31-2019.06.30,"10,000,000원"
1529,테크·가전,"나만의 깨끗한 공기 보호막, 휴대용 공기청정기 닥터톡톡",세종아이앤텍(주),263%,"11,823,000원",펀딩성공,211,7,나만의 프라이빗 공기청정기 닥터톡톡. 휴대용 미니 공기청정기 닥터톡톡과 함께 언제나 어디서나 깨끗하고 맛있게 숨쉬자!,2015.07.20-2015.08.20,"4,490,000원"
1530,테크·가전,[홈케어 뷰티디바이스] 아름다운 건강을 위한 홈케어 뷰티디바이스 VOMM,주식회사 엠엠코리아,263%,"7,918,200원",펀딩성공,52,67,"예쁜 관리를 집에서도 편하게 즐기는 홈케어 뷰티 디바이스, VOMM !",2021.03.03-2021.03.15,"3,000,000원"
1531,테크·가전,뮤지션이 인정한 혁명템!!! 고음질 무선이어폰 GB-100,GClef,262%,"5,240,600원",펀딩성공,117,90,부드러운 실리콘의 착용감. 뮤지션이 인정한 고음질 혁명템!!! 현장보다 더 생생한 현장음. 듀얼 드라이버 무선이어폰 GB-100,2018.09.21-2018.10.22,"2,000,000원"
1532,테크·가전,톡! 그만하고 말!!로 하세요. 음성 메신저! 보이스잇!!!,주식회사 크레코,262%,"3,412,000원",펀딩성공,58,53,지겨운 잔소리 !  톡으로 보내기엔 뭔가가 빠진듯한 말들 !  혼자 심심할 멍이와 냥이가 걱정될땐 ! 보이스잇!!! 문자나 톡보다는 말로 표현하세요.,2021.02.19-2021.03.25,"1,300,000원"
1533,테크·가전,[와디즈단독최초런칭] 닥터우먼스로빈. 나만의 힐링인싸템 AI미니쿨팬미스트,(주)아시아네트웍스,261%,"1,309,600원",펀딩성공,47,41,"나만의 친구 '로빈'이 살아숨쉬는 교감LED라이트,",2019.06.20-2019.07.21,"500,000원"
1534,테크·가전,"하루에 단15분 내 얼굴에 투자하세요. ""에어웨이브 W""",에어랩,261%,"2,614,200원",펀딩성공,65,121,"피부관리! 시간이 없어서, 여유가 안 되셨던 분들 모두 여기 주목!",2020.01.10-2020.02.09,"1,000,000원"
1535,테크·가전,"[인공지능 명상코치] 단 10분, 세상이 두렵지 않다!",3KH(주),260%,"7,806,000원",펀딩성공,38,49,지친 나를 위로 받고 싶습니다. 도와주세요~ 네.,2019.05.21-2019.06.23,"3,000,000원"
1536,테크·가전,책상에 올려만 둬도 충전이된다고?! 진짜 무선충전기를 경험하세요,주식회사 피알티코리아,258%,"12,939,000원",펀딩성공,221,430,기존 무선 충전의 방식을 탈피하여 한 단계 업그레이드 시킨 새로운 충전방식!,2020.08.19-2020.09.16,"5,000,000원"
1537,테크·가전,"눈으로 즐기는 특별한 음악, 에이플럼 분수스피커",주식회사 에이플럼,258%,"7,760,650원",펀딩성공,191,85,"음악, 귀로만 감상하시나요? 7개의 LED 조명과 분수 효과로 나의 공간을 더욱 아름답게 채워보세요. 파워풀한 사운드와 무선은 기본 옵션입니다.",2019.04.03-2019.04.14,"3,000,000원"
1538,테크·가전,빛을 따라 숨을 쉬어보세요. 오늘 밤 꿀잠으로 [허니슬립 숨(SOOM)],주식회사 허밍랩,257%,"12,869,598원",펀딩성공,55,121,빛의 움직임에 맞춰 호흡을 따라가보면 몸을 편안해지고 깊은 잠에 빠질거에요. 오늘 밤 SOOM쉬며 꿀잠 한 번 자볼까요? [허니슬립 숨(SOOM)]과 함께 편안한 밤 되세요,2020.08.27-2020.09.21,"5,000,000원"
1539,테크·가전,"갓성비, 퍼포먼스 모두 잡은 당신의 키보드 살균 모니터 받침대 ""키클린""",현제작소,257%,"2,001,200원",펀딩성공,43,155,"당신의 키보드를 관리할 멋진 ""풀 커버"" 살균 솔루션",2020.12.11-2020.12.28,"777,000원"
1540,테크·가전,헬렌 :: 나만의 스마트 주얼리,(주)딜리버,257%,"25,753,000원",펀딩성공,900,62,헬렌은 내게 중요한 알림만 진동을 통해 알려주는 스마트 주얼리입니다.,2015.10.05-2015.11.14,"10,000,000원"
1541,테크·가전,시야와 손목을 위한 프리미엄 메탈 노트북 맥북 스탠드 + DIY 패드,파워베슬(펀디안),257%,"5,145,800원",펀딩성공,221,152,"메탈 개방형 구조로 방열은 기본, 3단 각도 조절로 시야각과 손목각을 모두 생각한 프리미엄 노트북 맥북 스탠드! #DIY러버패드 #20kg #최대17인치 #프리미엄CNC메탈",2019.04.29-2019.05.19,"2,000,000원"
1542,테크·가전,입체사운드를 넘어 실시간 3D오디오! 4 in 1 무선헤드셋 MRH,(주)후본,256%,"7,690,000원",펀딩성공,166,141,콘서트의 현장감을 360도로 즐겨라! 입체 사운드를 뛰어 넘은 3D오디오 헤드셋 MRH,2019.07.18-2019.08.07,"3,000,000원"
1543,테크·가전,수경식물재배+어항+공기정화+가습 4in1 아쿠아팟플러스 어항공기정화기 ,홈톡스닷컴,255%,"7,670,000원",펀딩성공,71,85,아쿠아팟플러스 어항공기정화기 탄생으로 새로운 개념의 물생활이 시작됩니다. 원예치료에서도 이용되는 식물관리와 어항관리로 평생반려의 열대어와 수경식물 기르기에 도전해 보세요~,2018.12.26-2019.01.31,"3,000,000원"
1544,테크·가전,내 탈모는 운명? 지금 크로마흐 오리지널 팩으로 확인하세요,크로마흐(주),253%,"12,689,000원",펀딩성공,64,7,"""나는 유전적으로 탈모 인가?"" ""우리집안은 탈모가 없는데... 난 왜이리 불안하지..."" 지금까지 고민해오던 탈모에 대한 불안감.... 초정밀 유전자 추출 기술을 보유한 크로마흐의 오리지널 팩을 통해 지금 바로 확인해 보세요~",2015.10.01-2015.11.24,"5,000,000원"
1545,테크·가전,마블 어벤져스 프리미엄 고속충전 패드,에스에스트레이드,253%,"1,268,069원",펀딩성공,51,44,"시장출시전 와디즈 서포터들에게 제품의 대한 가격혜택을 드리고, 마켓테스트와 PR을 진행하고자 프로젝트를 진행하게 되었습니다. 많은 성원 부탁드립니다.",2019.09.20-2019.10.02,"500,000원"
1546,테크·가전,겨울에만 쓰는 가습기? Nope 사계절 잇템! [스노우볼 가습기],모노큐브,253%,"7,610,210원",펀딩성공,154,199,가습기는 한철이라구요?!!,2019.11.21-2019.12.13,"3,000,000원"
1547,테크·가전,꾹! 누르면 끝! 오토 코드와인딩기술로 전선엉킴없는 전문가용 헤어드라이어,(주)엠앤에스코리아,253%,"1,265,000원",펀딩성공,51,92,꾹! 누르면 코드정리 끝!,2019.11.22-2019.12.08,"500,000원"
1548,테크·가전,TV 소리를 스마트폰으로 들려주는 : 뮤트캐스트 (공짜 라디오는 덤),(주) 뮤트캐스트,252%,"5,049,400원",펀딩성공,54,66,"육아, 수험생 가족 여러분! 눈치 보면서 TV 보느라 고생 많이 하셨습니다. 이제 TV 소리를 스마트폰으로 편안하게 즐기세요.",2018.04.30-2018.05.31,"2,000,000원"
1549,테크·가전,[로밍 패스] 해외에서 내 전화번호 그대로! 음성통화와 SMS를 그대로!,비씨앤엠(주),251%,"2,517,500원",펀딩성공,54,125,"토도스홈은 값 비싼 로밍을 하지 않아도, 해외에서도 국내처럼 내 전화번호 그대로 음성통화, SMS 문자를 사용할 수 있는 서비스를 제공합니다.",2019.11.11-2019.12.01,"1,000,000원"
1550,테크·가전,물리학과 미학의 만남: 차량용 트롬베 텀블러 재떨이,(주)토네이도시스템즈,250%,"5,019,000원",펀딩성공,187,66,담배 꽁초에서 나오는 냄새와 애연가를 향한 주변의 따가운 시선으로부터 해방시켜 주는 과학적이고 심미적인 자동소화 기능의 텀블러재떨이 입니다.,2018.08.07-2018.09.03,"2,000,000원"
1551,테크·가전,국내에서 직접 디자인하고 개발한 신지모루의 전동 거치대 오그랩 미니!,(주)신지모루,249%,"24,969,500원",펀딩성공,"1,011",295,국내에서 디자인하고 개발한 믿을 수 있는 제품! 완벽한 성능을 자랑하는 전동 거치대를 합리적인 가격에 와디즈에서 먼저 만나볼 수 있습니다.,2018.11.01-2018.11.19,"10,000,000원"
1552,테크·가전,"[청정프로젝트]사랑하는아이와반려동물을위한99.9% 살균""스마트 퓨어""",티엔씨퍼스트(주),248%,"12,416,000원",펀딩성공,42,42,말 못하는 아이들과 반려동물이지만,2017.08.28-2017.09.25,"5,000,000원"
1553,테크·가전,"[스마트빔 터치] 바닥, 책상, 벽, 우리 집 모든 곳을 터치해 보세요.",Smart Beam Touch (이노아이오),247%,"24,772,000원",펀딩성공,87,223,"소중한 가족과 함께 언제 어디서든 17"" 터치 화면을 즐길 수 있다면 어떨까요? '스마트빔 터치'가 새로운 경험을 선사합니다",2019.02.15-2019.03.03,"10,000,000원"
1554,테크·가전,공기 청정이 끝이 아니다! 살균까지 되는 에코5 미니 공기청정살균기,에이파파,245%,"7,352,600원",펀딩성공,53,191,"공기 청정이 끝이 아닙니다. 청정 뿐만아니라 살균, 탈취 기능까지 갖춘 에코 5 미니!",2020.01.28-2020.02.23,"3,000,000원"
1555,테크·가전,★Qoobo가 한국에 왔어요★ 꼬리를 흔들어 마음을 채워주는 쿠션 로봇,SETOWORKS,244%,"4,890,000원",펀딩성공,68,81,Kick starter와 미국 CES에서 큰 화제가 된 Qoobo !  반려동물을 키우고 싶지만 여건상 키우지 못하거나 빈 마음을 채워줄 무언가가 필요하다면 Qoobo를 만나보세요,2019.06.27-2019.08.04,"2,000,000원"
1556,테크·가전,PT의 신개념 필수품  'LINABLE',모자이크어드바이저리,244%,"4,886,200원",펀딩성공,98,230,발표 자료 만드느라 고생해 본 적 있나요?,2020.01.28-2020.03.15,"2,000,000원"
1557,테크·가전,"귀에 착 핏,사운드,디자인 셋 다 잡은 리얼TWS 이어버드: SONG X",싹키우자,244%,"7,322,000원",펀딩성공,136,202,"글로벌 펀딩 3억을 달성한 ""SONG X"" 리얼 TWS무선 이어버드 6mm HIFI스피커 IPX5방수 Bluetooth5.0 3세대 TWS칩셋 무선충전 노이즈캔슬링 25시간사용",2021.03.02-2021.03.30,"3,000,000원"
1558,테크·가전,빛컨의 IoT 온도 모니터링 시스템을 직접 체험해보세요!,주식회사 빛컨,243%,"7,293,000원",펀딩성공,36,27,빛컨의 기술력 IoT-MODLINK 로 구현한 IoT 온도 모니터링 시스템 'T10' 으로 당신에게 스마트한 온도 관리 시스템을 구축해 드리겠습니다.,2018.11.15-2018.12.16,"3,000,000원"
1559,테크·가전,내 공간의 격을 높이는 나무 컴퓨터: 오비스 박스,오비스 달리,243%,"7,290,000원",펀딩성공,21,122,공간의 격을 높이는 원목 데스크탑 PC 오비스 박스.,2019.05.24-2019.06.16,"3,000,000원"
1560,테크·가전,상쾌한 아침을 맞이하는 가장 스마트한 방법 [맑은잠 IoT 수면등] ,브이티코퍼레이션,241%,"12,091,777원",펀딩성공,204,313,"맑은잠 IoT 수면등 프로젝트는 생체 리듬이 불규칙한 현대인들의 문제를 바로잡는 ""라이트 테라피 스마트 조명"" 프로젝트 입니다.",2020.09.25-2020.10.14,"5,000,000원"
1561,테크·가전,본질에 가장 충실한 차량용 거치대 (SUKIT) 차량용 무선충전 거치대,주식회사 에스엠전자 ,240%,"2,407,300원",펀딩성공,61,78,자동 무선충전 거치대 편한가요?,2019.11.01-2019.11.17,"1,000,000원"
1562,테크·가전,"평범한 핸드폰 케이스의 변신, 핸즈프리 소가죽 숄더&핸드 일체형 폰스트랩",모어오브,239%,"2,398,200원",펀딩성공,98,157,완벽한 핸즈프리가 주는 상상이상의 편리함을 느껴보세요.,2020.12.11-2020.12.20,"1,000,000원"
1563,테크·가전,[본앤메이드 : 신발살균기] 매일 빨 수 없는 신발 매일 신어야 하기에!,주식회사 본앤메이드,238%,"7,165,000원",펀딩성공,125,164,"살균이 가져오는 생활의 변화,",2020.09.14-2020.09.30,"3,000,000원"
1564,테크·가전,샤오미 전동칫솔?아니아니 오클린 원 음파 칫솔!,솔라렌코,237%,"11,891,000원",펀딩성공,113,138,"분당 42,000회 강력한 진동을 자랑하는 초강력 음파 전동 칫솔 오클린 원! 여러분의 맞춤 구강 관리를 위한 칫솔입니다!",2018.03.02-2018.04.01,"5,000,000원"
1565,테크·가전,"아웃도어를 위한 '괴물 스피커' : 글로벌 브랜드 ANKER, 아이콘",앤커코리아,235%,"7,073,000원",펀딩성공,159,115,"괴물 스펙의 괴물 스피커, 아이콘은 (1) 폭발적인 사운드 (2) 뛰어난 방수방진 성능 (3) 12시간 연속재생 (4) 실용적인 디자인과 세부 기능으로 아웃도어에 최적화되었습니다.",2019.06.27-2019.07.07,"3,000,000원"
1566,테크·가전,가장 건강하고 간편하게 모기를 퇴치하는 모키몬 모기퇴치기,모키몬 모기퇴치기,235%,"2,357,500원",펀딩성공,58,79,모기를 빛의 주파수로 유인하여 퇴치합니다.  소리없이 안전하고 가장 건강한 방법으로 모기를 퇴치하는 방법! 이제 모키몬 모기퇴치기가 있습니다.,2019.07.24-2019.08.15,"1,000,000원"
1567,테크·가전,TWS+반응형LED+풀레인지유닛+방수+터치휠! 최신 블루투스5.0 스피커,사운드베슬(펀디안),234%,"7,037,300원",펀딩성공,158,99,"음악에 빛으로 반응하는 블루투스 5.0 최신 완전무선스테레오 스피커! 소.확.행 완성템! 사운드베슬 명품 사운드와 은은한 싱크 LED! 압도적인 음악, 영화, 게이밍 맞춤 스피커!",2019.10.07-2019.11.14,"3,000,000원"
1568,테크·가전,[2차앵콜] 폰에 꽂기만 하면 99.9% 살균!  컴팩트 UV-C 살균기,주식회사 세토웍스,233%,"1,165,100원",펀딩성공,36,86,"이렇게 간편한 UV-C살균기 보셨나요? KC인증 완료된 제품으로 안심하고 사용하세요! 핸드폰에 꽂기만 하면 언제 어디서나 간편하게 살균! 여행갈 때, 외출할 때 주머니에 쏙!",2021.02.16-2021.03.08,"500,000원"
1569,테크·가전,"우리집, 인공지능 실내미세먼지공기질 측정, 에어필 홈(AirFEEL-H)",주식회사 시대의영웅,232%,"6,963,000원",펀딩성공,80,96,맑고 깨끗한 공기를 마실 권리는 누구나 있습니다.,2019.09.10-2019.09.29,"3,000,000원"
1570,테크·가전,[나무 가죽] 핸드폰 케이스 지갑_기종에 상관없이 다 받아 줄께~,COPI,232%,"1,218,000원",펀딩성공,45,27,세계적인 트렌드_친환경 나무 소재 CORK 식물성 가죽으로 제작된 핸드폰 케이스 지갑,2019.07.14-2019.07.24,"525,000원"
1571,테크·가전,앵콜펀딩!! Maskzip UV-C 살균 마스크집에 깨끗하게 보관하세요.,주식회사 하늬바람,232%,"1,161,600원",펀딩성공,38,77,하늬바람의 [휴대용 살균 마스크 보관함]을 앵콜 펀딩합니다. 마스크 착용이 필수인 요즘 꼭 필요한 Maskzip! UV-C살균과,2020.11.13-2020.11.30,"500,000원"
1572,테크·가전,3 in 2 멀티 충전 케이블에 응급배터리까지 모두 하나로 ! ,(주)테크노니아,232%,"11,648,800원",펀딩성공,782,427,3 in 2 멀티 충전케이블에 응급 외장 배터리까지 모두 하나로 !,2020.08.28-2020.09.29,"5,000,000원"
1573,테크·가전,스마트한 블루투스 선글라스! 시선비콘  ,(주)시선,231%,"23,141,000원",펀딩성공,238,199,"Above The Others! 시선비콘은 음악 듣기, 통화 등 장시간 사용에도 청각에 무리가 없고 야외활동과 일상생활에서  안전하게 사용가능한 블루투스 골전도 안경 입니다",2018.05.09-2018.06.09,"10,000,000원"
1574,테크·가전,Wireless에 품격을 더한 소리 All New 무선이어폰 AN1801,주식회사 ALL NEW,230%,"6,905,300원",펀딩성공,154,145,1+1하나의 아이템은 한사람을 후원하고 하나의 아이템은 하나의 이야기를 만든다. ALL NEW 블루투스 이어폰 AN1801 첫번째 이야기,2019.03.11-2019.04.09,"3,000,000원"
1575,테크·가전, 소중한 아이폰을 지켜주는 AGM 러기드 케이스, AGM 코리아 ,230%,"1,154,500원",펀딩성공,54,37,소중한 아이폰을 안전하게 지켜주는 AGM 러기드 케이스- 러기드폰 전문 제조사가,2019.07.31-2019.08.25,"500,000원"
1576,테크·가전,"본질에 가장 가까운 가습기 ""H - Air washer""",에스엠 산업,229%,"11,475,000원",펀딩성공,110,131,"안전, 관리, 가습량  3박자를 갖춘  H - Air washer",2018.06.22-2018.07.27,"5,000,000원"
1577,테크·가전,국민 3D 프린터 [Meister2.0],(주)쓰리디박스,228%,"22,865,000원",펀딩성공,64,61,사용하기 어려운 3D프린터? 복잡한 3D프린터?,2016.03.08-2016.03.31,"10,000,000원"
1578,테크·가전,전자파 걱정 없는 [울트라 슬림 온열패드 GUMU] 따뜻함만 담았습니다.,"Blue Traders Co., Ltd",228%,"6,863,000원",펀딩성공,85,118,"천근만근 무거운 몸과 괴로운 통증, 폭발하는 식욕, 인생의 회의를 느끼며 휴학과 퇴사욕을 불러 일을킬 만큼 걷잡을 수 없는 감정기복들을 느낄 때 GUMU해 보세요.",2019.10.25-2019.11.24,"3,000,000원"
1579,테크·가전,마스크가 스포츠카의 기술을 만나면 벌어지는 일~,솔루디,227%,"22,771,580원",펀딩성공,291,315,마스크가 스포츠카의 공기역학기술을 만나면 벌어지는 일~,2020.08.05-2020.08.31,"10,000,000원"
1580,테크·가전,냄새도 똑똑하게 컨트롤해 보자! <스마트한 디퓨저 컨크>,컨크,227%,"6,827,800원",펀딩성공,153,66,"카트리지를 넣으면, 향기의 양 조절은 물론 시간까지 설정 할 수 있는 스마트 디퓨저, 컨크! 내 공간의 건강한 냄새를 위해 최적화한 카트리지와 함께 '냄새를 컨트롤' 합니다.",2018.11.14-2018.11.30,"3,000,000원"
1581,테크·가전,맛을 기억하는 사진기! Cookplay 쿠킹저울,(주)쿡플레이,227%,"6,814,500원",펀딩성공,83,60,Cookplay 쿠킹저울은 요리의 또 다른 시작입니다.,2018.05.10-2018.06.10,"3,000,000원"
1582,테크·가전,두손가락으로 땅을 뚫다. 파인!,에스케이 에어로,227%,"2,276,000원",펀딩성공,40,95,"드릴에 꽂아 쉽게 땅을 뚫을 수 있는 드릴 비트! ""파인""",2019.09.18-2019.10.14,"1,000,000원"
1583,테크·가전,쓱싹하면 청소 끝! 강력한 진공청소와 뽀드득 물걸레질까지 한방에!,더블에스 샤이니 SS Shiny,223%,"11,174,000원",펀딩성공,61,123,무선+물걸레+진공청소기를 하나로!,2019.05.30-2019.06.16,"5,000,000원"
1584,테크·가전,어디서나 깨끗한 수저로 밥 먹을 수 있다고? 휴대용 수저 살균기 빠요!,주식회사이지테크,223%,"2,230,500원",펀딩성공,90,102,#식당에서 #밥 먹을 때 #위생 #찝찝함 빠요로 빠이-,2020.09.28-2020.10.28,"1,000,000원"
1585,테크·가전,1인가구도 이제 아쿠아 청소하세요. 벤투스 멀티 무선청소기,주식회사 좋은생활지웰,223%,"2,232,000원",펀딩성공,13,67,먼지 청소도 해야 되고 물걸레질도 해야 하고 침구도 청소해야 하는데 이거 저거 찾고 찾다가 시간 다 보내지 않나요? 청소에 필요한 도구는 모두 들어있는 멀티플레이어 벤투스 멀티,2020.11.24-2020.12.01,"1,000,000원"
1586,테크·가전,국내 제조 휴대용 공기청정기 / 반영구적 필터,(주)제이에스테크,222%,"11,109,000원",펀딩성공,126,135,차량용 & 탁상용 2가지의 장점을 더한 '에어라이징 미니' 공기청정기,2018.09.13-2018.10.10,"5,000,000원"
1587,테크·가전,당신과 사랑하는 사람에게 안전을 선물할 LED 표시장치,유진특수조명,222%,"3,337,000원",펀딩성공,47,132,교통 사고의 상당부분 2차 사고입니다.당신을 2차 사고에서 지켜줄 필수 아이템을 소개합니다.,2019.12.30-2020.01.26,"1,500,000원"
