,categories,title,company_names,percentages,funding_amounts,days_left,n_supporters,likes,descriptions,durations,target_amounts
0,테크·가전,[앵콜]신발냄새 잡는 끝판왕! 신발관리의 혁명 홈세라신발청정기U,주식회사 홈세라,849%,"8,496,400원",11일 남음,239,182,[가성비 끝판왕 1만원대] 신발 관리의 혁명! 신발도 청정하는 시대! 홈세라 신발살균청정기U S100으로 살균&탈취&건조까지 한번에 해결~청정해진 내 신발 뽀송뽀송 쿠션감UP!,2021.04.14-2021.05.10,"1,000,000원"
1,테크·가전,손가락 하나로 디지털 기기를 컨트롤! 진짜 만능 블루투스 마우스&리모컨,주식회사 블루티움,5030%,"25,153,500원",25일 남음,440,120,"전자책, 웹툰, 인강, 마우스, 영상촬영이  하나의 리모컨으로 다 된다고? 더욱 스마트해지고, 더욱 패셔너블하게 돌아왔다, 스마트 무선 터치 리모컨 릿제로의 두번째 버전,릿제로 X",2021.04.28-2021.05.24,"500,000원"
2,테크·가전,핑구X듀얼충전 마우스패드를 2만원대로! [핑구's Back2],케이티씨에스,1060%,"10,601,000원",18일 남음,322,79,전자기기 2개쯤은 기본이잖아요. 1+1 동시충전과 더불어 마우스 패드가 만났습니다. 1433%달성의 핑구와 함께 2만원대로 스마트한 라이프를 느껴보세요,2021.04.28-2021.05.17,"1,000,000원"
3,테크·가전,[얼룩제거히어로!2차앵콜]언제나!물만있으면OK무선초음파세척스틱!웨이블린!,주식회사 엘파인,3620%,"36,207,000원",18일 남음,633,293,"1주일 적어도 30회이상 얼룩빌런에 노출되는 일상-일터,집,식사시간,저녁약속,커피타임,캠핑,차박,여행지등",2021.04.27-2021.05.17,"1,000,000원"
4,테크·가전,[유인+흡입+감전] 자비없는 3콤보 해충사냥꾼 듀얼 해충퇴치기 등장!,동양라인,6769%,"135,396,700원",15일 남음,"2,657",1047,올 여름 필수템! 모기에게 물리지 않는 법은 물리기 전에 잡는 겁니다!,2021.04.23-2021.05.14,"2,000,000원"
5,테크·가전,[5억 앵콜]땀쟁이는 미리 준비해! 가볍게 돌아온 <넥밴드 선풍기 에어>,프린텍 주식회사,6267%,"62,671,700원",11일 남음,"1,082",490,"무게는 가볍게, 목에 닿는 넥스트랩은 얇게!",2021.04.22-2021.05.10,"1,000,000원"
6,테크·가전,[아마존 매출 10억] 글로벌이 인정한 스마트기기 케이스 ,(주)아이스픽,10522%,"52,611,480원",4일 남음,"1,941",950,"아직도 지갑을 들고 다니세요?! 전세계가 인정한 카드수납형 케이스의 끝판왕, 베루스 케이스와 자연으로부터 얻은 소재, 천연돌가루의 환상적 콜라보!",2021.04.16-2021.05.03,"500,000원"
7,테크·가전,[4.7점 앵콜] 서포터가 인정한 차량용 클리어 무선충전거치대 핸디그랩!,주식회사 핸디핸드,1030%,"10,307,100원",25일 남음,344,122,"리워드 만족도 4.7점 , 메이커 만족도 4.8점!",2021.04.27-2021.05.24,"1,000,000원"
8,테크·가전,[글로벌 64억 펀딩] 필터 교체가 필요없는 신개념 공기청정기 포이마핏!,비키스임포트앤엑스포트(영업소) ,8205%,"410,287,000원",11일 남음,"1,382",1103,대만 Flying V 펀딩액 64억 달성!,2021.04.15-2021.05.10,"5,000,000원"
9,테크·가전,[4.5앵콜] 포켓드럼? 비트에 몸을 맡겨라! 방구석에서 제대로 즐기자!,블루썸(bluessom),3564%,"35,643,000원",25일 남음,204,132,"포켓드럼2와 함께 소음 걱정 없이 집에서 자유롭게 드럼치자! 간단하게 전원버튼 누르고 앱과 연동만하면 드럼 칠 준비는 끝! 애플뮤직과 완벽 연동! 재미는 기본, 운동 효과까지!",2021.04.27-2021.05.24,"1,000,000원"
10,테크·가전,답답한 마스크를 벗고 공기청정기를 쓰다 | 웨어러블 공기청정기,(주)휴라인텍,9498%,"94,985,500원",4일 남음,631,650,나만의 프라이빗 공기청정 시스템 : 웨어러블 공기청정기 브레온!,2021.04.17-2021.05.03,"1,000,000원"
11,테크·가전,[글로벌 15억 펀딩] 아직도 줄자 쓰세요? 맥파이 양방향 레이저 줄자!,(주)맥파이테크,9469%,"94,696,500원",25일 남음,788,311,글로벌 15억 펀딩 신화! 양방향 레이저 줄자 VH-80이 Special Edition으로 돌아왔다!,2021.04.25-2021.05.24,"1,000,000원"
12,테크·가전,전기없이 착용만으로 발열이 된다고? EMS 기능까지! [HEATNESS],주식회사천산,2070%,"10,350,300원",18일 남음,78,65,"그저 좋은 줄만 알았던 원적외선, 하지만 사용법이 불편했다면? 원하는 부위에 설정도 버튼도 필요 없이 착용만으로 발열 시작! [HEATNESS]",2021.04.27-2021.05.17,"500,000원"
13,테크·가전,[앵콜] 초음파세척+UV살균으로 뽀득뽀득 개운하게! <스마클린UV>,(주)아우젠글로벌커머스,1096%,"10,965,000원",18일 남음,178,108,"가정용 초음파 세척기로 많은 사랑 받았던 그 제품, UV살균 기능까지 더해 업그레이드 되어 돌아왔습니다! ""스마클린UV""를 앵콜 펀딩으로 만나보세요.",2021.04.26-2021.05.17,"1,000,000원"
14,테크·가전,[시선강탈 넥밴드선풍기] 블루필이 돌아왔다 더 슬림하게 더 오래가는 엣씨,블루필 주식회사,1767%,"17,675,400원",펀딩성공,459,241,"선풍기 누적 50만개, Accelerated by SAMSUNG의 독보적인 기술력으로",2021.04.21-2021.04.28,"1,000,000원"
15,테크·가전,캠핑필수 선풍기 진짜 차박러가 캠핑용선풍기에 도전하다?! 엠팬 ,(주)비메이커,4939%,"24,697,800원",18일 남음,577,190,"차박러가 고민해본 캠핑용선풍기 엠팬. 자유로운 방향조절과 클립형구조. 배터리교체 방식으로 더 긴수명. 보조배터리와 LED랜턴, 그리고 5엽설계의 강력한 직진성과 정숙성까지",2021.04.22-2021.05.17,"500,000원"
16,테크·가전,[홈트의 완성] 거실에서 매일 5분 줄넘기! 스마트로프 루키+도넛,주식회사 탱그램팩토리,318%,"15,900,400원",11일 남음,438,204,"""내 줄넘기 기록, 우리 집 TV는 알고 있다!"" 스마트폰과 스마트 TV에 횟수/시간/칼로리를 기록하는 똑똑한 줄넘기, '스마트로프 루키+도넛' 업그레이드 런칭!",2021.04.22-2021.05.10,"5,000,000원"
17,테크·가전,평점5점 마지막앵콜]  블렌딩+채/편썰기까지 가능한 닌자 올인원블렌더!,주식회사 마이하우스,1528%,"15,283,000원",5일 남음,79,57,"이젠, 배달시키지도 말고, 힘들게 준비하여 요리하지도 않고, 블렌딩/다지기 모두 간.단.하.게 ""닌자"" 하세요",2021.04.27-2021.05.04,"1,000,000원"
18,테크·가전,아이패드를 위한 혁신적인 360도 회전 스마트 키보드 | DOQO2,주식회사 세토웍스,5151%,"51,515,000원",18일 남음,311,385,"블루투스로 간편한 연결, 알루미늄 디자인, 편의성, 내구성, 거기에 360도 회전까지, iPad를 위한 혁신적인 키보드를 만나보세요!",2021.04.24-2021.05.17,"1,000,000원"
19,테크·가전,[앵콜] 폰부터 노트북까지 고속충전! PD+PPS+QC+유니버설 파워베슬,펀디안(주),572%,"11,459,200원",18일 남음,173,122,"퀵스탠드의 남다른 편리함과 초슬림 디자인의 완벽조화~ GaN 업그레이드 파워베슬! 아이폰, 아이패드, 맥북, 스마트폰, 태블릿, 노트북을 위한 단 하나의 고속충전기를 만나보세요!",2021.04.27-2021.05.17,"2,000,000원"
20,테크·가전,[9299% 앵콜] 누르기만하면 술맛이 부드러워져요ㅣ술 에어레이터 끝판왕,주식회사 신정인터내셔날,3655%,"18,277,500원",11일 남음,221,255,"술 한잔 가득 마이크로 버블 에어레이팅 , 더 작고 더 가볍게 그리고 더 강력한 에어레이팅 성능으로 출시된 비네이라 트레블, 휴대용 케이스로 캠핑, 여행, 술자리 모두 OK!",2021.04.19-2021.05.10,"500,000원"
21,테크·가전,[5점 앵콜] 음향 장인 야마하의 10만원대 3D 서라운드 사운드바 ,주식회사 틱투엠(Tic2M),29520%,"295,208,000원",1일 남음,"1,586",1508,4K...8K...TV는 날로 좋아지는데 왜 아직도 사운드는 2D?! 만족도★5개 야마하 3D 서라운드 사운드바 SR-B20A 화이트 에디션으로 홈 시네마 시스템을 완성하세요!!,2021.03.27-2021.04.30,"1,000,000원"
22,테크·가전,[앵콜] 더욱 조용하고 슬림하게! 노이즈 캔슬링 헤드폰 Hesh ANC ,시에프디스트리뷰션 주식회사,1040%,"10,400,000원",18일 남음,86,41,더욱 조용한 하이브리드 노이즈 캔슬링 기술을 탑재한 헤드폰이 가볍고 슬림한 디자인까지 갖추었다면??,2021.04.27-2021.05.17,"1,000,000원"
23,테크·가전,내손안의 미니사이즈 풀파워! 지코 닥터락 미니 마사지건!,주식회사 시티파이브,2294%,"22,949,600원",4일 남음,260,151,미니사이즈 풀파워 마사지!,2021.04.17-2021.05.03,"1,000,000원"
24,테크·가전,LED가 땋! 존재감 터지는 디붐 픽수 슬링백,주식회사 아이스카이네트웍스,1892%,"28,394,000원",4일 남음,309,408,#LED 픽셀아트가 나오는 감각적인 슬링백,2021.04.05-2021.05.03,"1,500,000원"
25,테크·가전,[글로벌 15억] 무선충전과 수납을 동시에? 내손안의 데스크 '네스트',주식회사 문앤썬컴퍼니,1619%,"16,198,000원",18일 남음,175,126,수납공간 커스터마이징 파우치(무선 충전기 내장) '네스트'입니다.,2021.04.21-2021.05.17,"1,000,000원"
26,테크·가전,"""밤잠 설치는 분들을 위한 숙면 솔루션"" 꿀잠밴드 SLEEP i MASK",주식회사 리솔,1404%,"14,040,000원",18일 남음,87,86,"1,2,3만 기억하세요! 1일,2회,30분 사용으로 여러분은 오늘부터 숙면에 빠져듭니다!",2021.04.23-2021.05.17,"1,000,000원"
27,테크·가전,"위생에 진심인 당신에게, 내일의 깨끗한 물 한잔을 위한 개인컵 UV살균기",나인랩,3016%,"15,081,304원",18일 남음,214,131,"“불안한 시대를 살아가는 우리 모두의 일상을 지켜내는 살균 습관” 개인컵과 텀블러는 물론 마시는 물까지,",2021.04.16-2021.05.17,"500,000원"
28,테크·가전,"[10년 개발 거치대] 패드마운트 하나면, 침대 테블릿 거치대 고민 끝!",씨알존,829%,"8,298,000원",4일 남음,66,134,누워서 편하게 보자 !!,2021.04.18-2021.05.03,"1,000,000원"
29,테크·가전,[음쓰] 지긋지긋 음식물쓰레기 냄새+날파리 유지비가 '0'원인 쿨키퍼 ,주식회사 마이하우스,811%,"4,058,000원",4일 남음,37,75,냉동실에 음식물 쓰레기 넣으면 세균이 '49'배 증가된다는 사실 알고 있으신가요??,2021.04.21-2021.05.03,"500,000원"
30,테크·가전,듀얼 무선충전에 듀얼 공기청정을 더한~ 크루 휴대용 멀티 공기청정기!,중앙엠비즈 주식회사,41%,"2,050,000원",25일 남음,39,38,차량용품 전문가가 만든 미니멀 올인원 디바이스,2021.04.26-2021.05.24,"5,000,000원"
31,테크·가전,[5만원대 공간 살균기] 곰팡이?세균?바이러스? All케어 All클린!,썬웨이브,1120%,"5,601,000원",12일 남음,82,93,눈에 보이는 청소만 하고 있지 않으신가요? 복잡하고 번롭지않게 있는 공간을 살균하는 살균기 지금 만나보시기 바랍니다.,2021.04.19-2021.05.11,"500,000원"
32,테크·가전,[3369%앵콜]음악과 속도에 심장이 뛰는 당신에게 클립쉬X맥라렌 콜라보,주식회사 씨제이에스,707%,"7,074,000원",11일 남음,31,33,"3369% 달성으로 다시 돌아온 70년 이상의 음향기술 역사와 극강의 편안함, 강력한 방진방수 기능을 입은 [클립쉬 X 맥라렌 콜라보 에디션]",2021.04.26-2021.05.10,"1,000,000원"
33,테크·가전,[5.0앵콜] 복부 지압 마사지 이제 집에서 받아요! 복부 전문 관리기,쉬안 주식회사,1990%,"19,907,800원",4일 남음,71,91,"이런 복부관리기는 없었다ㅣ건강의 기본은 장(腸), 20만원대로 4,500번의 손으로 누르는 맛을 집에서 직접 느껴보세요! 복부를 꾹꾹 눌러주는 쉬안 고급형 유, 무선 복부관리기",2021.04.20-2021.05.03,"1,000,000원"
34,테크·가전,1대로 4대 효과! 사각없는 720도 홈카메라 [라운드아이],(주)에이치디텔레콤,1554%,"15,545,000원",18일 남음,129,118,"2개의 어안렌즈로 상하360, 좌우360로 전체 720도가 촬영되는 홈카메라입니다. 사각없는 영상과 빠른 스크롤로 빠짐없이 영상을 확인하세요!",2021.04.24-2021.05.17,"1,000,000원"
35,테크·가전,[앵콜] 클래스가 남다른 더 클래스 양가죽 핸들커버 정성을 가득담아! ,주식회사 차바치,487%,"2,436,500원",1일 남음,75,53,"차바치가 직접 만든 인조가죽, 소가죽도 아닌 양가죽의 고퀄리티 핸들커버로 텐션이 좋은 부드러운 양가죽으로 인체에 무해하며, 핸들의 열전도율이 빠르며 그립감이 좋아 선물용으로도 굿!",2021.04.15-2021.04.30,"500,000원"
36,테크·가전,[앵콜] 이렇게 예쁜 컴퓨터 보셨어요? [프리미엄 알루미늄 PC케이스],크리프타(CRIFTA),115%,"576,000원",25일 남음,15,43,"책상 위의 공간을 더욱 빛나게 해주는 아름다운 컴퓨터, 특별한 당신을 위한 PC 케이스 GRID를 지금 만나보세요 !",2021.04.27-2021.05.24,"500,000원"
37,테크·가전,[74억펀딩]캠핑용부터 무선충전까지 가능한 'BLUETTI 파워스테이션',(주)스마트모빌리티센터,3781%,"37,813,000원",1일 남음,105,420,인디고고 74억 펀딩! 'BLUETTI 파워스테이션'이 드디어 한국에 입성하였습니다.,2021.04.07-2021.04.30,"1,000,000원"
38,테크·가전,작지만 강력한 파워뱅크 X 렉스웜 무선 캠핑온열매트,(주)라온글로벌,2345%,"11,726,000원",4일 남음,50,73,작지만 강력한 파워뱅크 X 렉스웜 무선 캠핑온열매트로 전기가 없는곳에서도 자유롭고 편리하게,2021.04.18-2021.05.03,"500,000원"
39,테크·가전,탄소나노발열체를 사용한 사계절용 DC온열매트 [게르마늄 모달V24],와플케어,1277%,"6,386,000원",11일 남음,37,77,[DC온열매트] 탄소나노발열체를 사용한 사계절 꿀잠매트~ 와플케어 게르마늄 V24를 소개합니다.,2021.04.16-2021.05.10,"500,000원"
40,테크·가전,1시간에 5cm 출력 괴물! 국산 초고속 레진 3D 프린터 | 폴라리스Z,마이쿠키디어,1253%,"62,685,000원",4일 남음,52,186,"격이 다른 퍼포먼스를 가진 국산 모노 LCD 고속 레진 프린터, 폴라리스Z를 소개합니다.",2021.04.10-2021.05.03,"5,000,000원"
41,테크·가전,[앵콜] 개인방송 어렵지 않아요! ASMR도 가능한 큐마이크,올포토,842%,"8,420,000원",1일 남음,85,110,[앵콜] 개인방송 어렵지 않아요! ASMR도 가능한 큐마이크,2021.04.15-2021.04.30,"1,000,000원"
42,테크·가전,멀리 뛰어봐야 엄마 손바닥 안! ※위치 추적기 iM 시리즈※,(주)지티에이컴,583%,"5,834,000원",11일 남음,62,82,"어디로 튈 지 몰라 늘 걱정인 우리 아이, 우리 반려견. 어디 있어도 GPS 위치 추적기 [iM 시리즈]가 찾아드릴게요.",2021.04.20-2021.05.10,"1,000,000원"
43,테크·가전,동시 3개 충전! 알아서 충전 위치까지 찾아주는 초텍 3in1 무선충전기,주식회사 샘빌,560%,"2,801,100원",18일 남음,64,96,"동시에 3개의 기기를 충전하세요, 3in1 충전! / 더 이상 충전 위치 찾지 마세요, 위치 잡아주는 충전! / 칙칙한 무선 충전기는 이제 그만, 펄~그린으로 충전!",2021.04.19-2021.05.17,"500,000원"
44,테크·가전,"[CES혁신상] 눈에 보이지 않는 고속무선충전기 UTS-1, 45% 혜택",주식회사 디에프와이,315%,"3,153,400원",11일 남음,42,182,"""당신의 다음 충전기는 눈에 보이지 않는다"" 2021 CES 혁신상을 수상한 UTS-1을 3M 테이프로 가구 아래에 붙이세요. 당신이 꿈꾸던 진정한 무선 라이프가 현실이 됩니다.",2021.03.31-2021.05.10,"1,000,000원"
45,테크·가전,곁에서 지켜드릴게요! 99% UV살균 모니터 받침대  ,(주) 우드메탈,141%,"4,234,000원",12일 남음,71,108,보다 쾌적하고 건강한 사무환경에 대한 고민에서 기획된 'UV살균 무선충전 모니터 받침대'는,2021.04.07-2021.05.11,"3,000,000원"
46,테크·가전,[와디즈단독] 편리성 최강자! ONDO K 멀티형 칫솔 살균기!,(주)필리,86%,"860,000원",11일 남음,37,31,칫솔살균기+전용케이스+거치대+스트랩+벽걸이후크 까지 모두 모두~ 드리는 칫솔살균기 ONDO K!,2021.04.15-2021.05.10,"1,000,000원"
47,테크·가전,내 pc를 usb처럼 들고 다닐 수 있다면? 세일러박스!,원스탑피씨,1364%,"13,640,000원",11일 남음,35,200,"'휴대폰은 유심만 바꾸면 기존 내역이 세팅되는데,왜 컴퓨터는 그런게 없을까?' 혹시 이런 생각 해보신 적 없으세요? 이젠 세일러박스가 언제 어디서든 원하는 pc환경을 만들어드릴게요",2021.04.13-2021.05.10,"1,000,000원"
48,테크·가전,[마스크 살균기] 매일 쓰는 마스크에게 깨끗해지는 방이 생겼다?!,주식회사 다함스타일 ,450%,"4,502,840원",11일 남음,46,67,"마스크 착용, 자꾸 깜빡하시나요? 여러 마스크 중, 내 것 찾기 헷갈리셨죠? 벽/문에 마룸을 걸어 두세요. 까먹음&헷갈림 방지! 살균&건조까지 한번에 해결합니다.",2021.04.15-2021.05.10,"1,000,000원"
49,테크·가전,"멋대로 상상해라! 그 이상의 변신을 보여주는, 키덜트를 위한 로봇",골드래빗(주),332%,"3,325,000원",22일 남음,19,30,조립하는 재미와 컨트롤하는 손맛까지 두마리 토끼를 잡았다. 달리는 것만으로 만족할 수 없는 어른이를 위한 진짜 테크닉 토이가 왔다.,2021.04.26-2021.05.21,"1,000,000원"
50,테크·가전,스마트 수전,주식회사 트리티즈,336%,"3,361,400원",1일 남음,22,68,온도센서와 모터를 이용하여 자동으로 설정한 수온으로 조절해주는 샤워수전 입니다.,2021.03.31-2021.04.30,"1,000,000원"
51,테크·가전,[세균닥터] 이젠 빛으로 안심 살균하세요.,(주)지브이엔텍,281%,"1,405,000원",28일 남음,14,25,세균닥터는 인체에 무해한 48개의 가시광선 LED를 사용해 사람이 생활하는 공간을 안전하게 살균할 수 있는 이동이 가능한 살균 전용 램프입니다.,2021.04.22-2021.05.27,"500,000원"
52,테크·가전,[일상방역] 살균 받침대 SARS-CoV-2를 99.9% 살균 검증 제품,(주)미카이,234%,"1,170,000원",4일 남음,16,26,"미카이 살균 미니테이블은 사용자가 일생생활 주변에 설치하여, 모든 생활용품을 살균할 수 있는 생활방역 제품입니다. 1분 30초면 SARS-CoV-2 를 99.9% 살균합니다.",2021.04.20-2021.05.03,"500,000원"
53,테크·가전,[새로운 SNS의 등장!!] 얼리어답터는 서두르세요! 숏클립 온라인 모임,투게더(TOGETHER),126%,"1,260,100원",1일 남음,81,55,"당신의 숏클립을 모임 내에 공유해보세요! 다른 SNS와 무엇이 다른지 보여드릴게요. 평소에 해보고 싶었던 활동, 어울리고 싶었던 사람들, 예상하지 못했던 분야로의 첫걸음이 될거에요",2021.03.31-2021.04.30,"1,000,000원"
54,테크·가전,듀얼 LED를 적용한 UV-C 생활용품 살균기 (살균 Master),주식회사 헥스하이브,126%,"2,021,500원",18일 남음,45,36,듀얼 UV-C LED를 적용하여 스마트폰 및 기타 소형 일상 생활용품의 유해균 (폐렴간균 등)을 99.9%까지 살균 가능한 자외선 LED 살균기,2021.04.12-2021.05.17,"1,600,000원"
55,테크·가전,저장하는 순간 자동 백업! 언제든지 원하는 시간대로 DATASAFE,주식회사 쓰리알큐브시스템,123%,"3,713,500원",21일 남음,16,51,실시간 자동 백업으로 타임머신처럼 언제든 원하는 시점으로 복구 가능! DATASAFE,2021.04.15-2021.05.20,"3,000,000원"
56,테크·가전,먹는 와플? 협업툴 와플! 일이 힘들어도 당신은 힘들지 않도록 와플하세요,주식회사 티맥스와플,104%,"1,046,000원",8일 남음,52,49,[비대면 시대 필수 6종 협업 도구가 한 곳에!],2021.04.02-2021.05.07,"1,000,000원"
57,테크·가전,손목 통증과 청소기 고장은 그만! 프리미엄 원단으로 튜닝한 다이슨 청소기,마켓프렌즈 주식회사,53%,"268,300원",8일 남음,9,16,다이슨 옴니 글라이드 핸들 커버 & 스트랩 ｜손목 통증과 청소기 고장은 그만! 고급 외제차에 사용되는 프리미엄 알칸타라 원단으로 튜닝한 나의 다이슨 청소기 <GAMAYO>,2021.04.19-2021.05.07,"500,000원"
58,테크·가전,관악기 아티스트를 위한 마우스피스&리드 살균과 건조를 한방에!,주식회사 바이제로텍,35%,"357,000원",1일 남음,24,45,"잘브러(JALBLO), 진정한 휴대용 관악기 아티스트를 위한 마우스피스&리드 살균건조기!",2021.04.07-2021.04.30,"1,000,000원"
59,테크·가전,주차관제시스템 설치 끝!!!  이제부터 외부차량 아웃!,티아이에스,0%,0원,8일 남음,2,9,"주차순찰시스템 : 공동주택(아파트,빌라), 상가, 주차장 등 주차관리가 필요한 장소에 기존 주차관제시스템 가격의 절반수준으로 제공하고자 하는것이 본 프로젝트 미션입니다.",2021.04.16-2021.05.07,"9,980,000원"
60,테크·가전,안심식사를 위한 위생수저통!,나우인더스,0%,"45,900원",18일 남음,9,11,남이 만지지 않아 깨끗한 수저를 하나씩 꺼내 사용하는 위생수저통. 식당과 가정의 수저위생을 향상시킵니다.,2021.04.18-2021.05.17,"100,000,000원"
61,테크·가전,<휴대용 레이저 각인기>는 처음이죠? 글로벌 26억 펀딩 레이저패커 프로,셀릭,72259%,"1,083,893,600원",펀딩성공,"2,551",3173,"지워지지 않도록 새겨 드릴게요. 사진도 그림도 메시지도, 당신이 원하는 상상을 레이저로 새길 수 있는 휴대용 레이저 각인기 <레이저페커 프로>가 드디어 한국에 공식 상륙합니다!",2020.07.11-2020.08.09,"1,500,000원"
62,테크·가전,초음파 세척기 아직 모르시나요? 세균 제거 99.7%오염 완벽 세척!,에고스,60261%,"301,307,400원",펀딩성공,"4,769",3445,놀라운 세척을 경험하는 데 필요한 것은 물과 초음파 뿐!  이렇게 간단하게 깨끗해지는 거 실화인가요? 세균 99.7%까지 제거 해야 진짜 프로청결러.,2019.09.02-2019.09.23,"500,000원"
63,테크·가전,설거지와 세균 제거까지 싹! 다용도초음파세척기 라하츠,주식회사 기드온소닉,44691%,"446,911,000원",펀딩성공,915,1099,설거지부터 과일야채세척까지 모두 해결하는 초음파다용도세척기 라하츠!,2020.08.18-2020.09.01,"1,000,000원"
64,테크·가전,"베이직북14 : 대기업 노트북과 비교해보세요, 20만원대 파격 울트라북!",베이직스,40466%,"2,023,334,000원",펀딩성공,"6,178",6873,"대기업 노트북과 비교해보세요, 20만원대 파격 울트라북! 베이직북 14는 가격의 상식을 뒤엎고, 새로운 기준을 제시하고자 합니다.",2019.01.22-2019.02.21,"5,000,000원"
65,테크·가전,"[만족도 1위 선풍기] 아직도 들고 다녀? ""땀쟁이 필수템"" 넥밴드선풍기",프린텍 주식회사,38025%,"380,251,693원",펀딩성공,"8,002",2300,"♥오픈 6일만에 ""전 수량 펀딩 완료"" 14759% 달성! 서포터들의 요청 사항을 반영해 돌아왔어요♥와디즈 “단독”으로 진행하는 단순생활 두번째 프로젝트! 넥밴드 선풍기",2020.06.10-2020.06.29,"1,000,000원"
66,테크·가전,약혐 - 처음 선보이는 피지 다이어트! 헤드팝 포커스,주식회사 하만,37477%,"374,775,150원",펀딩성공,"5,032",3353,무얼 해봐도 결국 또 다시 생기는 피지... 피지 고민을 FUN 하게 해결해 줄 처음 만나는 디바이스 [헤드팝 포커스],2020.10.12-2020.11.09,"1,000,000원"
67,테크·가전,[4억달성 앵콜]의사를 포기하고 5년간 눈 연구 후 만든 눈 근육 운동기,주식회사 에덴룩스,36345%,"545,177,000원",펀딩성공,"1,541",1893,오투스플러스는 디바이스와 게임 APP을 연동하여,2021.02.20-2021.03.22,"1,500,000원"
68,테크·가전,[앵콜] 가정용 DIY 전동공구의 최강자! 12종 헤드의 달인파워툴,주) 사람,32713%,"163,569,600원",펀딩성공,630,1699,"세계최초 12가지의 DIY 전문공구 달인공구가 세계시장에 도전합니다.와디즈 서포터 분들의 응원을 부탁드립니다,.",2020.03.30-2020.04.20,"500,000원"
69,테크·가전,"[20만원대 스마트북] 폰만 연결하면 노트북,휴대용모니터,태블릿으로 변신",주식회사 펀디지,31195%,"311,951,000원",펀딩성공,"1,208",2219,"당신의 스마트폰은 강합니다. 다만, 플립북과 함께라면말이죠. 연결만으로 노트북과 태블릿으로 변신 가능한 가성비 끝판왕 Flipbook!",2020.06.22-2020.07.19,"1,000,000원"
70,테크·가전,[앵콜]여행용기타-모가비(녹음+믹싱+BT스피커+폴더블),주식회사 짐,30477%,"152,388,000원",펀딩성공,253,318,"시끄러운 장소에서 잡음없이 깨끗한 연주원음을 녹음 할수 있습니다. 스마트폰과 연결하여 B/T스피커를 통해 연주음이 출력이 되며 여행, 캠핑을 갈때 간편히 접어서 갈 수 있습니다.",2021.03.26-2021.04.26,"500,000원"
