,categories,title,company_names,percentages,funding_amounts,days_left,n_supporters,likes,descriptions,durations,target_amounts
490,테크·가전,"[1740대 펀딩] 아마존이 인정한 유그린! ""더블폴딩 스탠드"" 컴백",베라킷 주식회사,3100%,"31,007,300원",펀딩성공,"1,149",699,"홈트할 때 쌤 보고, 요리할 때 레시피 보고, 게임할 땐 엣지 있는 시야각! 폰부터 태블릿까지 모두 사용 가능한 그런 괜찮은 거치대? 바로 여기 유그린 더블폴딩 거치대입니다.",2020.09.29-2020.10.26,"1,000,000원"
491,테크·가전,[2만원대/가습기혁신] 진동자가 교체되는 위생 끝판왕 클린 가습기 스와다,블루필 주식회사,3088%,"30,884,200원",펀딩성공,681,737,진동자까지 교체해야 진짜 깨끗한 가습기!,2020.12.05-2020.12.14,"1,000,000원"
492,테크·가전,"가장 완벽한 물질 메탈, 그 메탈로 만든 프리미엄 애플워치 케이스!",링케,3075%,"15,375,700원",펀딩성공,696,510,Ringke - 세상에서 가장 아름다운 애플워치 케이스를 소개합니다. (애플워치 44mm 전용),2020.01.28-2020.02.28,"500,000원"
493,테크·가전,<업그레이드 앵콜> 밤을 낮으로! FHD 녹화까지? 나이트비전 블랙박스,(주)코너스톤커뮤니케이션즈,3058%,"152,914,700원",펀딩성공,423,713,"밤을 낮으로 바꿔드렸는데, 녹화를 못 해드린 게 속상해서 <업그레이드> 앵콜로 돌아왔습니다! 3.9억 펀딩 슈퍼 나이트비전 란모도에 FHD 2채널 블랙박스까지 장착한 <듀오박스>",2020.09.15-2020.10.12,"5,000,000원"
494,테크·가전,"공기청정기 필터, 한달에 830원? 공기청정기 맘(Mam)",(주) 아이와나테크,3058%,"30,584,000원",펀딩성공,282,317,공기청정기 가격보다 더 무서운 필터값! 1회용 마스크 1장 값으로 한달에 한 번 필터를 바꿀 수 있다면 믿으시겠어요?,2019.12.11-2019.12.22,"1,000,000원"
495,테크·가전,[업그레이드] 초음파세척기 <스마클린>이 더 깨끗하고 더 예뻐졌습니다!,AUZEN GLOBAL Inc.,3055%,"152,786,180원",펀딩성공,"1,847",1212,"묵을 대로 묵어버린 미세먼지, 알고 계셨나요? 매일 내 몸에 닿는 아이템에 찌든 때가 한가득이라는걸! 가정용 초음파 세척기를 국내 최초 출시한 '스마클린'으로 완벽하게 세척하세요♥",2019.10.11-2019.11.03,"5,000,000원"
496,테크·가전,맥북2대 2.5시간 완충! 120W-PD+70W-올인원A 멀티 고속충전기,펀디안(주),3054%,"61,088,800원",펀딩성공,870,968,"120W PD로 맥북 2대를 동시 고속충전하는 GaN 업그레이드 파워베슬! 아이폰, 아이패드, 맥북, 스마트폰, 태블릿, 노트북을 위한 하나의 올인원 고속충전기~폼나게 세워보세요!",2020.12.23-2021.01.11,"2,000,000원"
497,테크·가전,여행용 캐리어 및 의류 진공압축포장의 혁명! -핸디형 진공 압축기,(주)오르다,3044%,"30,440,200원",펀딩성공,774,387,여행용 의류용 핸디형 미니 진공 포장 압축기 라벨라를 통해 여행시,2018.07.26-2018.08.26,"1,000,000원"
498,테크·가전,"[해외 38억펀딩] 3만8천명이 선택한 100W, 동시 4대 고속충전기",정훈테크,3033%,"151,663,000원",펀딩성공,"1,604",1551,단 신용카드 한 장크기의 100W 멀티충전기로 최대 4대 기기까지 초고속 충전! 심지어 무게는 단 216g! 인디고고 38억펀딩 신화! 이제 하이퍼주스 하나면 충분합니다!,2020.04.18-2020.05.18,"5,000,000원"
499,테크·가전,"[국내독점] 애플워치 유저를 위한 메탈 스트랩 (실버 , 블랙)",로터프,3030%,"30,303,000원",펀딩성공,283,279,애플워치 유저를 위한 노마드(NOMAD) 프리미엄 애플워치 메탈 밴드 스틸 버전을 국내 최초로 만나보세요,2020.04.21-2020.05.11,"1,000,000원"
500,테크·가전,스마트하시다면? 스트로만 스마트워치! 스트랩 3종까지!,(주)제이제이아이앤씨,3026%,"30,268,500원",펀딩성공,518,429,스마트한 시대에 살고 계신 서포터 분들께 스마트한 LIFE를 제공해드리겠습니다.,2019.10.25-2019.11.17,"1,000,000원"
501,테크·가전,[3차앵콜/글로벌 2.4억] 치우기 편해서 매일 써요! 전기그릴 레가토,주식회사 제이펀,3024%,"30,248,200원",펀딩성공,249,591,사용이 쉬워야 자주 손이 갑니다. 편리함에 건강을 더한 프리미엄 전기그릴 #레가토 이제 요리가 더 스마트하고 즐거워질거예요!,2020.12.03-2020.12.14,"1,000,000원"
502,테크·가전,"""캠핑 차박 홈캉스의 완성은?"" ANKER 솔라 휴대용 스마트 빔프로젝터",(주)디스티팩토리,3024%,"90,732,200원",펀딩성공,170,395,"캠핑·차박·홈캉스의 즐거움을 높여줄 휴대용 빔프로젝터 네뷸라 솔라! 무선 3시간 연속 재생과 넷플릭스, 왓챠 등 안드로이드 무료 앱을 즐길 수 있는 스마트 빔프를 만나보세요.",2021.03.21-2021.04.05,"3,000,000원"
503,테크·가전,UNO? 이제 여러분 가정의 수도꼭지가 정수기가 됩니다. ,원이엔지,3023%,"15,116,000원",펀딩성공,91,244,플라스틱 병과 작별하세요. 여러분 가정의 싱크수전이 정수기로 변하는 PROFINE UNO를 소개합니다.,2020.04.29-2020.05.18,"500,000원"
504,테크·가전,스마트폰 사진이 예술작품으로 변하다 : 레볼캠,엠케이테크놀로지,3020%,"60,416,500원",펀딩성공,925,703,"(영상 시청시 하단 자막 클릭) 최적의 세가지 렌즈, 밝기 조정이 가능한 LED 조명 그리고 셀카 거울까지. 레볼캠은 스마트폰 사진의 재발견입니다.",2018.01.04-2018.02.04,"2,000,000원"
505,테크·가전,음식에도 프린트가 가능하다고요?! EVEBOT 신제품 커피 프린터,주식회사 키랩,3019%,"150,985,000원",펀딩성공,22,113,"자신만의 시그니처, 로고, 귀여운 그림까지! 다양한 아이디어를 음식위에 표현해보세요. 매일 아침 마시는 커피에도, 달콤한 마카롱에도, 생일 축하 케익에도 푸드 프린터가 함께합니다.",2020.10.05-2020.10.26,"5,000,000원"
506,테크·가전,[833% 앵콜]노트북부터 스마트폰까지(5A 60W PD충전) ,안전한 사람들(SAFE PEOPLE),3011%,"15,058,700원",펀딩성공,625,455,노트북 | 아이폰 | 안드로이드 | 마이크로5핀 | 모두 고속충전가능!! (데이터전송가능),2020.01.30-2020.03.15,"500,000원"
507,테크·가전,"칫솔, 이제는 접기만 하세요. 살균은 알아서 할테니!",(주)에스티엘 테크,3005%,"30,058,000원",펀딩성공,452,489,"아직도 칫솔, 케이스, 살균기 따로 쓰세요? 이제 하나면 충분해요.",2020.11.25-2020.12.14,"1,000,000원"
508,테크·가전,[대용량파워뱅크X온열매트] 자유로운 무선 캠핑차박 필수템 이 가격 실화,(주)라온글로벌,2994%,"44,918,000원",펀딩성공,220,677,이젠 무선 온열매트 시대! 신소재 그래핀 탄소 나노셀로 만들어 전자파/화재위험/저온화상위험으로부터 자유로운 렉스웜 온열매트를 소개합니다!,2021.01.31-2021.02.28,"1,500,000원"
509,테크·가전,더욱 조용하고 슬림하게! 디자인까지 잘 빠진 노이즈 캔슬링 헤드폰,시에프디스트리뷰션 주식회사,2991%,"29,914,000원",펀딩성공,254,261,더욱 조용한 하이브리드 노이즈 캔슬링 기능을 가진 헤드폰이 디자인까지 예쁘다면?? 스컬캔디 Hesh ANC 헤드폰으로 세상 속에서 당신만의 공간을 만들어 보세요.,2021.03.07-2021.03.22,"1,000,000원"
510,테크·가전,3 IN 1 전기면도기로 가성비와 가심비까지! <REXHAAN전기면도기>,한경희이지라이프(주),2978%,"89,345,000원",펀딩성공,"1,921",968,"HAAN에서 드디어 남성을 위한 제품을 개발했습니다. 바쁜 출근준비, 출장길에 꼭 필요한 간편 사용이 가능한 전기면도기로 남편과 아들의 출근시간절약, 피부보호에 앞장서고자 합니다.",2019.09.24-2019.10.22,"3,000,000원"
511,테크·가전,"[가성비갑] BLDC 모터를 품은 초경량 무선청소기, 벤투스 V5",좋은생활지웰,2975%,"89,261,000원",펀딩성공,768,527,BLDC 무선 핸디형 오브제 청소기 V5,2019.06.28-2019.07.14,"3,000,000원"
512,테크·가전,모든 노트북에서 OK! 휴대용 노트북 스탠드 링케 폴딩2,링케,2961%,"14,809,600원",펀딩성공,"1,030",516,"맥북이 아니여도, 모든 노트북은 평등해야 합니다.",2019.12.11-2020.01.02,"500,000원"
513,테크·가전,드라이기는 스탠드와 함께 있어야 비로소 완성됩니다.,알피콤,2957%,"14,786,600원",펀딩성공,536,496,드라이기는 스탠드와 함께 있어야 비로소 완성됩니다. 무빙(무설치) 스탠드 & 감각적인 디자인 드라이기로 내 공간을 디자인하세요! 내 일상은 큐나가 있었을 때와 없었을 때로 나뉩니다,2020.07.30-2020.08.18,"500,000원"
514,테크·가전,샤크닌자 NEW 블렌딩/다지기/채썰기/반죽을 하나로 올인원 싹쓰리 블렌더,주식회사 마이하우스,2926%,"58,524,000원",펀딩성공,292,318,"이젠, 배달시키지도 말고, 힘들게 준비하여 요리하지도 않고,",2020.10.13-2020.10.23,"2,000,000원"
515,테크·가전,[ 앵콜/평점4.7 ] 내 공간에 뜨는 달. 벨라루나 무드등,주식회사 디앤디,2912%,"14,560,000원",펀딩성공,263,381,"방을 어떻게 꾸며야 할지 고민이신가요? 단 하나로 셀프 인테리어 해결하기. 차원이 다른 달 무드등, BELLA LUNA가 앵콜펀딩으로 돌아왔습니다.",2020.05.01-2020.05.18,"500,000원"
516,테크·가전,더이상 보조배터리 방전은 없다! 태양광충전+무선충전+대용량보조배터리,파워팟(PowerPot),2904%,"29,048,000원",펀딩성공,544,600,"더이상 보조배터리 방전을 두려워마세요. 매일 뜨는 태양빛으로 16,000mAh 대용량 보조배터리를 무한 충전하고, 간편하게 무선 충전하세요. 우리생활에 더 큰 편리함으로 다가갑니다",2019.08.14-2019.09.16,"1,000,000원"
517,테크·가전,"[평점4.9앵콜] 침대에서 노트북하는 당신을 위해, 이제 랩데스크 하세요",RJ컨셉스토어,2888%,"28,889,400원",펀딩성공,746,750,"원하는 순간, 원하는 장소를 책상으로 만들어주는 노트북/책 받침대 [에르고미 랩데스크 블랙에디션]",2020.04.02-2020.04.26,"1,000,000원"
518,테크·가전,[3.8억 펀딩]한 손에 착! 콤팩트하고 강력한 와우스틱 무선 핫 글루펜,폭스아이디어,2884%,"28,848,500원",펀딩성공,843,488,지저분한 선은 이제 그만! 콤팩트하고 강력한 WOWSTICK 무선 핫 글루펜!,2021.03.21-2021.04.05,"1,000,000원"
519,테크·가전,흡연자를 위한 혁신적인 재떨이혁명. 카딱 스마트재떨이,아이로드주식회사,2872%,"287,257,903원",펀딩성공,"5,957",5314,자동차/사무실 모든 공간에서의 흡연자를 위한 혁신!,2018.04.03-2018.05.14,"10,000,000원"
520,테크·가전,[싱거 코스플레이]시선을 뗄 수 없는 독창적인 디자인의 준공업용 재봉기,태양에스엠 주식회사,2856%,"28,564,000원",펀딩성공,78,215,시선을 뗄 수 없는 독창적인 디자인!,2021.03.24-2021.04.05,"1,000,000원"
521,테크·가전,[인싸키보드]예쁨주의!휴대용 초슬림 기계식 키보드<탭텍TAPTEK>,Vinpok Korea,2847%,"142,352,700원",펀딩성공,"1,436",1309,맥•윈도우X유•무선 겸용 기계식 키보드가 무려~ 휴대용! 맥시멀리즘 성능에 ‘맥 레이아웃’ 미니멀리즘 디자인으로 ‘인싸’는 떼놓은 당상! 키보드 욕구불만 완전 정복!,2019.07.30-2019.08.25,"5,000,000원"
522,테크·가전,느리네? 여전히~ 너하고 난 레벨이 달라~ 초고속 5A/5Gbps 케이블,주식회사 블레이즈,2839%,"28,391,100원",펀딩성공,"1,101",637,스마트 시대의 대세는 C 타입 !!  5A초고속 충전은 기본,2019.09.24-2019.10.20,"1,000,000원"
523,테크·가전,[글로벌22억]영화같은 촬영이 가능한 SIRUI 35mm 애너모픽렌즈,대광엔터프라이즈,2836%,"85,081,000원",펀딩성공,107,279,[글로벌 펀딩 22억 달성] 영화 같은 촬영이 가능한 SIRUI 35mm 가성비 애너모픽 렌즈!,2020.11.18-2020.12.09,"3,000,000원"
524,테크·가전,[책상 위 혁신] 필요한 기능을 모두 담은 스마트 모니터 받침대 ,브로스앤컴퍼니(주),2836%,"85,083,400원",펀딩성공,"1,592",1505,"대한민국 1등 모니터 받침대 EYES 시리즈, 2020년 드디어 끝판왕 출시!",2020.01.28-2020.02.23,"3,000,000원"
525,테크·가전,"[요리,이걸로 끝] 튀김/전골/구이/탕/찜을 모두 하나로?! 만능멀티쿠커",주식회사 누누썸코프,2835%,"28,357,000원",펀딩성공,230,487,"요리, 이걸로 끝! 튀김/전골/구이/탕/찜을 모두 하나로 해결! 핫플레이트에 리프트기술까지 접목한 만능멀티쿠커! 이것저것 번거롭게 사지말고, 만능멀티쿠커 하나로 주방을 심플하게~",2020.08.10-2020.09.01,"1,000,000원"
526,테크·가전,"억대의 첨단 살균장비를, 9만원대에 내 집안으로! UV산소살균기",주식회사 맥솔루션,2833%,"28,339,100원",펀딩성공,225,197,"UV산소살균기 오투비스는 억대의 첨단 살균장비와 비슷한 원리로 제작되어 우리 가족에게 안전하고, 반영구적으로 사용 가능한 UV산소 살균 스프레이 디바이스입니다",2021.03.23-2021.04.13,"1,000,000원"
527,테크·가전,[1.6억 앵콜] 진짜! 수제맥주제조기 #테라 브루,블랙뷰티,2817%,"28,176,000원",펀딩성공,235,275,우리집 양조장! 집에서 즐기는 수제맥주 제조기 - 테라브루,2021.02.23-2021.03.23,"1,000,000원"
528,테크·가전,"50g의 놀라운 무게, 초경량 데스크탑 POKET PC X : 폭스테크",폭스테크,2816%,"28,168,000원",펀딩성공,176,644,"작지만 놀라운 성능,  그 한계를 돌파하다. 언제나 손쉽게 사용 가능한 주머니속 초경량 데스크탑. IDEA-TECHNOLOGY ⓒ FOXTECH",2019.10.28-2019.11.24,"1,000,000원"
529,테크·가전,[2억앵콜] 12개의 DIY 전용 달인파워툴 헤드로 대박 해결! ,주식회사 사람,2813%,"84,402,000원",펀딩성공,322,547,1058명의 대한민국 서포터분들과 함께 당당하게 DIY 전문공구 세계시장에 도전합니다.,2020.06.26-2020.07.08,"3,000,000원"
530,테크·가전,[구강세정의 혁명] 투박함 버리고! 가벼워야 개운해진다. 언제 어디서나!,시지아,2804%,"56,098,600원",펀딩성공,949,775,새로운 개념과 세련된 디자인으로 만들어진 휴대에 편리한 구강세정기가 제일 먼저 와디즈의 서포터님들과 만나고 창신적 제품에 대한 평가를 실제로 받아 보고자 합니다.,2020.06.26-2020.07.13,"2,000,000원"
531,테크·가전,"올 여름, 모기와의 전쟁 ! 이거 하나면 끝. 세상 아름다운 전기모기채",MOOO,2788%,"13,944,900원",펀딩성공,892,243,아름답고 편리하고 실속있는 전기모기채 !,2019.05.22-2019.05.29,"500,000원"
532,테크·가전,"허브와 키보드, 하나가 되다! 책상위의 해결사 ""콜루드 올인원 키보드""",주식회사 세토웍스,2785%,"83,571,000원",펀딩성공,593,1190,"7가지 허브가 키보드 속으로. 기능부터 디자인까지 완벽한 책상위의 해결사 ""Kolude Keyhub""",2020.07.30-2020.08.30,"3,000,000원"
533,테크·가전,20W 강력한 무선 사운드와 고속 무선 충전까지,(주)테크노니아,2783%,"27,832,801원",펀딩성공,532,501,2019년 미니멀라이프를 위한 웅장한 사운드와 무선충전까지 /소확행필수템 !! 거품없는 가격으로 올해 첫 득템의 찬스까지..,2018.11.30-2019.01.20,"1,000,000원"
534,테크·가전,앱과 블루투스로 연결된 스마트 매스 엑설사이즈 Toy <크레아큐브>,(주)크레아큐브,2771%,"16,626,777원",펀딩성공,203,177,"지루함? 그게 뭐죠? 4차 산업혁명 시대, IoT 기술을 접목한 크레아큐브를 통해 성취감과 도전정신을 키워보아요! 다중감각을 사용하여 인지능력과 뇌 발달까지 UP!",2020.02.20-2020.03.09,"600,000원"
535,테크·가전, [벨로닉스 워터텍] 지금까지 양치는 잊어라 새로운 개운함이 온다!,(주)서흥인터내셔날,2751%,"82,559,000원",펀딩성공,"1,434",1058,"다 아니까 더 무서운 치과, 가기전에 예방할 수 있다면?",2019.10.31-2019.11.24,"3,000,000원"
536,테크·가전,왜 따로 사요? 블루투스 이어폰+스피커=[사운드판다 알약 이어폰],(주)판다인터내셔널,2750%,"27,505,500원",펀딩성공,503,555,"블루투스 이어폰 VS 블루투스 스피커, 무엇을 살 지 고민하지 말아요. 열고 닫기 만으로 두 가지 기능이 바로 전환되는 2 in 1 제품, 사운다판다의 [알약 이어폰]입니다.",2019.10.11-2019.10.30,"1,000,000원"
537,테크·가전,"가방에쏙~휴대용보관파우치로,언제어디서나! 핸디전기매트",주식회사비앤비(B&B),2743%,"13,717,700원",펀딩성공,244,481,추위에 떨지마세요!! 다용도 휴대용 전기매트,2020.12.21-2021.01.04,"500,000원"
538,테크·가전,"T1 선수들이 내 핸드폰, 카메라 속에?!선수별 한정판 메모리카드에 굿즈",(주)파인인포메이션,2742%,"13,714,104원",펀딩성공,416,379,[와디즈 스페셜버드] KLEVV 메모리카드와 T1 굿즈 셋트 묶음!,2020.12.24-2021.01.07,"500,000원"
539,테크·가전,어플없이 사용가능한 8핀 OTG 데이터 케이블(아이폰&아이패드호환가능),(주)디엠케이코리아,2738%,"13,690,200원",펀딩성공,577,461,어플없이 사용가능한 8핀 OTG 케이블,2020.02.03-2020.02.17,"500,000원"
540,테크·가전,"추석선물ㅣ이것은 쿠션인가 안마기인가, 뭉친근육을 풀어 하루의 노곤함 싹!",(주)제스파,2733%,"27,337,000원",펀딩성공,293,352,"유튜*보고, 핸드폰 하면서 쉬는 김에",2020.08.28-2020.09.15,"1,000,000원"
541,테크·가전,110년 오디오 역사의 글로벌 브랜드 데논의 홈시네마 사운드바 ,데논,2730%,"81,356,000원",펀딩성공,311,308,"와디즈 ""최초"" 오리지널 정통 하이파이 오디오 브랜드! 데논의 DHT-S216 사운드바",2020.04.06-2020.04.20,"2,980,000원"
542,테크·가전,[앵콜]♠1분의 마술♠ 좋은사람과 술자리를 아름답게 이지소르보 에어레이터,(주)신정인터내셔날,2723%,"27,232,950원",펀딩성공,495,293,단 1분의 마법으로 더 부드러워진 소주를 맛 보세요.,2018.12.13-2019.01.01,"1,000,000원"
543,테크·가전,[누워서도 양손을자유롭게]스마트폰 거치대 끝판왕! 2가지를 한번에!!,제네시스 스마트거치대,2723%,"27,230,400원",펀딩성공,709,675,"제네시스가 만든 편리하고 안정적인 스마트폰 거치대. 흔들림감소, 부드러운 조작감, 편리함에 심플한 디자인까지! 삶을 더욱 편리하게 만들어줄 제네시스 스마트거치대를 만나보세요.",2019.09.02-2019.09.30,"1,000,000원"
544,테크·가전,소리도 언택트 하는 시대! 소리도 'BLAK' 하세요!,동동,2700%,"27,008,000원",펀딩성공,213,607,참지 말고 할 말은 하고 삽시다! BLAK 으로 만드는 당당한 외침. 이제는 서포터님의 차례입니다.,2020.12.14-2021.01.04,"1,000,000원"
545,테크·가전,[와디즈 멀티탭 1위] 손가락 하나면 뽑을 수 있는  '클릭탭 미니',태주산업,2696%,"26,966,300원",펀딩성공,645,461,[NEW 클릭탭 미니] 와디즈 멀티탭 1위! 일반 멀티탭에서도! 벽에서도! 클릭탭이 된다구요?!?!,2020.04.29-2020.05.18,"1,000,000원"
546,테크·가전,"""옆집에서도 터져요""  WiFi 데드존 킬러 Deco X60 공유기",티피링크코리아 유한회사,2696%,"53,923,500원",펀딩성공,323,471,"와이파이가 잘 터지는 장소를 찾아다니지 마세요. 티피링크 공유기를 사용하면 그럴 필요가 없거든요. 집, 카페 심지어 4층 건물까지 구석구석 커버하는 Deco X60을 소개합니다.",2020.05.20-2020.06.01,"2,000,000원"
547,테크·가전,번거로운 바닥청소! MOOO 전동 물걸레 청소기로 쓱쓱,MOOO,2691%,"13,458,000원",펀딩성공,173,163,1분에 180회 회전. 강력한 듀얼패드! 자동 물분사로 마르지 않는 걸레,2019.07.15-2019.07.28,"500,000원"
548,테크·가전,그 유명한 나노리프~ 나만의 감성에 맞춰 진화하는 스마트 조명 !,주식회사 오퍼스원 ,2686%,"26,866,000원",펀딩성공,118,171,그 유명한 나노리프~ 4년만에 돌아온 트라이앵글 시리즈~ 나만의 감성에 맞춰 진화하는 스마트 조명을 경험하세요 !,2021.03.25-2021.04.12,"1,000,000원"
549,테크·가전,[6101%앵콜]노트북&태블릿 파우치와 거치대를 하나로! MOFT,아이티에스글로벌,2676%,"26,763,000원",펀딩성공,497,741,파우치와 거치대를 하나로! 잠수복 소재를 적용한 신박한 수납공간까지!,2021.03.03-2021.03.29,"1,000,000원"
550,테크·가전,Cool 하고 멋진 언니 3인이 선택한 UV살균 위하임 무선진공포장기,주식회사 위하임,2673%,"133,695,000원",펀딩성공,971,1294,"의상디자이너 28살 지우씨, 강아지 3마리를 키우는 29살 진경씨, 10개월 아기엄마 동시통역사 지영씨, 3인방의 최근 위기 극복 아이템 UV살균 기능 위하임 무선진공포장기",2020.09.29-2020.11.13,"5,000,000원"
551,테크·가전,"애플 매니아를 위한 단 하나의 올인원 충전패드, Base Station",GREET,2672%,"53,442,140원",펀딩성공,374,388,"핸드폰, 에어팟, 애플워치, 맥북 충전을 동시에!",2019.10.22-2019.11.17,"2,000,000원"
552,테크·가전,[팬톤] 파워뱅크 블루투스 이어폰에 팬톤의 고급진 색감을 끼얹다.,(주)디엘티테크코리아,2667%,"80,038,100원",펀딩성공,"1,207",843,"좋은 블루투스 이어폰, 많이 보셨을겁니다.",2019.10.06-2019.10.28,"3,000,000원"
553,테크·가전,[내옆의 공기청정기] 이제는 호흡을 지키세요. NothingAIR1,오프리시,2662%,"26,626,000원",펀딩성공,187,351,공기청정기는 공간에서 주인공이 되어선 안됩니다. <<낫띵에어: Nothing AIR>>는 그저 묵묵히 쾌적함만을 제공하고자 합니다. 결국 공간은 사람을 위해 존재하니까요.,2019.12.19-2020.01.12,"1,000,000원"
554,테크·가전,[앵콜]콘택트렌즈를 99.9% 멸균하고 완벽하게 세척하는 큐브제로 멸균기,큐브제로,2658%,"13,290,500원",펀딩성공,227,339,큐브제로 콘택트렌즈 클리너,2020.03.20-2020.04.10,"500,000원"
555,테크·가전,"라돈,전자파 차단, 중금속 방지[두피부터 말려주는 혁신적 두피 드라이어]",주식회사 순수바람,2657%,"53,158,850원",펀딩성공,613,830,"단순히 모발을 말리는 것이 전부일까요? 두피 속까지 건조해야 진짜 드라이어죠! 전자파, 라돈, 먼지가 적게 발생하는 스마트 두피 드라이어 [퓨어리즘 프로]가 업그레이드 되었습니다!",2020.10.23-2020.11.17,"2,000,000원"
556,테크·가전,게임을 제대로 즐길 줄 아는 플레이어들을 위해 태어난 컨트롤러! ,주식회사 에이치앤씨스토리,2586%,"12,934,500원",펀딩성공,348,255,게임을 제대로 즐길 줄 아는 플레이어들을 위해 태어난 컨트롤러!,2021.01.19-2021.02.02,"500,000원"
557,테크·가전,누워서 하는 스트래칭&안마ㅣ목부터 골반까지 피로싹!<스트레칭 안마 매트>,에이파파,2582%,"51,658,000원",펀딩성공,358,301,"누워만 있어도 근육 마사지, 관절 스트레칭, 지압이 모두 된다? 하루 10분만 투자하세요! 재활 치료에서 영감을 받아 탄생한 스마트 스트레칭 안마 매트 GOOD-A7",2019.10.04-2019.10.20,"2,000,000원"
558,테크·가전,[1초컷 랩탑스탠드] '2만원대' 스탠드로 노트북을 업그레이드 해보세요!,주식회사 엠피큐레이션,2580%,"12,900,600원",펀딩성공,416,402,기본에 충실한 랩탑 거치대 폴드스탠드가 업그레이드 앵콜로 다시 돌아왔습니다. 1초만에 똑딱 펼쳐지는 마법같은 거치대를 경험해보세요~,2020.10.20-2020.11.09,"500,000원"
559,테크·가전,[때순이주목]때밀이+스크럽+마사지까지 우리집 욕실에서 한방에!,(주)퓨시스,2576%,"38,643,000원",펀딩성공,183,382,"목욕할 때 유일하게 손이 온전히 닿지 않는 곳, 등 세신! 포기하지마세요. 나만의 목욕루틴을 만들어줄 프리미엄 가정용 바디필링기",2021.03.02-2021.03.22,"1,500,000원"
560,테크·가전,VH-80 : 세계 최초 양방향 레이저 거리측정기,Magpie Tech,2565%,"76,966,000원",펀딩성공,509,378,"거리측정의 NEW 패러다임,",2018.07.09-2018.08.13,"3,000,000원"
561,테크·가전,하이브리드 스마트 워치 'ZeTime 지타임',(주)야베스 인터내셔널,2554%,"255,449,100원",펀딩성공,"1,236",827,스위스 세계최초 하이브리드 스마트워치 Zetime,2018.02.06-2018.03.11,"10,000,000원"
562,테크·가전,업무 시간을 확! 단축시켜주는 엑셀 한글 단축키마스터 장패드 [컨닝패드],제이피리테일,2551%,"25,510,000원",펀딩성공,"1,121",832,[업무의 시간을 '확' 단축시키기 프로젝트],2020.07.25-2020.08.10,"1,000,000원"
563,테크·가전,3015% 앵콜 마지막 펀딩 노트북부터 스마트폰까지 5A 60W PD충전,안전한사람들,2540%,"12,704,404원",펀딩성공,527,422,노트북 | 아이폰 | 안드로이드 | 마이크로5핀 | 모두 고속충전가능!! (데이터 전송가능),2020.04.23-2020.06.01,"500,000원"
